,sections,Text
0,Introduction,"The current major energy source used around the world is fossil fuels, but their quantities are limited. The excessive use of fossil fuels directly results in the release of large amounts of greenhouse gases, such as CO x , NO x , SO x , and C x H y , which cause global warming and acid rain problems [1,2]. Hydrogen is an interesting alternative clean energy source for various applications since it only produces water when it is combusted. Hydrogen can be used by itself or blended with another fuel, such as methane. The combustion of hydrogen mixed with methane results in lower NO x emissions from internal combustion engines, which is environmentally more desirable [3,4]. Not only does hydrogen produces greenhouse gases, but it also gives a high energy yield of 112 kJ/g. This is approximately 2.75 times higher than most hydrocarbon fuels on weight basis. Hydrogen can also be directly used in fuel cells for electricity generation [5–7]. Hydrogen can be produced by several processes already available, such as steam reforming of methane (SRM), non-catalytic partial oxidation (POX) of fossil fuels, autothermal reforming which combines SRM and POX, photochemical processes, photocatalytic processes, and photo-electrochemical processes [1,8–11]. Nevertheless, all of these processes require high energy for operation, do not give the dual goals of energy production and waste reduction, and are not environmentally friendly [5–7]. Hydrogen production by biological processes has been considered more economically feasible because these processes operate at relatively low temperatures and pressures (30–40 °C and 1 atm) [12], which, in turn, lead to lower energy consumption, an environmentally desirable goal in itself. Biological hydrogen production can be attained either via photo or dark fermentation processes, which are particularly attractive from the viewpoint of being able to directly convert organic compounds in wastewaters to hydrogen gas by fermentative bacteria [1–7,12]. The dark fermentation processes by anaerobic bacteria offer a more promising approach for hydrogen production as compared to the photo fermentation processes because the dark fermentation does not require light supply and waste stream transparency. In addition, it gives a higher and more stable hydrogen production rate, since the process can operate by day and night [13,14]. Under anaerobic conditions, organic compounds can be converted by acidogenic bacteria to produce mainly organic acids and hydrogen gas [15–17]. There are a number of parameters that have been considered to significantly affect the biological hydrogen production rate, such as pH, temperature, organic loading rate, cycle duration, solid retention time (SRT), hydraulic retention time (HRT), and toxic compounds present in an incoming wastewater. Several model wastewaters containing simple sugars (such as glucose and sucrose) and starch have been extensively studied for hydrogen production [5,16,18–28]. Fundamentally, industrial wastewaters with high strengths of organic compounds are far more economically attractive to be used as substrates for hydrogen production. This is because the use of industrial wastewaters for hydrogen production provides dual benefits for the reduction of wastewater treatment cost and the production of hydrogen as a renewable energy source. A number of studies of real industrial wastewaters have been investigated for hydrogen production, such as palm oil mill wastewater [15], cassava wastewater [17], rice winery wastewater [29], pulping wastewater [30], beer lees wastewater [31], and cheese processing wastewater [32]. However, to our knowledge, alcohol distillery wastewater with high contents of both potassium and sulfate has not been extensively used for hydrogen production via anaerobic fermentation. The alcohol distillery wastewater used in this study is the wastewater from the alcohol distillation process, using sugarcane molasses as a raw material. This alcohol distillery wastewater has a very high chemical oxygen demand (COD), up to 150,000 mg/l, and also contains high amounts of potassium and sulfate, which makes it unsuitable to efficiently convert to either hydrogen or methane. This is due to the toxicity of high concentrations of both potassium and sulfate. Hence, it is of great interests to investigate how to maximize the hydrogen production from the distillery wastewater. In this study, anaerobic sequencing batch reactors (ASBR) were employed to produce hydrogen from the distillery wastewater. The effects of feed COD value and COD loading rate were investigated for the ASBR operation, in order to minimize the toxicity of both potassium and sulfate and to maximize the efficiency of hydrogen production."
1,Experimental,
2,Seed sludge preparation,"2.1 Seed sludge preparation The seed sludge for the hydrogen production experiments, collected from the anaerobic tank of Red Bull Distillery (1988) Co., Ltd., Samuthsakorn, Thailand, was first concentrated by sedimentation. The concentrated sludge was ground and filtered through a 1-mm sieve in order to remove debris and large particles. Then, it was pretreated by boiling at 95 °C for 15 min in order to enrich spore-forming hydrogen-producing acidogenic bacteria and to eliminate hydrogen-consuming methanogenic bacteria [4]. The heat-treated sludge was then added to the anaerobic sequencing batch reactors (ASBR). The use of this heat-treated sludge can facilitate the start-up procedure."
3,Feed preparation,"2.2 Feed preparation Alcohol distillery wastewater was also obtained from the same distillery plant, where sugarcane molasses is used as a raw material for alcohol fermentation. It was filtered through a 0.2-μm sieve to remove any large solid particles before use. The alcohol distillery wastewater, having a COD of about 150,000 mg/l, was then diluted with water to obtain various feed COD values of 20,000, 40,000, and 60,000 mg/l, in order to determine the highest tolerant level of the toxicity of both potassium and sulfate on the hydrogen-producing bacteria. The freshly prepared wastewater was used without any nutrient supplementation in order to investigate its inherent potential for hydrogen production."
4,Bioreactor design and operation,"2.3 Bioreactor design and operation Two identical ASBR reactors were used independently to perform the hydrogen production experiments. To inhibit the activity of photosynthetic bacteria, the 5-L bioreactors were made of opaque PVC. Each of them had an inner diameter of 13 cm and a height of 30 cm. The bioreactors were operated with a working volume of 4 l. The schematic of the investigated ASBR unit is shown in Fig. 1 . The ASBR operation comprised four sequential steps: feeding, reacting, settling, and decanting. During the operation, the time required for each step was controlled by digital timers, which regulated a diaphragm pump to feed the prepared wastewater into the top of the bioreactor during the feeding step. Homogeneous mixing of the microbial cells and wastewater was achieved by using a magnetic stirrer at 400 rpm during the reacting step. A pH-controller (equipped with diaphragm pumps connected to 1 M NaOH and 1 M H2SO4 solutions) and a heater (equipped with a thermocouple) were used to maintain a constant pH of 5.5 and a constant temperature of 37 °C, respectively. Regarding the work of Bhaskar et al. [33], the pH range of 5.5–6 was considered to be the optimum pH range for hydrogen production. In addition, Lee et al. [34] reported that an excellent hydrogen production was obtained when a bioreactor was operated under a mesophilic temperature of 37 °C and pH of 5.5. Moreover, Lin and Chen [24] reported that the sulfate toxicity could be reduced by controlling a system pH at 5.5, which was the desired value for suppressing the activity of sulfate-reducing bacteria. Hence, in this work, the studied ASBR reactors were operated to produce hydrogen at the temperature of 37 °C and pH of 5.5. For the start-up procedure, 500 ml of the heat-treated seed sludge was added to each studied ASBR reactor. The distillery wastewater was diluted to have a feed COD of 20,000 mg/l for starting up the ASBR units. A COD loading rate was then increased stepwise by increasing feed flow rate and/or feed COD concentration. The operation times of the four sequential steps for the ASBR operation at a cycle time of 6 cycles per day in this present work are shown in Table 1 . The 6 cycles per day was used because it was proven in our previous work to be the optimum operationable cycle time for the ASBR system that provided exceptionally high hydrogen production performance [17]. In this work, the feed and decant flow rates were varied at different feed COD values of 20,000, 40,000, and 60,000 mg/l to achieve different COD loading rates, as shown in Table 2 . In this study, the toxicity from both high potassium and sulfate was reduced by dilution technique and a lowest dilution ratio was determined in order to minimize the volume of the treated distillery wastewater. Hence, a feed COD value lower than 20,000 mg/l was not studied while at a feed COD value greater than 60,000 mg/l, the system performance was found to decrease drastically. For any given feed COD value, the experimental data at very low COD loading rates producing a low hydrogen concentration with a very high methane concentration as well as at very high COD loading rates with low hydrogen production efficiency were not reported and excluded from the table. Hence, Table 2 shows only 4 COD loading rates for each studied feed COD value which are sufficient enough for evaluating both the best feed COD value and COD loading rate for the hydrogen production. Under any given feed COD value and COD loading rate, the ASBR system was operated to reach steady state around two weeks before taking samples of effluents and produced gas for analyses. The steady state condition was justified when both the gas production rate and effluent COD were nearly invariant with time (with standard deviation less than 5% from day-to-day analyses). The produced gas samples were measured for gas production rate and analyzed for gas composition. The feed and effluent samples were taken for analyses of COD, total amount of volatile fatty acids (VFA), and VFA composition. For any given experimental conditions, the steady state data from at least three runs were averaged and used to assess the process performance of the ASBR system."
5,Measurements and analytical methods,"2.4 Measurements and analytical methods The gas production rate was determined by a wet gas meter. The gas composition of the produced gas samples was analyzed by a gas chromatograph (AutoSystem GC, Arnel PerkinElmer) equipped with a thermal conductivity detector (TCD) and a stainless-steel HayeSep D 100/120 mesh packed column (Alltech). The total amount of volatile fatty acids (VFA) in the effluent samples was determined by the distillation and titration method [35]. The VFA composition in the effluent samples was analyzed by another gas chromatograph (PR2100, Perichrom) equipped with a flame ionization detector and a DB-WAXetr capillary column (J & W Scientific). The volatile suspended solids (VSS) in the effluent samples, used to represent the microbial washout from the ASBR unit, and the mixed liquor volatile suspended solids (MLVSS) used to represent the microbial concentration in the ASBR unit were both measured according to the standard methods [35]. The COD in the feed and effluent samples was determined by the dichromate method, using a COD reactor and a spectrophotometer (DR 2700, HACH). The potassium concentration in the feed and effluent samples was also analyzed, using an atomic absorption spectrophotometer (SpectrAA 300, Varian)."
6,Results and discussion,
7,Characteristics of distillery wastewater,"3.1 Characteristics of distillery wastewater Table 3 shows the characteristics of the distillery wastewater used in this work. The distillery wastewater contains a high concentration of organic compounds, as clearly seen by both COD (Chemical Oxygen Demand) and BOD (Biochemical Oxygen Demand) values. Most of the organic compounds are in soluble form, as indicated by the low SS:TS (Suspended Solids:Total Solids) ratio. The low BOD:COD ratio of 27:100 indicates that this distillery wastewater is hardly biodegradable. This was as expected, since the sugarcane molasses was used as the raw material for the alcohol fermentation, and the most easily biodegradable fraction had already been utilized by the yeast to produce ethanol. Interestingly, this distillery wastewater also contains very high concentrations of both potassium and sulfate in the toxicity levels. For the toxicity levels of potassium to anaerobic bacteria, it has been reported that the moderate and strong inhibition ranges are 2500–4500 and 12,000 mg/l, respectively [36]. It has also been reported that in a full-scale biogas plant operation, a dilution of the distillery wastewater is needed in order to minimize the potassium toxicity. Hence, in this study, a maximum potassium concentration that could be used to operate the studied ASBR unit to achieve acceptable hydrogen production efficiency was also investigated, as will be described later."
8,Organic removal results,"3.2 Organic removal results Fig. 2 shows the effect of COD loading rate and hydraulic retention time (HRT) on the COD removal efficiency and gas production rate at different feed COD values. The maximum COD removal efficiencies at the feed COD values of 20,000, 40,000, and 60,000 mg/l were 27, 30, and 32% at the COD loading rates of 37.5, 60, and 112.5 kg/m3 d, respectively. It should be mentioned here that at a feed COD value greater than 60,000 mg/l, the studied ASBR system showed poor process performance in terms of very low COD removal efficiency, as well as very low gas production rate and high carbon dioxide content with low hydrogen content in the produced gas. Hence, the highest feed COD value of 60,000 mg/l was used in this present work. Under the studied range of feed COD values of 20,000–60,000 mg/l, the results indicate that the compounds in the distillery wastewater were more effectively converted anaerobically at a higher feed COD value and a higher COD loading rate, resulting in high gas production rate, as shown next. However, a lower COD removal efficiency as compared to a sucrose-containing wastewater [24] was observed, possibly because the distillery wastewater contains higher-molecular-weight organic components, leading to it being hardly biodegraded as compared with a simple sugar [37]. The gas production rate as a function of COD loading rate and HRT at different feed COD values is also shown in Fig. 2a, b, and c, respectively. For the feed COD value of 20,000 mg/l (Fig. 2a), the gas production rate dramatically increased with increasing COD loading rate from 0.11 l/h at 15 kg/m3 d to 1.09 l/h at 37.5 kg/m3 d. For the feed COD value of 40,000 mg/l (Fig. 2b), the gas production rate increased with increasing COD loading rate and reached the maximum of 1.59 l/h at a COD loading rate of 60 kg/m3 d. Beyond the COD loading rate of 60 kg/m3 d, it decreased to 1.35 l/h with further increasing COD loading rate to 75 kg/m3 d. For the feed COD value of 60,000 mg/l (Fig. 2c), the gas production rate remained nearly constant at about 0.75 l/h at COD loading rates in the range of 45–90 kg/m3 d, but it increased to 1.49 l/h at a COD loading rate of 112.5 kg/m3 d. The comparative results at different COD loading rates of the three feed COD values of 20,000, 40,000, and 60,000 mg/l showed that the gas production rate for the feed COD value of 40,000 mg/l—with a COD loading rate of 60 kg/m3 d and a hydraulic retention time (HRT) of 16 h—was much higher than those for the feed COD values of 20,000 and 60,000 mg/l. This is possibly due to a relatively higher bacterial growth at the feed COD value of 40,000 mg/l, as shown later in the part of MLVSS. The decrease in gas production rate at any given COD loading rate with increasing feed COD value (corresponding to both a lower gas production rate and a lower hydrogen content in the produced gas, as shown next in Fig. 3 ) is probably due to a higher VFA accumulation [4,16,17], which will be discussed in the part of total VFA concentration. The composition of the produced gas as a function of COD loading rate and HRT at different feed COD values is shown in Fig. 3. For the feed COD value of 20,000 mg/l (Fig. 3a), the hydrogen content in the produced gas increased with increasing COD loading rate and reached the maximum of 29.6% at a COD loading rate of 37.5 kg/m3 d. In contrast, the carbon dioxide and methane contents showed the opposite trend to the hydrogen content, with the minimum values of 63.9 and 6.5%, respectively, at a COD loading rate of 37.5 kg/m3 d. For the feed COD value of 40,000 mg/l (Fig. 3b), the hydrogen content increased from 7.0 to 34.7% with increasing COD loading rate from 30 to 60 kg/m3 d and then decreased to 28.0% at a higher COD loading rate of 75 kg/m3 d. The decrease in both gas production rate and hydrogen content at a higher COD loading rate at the feed COD value of 40,000 mg/l is due to the toxicity of VFA accumulation, as explained later in the part of total VFA concentration. The carbon dioxide content also showed the opposite trend to the hydrogen content. It decreased from 81.3 to 65.3% when increasing COD loading rate to 60 kg/m3 d, and after that it slightly increased to 72.0% at a COD loading rate of 75 kg/m3 d. However, the methane content in the produced gas decreased dramatically with increasing COD loading rate, and no methane was detected at a COD loading rate higher than 60 kg/m3 d. This is possibly because the system was in a highly favorably acidic environment (high VFA concentration), which leads to totally suppressing the methane production step [38]. For the feed COD value of 60,000 mg/l (Fig. 3c), the hydrogen content became almost unchanged at 24.0% when increasing COD loading rate from 45 to 90 kg/m3 d, and then it increased to 33.7% at a COD loading rate of 112.5 kg/m3 d. There was no methane detected at this feed COD value for all COD loading rates. It can be clearly observed that the system operated at the feed COD value of 40,000 mg/l—with a COD loading rate of 60 kg/m3 d and an HRT of 16 h—provided the maximum hydrogen content in the produced gas."
