,sections,Text
0,Introduction,"The inter-related problems of energy and environment are among the biggest challenges facing the world today, in particular energy sustainability and carbon emissions from the fossil fuels. Hydrogen has been projected as one of the few long-term sustainable clean energy carriers, emitting only water vapour as a by-product during the combustion or oxidation process. Although it is possible to use hydrogen as a fuel in internal combustion engines (ICE), its use in fuel cells, which act like batteries to convert chemical energy to produce electricity, is more attractive because of its higher efficiency [1]. The United States Department of Energy (DOE) launched an Energy Hydrogen Program in 2003 bringing together the offices of Energy Efficiency and Renewable Energy (EERE), Fossil Energy (FE), Nuclear Energy (NE), and Science (SC). Each office manages activities that address the hydrogen technologies which meet the needs of their respective feedstock and target applications. The Hydrogen Posture Plan, published by EERE in February 2004, envisaged a complete transition to a hydrogen economy by 2030–2040 [2]. It identifies various resources which can be utilised to produce hydrogen, including both renewable and non-renewable resources. An established technology, such as, steam reforming of methane or natural gas would be most likely adopted initially, because of its wide use and economic feasibility [3]. In the long term, the technology will evolve towards more renewable resources such as biomass or water electrolysis, greatly reducing NO x and CO x emissions. There are several established and developing technologies to produce hydrogen from various sources. These technologies can be characterised in three categories, whereby hydrogen is produced with – (a) net positive emission of CO and CO2, (b) CO2 free emissions, and (c) CO2 neutral emissions. Examples of type (a) include steam reforming, partial oxidation and autothermal reforming of hydrocarbons such as natural gas [4], as well as the shift reaction of gaseous products of coal gasification [5]. CO2 free hydrogen production can be achieved through methane decomposition [6,7] and methane aromatisation [8,9]. However, hydrogen production can be environmentally friendly only if the resource used to extract hydrogen is carbon neutral. Resources like natural gas and coal require a lot of energy for mining and processing, adding to the CO2 emissions during hydrogen production, thus increasing the environmental impact of hydrogen production from these sources. CO2 neutral hydrogen production can be achieved by the conversion of biomass via gasification [10], pyrolysis of bio-oils [11], steam reforming of biomass derived higher alkanes and alcohols [4], and aqueous phase reforming of oxygenated hydrocarbons [12]. Biomass derived hydrogen can be classified as carbon neutral because the CO2 released during hydrogen production is consumed by further biomass generation (neglecting the CO2 produced from the fossil fuel energy required for operating the hydrogen production unit) [13]. In this manuscript we review the recent developments in the catalytic processes involved in hydrogen production from biomass, with particular attention given to the advances in the understanding of improvements in the catalyst properties. Before the advent of the fossil fuel based economy in the 19th century, biomass was the major source of energy. However, the energy efficiency in the conversion of biomass was very low. Therefore, fossil fuel energy proved to be a more economical alternative for the developing society. With increasing industrialisation worldwide, energy demands have increased to a stage where fossil fuel energy will not be able to meet the sustained growth of the world economies in the near future. As a result, a major shift back towards a biomass based economy is required because biomass is one of the few current sustainable resources of renewable energy [14,15]. According to government estimates [16] of the current excess biomass resources (not including edible biomass) in the U.S., more than 50% of the domestic crude oil demands [17] can be met by biomass resources, based on the energy content of the dry lignocellulosic biomass [15]. The availability of excess biomass varies in other countries but is available in sufficient quantities in the major oil consuming countries to be economically viable for energy production. Therefore, this biomass based energy can be utilised to replace a major source of CO2 emissions. Processes with high biomass-to-energy conversion efficiency are required to make this transition a reality and currently there are no obvious routes to achieve this. The leading research in this field is covered in this review with a focus on hydrogen production."
1,Lignocellulosic biomass conversion,"Lignocellulosic biomass (plant biomass) conversion can be achieved from various resources, including 1. Forestry wastes such as logging wastes, sawmill wood waste, and residues of the trees and shrubs. 2. Agricultural residues like animal and crop wastes (e.g. corn stover). 3. Energy crops like corn, sugarcane, grasses and aquatic plants like water hyacinth. Residues of energy crops like corn stover and sugarcane or sorghum bagasse have high energy content per unit mass [18] and are therefore attractive for biomass conversion. Forestry residues of pine and eucalyptus have lesser heating value per unit mass and are costly to produce [18], but contain less ash content [19]. Lignocellulosic biomass, which represents the most abundant form of biomass, contains approximately 40–50% cellulose, 20–30% hemicellulose and 0–20% lignin [19]. Fig. 1 [20] illustrates the different routes which can be adopted to produce hydrogen from biomass, including gasification to produce syn-gas (Section 2.1), pyrolysis to produce bio-oils (Section 2.3) and hydrolysis of cellulose to produce sugar monomers (Section 2.5). Syn-gas can be converted to hydrogen by water gas shift (WGS) reaction (Section 2.2); however, any remaining CO must be removed from the gas stream. This can be achieved by preferential oxidation of CO. Pyrolysis bio-oil can be converted to liquid fuel but the processes are complex and the conversion is low. Hydrogen can be produced from the bio-oil by autothermal reforming (Section 2.4) with high conversion efficiency, especially with the use of catalytic membrane reactors. Aqueous phase reforming can be used to convert sugars and sugar alcohols, such as sorbitol, to produce hydrogen (Section 2.6). In addition to these, there are other biological (enzymatic and bacterial) routes to produce hydrogen, but the scope of this review is restricted to the heterogeneous catalytic routes only. Hydrogen produced from biomass can be used as fuel in polymer electrolyte membrane (PEM) fuel cells to produce electricity for transportation purposes. In the short to medium term, this hydrogen can also be used for traditional purposes to minimise the environmental effects of the hydrogen derived from fossil fuels. Currently, industries produce approximately 50Mtonnes/year of hydrogen globally for ammonia synthesis, hydrogenation of crude oil to produce petrol and diesel and to hydrogenate edible oil. The benefits of a true hydrogen economy can only be achieved if the hydrogen is derived from renewable and carbon neutral resources like biomass [12]."
2,Biomass gasification to produce syn-gas,"2.1 Biomass gasification to produce syn-gas Biomass gasification is similar to coal gasification, except that the biomass gasification is conducted at a much lower temperature. This is because biomass contains many more functionalities than coal and is therefore very reactive. Gasification is achieved at temperatures in excess of 700°C in the presence of oxygen/air and/or steam, however tar free gasification requires much higher temperatures. Syn-gas (CO2, CO, H2) is produced when oxygen is used for the gasification as opposed to a producer gas (CO2, CO, H2, CH4, N2), in which case air is used for gasification. A combination of pyrolysis, partial oxidation and/or steam reforming of gaseous alkanes and char takes place under these conditions. Table 1 shows representative reactions which take place during gasification [15,21]. The presence of oxygen or air in the gasification equipment promotes partial oxidation over pyrolysis reactions. Although it is possible to obtain some gaseous products, as seen from Table 1, fast pyrolysis reactions generally produce bio-oils, tar and charcoal. Water gas shift reaction can be conducted in a separate reactor in the presence of CuO–ZnO or Fe catalyst depending upon the reaction temperatures (details of WGS in Section 2.2). Catalytic cracking, gasifier type, design, heating rate, temperature and residence time can be optimised to maximise the efficiency of gasification with minimum tar formation. Tars are aromatic hydrocarbons which can be produced from the condensation of organic matter in the gasifier or further downstream [22], but it is generally formed in the gasifier at low operating temperatures. Thermal cracking of the tar is possible at temperature in excess of 1000°C [22] and by using catalytic additives like dolomite, olivine and char [23], with 100% removal of tar reported by using dolomite as the gasifying agent [24]. Moreover, dolomite and CeO2/SiO2 supported Ni, Pt, Pd, Ru and alkaline metal oxides can be used to catalyse the gasification process to reduce tar formation and improve the product gas purity and conversion efficiency [25–27]. Although Rh/CeO2/SiO2 has been reported to be the most effective catalyst to reduce tar formation [26], Ni based catalysts are also highly active for tar destruction. Since Ni based catalysts are industrially used for steam reforming of methane and naphtha [28,29], they are also expected to catalyse the steam reforming of tars as well as WGS reaction to produce H2. While alkali metal salts also decrease the tar yield, their use leads to an increase in char [27,30] and ash content, and are therefore not suitable for commercial use [31]. The inorganic contents of the biomass such as sodium, potassium, calcium and other alkali are converted to ash which is collected at the bottom of the gasifier or carried away with the product gas as fly ash [15,32]. Deposition of ash in the gasifier may cause sintering, fouling, agglomeration and slagging [33]. Recent improvements in the gasification technology include the Hydrogen Production by Reaction Integrated Novel Gasification (HyPr-RING) technology, first proposed by Lin et al. [5,34–38]. In this technology, the gasification and water gas shift reaction is combined in one reactor with simultaneous absorption of CO2 and other pollutants to increase the hydrogen yield, while maintaining a relatively low reaction temperature of 650°C. The reactions take place in a two-step process (Fig. 2 ) where in the first process water reacts with the hydrocarbon to produce H2 and CO2 (endothermic reaction). H2 can then be used to generate power which produces water as the by-product. In the second step CO2 is absorbed by Ca(OH)2, which is in turn produced at high pressure by the hydration of CaO by water. The resultant CaCO3 can be separated and regenerated to produce CaO and release pure CO2 for sequestration. Although this technology was initially designed for coal gasification, we believe that important lessons learned from this technology can be applied to great effect in biomass gasification. With the high water content of the biomass, the gasification can proceed with little or no additional water supplied for the reaction. One of the latest developments in gasification technology, called the Carbo-V process, has come from the CHOREN Technologies GmbH, formally called the Umwelt- und Energietechnik (UET) in Freiberg, Germany [39,40]. The main aim of this process is to produce tar free syn-gas for hydrogen or liquid fuel production. This process takes place in two steps. In the first step biomass is converted to tar containing gas and charcoal in a pyrolysis unit which operates at 500°C. The tar containing gas is combusted in a high temperature gasifier by co-feeding oxygen. Here, the charcoal from the first reactor is completely gasified to syn-gas at 1500°C in an entrained flow gasifier. The remaining ash is converted to slag which can be used as construction material because of its granular form. The advantages of Carbo-V process over the normal gasifier is that it increases efficiency (>80%) via – (1) chemical quenching by blowing charcoal into the hot gas, and (2) decreasing the heat losses in the combustion chamber because of indirect cooling. The low temperature pyrolysis reactor increases the feedstock flexibility as the solid feed is converted to combustible gas and charcoal. A similar two-step process, called BIOLIQ, was developed at the Forschungszentrum Karlsruhe, Germany [41,42]. In this process, lignocellulosic biomass such as straw and other non-woody biomass is first liquefied by fast pyrolysis at many local small plants. The resulting bio-oil and char slurry is transported to a central facility where large pressurised entrained flow gasifiers combusts the slurry to produce tar free syn-gas. The gasifier is operated at 26bar pressure and at temperatures ranging between 1200 and 1600°C (typically above the ash melting point). Burners at the top of the gasifiers are fed by a nozzle that atomises the incoming slurry pneumatically by pure O2 (at stoichiometric ratio of 0.3–0.7) at the gasifier pressure. The gasification takes place in a downward flame reaction in typically 1s. The resulting syn-gas and molten ash exits the bottom of the gasifier into a quench zone where it is cooled by injecting water. High gasification efficiency (70% at 1200°C operating temperature) and very high carbon conversion (>99%) have been reported with this process [42]. 2.1.1 Biomass gasification in supercritical water Gasification of biomass to produce syn-gas via the processes described so far is limited to biomass containing less than 35% water content [43]. In many cases however, the moisture content of available biomass may exceed that limit. In this scenario it is possible to gasify biomass under supercritical water conditions – water above its thermodynamic critical temperature (374.3°C) and pressure (221.2bar). After the pioneering work in supercritical water gasification (SCWG) carried out by Modell [44], several other researchers studied hydrolysis reactions of biomass products in near- or super-critical water [45–53] to produce various liquid products. At supercritical water temperatures in excess of 600°C, hydrothermolysis of the biomass products will lead to gaseous products, including H2, CO, CO2 and CH4, with 100% conversion [54–56]. This is a great advantage over conventional oxygen/steam gasification technology which leads to tar and char formation. SCWG can be categorised into two operating conditions based on their temperature. Low temperature SCWG is operated between 350 and 600°C and high temperature SCWG is conducted at temperature in excess of 600°C. Low temperature SCWG was initially developed at Battelle Memorial Institute using a batch reactor [57,58] and was later adopted on a bench scale continuous reactor system [59]. As previously mentioned, 100% gasification is achieved only at temperatures in excess of 600°C, therefore low temperature SWCG is performed in the presence of a catalyst. The catalysts used are generally composed of bimetallic Ru or Ni supported on titania, zirconia or carbon [60,61] which are stable under severe oxidising and corrosive conditions of the near-critical water. Use of homogeneous alkali solutions [62] and heterogenous alkali metal catalysts [63] have also been reported in SCWG, but recovery of such catalysts is a major problem. Reaction studies conducted by Minowa et al. without any catalyst [63–67] showed that the hydrolysis of cellulose to glucose was the primary step leading to various products depending upon the reaction temperature. At 200°C, the hydrolysis resulted in mostly sugar formation with no oil, gas or char produced. At 250°C, the products ranged from sugars to water-soluble non-sugar compounds including gas, oil and char. Finally, at temperatures in excess of 300°C cellulose was completely decomposed to produce char as the main product, at 60% yield (on carbon basis) and 10% gas yield. Using sodium carbonate as a catalyst can reduce the onset temperature of cellulose decomposition, as well as, increase the gas and oil yield [63–67]. Metal catalysts like Ni did not reduce the onset temperature of the hydrolysis reaction but increased the yield of H2 in the gas stream. After the hydrolysis of cellulose to produce sugars the Ni catalysed reaction proceeds similar to the steam reforming reaction, but in the liquid phase (11) C6H12O6(l)+6H2O(l)→6CO2(g)+12H2(g) However, under these conditions the methanation reaction is also thermodynamically favourable and therefore some of the hydrogen evolved in Eq. (11) is consumed to form methane. Ni and many other metal catalysts also suffer from severe corrosion at supercritical water condition, especially at the high temperatures needed for higher H2 yields. This problem was overcome by Antal and co-workers by using charcoal and other carbons as catalysts for the gasification of tars in supercritical water [56]. Carbon may seem to be an unlikely candidate for a catalyst at supercritical water conditions, but the authors showed that in the presence of hydrogen and at the temperatures of supercritical water, carbon is very stable [68,69]. At high temperature SCWG conditions (600–800°C) biomass is highly reactive, which increases the gasification efficiency but only at low concentrations. The gasification efficiency drops sharply with increasing feed concentration. To get around this problem researchers have conducted high temperature SCWG in two stages. The first stage involves hydrolysis of biomass to produce water-soluble compounds followed by gasification in the second stage [60]. Addition of alkali like KOH, KHCO3 and Na2CO3 have been shown to increase the H2 yield from the gasification of model biomass compounds such as glucose and pryrocatechol [62]. This may be due to the enhanced WGS reaction in the presence of an alkali [70]. To overcome the problem of high recovery costs of the alkali catalysts, zirconia can be used to catalyse high temperature SCWG reactions, however, the activity of zirconia is lower than Na2CO3 [71,72]."
