,sections,Text
6,Hydrolysis of biomass to produce sugars,"2.5 Hydrolysis of biomass to produce sugars Biomass hydrolysis technology to produce sugar monomers include dilute acid hydrolysis [153–155], concentrated acid hydrolysis [156], alkaline hydrolysis [155], enzyme hydrolysis [157,158] and near- and super-critical water hydrolysis. Near- and super-critical water hydrolysis was discussed in Section 2.1 as an intermediary of the SCWG process. Yu et al. [159] also recently conducted a review of biomass hydrolysis in hot compressed water. Moreover, since the scope of this review does not including biochemical process we will not discuss the enzyme hydrolysis process. In this section we discuss only the dilute/concentrated acid and alkaline hydrolysis in detail. Briefly, the mechanism of hydrothermal hydrolysis of cellulose involves cleavage of a C–O–C bond by a water molecule, as shown in Fig. 6 (pathway C) and the subsequent formation of glucose monomers. During the hydrothermal treatment organic acids like acetic acid and formic acid are also formed, shifting the pH from neutral (or just below) to approximately 3 [155]. The reaction rate constant is however independent of the pH of the solution. The reaction follows a first order mechanism up to the transformation yield of over 90%. Conversion of cellulose with respect to time is strongly dependent on the reaction temperature and the activation energy is calculated to be 136kJ/mol [155]. This activation energy is slightly higher than that for acid hydrolysis but is within the range of various acid catalyst experiments. One of the interesting aspects to note here is that the maximum glucose yield from hydrothermal hydrolysis is approximately 60% because of the conversion of glucose into further degradation products. The complete mechanism is defined in Fig. 7 , where A′ is the intermediate product. 2.5.1 Acid hydrolysis Acid hydrolysis of cellulose, shown in Fig. 6 (pathway A), involves the C–O–C bond cleavage by protonation of the glucoside bonds. In the first step, the proton (H+) may attack either the oxygen bond between the two glucose units (pathway A1) or the cyclic oxygen bond in the glucose unit (pathway A2) [160]. The conjugated acid intermediates are believed to be formed rapidly followed by a slow reaction step involving splitting of glucosidic bonds by the addition of a water molecule and releasing a proton. Apart from the hydrolysis reaction pathways illustrated in Fig. 7 cellulose may be modified to form unreactive compounds, which do not go through the hydrolysis reaction to produce sugars [161]. The rate constants of hydrolysis reaction are directly correlated to the proton concentration in the reaction. Therefore, the strength of the acids used for hydrolysis is an important parameter in determining the effectiveness in the cleavage reaction. Effectiveness of the acids for the cleavage decreases in the order of their pK a (acid strength) value – HCl>H2SO4 >HNO3 >CF3COOH>H3PO4 >HCOOH>CH3COOH [155]. For mineral acids the hydrolytic activity, defined by their pH value, can be increased with an increase in reaction temperature. However, the organic acid activity decreases with increased temperature. Therefore, a high concentration (>50%) of organic acids, like acetic acid, at moderate temperatures (160–185°C) can be used to achieve high activity. Dilute acid hydrolysis is carried out at high temperatures and pressures with reaction time in the order of a few minutes. This is suitable for a continuous process on a commercial scale application as it is possible to achieve a glucose yield of up to 50% using dilute acid hydrolysis [156]. Higher glucose yields can be achieved with shorter reaction time to avoid further degradation, but higher temperatures are required for that, which creates a problem of low thermal efficiency due to the heat-transfer limitation. Counter-current continual shrinking bed reactor technologies have been successfully employed to achieve glucose yield in excess of 90% from cellulose hydrolysis [162,163]. Unlike traditional fixed volume reactors, a continual shrinking bed reactor has a spring that maintains a tight and uniform packed bed of biomass solids, thus forcing the hydrolysis medium close to the solid surface. Torget and Lee proposed that to achieve the high yield of glucose from crystalline cellulose, a ‘scouring’ of the solid phase by the liquor phase is necessary [153]. Another method to maximise the glucose yield from dilute acid hydrolysis of cellulose is to carry out the reactions in two stages. The first stage involves dilute acid treatment under mild conditions (temperature and pressure) and short residence time (few minutes). This step decreases the degree of polymerisation of cellulose to form oligomers and C5 sugars. The C5 sugars are recovered at this stage and the second stage is optimised to recover C6 sugars. The second step is conducted at higher temperature, and acid concentration, and longer residence time (1.5–3h) [162–164]. Concentrated acid hydrolysis uses highly concentrated sulphuric acid to convert the crystalline cellulose into an amorphous form. Sulphuric acid breaks the hydrogen bonds between the cellulose chains and the resulting amorphous cellulose forms a homogeneous gel in the acid solution. In the amorphous form cellulose is easy to hydrolyse in water at low temperatures, providing a rapid and complete conversion to glucose [159,165]. However the process faces many challenges for commercialisation because of the highly corrosive acid environment and high costs of acid consumption and recovery. 2.5.2 Alkaline hydrolysis In alkaline hydrolysis, shown in Fig. 6 (pathway B), OH− ions attack the anomeric carbon atom, thereby, cleaving the C–O–C bond. With the addition of a water molecule and the release of an OH− ion in the next step, the glucose monomer units are formed. Experimental results suggest that the rate of alkaline hydrolysis of cellobiose (the basic repeating unit in cellulose) and water-soluble carbohydrates is higher than that of acid hydrolysis and hydrothermal hydrolysis [155,159]. However, the sugar monomers and dimers are severely attacked in alkali solutions, leading to degradation such as tautomerism of aldose and ketose with enediols [166]. Alkali degradation of dilute solutions results in near 100% conversion of sugar monomers into <C6 acids. Moreover, the composition of reaction products is independent of reaction temperature [166]. Hemicellulose is relatively stable to the alkali treatment but starts degrading at temperatures greater than 100°C. Cellulose is stable to alkali treatment at temperatures below 170°C [166] and is known to increase in crystallinity and the glazed appearance after 1h treatment with 18% NaOH solution at 100°C [167]. However, cellulose can be depolymerised in boiling diluted NaOH solution at temperatures ≤170°C [166]. This is caused by the dissolution of short-chain molecules at the reducing ends of the cellulose chain (known as peeling) [168]. When cellulose is treated at more than 170°C in an alkali solution random cleavage of glucosidic bonds results in rapid decrease in the degree of polymerisation [169]. At this point, apart from the monomer degradation, the alkaline hydrolysis also suffers from the formation of organic acids such as isosaccharinic acid, lactic acid, etc. This decreases the pH of the reaction and makes it difficult to determine the reaction parameters. Therefore, alkali treatment may only be used as a pre-treatment of lignocellulosic biomass before enzymatic hydrolysis. Low alkali concentration (e.g. 1% NaOH solution) at room temperature can considerably enhance the efficiency of enzymatic hydrolysis using cellulose [155]. Table 4 presents the summary of all the hydrolysis methods discussed in this section, including the advantages and disadvantages of each method [155,170]."
7,Hydrogen production from aqueous phase reforming,"2.6 Hydrogen production from aqueous phase reforming Initially Antal et al. [171] proposed the use of glucose as potential feedstock for hydrogen production via the steam reforming reaction. However, this reaction resulted in the formation of a hydrocarbon-rich syn-gas, with low hydrogen yields. Recently, a new method involving the oxygenated hydrocarbon decomposition was developed by Dumesic and co-workers [12,20,172–182]. They were able to convert biomass-derived oxygenated hydrocarbons with C:O ratio of 1:1, such as methanol, ethylene glycol, glycerol, glucose and sorbitol, into H2, CO, CO2 and gaseous alkanes by the catalytic aqueous phase reforming (APR) reaction using supported metal catalysts. The APR is carried out at a temperature range of 200–250°C and pressures of 10–50bar to maintain the liquid phase. The advantages of this method include moderate reaction temperature and pressure which favours the WGS reaction in the same reactor, low CO level in the gas stream (100–1000ppm), which is ideal for fuel cell application and a lower energy requirement compared to steam reforming because the oxygenated hydrocarbon feed and water are in the liquid phase. Additionally, the feedstock is non-hazardous which makes its storage relatively easier. The overall reaction for hydrogen production from oxygenated hydrocarbon with C:O=1:1 by APR, shown in Eq. (19) is similar to the steam reforming reaction (Eq. (8)): (19) C x H 2 x + 2 O x + x H 2 O → ( 2 x + 1 ) H 2 + x C O 2 Although this reaction is thermodynamically favourable for the production of H2 and CO2, in these conditions the products can further react to form alkanes and water: (20) CO2 +4H2O↔CH4 +2H2O Fig. 8 shows the reaction pathways involved in the formation of hydrogen, CO, CO2 and alkanes. One of the pathways, similar to the steam reforming reaction (Eq. (8)) is to produce adsorbed CO on the metal site by the C–C bond cleavage. It is followed by the WGS reaction (Eq. (9)) to produce H2 and CO2. The combined reaction is given by Eq. (19). However, the Fischer–Tropsch reaction [183,184] to form alkanes and water presents a series selectivity problem because it consumes hydrogen. A parallel reaction proceeds through the cleavage of C–O bonds to form alcohols. Other pathways involve dehydration/hydrogenation and dehydrogenation/rearrangement of the oxygenated hydrocarbons to form alcohols and acids, which reacts with water to give alkanes, H2 and CO2. These reaction pathways present a parallel selectivity challenge which should be overcome to maximise the hydrogen yield. The optimum catalytic pathway for the production of H2 and CO2 by APR of oxygenated hydrocarbons involves cleavage of C–C bonds as well as C–H and/or O–H bonds to form adsorbed species on the catalyst surface [184]. Therefore, a good catalyst for production of H2 by aqueous phase reforming must be highly selective for C–C bond cleavage and promote removal of adsorbed CO species by the WGS reaction. However the catalyst must not catalyse C–O bond cleavage and hydrogenation of CO and CO2. Cleavage of C–C bonds can occur over Pt, Pd, Rh, Sn, Ni, Co, Cu, Zn and their combinations [178]. Davda et al. reported that on silica support the activity for APR, measured by the rate of CO2 production per catalytic metal surface site at 210°C, decreased in the following order – Pt∼Ni>Ru>Rh∼Pd>Ir [178]. Although the activity of Ni is comparable to that of Pt catalyst, its H2-selectivity and stability is very low. Ni/SiO2 showed significant deactivation at 225°C, making it unsuitable for long runs. Pt and Pd based catalysts exhibit low selectivity for C–O bond cleavage and the series reactions, namely the methanation and Fisher–Tropsch reactions. Pt was found to be the most suitable catalyst for the APR reactions but the cost of this catalyst is prohibitive for large-scale applications. The activity and selectivity of the metal catalysts also depends on the supports used. In general, acidic supports such as SiO2–Al2O3 are more alkane-selective and the basic/neutral supports such as Al2O3 and carbon are more H2-selective. pH of the solution should also be neutral for higher H2-selectivity. This can also be seen from Fig. 8, where dehydrogenation of the feed leads to acid formation, reducing the pH and leading to the production of more alkanes. H2-selectivity also decreases with increasing number of carbon atoms in the feed molecule. The H2-selectivity decreases in the following order: methanol>ethylene glycol>glycerol>sorbitol>glucose [12]. The H2-selectivity of catalysts can be improved by alloying Pt and Pd with Ni, Co and Fe supported on high selectivity supports such as Al2O3. PtNi and PtCo catalysts with atomic ratios from 1:1 to 1:9 have been shown to improve the selectivity of ethylene glycol reforming [172]. 2.6.1 Hydrogen production from sugars We reported previously that hydrogen can be produced from APR of sugars and sugar alcohols [181,185–188]. Sugars and sugar alcohols, like sorbitol, can be directly produced from hydrolysis of biomass [155,159,189]. However, sugar reforming presents a greater challenge than methanol and ethylene glycol reforming because of the more complex chemical structure of sugars, which results in parallel selectivity issues [187]. Initial tests were carried out in a batch reactor for reforming of aqueous solutions of glucose, fructose and sucrose [185]. Fig. 9 shows the possible routes of reaction for APR of fructose using Pt/Al2O3 catalyst at 200°C. Initially, the fructose molecule goes through dehydrogenation process selectively on the metal surface to give hydrogen and adsorbed organic species on metal site. According to density function theory studies of Gursahani et al. [190] C–C bonds are selectively adsorbed on the platinum site at temperatures around 200°C. The adsorption of C–C bond results in cleavage and formation of CH–OH group adsorbed on metal (* representing the metal site). CH–OH then dehydrogenates to produce CO and hydrogen. CO might then go through WGS reaction to give CO2 and H2 or it might go through methanation reaction to give CH4 and water. It is clear that the hydrogen consuming reactions are unwanted and therefore the catalysts must be WGS selective. Fig. 9 also shows that the adsorbed fructose molecule might then go through further C–C cleavage to give acetic acid and adsorbed CH–OH, which is again a desirable reaction as it results in higher hydrogen selectivity. It is known from the literature [182] that C–C bond cleavage is the limiting factor in the reforming process. In the lack of active metal sites, as was the case with alumina only study, the dehydrogenation of the fructose molecule does not produce C–C cleavage [187]. Presence of ketones and esters were detected in this case which might be the result of C–O bond cleavage followed by dehydration. This reaction takes place on weak acid sites of γ-Al2O3 [191]. The formation of these organic groups results in lower selectivity of hydrogen as they do not take part in further reforming reactions. APR of sorbitol is more selective for hydrogen production compared to sugars because of the lack of an ester group. We studied the APR of sorbitol using alloy catalysts of Pt, Ni and Pd. We found that alumina nanofibre (Alnf) supported Ni–Pt catalyst in an atomic ratio of 33:1 was the most active and selective catalyst for APR of sorbitol [181,188]. Characterisation of the mono- and bimetallic catalysts of Ni, Pt and Pd showed that alloying Ni with noble metals results in a higher number of active sites due to the increased reducibility. Moreover, the alloy catalysts showed lower CO-chemisorption binding strength compared to its constituent monometallic catalysts. The differential heat of CO-chemisorption, measured by a heat-flux calorimeter, was found to be 111.28kJ/mol for Ni–Pt/Alnf, which was 11.45 and 5.51kJ/mol lower than Pt/Alnf and Ni/Alnf, respectively [181]. The decrease in CO binding strength results in removal of adsorbed CO species by WGS reaction (Fig. 8) and therefore a higher fraction of active metal sites is available for the reforming reaction. The turn over frequency (TOF) of H2 production, defined as moles of H2 per mol of surface site measured by CO chemisorption, was found to be maximum for Ni–Pt/Alnf, which was 2 and 5 times more than Pt/Alnf and Ni/Alnf, respectively. The TOF of H2 production from APR of 10wt% sorbitol solution at 200°C, 20bar and WHSV=6.2h−1 using Ni–Pt/Alnf catalyst was found to be 0.074min−1 at 62.5% sorbitol conversion and 75.6% H2-selectivity [181]. This rate of formation compares favourably with the results reported by Cortright et al. [12] where they achieved H2 TOF=1.0min−1 at 225°C using 3% Pt/Al2O3, but at lower conversion rates. According to Cortright et al. [12] the TOF drops sharply with increase in conversion rate – e.g. the H2 TOF from APR of ethylene glycol was reported to decreases from 7min−1 at 3.5% conversion to 0.7min−1 and 0.08min−1 at 62% and 90% conversion, respectively. Davda et al. [173] investigated hydrogenation of glucose to form sorbitol, followed by APR in a hydrogen-rich environment to produce H2. The hydrogenation of glucose takes place on metal catalysts with high selectivity at low temperature (e.g. 125°C) and high H2 pressure (50bar). However, the APR is H2-selective at pressures just above the bubble-point pressure of the liquid feed and at moderate space velocities [174]. Therefore, it may not be practical to operate hydrogenation and APR reactors in series. Recently an interesting alternative was reported by Fukuoka and Dhepe whereby cellulose can be directly converted to sorbitol [189]. They showed that cellulose hydrolysis to produce glucose can be followed with glucose hydrogenation to produce sorbitol and mannitol in a single reactor. The reaction is carried out over Pt and Ru catalysts supported over γ-Al2O3, SiO2–Al2O3 and the H form of ultrastable Y zeolite (HUSY), at temperatures ranging from 170 to 200°C and pressure of 50bar. The maximum yield of 31% (25% sorbitol and 6% mannitol) was obtained with Pt/γ-Al2O3 catalyst at 190°C and 50bar pressure after 24h reaction. The authors believed that the acid sites required for the cellulose hydrolysis is produced in situ from the dissociation of H2 over metal, in addition to the acidic sites on the support. The dissociated H2 spills over the support site which catalyses the C–O–C bond cleavage resulting in a CO bond and is rapidly reduced over the Pt and Ru sites to form sorbitol [189]. The resulting sorbitol can be fed to the APR reactor after a pressure reduction step to maintain the APR reactor pressure to just above the bubble point at temperatures of 200–220°C (Fig. 10 )."
8,Conclusions,"Hydrogen is believed to be the fuel of the future, however, there are many challenges facing the transition of liquid fuels to hydrogen. Hydrogen derived from fossil fuels will be either carbon intensive or expensive because of carbon sequestration costs. Therefore, hydrogen should be generated from resources which are carbon neutral and renewable for long term environmental sustainability. Biomass is one of the resources which can be utilised to produce hydrogen in the future. Lignocellulosic biomass is abundant and does not compete with the food resources. It is also considerably cheaper than crude oil on an energy basis. However, the existing technologies to convert lignocellulose into hydrogen are still in the nascent stages and require further development to improve the efficiency and reduce the cost of production. Table 5 illustrates the various technologies currently available and their advantages and challenges. The energy ratios of the hydrogen produced from these processes provide an insight into their inherent energy losses. One of the most mature technologies is the biomass gasification to produce syn-gas. This technology is however very expensive due to high energy requirements and inherent energy losses in biomass gasification [192]. Conversion of syn-gas to hydrogen by the WGS reaction is another established processes but it also suffers from energy losses [193]. The overall energy ratio (ratio of heating value of H2 to the heating value of feed) of the conversion of biomass to hydrogen by gasification route is between 36% and 73% [21,192]. Since these technologies are already advanced from decades of research and development, it is unlikely that there will be a substantial improvement in the performance of these technologies in the coming years. Improvements in the performance can however come from new reactor designs such as catalytic membrane reactors, which enhance syn-gas conversion by shifting the equilibrium of the WGS reaction. The cost of the membranes is likely to reduce with advancements in the membrane material and production methods. Production of bio-oils from fast pyrolysis of biomass is also a commercially available technology. Bio-oils have high oxygen and water content and are also chemically very unstable- degrading with time. Therefore, bio-oils are currently not used as fuels. Most of the bio-oils currently produced is utilised in chemicals production. Therefore, fast pyrolysis process can be optimised to produce more gases and along with the co-product strategy described in Fig. 4 these gaseous products can be separated and converted to hydrogen. The bio-oil fraction can be subsequently separated into the water-soluble and -insoluble fraction. The water-soluble fraction can be converted to hydrogen by ATR or steam reforming. Fast pyrolysis process is a cheaper technology compared to gasification [194], therefore hydrogen production costs are also be expected to cheaper. The energy ratio of hydrogen produced from fast pyrolysis is also considerably higher than gasification technology. Finally, hydrogen can also be produced from sugars and sugar alcohols obtained from the hydrolysis of cellulose. Efficient processes are required to convert cellulosic biomass into sugar monomer. As seen from Tables 4 and 5 there are major challenges in achieving high efficiency without any environmental issues. Some of the recent catalytic routes, using metal catalysts to convert cellulose and starches into sugars and sugar alcohols are therefore promising in this regard [189,195]. APR of sugars and sugar alcohols has attracted a lot of attention recently due to its several advantages [174]. The most important advantage is that the hydrogen stream contains very low CO concentration which is ideal for fuel cell application. However, APR technology is only at the research and development stage, and Virent Energy Systems Inc. is currently working on commercialising this technology. In future, the conversion of biomass to hydrogen will largely depend upon many regional factors. These factors include availability of excess cultivable landmass, access to suitable technologies, and political will and regulations on clean fuel. Apart from improving the performance of currently available processes, there is also a need to develop more unconventional methods for H2 production if the hydrogen economy is to be realised in the future."
