,sections,Text
0,Introduction,"Diminishing fossil resources, in combination with environmental concerns related to reducing atmospheric pollution and global greenhouse gas emissions, dictate the development of alternative renewable sources and new technologies for the production of fuels and chemicals. In this regard, conversion of lignocellulosic biomass is of special interest, since it is widely available and is the only carbon containing renewable feedstock [1]. However, biomass is highly oxygenated and highly functionalized, and therefore, the reactive oxygenated organic compounds should be selectively deoxygenated at high yields [1]. This can be achieved by catalytic hydrodeoxygenation (HDO), which removes oxygen at a moderate temperature usually with high-pressure hydrogen without loss of carbon atoms [2]. Biomass derived furfural, produced by acidic dehydration of hemicelluloses, is an important intermediate for biofuels and chemicals [3]. Furfural is also a key oxygenated compound commonly found in bio-oil derived from fast pyrolysis of biomass [4,5]. In order to improve stability, boiling point range, and water solubility, the contained unsaturated compounds (like aldehydes) of bio-oil should be reduced [5,6]. Selective hydrogenolysis of furfural is a vital way to transform it into more valuable products, such as furfuryl alcohol (FA), tetrahydrofurfuryl alcohol (THFA), 2-methyl furan (MF), or cyclopentanone [7,8]. Among various products, MF is attractive due to its intrinsically high research octane number and its potential use for chemicals, e.g., by converting it to toluene [9–13]. Moreover, one of its two reactive α-positions is protected by an unreactive methyl group, which could reduce side reactions (i.e., overalkylation) [14]. In chemical industry, MF is used for the synthesis of crysanthemate pesticides, perfume intermediates and chloroquine lateral chains in medical intermediates [15]. Due to its high vapor pressure, furfural hydrogenation can take place efficiently both in the gas and the liquid phase and the most widely studied catalysts are Pt [7,16], Pd [17], Ru [8,16] and Cu [17] supported on carbon, alumina, or silica [4,5,7,8,16,18]. Efforts have been made to improve catalytic activity and selectivity either via catalyst doping with various additives, such as Cu on Ni/MgAlO [19] or Mo on Co/B [20] catalysts, or by using bimetallic systems, such as Sn–Pt [21], Sn–Ni [21], Pt–Ge [22] and Pt–Sn [22] supported on SiO2. The increased activity has been attributed either to an increase of metal electron density or the creation of new active sites, which both favor the hydrogenation of the CO group and eliminate undesirable reactions, such as decarbonylation and ring opening [21,22]. Liquid phase chemistry is probably preferred for compatibility with the upstream production of furfural [23,24]. Previous liquid phase hydrogenation studies showed that catalytic activity and especially product distribution are mainly affected by the solvent [7,8] and to a less extent by the nature of the catalyst and the initial concentration of furfural [16]. In particular, aqueous solvents lead to the production of cyclopentanol and cyclopentanone, whereas organic solvents, such as polar alcohols, produce mainly FA, tetrahydrofurfuryl alcohol, and methyl furan [7,8,16]. The formation of FA in liquid phase furfural hydrogenation has extensively been reported on many catalysts (Ru/C [8], Pt/C [7], Pt–Sn/SiO2 [18,21], Rh–Sn/SiO2 [21], Ni–Sn/SiO2 [21], Pt–Ge/SiO2 [22], MoNiB/γ-Al2O3 [5], Ce–Ni–B [25], Fe–Ni–B [26], Mo–Co–B [20], Co–Ni–B [27], Ir/TiO2 [28]) and/or solvents (n-butanol [7,8], methyltetrahydrofuran [8], 2-propanol [18,21,22], n-heptane [18], ethanol [18,20,25–27], methanol [5], n-decanol [7], tetrahydrofuran [7], n-heptane-EtOH [28]). Ordomsky et al. [8] found that on Ru/C furfural hydrogenation proceeds initially with the formation of FA, which, depending on the solvent, is further converted to THFA and/or MF (with a maximum selectivity of 19%). On the other hand, Villaverde et al. [29] recently found that FA selectivity is not influenced either by the initial furfural concentration or the temperature, and is always 100% using 2-propanol as the solvent over Cu-based catalysts. Contrary to the widely reported FA formation, only a few studies have produced MF (Table 1 ) [7,8,16,19,30–32]. Among these studies, only Yan et al. [31] reported recently a moderate yield of 51% over a Cu–Fe catalyst at temperatures as high as 220°C with the yield in other studies being low. Although no reference related to catalyst stability has been made, the authors state that such high temperatures would increase the energy cost as well as coke formation, via thermal polymerization of furfural [31]. In most of the studies reported so far, high-pressure H2 has been used. However, use of molecular hydrogen is not entirely green and is plagued by a number of problems related to hydrogen availability in remote locations, high compression cost, complex trickle bed reactor design, dilution, low solubility, safety, transportation, storage, and restrictions in operating parameters. These aspects increase the cost and complexity of the process [33,34]. An alternative route for the conversion of furfural to MF could entail catalytic transfer hydrogenation (CTH), in which a hydrogen donor is used as a hydrogen source, instead of molecular H2. Among hydrogen donors, alcohols are attractive, since they are non-corrosive, can act both as reactants and solvents, can be produced sustainably from biomass (e.g., ethanol, butanol), and their dehydrogenation products (aldehydes or ketones) can readily be separated from the products and regenerated under mild-conditions using inexpensive base metal catalysts at moderate hydrogen pressures or used as chemicals [35–37]. In the present study the production of MF through CTH of furfural has been investigated in the liquid phase over Ru/C catalyst, in an attempt to identify the key operating parameters that determine catalytic activity and selectivity. Mechanistic aspects of the reaction are investigated by following the evolution of reaction intermediates and final products in the liquid phase, and possible pathways are presented."
1,Experimental,
2,Reactor and procedures,"2.1 Reactor and procedures CTH of furfural has been carried out in a stainless steel 100ml Parr batch reactor heated in a temperature-controlled oil bath on a digital stirring hot plate. In a typical experiment, 24mL of a 2-propanol solution of furfural (1wt.%) and 0.1g of 5wt.% Ru/C (Sigma–Aldrich) were added to the reactor, sealed under N2 pressure (2.04MPa) and heated to the reaction temperature. The reaction was stopped at desired times, the reactor was cool down in an ice bath and the suspension was collected, filtered, stored in sealed vials and analyzed. Prior to each experiment, Ru/C catalyst was treated for 3h at 300°C in H2 flow of 40cc/min followed by oxidation for 3h at 130°C in 5% O2/He flow of 40cc/min. As we discuss later, this mild calcination is important for catalyst performance."
3,Analytical methods,"2.2 Analytical methods Identification of the liquids products was made using a gas chromatography–mass spectrometry (GC/MS, Shimadzu QP2010 Plus) system. The GC (Shimadzu GC2010) is equipped with an HP-INNOWax capillary column (30m×0.25mm id×0.50μm film thickness) and interfaced directly to the MS (Shimadzu QP2010 Plus), which was used as a detector. Identification of the GC/MS spectral features was accomplished using a built-in library. Quantification of the liquids products was made using a gas chromatography (GC, Agilent 7890A), equipped with an HP-INNOWax capillary column (30m×0.25mm id×0.5μm film thickness) and an FID detector. The GC operated with He as the carrier gas. Response factors were determined using self-prepared solutions of known concentration. Ethers were identified using a NMR spectrometer (Bruker AV400), equipped with a cryogenic QNP (1H, 13C, 19F, and 31P) probe. Prior to analysis, the product mixture, containing ethers, was dried using a rotary evaporator followed by dilution in deuterated DMSO. Since the ether produced was not commercially available, it was quantified by synthesizing it. For this purpose, furfural hydrogenation via the Meerwein–Ponndorf–Verley (MPV) reaction and etherification was carried out using an acid catalyst (Sn-Beta zeolite), leading to production and isolation of the ether as the main product, analogous to our recent work [37]. Its retention time and molecular structure have been confirmed with gas chromatography and NMR spectroscopy, respectively. The ether response factor of self-prepared containing ether solutions was then determined. Furfural conversion is defined as the moles of furfural reacted divided by the initial moles of furfural loaded in the reactor. Product yield is defined as the moles of each product containing carbon over the initial moles of furfural, multiplied with a scaling factor to account for possible differences in the number of carbon atoms (e.g., 4/5 for furan)."
4,TPR experiments,"2.3 TPR experiments Hydrogen-Temperature Programmed Reduction (H2-TPR) experiments were carried out using an Altamira AM-200ip instrument. In a typical experiment, 70mg of the catalyst was placed in a U-tube quartz reactor and reduced at 300°C with a flowing 50% H2/He mixture (30cm3/min) for 3h, followed by treatment at 130°C with a flowing 5% O2/He mixture (30cm3/min) for 3h. The sample was then cooled at room temperature and TPR experiments were carried out by switching the feed composition from He to 10% H2/Ar (30cm3/min), maintaining it at 25°C for 5min, and then heating linearly (β =10°C/min) to 700°C. Hydrogen consumption was monitored using a thermal conductivity detector (TCD)."
5,Results and discussion,
6,Effect of reaction temperature on product distribution,"3.1 Effect of reaction temperature on product distribution The effect of reaction temperature, in the range of 120–200°C, on catalytic activity is presented in Fig. 1A. Furfural conversion increases from 30% to 95% with increasing temperature. The main hydrogenolysis products detected are FA and MF. The FA alcohol yield is 10–12% up to 170°C and then decreases to 5% with further increase in temperature. The yield of MF increases progressively with increasing reaction temperature and reaches 50% at 195°C. Although, high yield to FA is commonplace [5,7,8,18,20–22,25–29], only a few studies report high yields of MF from hydrogenolysis of furfural [7,8,16,19,30,31]. Hronec et al. [7] reported MF yields of 40.4 and 23.2% using n-butanol and n-decanol as solvents, respectively, at 175°C over Pt/C catalysts. In both cases, the FA yield was higher than that of MF, whereas furfural conversion was higher than 94%. It is only recently that a moderate MF yield of 51% was observed in octane solvent at 220°C over a Cu–Fe catalyst [31]. The formation of small yields of furan (FU), <5%, indicates that furfural decarbonylation occurs in parallel to the hydrogenation of the aldehyde group, in accordance with previous studies over Pd and Ni/SiO2 catalysts [6,17,38,39] but it is a dominant path under our conditions and catalyst. It has been proposed that decarbonylation is enhanced under conditions that favor the formation of acyl species, which acts as a precursor to furan and CO [6]. Production of traces of THFA (yields <1%) indicates that the hydrogenation of the furan ring is not favored under our experimental conditions. This is in agreement with previous studies where THFA was always detected as a secondary product, exhibiting selectivities lower than 10–15% [7,8,16]. The formation of the furan,2-(2-furanylmethyl)-5-methyl (compound 2; a dimer shown in Fig. 2 ) is possibly taking place either via FA dimerization, possibly through acid catalyzed dehydration [40–42] and/or via hydroxyalkylation/alkylation of MF [43]. The yield of the latter compound increases with increasing temperature, reaching 10% at 180°C (Fig. 1A). Experiments conducted using MF as reactant showed no dimer formation, indicating that MF alkylation is not taking place under CTH of furfural. On the other hand, as it will be discussed below, the dimer production occurs when starting from FA. FA dimerization has been proposed to proceed through condensation of a hydroxyl group of one furan ring with the C5-hydrogen of another, resulting in the above mentioned dimer, in which the furan rings are connected by a methylene group [42]. Another possible route for dimer formation is through interaction of FA with MF. Experiments conducted using 1% FA–1% MF mixture as reactant showed the production of this dimer, exhibiting higher yields than that obtained using solely FA, under otherwise identical reaction conditions. However, the dimer yield is always lower than 10% and therefore, FA dimerization could not be excluded. Among the products detected, the 2-(isopropoxy)methyl furan (compound 1; an ether shown in Fig. 2), seems to strongly influence the MF yield. The ether yield goes through a maximum of 32% at 170°C, which is almost equal to that of MF (Fig. 1A). This ether forms from the etherification of isopropanol with FA and has previously been observed under conditions of furfural hydrogenation over Pt, Rh, and Ni based catalysts [18,21]. The corresponding ether originating from 1-butanol solvent has also been reported by Ordomsky et al. [8] over Ru/C catalysts. That work led to an almost full conversion of furfural with only 37% selectivity to FA, THFA and MF. Similarly, Godwa et al. [30] observed the formation of 2-(diethoxymethyl) furan (14% yield) under conditions of furfural hydrogenation using ethanol solvent and Ru based catalyst. A similar side reaction leading to the hemiacetal by-product was observed in ethanol solvent/furfural mixtures on Ir/TiO2 [28]. The latter reaction was enhanced at the expense of FA as the catalyst surface acidity increased. The hydrogen required for furfural hydrogenation is produced in situ via the 2-propanol dehydrogenation reaction. Fig. 1B shows the 2-propanol conversion and product distribution vs. temperature. It is observed that the 2-propanol conversion increases from 0.1% to 1.5% with increasing temperature, with acetone yield reaching ∼1% at 180–195°C. Based on the reaction stoichiometry, 2-propanol dehydrogenation produces equivalent amounts of H2, which in turn are utilized in the upgrading of furfural. In addition to acetone, smaller amounts of diisopropylether (<0.3%) are also produced via 2-propanol etherification. Traces of propane are due to hydrogenation of propylene produced through 2-propanol dehydration. The yield of the latter products (propylene, propane) increases above 170°C, rationalizing the slight decrease of acetone yield at 195°C. The neat 2-propanol reaction over Ru/C catalyst has also been investigated to determine the amount of H2 gas that can be produced under the same reaction conditions and provide insights into the hydrogenation mechanism of furfural. It was found (Fig. S6) that in the absence of furfural, 2-propanol is readily converted into acetone (and equivalent amounts of H2) along with diisopropyl ether (<5%) and small amounts of propane (<2%). 2-Propanol conversion and acetone yield reaches 28% and 20%, respectively, at 180°C. Results provide evidence that 2-propanol can dehydrogenate under the CTH of furfural. As a result, the hydrogenation of the CHO group of furfural may occur from the hydrogen produced from the dehydrogenation of the alcohol on metallic Ru. An alternate path entails the MPV interhydride transfer reaction between the carbonyl group CO of the furfural and the OH group of the 2-propanol, which is known to occur on Lewis acid catalysts [37,44,45]. Under our reaction conditions, RuO2 is an effective MPV catalyst of the CHO group [57] and thus, both hydrogenation mechanisms can be at play. The competitive adsorption of furfural may reduce the ability of alcohol to supply hydrogen via direct metal-catalyzed dehydrogenation of the 2-pronanol and hydrogenation of CHO. As a result, further studies are needed to understand the hydrogenation mechanism of CHO. Upon production of FA, the hydrogenolysis of CH2OH to CH3 should entail atomic hydrogen produced from 2-propanol dehydrogenation. Metal catalyzed hydrogen production is further corroborated from the molar balance of hydrogen (hydrogen produced from alcohol and utilized in hydrogenating products). We estimate no significant accumulation of hydrogen under many conditions except at long times and high temperatures. Interestingly, when 2-propanol is converted during CTH of furfural, the acetone yield is significantly lower compared to that from pure 2-propanol. This is in agreement with our previous study of CTH of 5-(hydroxymethyl)furfural (HMF) [37]. It is possible that 2-propanol and furfural compete for active sites, resulting in lower rates of 2-propanol dehydrogenation during CTH of furfural compared to neat conditions. This hypothesis is supported from density functional theory periodic slab calculations in VASP that show that the adsorption energy (in eV) varies as follows: furfural (−2.4)>FA (−1.8)>MF (−1.6)>furan (−1.6)>acetone (−1.1)>2-propanol (−1.0). Overall, 2-propanol dehydrogenation is faster than its etherification and supplies the necessary hydrogen to drive the furfural upgrade. The contribution of protons from 2-propanol and the acid sites of carbon support (due to COOH groups) on the reaction chemistry was determined by investigating the reaction without any catalyst and over activated carbon, respectively. As it can be seen in Table S1 (Supplemental Information (SI)), furfural shows very little reactivity (6.3% conversion almost completely toward FA) in solution (without Ru/C catalyst or activated carbon), indicating that the alcohol protons do not play an active role on transfer hydrogenation. Furthermore, the reaction of furfural over activated carbon (SI, Table S1) shows 34.5% conversion with 15% yields of hydrogenated products (mostly FA) and 6.2% yield of the ether (compound 1). A similar experiment was conducted using FA as a reactant and results showed that FA is mainly etherified with 2-propanol on the surface of the carbon support, exhibiting a conversion of 41% with a 32% yield of compound 1 and a 2% yield of MF. Comparison with the results obtained using furfural as a reactant (Table S1) indicates that the rate of furfuryl alcohol hydrogenolysis is higher, in agreement with the results discussed below. Results suggest that some partial hydrogenation of furfural or FA is possible on the carbon. However, complete hydrogenolysis of furfural or FA to MF is not feasible without Ru under the same reaction conditions. The acid functional groups on activated carbon are most probably responsible for the observed etherification. Results of neat 2-propanol conversion over carbon support (Table S1) show that 2-propanol dehydrogenation activity is slightly higher in the absence of furfural (2-propanol conversion 0.62%; acetone yield 0.56%), but the effect is profound in the case of Ru/C catalyst. This can be clearly seen in Fig. S6, where the neat 2-propanol conversion and product yields are presented for Ru/C and activated carbon at 180°C. 2-Propanol conversion and acetone yield (and consequently H2 yield) increases from 0.6% to 28% and from 0.56% to 20% with the addition of Ru on the carbon support. Clearly, 2-propanol dehydrogenation on the carbon support is not important for the conversion of furfural in Ru/C catalyst."
