,sections,Text
0,Introduction,"Aqueous phase reforming for the production of hydrogen is an enabling technology with feedstocks such as sugars, sugar alcohols, and other polyols that are unstable at the operating temperature of conventional steam reforming [1]. Initial work from the Dumesic group pointed to the ability of supported platinum catalysts to produce hydrogen with good selectivity, although selectivity decreased as the number of carbons in the feedstock increased [2]. A substantial body of subsequent work by a number of different groups has focused on modifications to the catalyst to increase the activity to commercially acceptable rates, while retaining hydrogen selectivity. A variety of catalyst formulations based on both precious metal and non-precious metals have been described [3–12], but precious metal catalysts, most notably those including Pt, have shown the best performance [11,13]. Alloying of Pt with Ni or Co has also been described [14]. Addition of Re to the Pt metal improves catalyst activity significantly [15]. Due to issues of long-term hydrothermal stability, only a handful of supports can be used in APR, with carbon being a leading support candidate and the support used in this investigation [8]. In this work, we have focused on the aqueous phase reforming of glycerol, and have compared a Pt/C catalyst with Pt–Re/C catalysts having the same Pt loading and different Re loadings. Gas phase glycerol reforming with similar catalysts has been reported [15–17], as well as glycerol APR with Pt/Al2O3 catalyst [18,19]. More detailed studies of Pt–Re interactions will be provided in a subsequent publication. The goal of this work is increased hydrogen productivity, but the quantity and distribution of other products is also of interest. The selection of glycerol feedstock is based in part on its ready and cheap availability as a by-product of bio-diesel production, but more specifically it acts as a “model” polyol compound that undergoes the same types of reactions experienced by sugar alcohols such as sorbitol and xylitol, but with a simpler product slate. This facilitates the analysis, especially of the water-soluble oxygenated products. We have carried out our reactions at a relatively high space velocity. The purpose for this was to accentuate production of intermediate products, facilitating an uncovering of the different accessible reaction pathways, and an understanding of how they are affected by catalyst composition or reaction conditions. Operation at lower space velocities provides higher hydrogen selectivity. Since reaction pathways leading to the formation of products such as mono-alcohols and alkanes could be the result of acid-catalysis, we have also examined the effect of base (KOH) addition to the feed on catalyst selectivity, in an effort to control the reaction pathways available to intermediates. We will show that addition of base, although it does successfully suppress some of the undesirable acid-catalyzed reactions in favor of those producing hydrogen, also facilitates undesirable reactions and therefore control of base concentration is necessary."
1,Experimental,
2,Catalyst preparation,"2.1 Catalyst preparation The catalysts were prepared using incipient wetness impregnation, using tetra-amine platinum dinitrate (Pt(NH3)4(NO3)2) and perrhenic acid (HReO4) as the platinum and rhenium sources, respectively. A high surface area activated carbon support (Engelhard, SSA 540m2/g, pore volume 0.42ml/g) was selected for this work. Specifically, for synthesis of the 3wt%Pt/C catalyst (3%Pt/C), 20g of the dried carbon support was impregnated with a solution prepared by dissolving 1.24g of Pt(NH3)4(NO3)2 into 8.4g of DI water in a 30ml glass vial, with shaking for at least 2h prior to use. The impregnated sample was dried at 110°C in air for 2h and then calcined at 260°C in air for 2h with a ramp rate of 5°C/min. A 3%Re/C catalyst was prepared analogously. For preparation of 3%Pt–Re/C catalysts, sequential impregnation was used. Specifically for preparation of 3%Pt–3%Re/C, 10g of calcined 3%Pt/C catalyst was impregnated with 4.42g of 7wt% perrhenic acid solution, dried at 110°C in air for 2h, and calcined at 260°C in air for 2h. Multi-point BET measurements were obtained with an Autosorb-6 gas sorption system (Quantachrome Corporation), after the samples were degassed overnight at 110°C. CO and H2 chemisorption were carried out at 45°C using an Autochem II pulse chemisorption analyzer (Micromeritics). Prior to the chemisorption measurement, about 100mg catalyst was first reduced in situ at 280°C for 1h in pure H2 at a flow rate of 50ml/min, then purged with He (for CO chemisorption) or Ar (for H2 chemisorption) at 300°C for 30min at a flow rate of 50ml/min, and finally cooled to 45°C. The CO and H2 chemisorption data are summarized in Table 1 ."
3,Catalyst testing,"2.2 Catalyst testing Experiments were carried out in a single channel microreactor with active heat exchange within the catalyst bed. This reactor has been described previously [20], and was used so that the activity measurements could be made under nearly isothermal conditions. A schematic of the experimental setup is provided in Fig. 1 . The microchannel reactor body was made from SS316, and was enclosed by an oil-heating jacket with the oil being circulated using a Julabo oil pump. The reaction temperature was controlled within ±1°C. The total effective volume of the reactor channel is about 0.45ml (0.635mm×12.7mm×55mm). A charge of 200mg of catalyst (60–100 mesh size) was packed into the narrow slot of the microchannel reactor, and a stainless steel screen (−325 mesh) and a stainless steel foam disk were placed on each side of the reactor to maintain the catalyst particles in place during experiments. Prior to the reaction test, the catalyst was reduced at 280°C for 2h in 10sccm of pure H2 at atmospheric pressure. After purging the system with N2 and cooling down to 60°C, the backpressure regulator was set at the desired pressure (typically 425psig), the aqueous feed solution comprising 10% glycerol (by weight) was introduced using a HPLC digital pump (Series III) at the desired feed rate, and heating of the catalyst bed was initiated. When the reactor reached the desired reaction temperature, in most cases 225°C, N2 flow was set at 10sccm (N2 served as an internal analytical standard). The system was allowed to stabilize for about 2h prior to analysis of the reaction products. Gas product analysis was carried out using a micro gas chromatograph (Agilent Micro GC 3000C), equipped with two molsieve 5A columns, one Plot Q column, and one OV-1 column. The liquid products were collected and analyzed with a Waters high performance liquid chromatograph (HPLC), comprising a HPLC pump, autosampler, and a refractive index detector. A Bio-Rad Aminex HPX-87H ion exclusion column (300mm×7.8mm) was used for analyte separation. A 0.005M H2SO4 aqueous solution was used as eluent for this analysis at a flow rate of 0.55ml/min. The data sets were processed and checked for carbon balance, which was typically >95%. The glycerol conversion was determined by: Conversion ( % ) = 100 * moles glycerol reacted / moles glycerol fed The selectivity to H2 is defined as the ratio of the amount of H2 produced divided by the amount of H2 that could be produced if all the converted glycerol had undergone complete reforming to produce H2 and CO, and all CO shifted to CO2. Under this definition, one mole of converted glycerol could generate 7mol of H2 and 3mol of CO2. The selectivity of the other carbon containing products refers to the percentage of carbon present in this product relative to the total carbon available based on converted glycerol."
4,Results and discussion,
5,Catalyst characterization,"3.1 Catalyst characterization The BET surface area, measured for the Pt/C and Pt–Re/C catalysts, remained similar to that measured for the carbon support alone (about 540m2/g). Table 1 summarizes the chemisorption results for the various Pt/C, Pt–Re/C, and Re/C catalysts used in this work. On the 3%Pt/C catalyst, the irreversible CO uptake indicates a metal dispersion of 75.6%, based on the assumption of a CO:M ratio of unity. On the other hand, the H2 chemisorption suggests a dispersion value near unity (for H/M=1). On Pt surfaces the tendency for bridge bonding to occur can lead to an underestimation of metal dispersion by CO chemisorption [21]. This may explain the discrepancy between the CO and H2 results. Addition of Re to the Pt/C results in a decrease in both the CO and H2 chemisorption values (Pt loading remaining constant), however the decrease in CO chemisorption is significantly greater than for H2. The CO and H2 uptake values for 3%Re/C alone are very low. We note that the low CO chemisorption value with 3%Re/C, as well as the decrease in CO chemisorption values observed in our work following Re addition, differ from the results reported by Simonetti et al. [15] and Kunkes et al. [16]. In these latter studies, the temperature of reduction (450°C) was substantially greater than used in our work (280°C), which could well affect the degree of Re reduction, and its subsequent alloy formation with Pt. Moreover, differences in catalyst preparation (co-impregnation vs. sequential), Pt metal source (H2PtCl6·6H2O vs. Pt(NH3)4(NO3)2), type of carbon (carbon black vs. activated carbon), and temperature at which the chemisorption measurements were made (27°C vs. 45°C) may also contribute to the disparity in the results. The importance of pretreatment on Pt–Re/Al2O3 has been emphasized [22]. The decrease in CO and H2 chemisorption upon Re addition could be the result of several factors including (i) the Pt–Re particles are larger; (ii) Re (oxide) locates preferentially at the particle surface; (iii) Re alters the electronic structure of Pt, affecting its chemisorption properties and/or its reducibility. The fact that the H2 chemisorption is less affected than the CO chemisorption following Re addition complicates the determination of Pt dispersion and the calculation of active sites as well as determination of turnover frequencies (TOFs). According to both the CO and H2 chemisorption data, there appear to be fewer Pt surface sites available for catalysis following the addition of Re (assuming that only Pt is responsible for CO and H2 chemisorption), which will have an effect of accentuating the calculated turnover frequencies for the Pt–Re/C catalysts relative to Pt/C."
6,Effect of addition of rhenium to Pt/C on glycerol aqueous phase reforming,"3.2 Effect of addition of rhenium to Pt/C on glycerol aqueous phase reforming The gas phase product distributions and calculated turnover frequencies (based on CO chemisorption) for glycerol conversion and H2, CO2, and alkane production from the APR of glycerol at 225°C and 420psig for the Pt/C and Pt–Re/C catalysts are summarized in Table 2 . For high glycerol conversions, the turnover frequencies are underestimated, assuming a non-zero order rate dependence on glycerol. The trend in performance with increasing Re loading is shown in Fig. 2 in terms of TOF. These results reflect initial catalyst performance, obtained after lineout of the reactor system (approximately 2h). The Pt/C catalyst stands out in terms of having very high selectivity toward hydrogen (see Table 2), but displays very low glycerol conversion under these conditions. The addition of Re to 3%Pt/C has a dramatic effect in increasing the glycerol conversion, even though a catalyst comprising only Re (3%Re/C) is inactive for the APR of glycerol (data not shown). As a trade-off for increasing glycerol conversion at a fixed space velocity, the high selectivity toward hydrogen decreases in favor of greater alkane selectivity when Re is added. It is notable that the carbon based selectivity to gas phase products (CO2 +CO+alkanes) for the 3%Pt–Re/C catalysts are similar, in the range of 53–59%, distinctly lower than that of the 3%Pt/C catalyst. Thus, although glycerol conversion increases with increasing Re content, this is not accompanied by an increase in gas phase product selectivity at these space velocities. The effect of Re promotion on H2 selectivity is shown in Fig. 3 , where space velocity was adjusted in order to compare performance at comparable conversion level. It can be seen that, at comparable conversion, the Re promoted catalysts show lower H2 selectivity. However, due to the greater glycerol conversion with addition of Re at fixed space velocity, all Re-containing catalysts show higher hydrogen productivity than 3%Pt/C (Table 2). Table 3 quantifies the liquid phase product distribution produced from these same catalysts at the same space velocity. In order to more fairly compare the effect of Re promotion on catalyst selectivity, the 3%Pt/C catalyst performance is compared to 3%Pt–3%Re/C at similar glycerol conversion in Fig. 4 . We were unable to distinguish chromatographically between acetone and isopropanol, and several mass spectroscopic analyses of the liquid product established that both are present although acetone tends to predominate. For convenience, and since isopropanol is a reduction product of acetone, the acetone/isopropanol peak has been collectively lumped under “alcohol” in Fig. 4. With the Re-free 3%Pt/C, the liquid products are limited to ethylene glycol (EG) and propylene glycol (PG), with no evidence of monohydric alcohols or carboxylic acids even up to 26% conversion of glycerol. The addition of Re results in higher conversion, however, it also results in higher alkanes and liquid phase product selectivity. In addition, reaction pathways leading to alcohols and acids are facilitated as shown in Fig. 4. The promotional effect of Re on Pt-based catalysts for aqueous phase reforming has not been definitively resolved. Re promotion of Pt-based catalysts for the water gas shift reaction has been reported in the literature. A Pt–Re/TiO2 catalyst was shown to be more active than Pt/TiO2 [23]. The role of Re in enhancing the activity was attributed to the presence of ReOx species under the WGS reaction conditions. The ReOx species provide an additional redox pathway, in which ReOx is reduced by CO, generating CO2, and re-oxidized by H2O, forming H2 [24]. On the other hand, Sato et al. attributed the increase in activity of Pt–Re/TiO2 to Pt–Re bimetallic formation, which resulted in stronger CO adsorption [25]. An enhancement in activity of Pt/ZrO2 by Mo and Re promotion was reported by Ruettinger et al. [26]. The Pt–Re, Pt–Mo and Pt–Re–Mo alloy formation was shown to be responsible for the enhanced activity. For gas phase glycerol reforming, Kunkes et al. attributed the increase in activity by Re addition to weakened CO adsorption [16]. The conflicting arguments on whether Re addition to Pt results in stronger or weaker CO adsorption could possibly be attributed to a particle size effect. Ruettinger et al. reported that CO adsorption is weaker on small Pt–Re particles and stronger on the larger Pt–Re particles [26]. Since part of the Re is present as ReOx under the hydrothermal reaction conditions of glycerol APR (detailed evidence for this will be provided in a separate publication), we believe that Re may have a dual effect on Pt: • Pt–Re alloy formation leads to an increased rate of dehydrogenation and decarbonylation. • ReOx (acidic) species promote dehydration pathways leading to liquid products (propylene glycol, acids and alcohols) and alkanes. More details on Pt–Re alloy formation and its effect on the electronic structure of Pt is under investigation and will also be the subject of a future publication. The effect of ReOx acidity on the reaction pathway is discussed in more detail below."
7,Reaction pathways,"3.3 Reaction pathways A plausible reaction pathway for the desired production of hydrogen from glycerol is shown in the box at the top of Fig. 5 . The initial step involves dehydrogenation to form an aldehyde (glyceraldehyde) intermediate, which subsequently de-carbonylates (C–C bond scission) to produce CO and a C2-diol moiety. This dehydrogenation—decarbonylation sequence is repeated until complete conversion of glycerol to CO and H2 is obtained. The mechanism by which the carbon–carbon bond cleavage occurs is subject to some debate. Carbon–carbon bond cleavage catalyzed by adjacent metal (Pt) sites (19), as well as the retro-aldol reaction of glyceraldehyde, both offer plausible pathways, although the latter is more facilitated at higher pH [27]. In the presence of base, Maris and Davis have argued that C–C bond breakage over Pt is primarily via a base-catalyzed pathway rather than through metal-centered catalysis, whereas with Ru the C–C bond cleavage is metal catalyzed [28]. Wawrzetz et al. have asserted that a combination of metal and acid-based reactions over a bifunctional catalyst must be invoked to explain their experimental results for glycerol APR [19]. Alternate reaction pathways are required to explain the appearance of the other liquid phase and gas phase products, and a plausible series of representative pathways (excluding carboxylic acid production) is also provided in Fig. 5. These are primarily routes through C–O bond cleavage or scission, which compete with the desired dehydrogenation–decarbonylation pathway. For the C–O scission pathway, the net effect is consumption of one mole of H2 per C–O bond broken. The CO2 produced reflects the selectivity for C–C cleavage through the preferred pathway shown in the box in Fig. 5. A plausible method to express the relative importance of H2 generating (C–C cleavage) vs. H2 consuming (C–O cleavage) pathways is through the use of the relative H2 yield (RHY). RHY is defined as the ratio: (measured H2/CO2)/(theoretical H2/CO2). Thus, as the C–O cleavage pathway becomes more pronounced, the RHY becomes <1 and drops progressively. In the case of 3%Pt/C, the detected liquid phase products were limited to EG and PG, as mentioned earlier. Therefore, on Pt/C, the only H2 consuming reaction pathway is the conversion of glycerol to PG. The RHY for Pt/C with glycerol under the conditions tested was 0.9. PG could be formed either via dehydration of initially formed glyceraldehyde to pyruvaldehyde followed by addition of two moles of hydrogen, or direct dehydration of glycerol through an acetol intermediate followed by subsequent hydrogenation [29,30]. The dehydration–hydrogenation pathway through acetol has been proposed to occur under acidic environments as a route to propylene glycol over Ru/C [31,32], copper chromite [33], Cu–ZnO [34], and recently with Pt/Al2O3 and Pt black [19], wherein it was asserted that Pt black generates the necessary acidity to proceed through an acetol intermediate. Since the aqueous medium in our experiment was mildly acidic, and 3%Pt/C exhibited some acidity by NH3 TPD (data not shown), it was inferred that PG could be generated via a dehydration–hydrogenation pathway through such an acetol intermediate. This would suggest that the more acidic ReOx could favor this pathway to convert glycerol. We note, however, that our test with 3%Re/C showed no activity, suggesting that although acetol might be a dehydration-based intermediate, subsequent conversion to observable products such as PG requires a metal hydrogenation function that is not provided by Re or ReOx alone. The alternate pathway of dehydration of initially formed glyceraldehyde to pyruvaldehyde is facile and, for reasons described below, the more likely pathway for PG formation over 3%Pt/C. Glyceraldehyde is more active towards dehydration chemistry compared to PG and EG because it can proceed through a bimolecular elimination reaction shown below. The combination of the terminal OH leaving group and acidity of the alpha-hydrogen to the aldehyde allows glyceraldehyde to dehydrate readily in the presence of a weak acid. In contrast the aldehydes of PG and EG do not have a leaving group on the terminal carbon and therefore would proceed through a unimolecular elimination reaction (also shown below). Unimolecular elimination reactions require either a strong leaving group or strong acid catalyst, neither of which are present during glycerol APR over Pt/C. This is evidence by the fact that there was no observed dehydration of PG or EG to form other liquid products on Pt/C. Dehydration of glyceraldehyde by an elimination bimolecular E2 pathway. Dehydration of PG by an elimination unimolecular E1c pathway. When Re is added to Pt/C, the TOF of glycerol and products increases, as is shown in Fig. 2. Re addition results in lower selectivity to hydrogen relative to alkanes, and the overall gas phase product selectivity decreases as shown in Fig. 4. The major selectivity change in the aqueous phase products as a result of the addition of Re to Pt/C is the significant increase in alcohol products and C2 + alkanes, along with the appearance of carboxylic acids, all at the expense of diol products. The reason for this change in selectivity with Re may be the result of ReOx species on the surface generating acidity [35], facilitating the dehydration–hydrogenation pathways at the expense of initial dehydrogenation to glyceraldehyde which would be followed by carbon–carbon bond cleavage (decarbonylation). Analogously, formation of alcohols could occur by dehydration–hydrogenation of diols (propanols from PG, ethanol from EG), and formation of ethane and propane analogously via dehydration–hydrogenation of alcohols. Since separate experiments (not shown) showed no methanation or Fischer–Tropsch activity with Pt–Re, methane formation is likely due to reforming (decomposition) of ethanol. As mentioned above, the dehydration of alcohols and diols is less favored due to the EI chemistry required for dehydration. This explains the low selectivity of Pt/C for alkanes. In the case of Pt–Re/C, the enhanced acidity of ReOx results in higher selectivity to alkanes, albeit still low relative to CO2. On Pt/C, the PG/EG ratio increases with conversion, suggesting a much lower activity of PG relative to EG. In contrast, on Pt–Re/C the PG/EG ratio was almost independent of conversion (data not shown) which consistent with the additional reaction pathways facilitated by ReOx, as discussed above. The formation of carboxylic acids is less readily explained, but a combination of hydration/dehydrogenation reactions of aldehydic intermediates through a redox mechanism on ReOx provides a possible pathway. By retarding the dehydration pathways, higher H2 yields might be achieved since dehydration–hydrogenation consumes H2. For this reason we decided to investigate the effect of base addition to the feed, to provide a higher pH medium with the intention to inhibit undesirable acid-catalyzed dehydration reactions."
