,sections,Text
0,Introduction,"The chemistry of P-based ligands has been extensively investigated in recent years [1]. These compounds are extremely attractive as potential ligands since various structural modifications are accessible via simple PN, PC and PO bond formation [2]. Many modified P-based ligands have significant applications in organometallic chemistry and catalysis, giving selective catalysts for hydroformylation, hydrosilylation and, especially transfer hydrogenation [3,4,5,6]. Although many chiral phosphorus ligands have been synthesized and used in transition-metal-catalyzed asymmetric reactions, a large number of reactions still lack effective chiral ligands, and the enantioselectivities in many reactions are substrate dependent [7]. While much effort has been devoted to the synthesis of aminophosphines and their metal complexes, similar studies on the analogous phosphinites are less extensive [8,9], even though some of their complexes have proved to be efficient catalysts [10,11]. Phosphinites provide different chemical, electronic and structural properties compared to phosphines. The metal-phosphorus bond is often stronger for phosphinites compared to the related phosphine due to the presence of electron-withdrawing P-OR group. In addition, the empty σ*-orbital of the phosphinite P(OR)R2 is stabilized, making the phosphinite a better acceptor [12]. Therefore, the development of effective chiral ligands, especially ligands having novel chiral backbones, is still an important and challenging task for chemists [13]. Many biologically active compounds, such as pharmaceuticals, agrochemicals, flavoring, and functional materials, exhibit “handedness” [14]. The preparation of these “handed” (chiral) compounds in enantiomerically pure form is a challenging goal in modern organic synthesis. Undoubtedly, the use of chiral metal complex catalysis is a powerful, economically feasible tool for the preparation of optically active organic compounds on both laboratory and industrial scales [15]. Furthermore, transition metal complexes are influential catalysts for organic transformations and when the suitable ligands are associated with the metal center, they can offer chemio, regio or stereo selectivity under mild conditions [16]. However, the appropriate choice of metal precursors and the reaction conditions are crucial for catalytic properties [17]. A number of transition metal complexes are known to be catalyzing hydrogen transfer from an alcohol to a ketone [18,19]. Ketones are the most widespread corporate precursors used in organic synthesis and reduced ketones, alcohols are very important blocks for the pharmaceutical and fine chemical industries [20]. Although many applications require racemic alcohols, the need for enantiomerically pure products is growing because of their significance as intermediates for the manufacture of pharmaceuticals and advanced materials [21,22], raising great interest in finding new methods for their production. In addition, ketones are one of the most common families of unsaturated substrates, therefore the enantioselective reduction of prochiral ketones leading to optically pure secondary alcohols is a subject of considerable interest from both the academic and the industrial perpectives [23]. Extensive efforts have been devoted to their reduction into secondary alcohols especially via hydrogenation [24]. Catalytic transfer hydrogenation (TH) with the aid of a stable hydrogen donor is a useful alternative process for catalytic hydrogenation by molecular hydrogen for the reduction of ketones [25,26]. In transfer hydrogenation, organic molecules such as primary and secondary alcohols [27] or formic acid and its salts [28] have been employed as the hydrogen source. Over the last three decades, most effort on asymmetric transfer hydrogenation has been focused on the use of ruthenium, rhodium and iridium catalysts [29,30,31]. It is well-known that ionic liquids are potential replacements for organic solvents both on laboratory and industrial scales due to their green characteristics such as thermal stability [32,33,34], lack of vapor pressure, non-flammability, wide liquid range, wide range of solubility and miscibility [35,36,37,38]. Furthermore, they can be readily recycled; have profound effect on the activity and selectivity in reactions and in some cases, facilitate the isolation of products. Therefore, ionic liquids are considered to be viable substitute for volatile organic solvents [39]. An unusual feature of ionic liquids is the tunability of their chemical and physical properties by selection of appropriate anion–cation combinations [40]. Metal-containing ionic liquids are regarded as promising new materials that combine the properties of ionic liquids with additional intrinsic magnetic, spectroscopic, or catalytic properties, depending on the incorporated metal ion [41]. Furthermore, it has been known that ionic liquids (ILs) can be functionalized flexibly by incorporating functional moieties into the IL structure to develop different functionalized ionic liquids (FILs), which dually possess the characters of the incorporated functionalities as well as those of the ILs [42,43]. The P-based ligands-FILs have long been investigated for the design of the ionic organometallic compounds and applications to catalysis [44,45,46]. It has been found that, while the coordinating P(III) atom is vicinal to the positive charged imidazolium ring, the corresponding P-based ligands-FILs are featured with π-acceptor character as well as σ-donor [47,48]. Hence, the varied coordination behaviors of such P-based ligands-FILs are in great concerns in the coordinating chemistry and catalysis, leading to the significant changes of the complex configurations and catalytic performance [49]. In recent years, we have been synthesized many P-based ligands and used them in transition-metal-catalyzed asymmetric transfer hydrogenation reaction [50]. However, P-based ligands containing ionic liquid part are rarely used in this reaction. Furthermore, there is still a need for highly effective chiral ligands. Therefore, to develop effective highly active well-designed chiral ligands, the features of ionic liquids are combined with phosphinites. Although some phosphinite ligands and their derivatives have been employed successfully as ligands in the transfer hydrogenation of ketones [51,52,53] references therein), a screening of catalytic activities of ionic liquid based phosphinites in this reaction is not common in the literature. For this reason, we are extending our study to develop useful and magnificent catalysts, in this paper, we report for the first time the synthesis and full characterization of four new half-sandwiches ruthenium, iridium and rhodium-arene complexes based on chiral functionalized ionic liquid, CFIL, and their subsequent application in asymmetric transfer hydrogenation of the various ketones."
1,Experimental,
2,Materials and methods,"2.1 Materials and methods Unless otherwise mentioned, all reactions were carried out under an atmosphere of argon using conventional Schlenk glassware, solvents were dried using established procedures and distilled under argon just prior to use. Analytical grade and deuterated solvents were purchased from Merck. The starting materials 1-methylimidazole, (S)-2-oxiranylanisole, PPh2Cl and Et3N were purchased from Fluka and used as received. [Ru(η6-p-cymene)(µ-Cl)Cl]2 [54], [Ru(η6-benzene)(µ-Cl)Cl]2 [55], Ir(η5-C5Me5)(μ-Cl)Cl]2 [56] and [Rh(μ-Cl)(cod)]2 [57] were prepared according to the literature procedures. 1H (at 400.1 MHz), 13C (at 100.6 MHz) and 31P-{1H} NMR (at 162.0 MHz) spectra were recorded on a Bruker AV 400 spectrometer, with TMS (tetramethylsilane) as an internal reference for 1H NMR and 13C NMR or 85% H3PO4 as an external reference for 31P-{1H} NMR. The infrared spectra was measured by an Agilent Cary 630 FTIR, respectively. The FTIR spectra were recorded using a universal ATR sampling accessory (4000–400 cm−1).Elemental analysis was carried out on a Costech ECS 4010 instrument. Melting points were recorded by a Gallenkamp Model apparatus with open capillaries."
3,General procedure for the asymmetric transfer hydrogenation of ketones,"2.2 General procedure for the asymmetric transfer hydrogenation of ketones Typical procedure for the catalytic hydrogen-transfer reaction: a solution of the complexes 3–6 (0.00125 mmol), KOH (0.00625 mmol) and the corresponding ketone (0.25 mmol) in degassed isoPrOH (5 mL) was refluxed until the reaction completed. Then, a sample of the reaction mixture is taken off, diluted with acetone and analyzed immediately by GC, conversions obtained are related to the residual unreacted ketone."
4,GC analyses,"2.3 GC analyses GC analyses were performed on a Shimadzu GC 2010 Plus Gas Chromatograph equipped with a cyclodex-B (Agilent) capillary column (30 m × 0.32 mm I.D. × 0.25 μm film thickness). Racemic samples of alcohols were obtained by reduction of the corresponding ketones with NaBH4 and used as the authentic samples for ee % determination. The GC parameters for asymmetric transfer hydrogenation of ketones were as follows; initial temperature, 50 °C; initial time 1.1 min; solvent delay, 4.48 min; temperature ramp 1.3 °C/min; final temperature, 150 °C; initial time 2.2 min; temperature ramp 2.15 °C/min; final temperature, 250 °C; initial time 3.3 min; final time, 44.33 min; injector port temperature, 200 °C; detector temperature, 200 °C, injection volume, 2.0 μL."
5,Synthesis and characterization of compounds,"2.4 Synthesis and characterization of compounds 2.4.1 Synthesis of 3-[(2S)-2-hydroxy-3-phenoxypropyl]-1-methyl-1H-imidazol-3-ium chloride, (1) To a stirred solution of 1-methylimidazole (1.03 g, 12.5 mmol) in ethanol (2 mL) at room temperature was carefully added concentrated hydrochloric acid (1.05 mL, 12.8 mmol). Caution: neutralization of a base with a strong acid is highly exothermic. After addition of acid, the reaction mixture was cooled to room temperature and (S)-2-oxiranylanisole (1.95 g, 13 mmol) was added dropwise with stirring, while maintaining the temperature at 25 °C. The reaction vessel was then sealed and stirred at room temperature for approximately 30 h. The solvent was removed under reduced pressure on heating at 70 °C, followed by heating under high vacuum, to yield a liquid that became more viscous upon extensive drying, and this was recrystallized from ethylacetate at 0 °C. The precipitated product was filtered and dried in vacuo yielding 1 as an off-white solid. Yield: 2.79 g, 83.0%; M.p.: 121–122 °C; [α]D 20= +33.6° (c 1, CHCl3); 1H NMR CDCl3-d1, ppm): δ: 9.57 (s, 1H, (CH3)NC H N–), 7.41 and 7.33 (2xs, 2H, –NC H C H N–), 7.12–7.16 (m, 2H, –CH2O Ph ), 6.82–6.86 (m, 1H, –CH2O Ph ), 6.77–6.79 (m, 2H, –CH2O Ph ), 6.08 (d, 1H, J = 5.8 Hz, –CHO H ), 4.53–4.56 (m, 1H, NC H 2, (a)), 4.36–4.41 (m, 1H, NC H 2, (b)), 4.27 (br, 1H, –C H OH), 4.02–4.05 (m, 1H, –C H 2OPh, (a)), 3.85 (s, 3H, C H 3N), 3.77–3.81 (m, 1H, –C H 2OPh, (b)); 13C NMR (100.6 MHz, CDCl3-d1, ppm): δ: 36.43 ( C H3N), 52.55 (N C H2), 67.56, 68.40 (– C HOH and – C H2OPh), 114.45, 121.24, 129.54 (o-, m-, p-carbons of –CH2O Ph ), 122.90, 123.28 (–N C H C HN–), 137.62 ((CH3)N C HN–),158.00 (i-carbon of –CH2O Ph ); assignment was based on the 1H–13C HETCOR, DEPT and 1H–1H COSY spectra; IR: υ 3209 (OH), 2959 (aliphatic CH) cm−1; Anal. for C13H17N2O2Cl (268.74 g/mol): calcd. C 58.10, H 6.38, N 10.42; found C 57.99, H 6.34, N 10.37%. 2.4.2 Synthesis of [3-[(2S)-2-[(diphenylphosphanyl)oxy]-3-phenoxypropyl]-1-methyl-1H-imidazol-3-ium chloride], (2) 3-[(2S)-2-hydroxy-3-phenoxypropyl]-1-methyl-1H-imidazol-3-ium chloride, (1) (0.100 gr, 0.37 mmol) and Et3N (0.038 gr, 0.37 mmol) were dissolved in dry CH2Cl2 (30 mL) under an argon atmosphere. Next, PPh2Cl (0.084 gr, 0.37 mmol) was added dropwise with a syringe to this solution. The mixture was stirred at room temperature for 30 min, and the solvent was removed under reduced pressure. After addition of dry thf, the white precipitate (triethylammonium chloride) was filtered off under argon and dried in vacuo to produce a white viscous oily compound 2. Yield: 0.160 g, 95.0%. [α]D 20= +42.5° (c 1, CHCl3); 1H NMR (400.1 MHz, CDCl3-d1, ppm): δ: 9.91 (s, 1H, -(CH3)NC H N–), 6.74–7.30 (m, 17H, P(C6 H 5)2 + –NC H C H N-+–CH2O Ph ), 4.84–4.87 (m, 1H, NC H 2, (a)), 4.62–4.70 (m, 2H, NC H 2, (b) + -C H OP), 4.17 (m, 2H, -C H 2OPh), 3.72 (s, 3H, C H 3N); 13C NMR (100.6 MHz, CDCl3-d1, ppm): δ 36.60 ( C H3N), 52.62 (N C H2), 67.64 (– C H2OPh), 78.09 (d, J = 22.1 Hz, - C HOP), 114.56, 121.35, 122.76, 123.16, 129.61 (–N C H C HN– and o-, m-, p-carbons of –CH2O Ph ), 128.62 (d, 3 J 31P–13C = 9.1 Hz, m-P( C 6H5)2), 131.53 (p-P( C 6H5)2), 135.28 (d, 2 J 31P–13C = 12.1, o-P( C 6H5)2)), 138.21 (-(CH3)N C HN–), 158.02 (i-carbon of –CH2O Ph ) (not observed, i-P(C 6H5)2); assignment was based on the 1H–13C HETCOR, DEPT and 1H–1H COSY spectra; 31P-{1H} NMR (162.0 MHz, CDCl3-d1, ppm): δ 118.49 (s, O P Ph2); IR: υ 3146, 3053 (aromatic CH), 2930, 2870 (aliphatic CH) 1435 (P-Ph), 1044 (OP) cm−1; Anal. for C25H26N2O2PCl (452.92 g/mol): calcd. C 66.30, H 5.79, N 6.19; found C 66.21, H 5.73, N 6.15%. 2.4.3 Synthesis of [3-[(2S)-2-({[dichloro(η6-p-cymene)ruthenium]diphenyl phosphanyl}oxy)-3-phenoxypropyl]-1-methyl-1H-imidazol-3-ium chloride], (3) [Ru(η6-p-cymene)(µ-Cl)Cl]2 (0.068 g, 0.110 mmol) and [(Ph2P)-C13H16N2O2]Cl, 2 (0.100 g, 0.221 mmol) were dissolved in dry CH2Cl2 (25 mL) under argon atmosphere and stirred for 1 h at room temperature. The volume was concentrated to ca. 1–2 mL under reduced pressure and addition of petroleum ether (20 mL) gave the corresponding ruthenium(II) complex as a red solid. The product was collected by filtration and dried in vacuo. Yield:150 mg, 89.5%; m.p.:127–128 °C; [α]D 20= +39.1° (c 1, CHCl3); 1H NMR (400.1 MHz, CDCl3 , ppm): δ 9.89 (s, 1H, -(CH3)NC H N–), 6.42–7.95 (m, 17H, P(C6 H 5)2 + –NC H C H N-+–CH2O Ph ), 5.50 (s, 2H, aromatic protons of p-cymene), 5.16 (d, J = 5.2 Hz, 1H, aromatic protons of p-cymene), 4.93 (d, J = 5.2 Hz, 1H, aromatic protons of p-cymene), 4.69 (br, 1H, -C H OP), 4.60 (br, 2H, NC H 2), 3.95 (br, 4H, -C H 2OPh, (a) + C H 3N), 3.60 (br, 1H, -C H 2OPh, (b), 2.45 (m, 1H, –C H – of p-cymene), 1.85 (s, 3H, C H 3Ph of p-cymene), 1.05 (d, J = 6.8 Hz, 3H, C H 3)2CHPh of p-cymene), 0.72 (d, J = 6.8 Hz, 3H, C H 3)2CHPh of p-cymene); 13C NMR (100.6 MHz, CDCl3-d1, ppm): δ 17.22 ( C H3Ph of p-cymene), 20.25, 22.56 (( C H3)2CHPh of p-cymene), 30.05 (– C H– of p-cymene), 36.60 ( C H3N), 50.50 (N C H2), 66.55 (– C H2OPh), 73.73 (d, J = 9.1 Hz, - C HOP), 85.29 (s, aromatic carbons of p-cymene), 88.26 (s, aromatic carbons of p-cymene), 89.91 (d, J = 8.0 Hz, aromatic carbons of p-cymene), 94.23 (s, aromatic carbons of p-cymene), 96.41, 110.35 (quaternary carbons of p-cymene), 114.27, 121.15, 122.55, 124.18, 129.33 (–N C H C HN– and o-, m-, p-carbons of –CH2O Ph ), 128.30 (d, 3 J 31P–13C = 10.1 Hz, m-P( C 6H5)2), 131.30 (p-P( C 6H5)2), 134.50 (d, 2 J 31P–13C = 12.1, o-P( C 6H5)2)), 137.78 (-(CH3)N C HN–), 157.18 (i-carbon of –CH2O Ph ), (not observed, i-P( C 6H5)2); assignment was based on the 1H–13C HETCOR, DEPT and 1H–1H COSY spectra; 31P-{1H} NMR (162.0 MHz, CDCl3 , ppm): δ 124.61 (s, O P Ph2); IR: υ 3146, 3056 (aromatic CH), 2960, 2870 (aliphatic CH) 1435 (P-Ph), 1044 (OP) cm−1; Anal. for C35H40N2O2PRuCl3 (759.12 g/mol): calcd. C 55.38, H 5.31, N 3.69; found C 55.31, H 5.27, N 3.64%. 2.4.4 Synthesis of [3-[(2S)-2-({[dichloro(η6-benzene)ruthenio]diphenylphosphanyl}oxy)-3-phenoxypropyl]-1-methyl-1H-imidazol-3-ium chloride], (4) [Ru(η6-benzene)(µ-Cl)Cl]2 (0.055 g, 0.110 mmol) and [(Ph2P)-C13H16N2O2]Cl, 2 (0.100 g, 0.221 mmol) were dissolved in dry CH2Cl2 (25 mL) under argon atmosphere and stirred for 1 h at room temperature. The volume was concentrated to ca. 1–2 mL under reduced pressure and addition of petroleum ether (20 mL) gave the corresponding ruthenium (II) complex as a red solid. The product was collected by filtration and dried in vacuo. Yield:138 mg, 88.9%; m.p.:131–132 °C; [α]D 20= +28.8° (c 1, CHCl3); 1H NMR (400.1 MHz, CDCl3 , ppm): δ 9.26 (s, 1H, -(CH3)NC H N–), 6.63–7.95 (m, 17H, P(C6 H 5)2 + –NC H C H N-+–CH2O Ph ), 5.50 (s, 6H, aromatic protons of benzene), 5.11 (br, 1H, -C H OP), 4.60 (br, 2H, NC H 2), 3.97 (br, 5H, -C H 2OPh + C H 3N)); 13C NMR (100.6 MHz, CDCl3-d1, ppm): δ (not observed, C H3N), 52.12 (N C H2), 67.88 (– C H2OPh), 75.32 (d, J = 16.1 Hz, - C HOP), 90.49 (s, aromatic carbons of benzene), 114.68, 121.14, 124.62, 124.84, 129.43 (–N C H C HN– and o-, m-, p-carbons of –CH2O Ph ), 128.58 (d, 3 J 31P–13C = 10.1 Hz, m-P( C 6H5)2), 131.59 (p-P( C 6H5)2), 133.38 (d, 2 J 31P–13C = 35.2o-P( C 6H5)2)), 137.69 (-(CH3)N C HN–), 157.37 (i-carbon of –CH2O Ph ), (not observed, i-P( C 6H5)2); assignment was based on the 1H–13C HETCOR, DEPT and 1H–1H COSY spectra; 31P-{1H} NMR (162.0 MHz, CDCl3 , ppm): δ 121.85 (s, O P Ph2); IR: υ 3142, 3056 (aromatic CH), 2952 (aliphatic CH) 1435 (P-Ph), 1044 (OP) cm−1; Anal. for C31H32N2O2PRuCl3 (703.01 g/mol): calcd. C 52.96, H 4.59, N 3.99; found C 52.88, H 4.55, N 3.94%. 2.4.5 Synthesis of [3-[(2S)-2-{[(dichloro(ɳ5–pentamethylcyclopentadienyl)iridio)diphenyl phosphanyl]oxy}-3-phenoxypropyl]-1-methyl-1H-imidazol-3-ium chloride], (5) Ir(η5-C5Me5)(μ-Cl)Cl]2 (0.088 g, 0.110 mmol) and [(Ph2P)-C13H16N2O2]Cl, 2 (0.100 g, 0.221 mmol) were dissolved in dry CH2Cl2 (25 mL) under argon atmosphere and stirred for 1 h at room temperature. The volume was concentrated to ca. 1–2 mL under reduced pressure and addition of petroleum ether (20 mL) gave the corresponding Iridium (III) complex as an orange microcrystalline solid. The product was collected by filtration and dried in vacuo. Yield:160 mg, 85.1%; m.p.:152–153 °C; [α]D 20= +46.7° (c 1, CHCl3); 1H NMR (400.1 MHz, CDCl3 , ppm): δ 9.72 (s, 1H, -(CH3)NC H N–), 6.46–7.88 (m, 17H, P(C6 H 5)2 + –NC H C H N-+–CH2O Ph ), 5.13 (br, 1H, -C H OP), 4.67 (d, J = 17.2 Hz, 2H, NC H 2), 4.00 (s, 3H, C H 3N), 3.97 (br, 1H, -C H 2OPh, (a), 3.86 (br, 1H, -C H 2OPh, (b), 1.33 (s, 15H, C H 3 of Cp ∗(C5Me5); 13C NMR (100.6 MHz, CDCl3-d1, ppm): δ 8.24 (C5 Me 5), 36.90 ( C H3N), 50.63 (N C H2), 67.58 (– C H2OPh), 74.44 (d, J = 6.0 Hz, - C HOP), 94.12 ( C 5Me5), 114.29, 120.96, 122.67, 123.76, 129.22 (–N C H C HN– and o-, m-, p-carbons of –CH2O Ph ), 128.29 (d, J = 11.1 Hz, m-P( C 6H5)2), 131.57 (s, p-P( C 6H5)2), 134.67 (br, o-P( C 6H5)2)), 138.37 (-(CH3)N C HN–), 157.42 (i-carbon of –CH2O Ph ) (not observed, i-P( C 6H5)2); assignment was based on the 1H–13C HETCOR, DEPT and 1H–1H COSY spectra; 31P-{1H} NMR (162.0 MHz, CDCl3 , ppm): δ 94.03 (s, O P Ph2); IR: υ 3056 (aromatic CH), 2960 (aliphatic CH) 1435 (P-Ph), 1044 (OP) cm−1; Anal. for C35H41N2O2PIrCl3 (851.27 g/mol): calcd. C 49.38, H 4.85, N 3.29; found C 49.29, H 4.81, N 3.26%. 2.4.6 Synthesis of [3-[(2S)-2-{[(chloro(ɳ4-1,5-cyclooctadiene)rhodium)diphenyl phosphanyl] oxy}-3-phenoxypropyl]-1-methyl-1H-imidazol-3-ium chloride], (6) [Rh(μ-Cl)(cod)]2 (0.054 g, 0.110 mmol) and [(Ph2P)-C13H16N2O2]Cl, 2 (0.100 g, 0.221 mmol) were dissolved in dry CH2Cl2 (25 mL) under argon atmosphere and stirred for 1 h at room temperature. The volume was concentrated to ca. 1–2 mL under reduced pressure and addition of petroleum ether (20 mL) gave the corresponding Rhodium (I) complex as a yellow microcrystalline solid. The product was collected by filtration and dried in vacuo. Yield: 130 mg, 84.2%; m.p.:124–125 °C; [α]D 20= +33.2° (c 1, CHCl3); 1H NMR (400.1 MHz, CDCl3 , ppm): δ 10.41 (s, 1H, -(CH3)NC H N–), 6.84–7.52 (m, 17H, P(C6 H 5)2 + –NC H C H N-+–CH2O Ph ), 5.76 (br, 1H, C H of cod), 5.69 (br, 1H, C H of cod), 5.03 (m, 1H, NC H 2 (a)), 4.85 (m, 1H, NC H 2 (b)), 4.57–4.64 (m, 2H, -C H 2OPh), 4.27 (br, 1H, -C H OP), 3.93 (s, 3H, C H 3N), 3.42 (br, 1H, C H of cod), 2.96 (br, 1H, C H of cod), 2.38 (br, 2H, C H 2 of cod), 2.28 (d, J = 7.2 Hz, 2H, C H 2 of cod), 1.96 (br, 2H, C H 2 of cod), 1.67 (d, J = 8.0 Hz, 2H, C H 2 of cod) ; 13C NMR (100.6 MHz, CDCl3-d1, ppm): δ 27.82, 29.08, 32.12, 34.04 ( C H2 of cod), 36.65 ( C H3N), 50.63 (N C H2), 68.97 (– C H2OPh), 71.32 (d, J = 15.1 Hz, C H of cod), 71.81 (d, J = 13.1 Hz, C H of cod), 77.58 (d, J = 12.1 Hz, - C HOP), 111.85 (d, J = 11.1 Hz, C H of cod), 114.74, 121.49, 122.20, 123.12, 129.76 (–N C H C HN– and o-, m-, p-carbons of –CH2O Ph ), 128.77 (d, J = 13.1 Hz, m-P( C 6H5)2), 131.65 (s, p-P( C 6H5)2), 133.18 (d, J = 15.1 Hz, o-P( C 6H5)2)), 138.94 (-(CH3)N C HN–), 158.08 (i-carbon of –CH2O Ph ) (not observed, i-P( C 6H5)2); assignment was based on the 1H–13C HETCOR, DEPT and 1H–1H COSY spectra; 31P-{1H} NMR (162.0 MHz, CDCl3 , ppm): δ 123.31 (d, 1 J (103Rh–31P) = 176.6 Hz, O P Ph2); IR: υ 3146, 3053 (aromatic CH), 2937, 2874 (aliphatic CH) 1435 (P-Ph), 1044 (OP) cm−1; Anal. for C33H38N2O2PRhCl2 (699.46 g/mol): calcd. C 56.67, H 5.48, N 4.05; found C 56.56, H 5.44, N 4.01%."
6,Results and discussion,
