,sections,Text
0,Introduction,"In molecular synthesis, organic peroxides are often key reagents both in laboratory and industrial processes as oxidizing agents and initiators for free-radical reactions. Organic peroxides are not only useful in organic synthetic chemistry, but they are also highly involved in biological processes: indeed, their various biological activities and pharmaceutical applications have driven the recent advances in the peroxide's chemistry field as highlighted by the hundreds of publications covered in the literature concerning organic peroxides [1–3]. By contrast, the particular hydroperoxide motif of β-hydroperoxy alcohol was only scarcely reviewed up today, and the aim of this present review is to focus on its preparation (Fig. 1 ) [4]. β-hydroperoxy alcohols (HPA) 1, also known as β-hydroxyhydroperoxides, are important and versatile intermediates in organic synthesis. One important application of HPAs is the preparation of 1,2,4-trioxanes (Scheme 1 ) [1–3]. Indeed, the classical pathway to obtain efficiently 1,2,4-trioxanes 2 is the condensation of β-hydroperoxy alcohols 1 with carbonyl compounds (Scheme 1a) [5–8]. To promote such peroxyacetalization of β-hydroperoxy alcohols, the use of Brønsted acids such as tungstic acid [9], hydrochloric acid [10–12], p-toluenesulfonic acid (p-TSA) [13–21], 10-camphorsulfonic acid (CSA) [17,22,23], or pyridinium or p-toluenesulfonate (PPTS) was required [24]. Due to the simplicity and versatility of the method, the pharmaceutical company Sanofi-Aventis patented [25] the simple Brønsted acid-catalysed condensation protocol using p-TSA for the preparation of various 1,2,4-trioxanes and their application as antimalarial drugs. Another widely used catalyst was the Lewis acid (LA) boron trifluoride [24,26–33] and more anecdotally transition metal catalysts such as copper(II) sulfate [34] or the recoverable silica-supported ferric chloride [35] were also reported. An alternative pathway for the 1,2,4-trioxanes synthesis by peroxyacetalization reaction used aliphatic and aromatic orthoesters (RC(OR’)3) as carbonyl sources (with different catalysts such as indium triflate [24] as a Lewis acid catalyst, PPTS [36] or p-TSA [37] as a Brønsted acid catalyst) (Scheme 1b). Orthocarbonates (C(OR)4) can be also used in the presence of boron trifluoride (Scheme 1c) [36]. 1,2,4-trioxanes have aroused a great deal of interest in the scientific community due to their antimalarial properties [38,39], especially since the discovery of artemisinin by You-You Tu, Nobel Laureate in Physiology or Medicine in 2015 (Fig. 2 ). They also displayed antitumor [30,40] as well as fasciocidal activities [41] and a lot of other various types of bioactivity [42] as recently shown by their description as possible agents to fight against coronavirus disease COVID-19 [43–45]. Another interest of the 1,2,4-trioxane motif is the use as an alternative to ketal protecting group of carbonyls which are stables under various conditions such as Wittig reaction, addition of Grignard reagents or reductive conditions. The deprotection leading to the corresponding carbonyl derivatives can be conducted efficiently in high yields under basic conditions at ambient temperature [46]. A second versatile application of HPAs is epoxidation reactions. Indeed, β-hydroperoxy alcohols can be used as oxygen donors in highly diastereoselective, titanium-catalysed epoxidation of ene diols [47], thus exhibiting interesting advantages over the classical Sharpless epoxidation [48]. Indeed, one advantageous practical purpose is that the reaction could be conducted at room temperature under short reaction times (ca. 1/2 h) with a high stereochemical control (Eq. (2-1), Scheme 2 ). As a representative example, starting from an enantiomerically pure ene diol derivative 5, the corresponding epoxy diol product 6 was obtained in an enantiomerically and diastereoisomerically pure form. In addition, HPA could play the double role of the oxygen donor and oxygen acceptor, thus avoiding the use of an external hydroperoxide, such as the classical tert-butyl hydroperoxide in the Sharpless epoxidation (Eq. (2-2), Scheme 2). Noticeably, an enhanced reaction rate compared to the conventional titanium-catalysed epoxidation with tert-butyl hydroperoxide (TBHP) was also reported (5 min at −20 °C) [49]. Such poor reactivity of allylic alcohols bearing an additional hydroxyl functionalities in the Sharpless epoxidation with TBHP was already well-reported [50,51]. Moreover, using chiral allylic alcohols (e.g. 10) in an one-pot epoxyhydroxylation, chiral epoxydiols (e.g. 12) could be selectively obtained, notably with the introduction of three additional chiral centres in successive, adjacent positions (Eq. (2-3), Scheme 2). [47,52]. Noticeably, the reduction of the HPA moiety could be performed with common reducing agents such as Pd/C-catalysed hydrogenation [34], KI [53], Ph3P (excess) [54], Ph2S (3 equiv.) [55], as representative examples and led to 1,2-diol, and more especially cis-1,2-diol. Finally, numerous studies [9,53,54,56–62] showed that HPAs can be subjected to homolytic cleavage of the O–O bond leading to the corresponding carbonyl derivatives via diverse pathways such as thermolysis, photolysis or transition-ion-mediated decomposition through single electron transfer (Eq. (3-1), Scheme 3 ). as well as acid- or base-catalysed fragmentation (Eq. (3-2), Scheme 3). Noticeably, these fragmentation methodologies allowed easy accesses to aldehydes, ketones and carboxylic acids, which highlighted that HPA derivatives have to be seen as ideal key intermediates in the oxidative cleavage of alkenes. Currently, five main general approaches to afford HPAs were described in the literature: (i) starting from alkenes, (ii) via the epoxide opening with hydrogen peroxide, (iii) by allylic alcohol oxidation, (iv) using the Kornblum−DeLaMare rearrangement of β-hydroperoxy alkylperoxides and (v) using a H2O2 mediated reaction of 1,2-diol in acidic conditions (Scheme 4 ). This review aims to report the state of the art in this area, highlighting the advantages of the methodologies but also the possible drawbacks, such as the limited scope, the unsatisfactory efficiency, the use of toxic reagents, and the inappropriate conditions with regard to safety requirements. This review also aims to highlight the recent achievements for the synthesis of HPA avoiding the use of hazardous anhydrous and ethereal solution of hydrogen peroxide, which make them safer to be implemented in an industrial scale-up phase and stimulate a revival interest in the synthetic community."
1,HPA synthesis starting from alkenes,This first part of this review will focus on the pioneer syntheses of HPAs using radio-induced methodologies and the chemical preparation from alkenes (other than those involving an epoxide intermediate which will be described in the following part).
2,Pioneering work on natural molecules,"2.1 Pioneering work on natural molecules Historically, the first synthesis of the HPA motif took place directly from alkenes, by radiochemical activation. The degradation of DNA in cells induced by radiation such as X, α, β or γ-rays had serious biological consequences such as the cell death, reproductive death, mutation and carcinogenesis. Thus, to learn more about the radio-induced modifications in DNA nucleobases, the study of pyrimidines led to the first synthesis of the HPA moiety. Indeed, since 1956, it has been shown that the radiolysis of oxygenated aqueous solutions of thymine 13 led to the formation of peroxidized organic products, which were identified as the pyrimidine HPA 14/15 formed by saturation of the 5:6 ethylenic bond [63–65]. Two years later, in order to validate the cis or trans configuration of the HPA motif, Ekert and Monier carried out chemical syntheses of the cis and trans isomers of 5-hydroperoxy-6-hydroxydihydro-thymine 14 and of 6-hydroperoxy-5-hydroxydihydro-thymine 15 (Scheme 5 ) [66]. The mixture of cis-14 and cis-15 isomers was obtained by reaction of thymine 13 with concentrated hydrogen peroxide in the presence of a catalytic amount of OsO4. The trans isomers were separately prepared from 13 in a sequential pathway: first, the trans-4-hydroxy-5-bromothymine was prepared by reaction with hypobromous acid. By treatment with concentrated H2O2 then wet Ag2O, HPA trans-14 was obtained. By switching the order of the introduction of the two reactants, HPA trans-15 was selectively prepared. Thus, in accordance with Latarjet's results [67], the HPA obtained by radiation of thymine was in fact a 20:80 mixture of the cis and trans isomers of 14. The proposed reaction sequence for the HPA formation is shown in Scheme 6 . In a very similar way to X-rays, hydroperoxides can be formed by the action of γ radiation on thymine in aerated aqueous solution as demonstrated by Téoule and Cadet [69]. Similarly, the identification of the different hydroperoxides formed during the irradiation process, (e.g. 5(6)-hydroperoxy-6(5)-hydroxydihydrothymine 14 and 15), was based on the comparison with separately prepared compounds. A new family of HPAs was obtained from various steroids under ionizing radiation. Indeed, as representative examples, the action of ionizing radiation on aqueous solutions of 11-deoxycorticosterone, cortisone and related steroids led to the corresponding HPA derivatives (Scheme 7 ). The corresponding regioisomer with the hydroxyl group on the C4 carbon and hydroperoxyl on the C5 carbon can also be formed [65,68,70]. These radiochemical or chemical synthetic routes only had an interest in fundamental research, particularly in the field of biology. Indeed, starting from simple olefinic molecules, the radiolysis of an aqueous solutions of ethylene gave only very small amounts of stable hydroperoxides [71]. On the other hand, the formation of HPAs from the irradiation of an aqueous solution of propylene in the presence of oxygen was briefly mentioned [65,70]. Thus, the action of ionizing radiations on ethylenic systems in the presence of oxygen could lead to HPAs, although this did not constitute a viable and efficient synthetic route."
3,From tropospheric chemistry to preparative HPA synthetic methods,"2.2 From tropospheric chemistry to preparative HPA synthetic methods A similar mechanism for the formation of HPAs can take place naturally in the troposphere. These reactions were mainly initiated by hydroxyl radicals, whose primary formation results from the photo-dissociation of ozone by solar ultraviolet radiation in the presence of water vapour [72]. Thus, oxidation of isoprene 16 in certain geographic areas led to the formation of HPAs 17 and 18 (Scheme 8 ) [73–75]. This tropospheric type of route could also be used in the laboratory. For example, Wan and Davis had described the formation of HPAs by the photo-oxygenation of several m-nitrostyrenes in the presence of oxygen [76]. Although photochemical reactions in the presence of oxygen were generally not selective, the authors had shown that starting with m-nitrostyrene derivatives, the reaction in water in the presence of oxygen was clean and took place via a global tandem addition process (Scheme 9 ). When an oxygen flow was applied in the aqueous solution of m-nitrostyrenes 19–21 under light irradiation, the corresponding HPAs 22–24 were selectively obtained in low conversions (<30 %). Noticeably, under similar conditions, m-nitrostilbene only led in the trans-to-cis photo-isomerization product [77]. Additionally, due their relative low stability, prolonged irradiation resulted in the formation of m-nitrobenzaldehyde 27 along with aldehyde 26, and small amounts of α-hydroxyketone 25. These products all originated from a secondary photochemical reaction, as confirmed by an independent photolysis of HPA 22. Performing sensitization experiments with rose Bengal of aqueous solution of m-nitrostyrenes led to no significant reaction which ruled out the implication of singlet oxygen in the process. These observations suggested that only the triplet state of oxygen was involved in the reaction pathway. A plausible mechanism for water and oxygen addition is shown in Scheme 10 . Notably, water underwent nucleophilic attack of the polarized triplet excited state generating a m-nitrobenzyl carbanion intermediate which could be “trapped” by dissolved oxygen to give the corresponding HPAs (Scheme 10). HPA 22 was fairly stable and could be purified by silica gel chromatography or crystallized from acetone. Its reduction with aqueous Na2SO3 or KI gave the corresponding 1,2-diol and hence offered a simple overall procedure for the dihydroxylation of m-nitrostyrene 19. By contrast, HPA 23 and 24 were much less stable and could easily decompose by thermolysis (at > 30 °C) or by prolonged photolysis, which make their purification difficult. It must be underlined that it represented the first and still the only example of conversion of alkenes, more particularly styrenes to HPA by photo-oxygenation using natural triplet oxygen (if excluding allylic alcohols). Unlike Wan and Davis, Jefford et al. introduced the HPA motif via singlet-oxygen-mediated reaction [78]. In fact, the methylene blue (MB)-sensitized photo-oxygenation of indene 28 in aqueous acetone solution containing traces of hydrochloric acid at 10 °C for 10 h led to the trans-2-hydroperoxy-1-hydroxyindane 31 as the major product in 72 % isolated yield (Scheme 11 ). Small amount of the chloro analogue 30 (2 %) and the cis-fused 3,3-dimethyl-1,2,4-trioxane 32 (7 %) were also obtained. This result indicated that a singlet oxygen molecule could be added to indene 28 to form the zwitterionic stabilized species 29. Noticeably, when 1,2-dihydronaphthalene 33 was used under the same conditions (aqueous acetone solution, with or without addition of HCl), allylic hydroperoxide 34 was the main product (60% yield) while HPA 35 was isolated in 29 % yield (Scheme 12 ). Additionally, the amount of hydrochloric acid had no effect on the composition of the mixture. This reaction was sensitive to the substituents present on the aromatic ring. Indeed, no reaction took place when a nitro group was present in position 7 of 1,2-dihydronaphthalene 33 and no HPA was formed if this position was occupied by a methoxy group since in this case a dioxetane was generated instead of the zwitterionic peroxide intermediate. Even if interesting, this methodology to prepare HPAs was substrate specific and not suitable for aliphatic olefins."
4,The perhydrolysis way via ring-opening of epoxides,"Epoxides are versatile and important intermediates in organic synthesis [79]. No reaction of epoxides has been more thoroughly studied and more widely used in synthesis than the regio- and stereoselective ring-opening reactions with a variety of nucleophilic species leading to β-substituted alcohols [80–82]. In this area, the opening of epoxides with hydrogen peroxide as a nucleophile is one of the easiest and most straightforward synthetic procedures for the efficient preparation of β-hydroperoxy alcohols. In this paragraph, a few general features of this reaction will be first presented highlighting its main advantages and limitations and then advances made to overcome these limitations will be described."
5,Hydrolysis versus perhydrolysis: general considerations,"3.1 Hydrolysis versus perhydrolysis: general considerations Epoxides can be ring-opened in either neutral, basic, or acidic conditions [81,85–94]. Usually, the presence of acid accelerates the epoxide's ring opening. More interestingly, the main concern in this area is the regioselectivity of the ring opening of unsymmetrical epoxides which differs under acid-catalysed, base-catalysed or neutral conditions. Indeed, performing the reaction under basic or neutral conditions leads to regioselective nucleophilic attacks at the sterically less-hindered carbon atom according to a classical SN2 mechanism. On the other hand, the reaction is described to proceed via a borderline SN2 mechanism (or modified A2) under acidic conditions [80,83,84]. One of the most important reactions involving a nucleophile for the opening of epoxides in industrial applications is hydrolysis which results in the corresponding 1,2-diols (Scheme 13 ) [95]. However, hydrogen peroxide has very different chemical properties from water [96], as classically illustrated by pH meter readings of aqueous hydrogen peroxide solutions which are lower than the “real” pH value in water. Indeed, Kolczynski et al. have shown [97] that this behaviour appeared to have a connection with hydrogen ion activity. More precisely, it is linked to the difference in the free energy of the proton solvation in water and in hydrogen peroxide which is about 9 kcal/mol, indicating that the proton is more firmly bound to oxygen in water. As a result, undissociated hydrogen peroxide behaves as a stronger nucleophile than water. This argument was confirmed by Sanderson who indicated that hydrogen peroxide was about 104 times more nucleophilic than water [98]. Based on these observations, it becomes apparent that hydrogen peroxide can act as a nucleophile in epoxide opening reactions resulting in HPA formation via a perhydrolysis reaction (Scheme 13). Thus, the use of aqueous hydrogen peroxide should result in a competition for the opening of epoxides by water and hydrogen peroxide nucleophiles. In the next part, in order to direct the reaction towards the selective formation of HPAs, highly concentrated hydrogen peroxide, or even anhydrous or in ethereal extracts were used, even if such reactions can represent high risks [99]."
