,sections,Text
9,Photo-oxygenation of allylic alcohols,"4.1 Photo-oxygenation of allylic alcohols Photo-oxygenation processes are classified as different three types depending on the mechanism involved [126,127]: Type I for radical-induced oxygenation (with triplet oxygen as the transfer reagent), type II for energy-transfer oxygenation (with singlet excited oxygen as the reagent), and more scarcely encountered type III for electron-transfer oxygenation [128] (with triplet oxygen or with a superoxide anion radical as reagent). The photooxygenation of alkenes containing at least one allylic hydrogen with singlet oxygen usually followed a type II mechanism, yielding the corresponding allylic hydroperoxides resulting from the shift of the double bond (Scheme 33 ). Since its discovery by Schenck in 1948 [129], this reaction has been widely used and starting from allylic alcohols, the HPA motif could be generated via the reaction with triplet oxygen from air as the reagent in the presence of an energy-transfer sensitizer (sens) (e.g. natural porphyrins or xanthene dyes) under sunlight. Photooxygenation of allylic alcohols was first studied soon after the discovery of Schenck but initially the isolation of stable HPAs was not reported [130–132]. Noticeably, Ohloff et al. reported the first formation of the HPA derivative during their studies on type II photooxygenation of β-damascol 68 (Scheme 34 ) [130,132]. By treatment of β-damascol with singlet oxygen, a 3:2 mixture of α,β-epoxyketone 70 and the α-methylene ketone 72, was obtained in addition to crotonaldehyde 73. Noticeably, HPA 71 was stable at 0 °C, but decomposed at room temperature leading to the corresponding carbonyl derivatives, 72 and 73. For steric reasons, the access of the singlet oxygen to the upper side of the double bond was difficult, which explained why the yield of 72 only reached 40 % and why the main product was the epoxide 70, formed via 69. The first work concerning the efficient preparation and isolation of HPAs obtained by allylic alcohol photooxygenation was carried out by Singh in 1990 [133] with the aim of synthesizing 1,2,4-trioxanes [134,135]. Allylic alcohols such as 3-aryl-2-butenols 74a-g were particularly targeted as the presence of an aryl group in position 3 of the allylic alcohols should favour the regiospecific formation of the HPAs 75a-g (Scheme 35 ). Thus, the reactions were carried out in ethanol under air in the presence of methylene blue (MB) as photosensitizer at a temperature between 0 and 10 °C for 16 h (Scheme 35). Under these conditions, HPAs 75a-g were obtained in 37–55 % yields after purification by silica gel chromatography and crystallization. Additionally, due to the remarkably high regioselectivity of the singlet oxygen ene reaction with allylic alcohols, the regio- and diastereoselective photooxygenation of chiral allylic alcohols, in which the hydroxyl group acts as a directing group, was firstly reported by Adam et al. [136,137]. Thus, starting from chiral allylic alcohols 76, by reaction of oxygen in the presence of tetraphenylporphine in CCl4 under a 150-W sodium lamp irradiation at 0 °C, the corresponding HPA 77 were obtained regio- and diastereoselectively (up to >97:<3 and 95:5, respectively). (Table 1 ). These results demonstrated that (i) (Z)-chiral allylic alcohols led to excellent diastereoselectivities in favour of the syn compound whereas (E) isomer led to poor syn:anti selectivity and (ii) that the steric effect of the aliphatic substituent attached to the stereogenic center did not influence the diastereoselectivity (entries 1–4, Table 1). Such observations seemed to confirm that the steric control and the 1,2-allylic steric strain had a weak influence on the diastereoselectivity, unlike the 1,3-allylic one (entries 1, 5–7, Table 1). In a mechanism point of view, the interaction of singlet oxygen with the hydroxyl group in the most stable conformer, i.e., not destabilized by the 1,3-allylic strain, selectively directed the approach of the electrophilic singlet oxygen to one side of the double bond as shown in Scheme 36 providing stereoselectively the syn HPAs. Noticeably, the diastereoselectivity of this reaction was higher in non-polar solvents such as chloroform, dichloromethane or tetrachloromethane. This regio- and diastereoselective photo-oxygenation of chiral allylic alcohols [138,139] has been extended to ester [140] or ether [141] functionalized allylic alcohols, and was applied for the synthesis of 1,2,4-trioxanes [21,142]. Noticeably, this transformation could be performed with allylic alcohols bearing di-, tri- and tetra-substituted (Z)-CC with a vicinal substituent at the stereogenic centre. Additionally, photo-oxygenation of chiral allylic alcohols can be also performed in micro-emulsions [143] or on PS–DVB polymer matrix doped with adsorbed porphyrin sensitizers [21]. This reaction could be performed using several photosensitizers. Apart from the most widely used tetraphenylporphyrin [21,24,27,33,36,37,142b,144], a fluorinated derivative of porphyrin, 5,10,15,20-tetrakis-(hepta-fluoropropyl)porphyrin [145,146], and methylene blue under homogeneous conditions [20,147–149] or incorporated in zeolite [150] were reported. Despite the advantages of this procedure, condensed phase photo-oxygenation conditions suffered from at least five major disadvantages as reported by Griesbeck [151]: (i) dyes have to be soluble in the reaction mixture which is limiting the use dye-solvent combinations, (ii) the dye extraction from the crude mixture is often carried out by chromatography which is an important constraint in an industrial point of view, (iii) singlet oxygen exhibits the longest lifetime in toxic solvents such as halogenated ones (e.g. CCl4, freons, perfluorohydrocarbons) [152,153], (iv) in halogenated solvents, dye photobleaching often happens especially when long reaction times are required [145], and (v) solution purging with pure oxygen is a main drawback in both industry and laboratory. Noticeably, since the beginning of this millennium, notable progresses on the efficiency of type II photo-oxygenation were performed by Griesbeck et al. in the solid phase polymer matrix [29,32,142b,154–157]. When performing photo-oxygenations in classical vessels, the restricted spatial illumination is one of the main drawbacks which explains the long reaction times observed. Additionally, the reaction efficiency is mainly disfavoured by the low interfacial area between the oxygen and the reaction mixture and the long molecular diffusion distances. In order to obtain a more efficient process, Kim et al. introduced the concept of triple-channel micro-reactors applied to photo-oxygenation [158] (Fig. 4 ). These reactors were based on continuous-flow processing, large gas–liquid interfacial area, short molecular diffusion distances, and very high surface illumination homogeneity. The efficiency of the methylene blue photosensitized oxygenations of allylic alcohols such as 78 using the triple-channel micro-reactor was demonstrated over the classical batch reactions (Scheme 37 ). Another very promising route to HPAs by photo-oxygenation of allyl alcohols without the aforementioned disadvantages was described in 2013 by Poliakoff, George et al. [31]. In order to avoid managing problems during scale-up steps related to the high reactivity of 1O2, and its quenching with solvents, the selection of the appropriate industrially acceptable non-flammable solvents was crucial. Thus, using perfluorinated photosensitizer (5,10,15,20-tetrakis-(pentafluorophenyl)porphyrin, TPFPP), photo-oxidation could be conducted continuously in scCO2, as a non-toxic and non-flammable reaction medium used close to ambient temperature (40 °C) [159–161]. The photo-oxidation proceeded faster in scCO2 than in conventional solvents, probably because (i) the reaction was conducted in a single phase conditions as gaseous O2 and scCO2 (6 % O2 in CO2) were fully miscible, and (ii) the relatively long lifetime of 1O2 in CO2 (5.1 ms at 14.7 MPa, 314 K, vs 59 ms for CCl4) [162,163]. Thus, using a flow system with a reduced reactor volume, a cyclic ketone was necessary for obtaining the target 1,2,4-trioxanes 82, via the formation of the intermediate HPA 81 in a maximum of 86 % yield. Noticeably the cyclic ketone acted as a suitable co-solvent to dissolve TPFPP (Scheme 38 ). This part highlighted that photo-oxygenation of allylic alcohols is an elegant and efficient method for the synthesis of HPAs. However, photo-oxygenation in a large-scale production prospect with conventional solvents is still problematic: (i) the combination of organic compounds, pure oxygen, and light can lead to serious safety issues, (ii) lamps wearing and the progressive opacification of the photo-reactor's walls with organic deposits necessitate to adjust the irradiation time in order to guarantee a constant conversion rate of the substrate, and (iii) photo-reactors suffer from a lack of economy of scale and are rarely available in a multipurpose chemical plant. These limitations have prompted researchers to develop methods in which the generation of singlet oxygen is not photo-induced."
10,Chemical generation of singlet oxygen,"4.2 Chemical generation of singlet oxygen Another route to achieve the transformation of allylic alcohols into HPAs can involve singlet oxygen generated chemically [164]. In contrast, these techniques have been used mainly in mechanistic studies but more scarcely in organic synthesis. Indeed, the use of highly oxidizing inorganic agents (e.g. ClO−, BrO−) which can cause side reactions, or of organic sources such as phosphite ozonide [165] or polycyclic aromatic endoperoxides [166] which required prior preparation is the main limitation for their easy utilizations. A more significant drawback is the use of stoichiometric amount of such reagents thus generating large amounts of waste. However, if the quantitative generation of singlet oxygen can be performed using a catalytic amount of a singlet oxygen promotor in a mild and convenient method, this chemically generated 1 O 2 can become useful in synthesis. Indeed, the disproportionation of hydrogen peroxide is promoted catalytically by sodium molybdate in alkaline aqueous medium with or without polar solvents such as methanol (Scheme 39 ) [167]. Noticeably, such pathway for the production of singlet oxygen was already used in an industrial scale, for example for the manufacture of rose oxide from β-citronellol by DSM [168,169]. On the other hand, it is important to underline that this reaction is exothermic and can easily lead to a thermal runaway which would obviously become problematic on a very large scale without special precautions. First reports dealing with HPA synthesis from allylic alcohols and chemically generated 1O2 in micro-emulsions have been reported [143] and patented [170] by Nardello, Aubry, et al. Thus, reactions with allylic alcohols such as (S)-4-methylpent-3-en-2-ol (S)-80 were performed in several reaction media (e.g., water, organic solvents, water-in-oil micro-emulsions (W/O)). Notably, the use of such micro-emulsions should restrict the direct interaction between allylic alcohol (S)-80 and peroxomolybdate intermediates and thus minimized its epoxidation (Scheme 40 ). The use of W/O micro-emulsions, prepared from sodium dodecylsulfate as surfactant, ethanol or n-butanol as co-surfactant, and dichloromethane or tetrachloromethane as continuous organic phase, formed HPAs as the major products in addition to epoxides (Table 2 ). The H2O2/MoO4 2− system in micro-emulsions allows to generate singlet oxygen in short reaction times, without specific photochemical equipment. However, the major disadvantage of this system is the lack of chemoselectivity due to the formation of epoxides. Moreover, in comparison to the photo-generated singlet oxygen, the stereoselectivity syn/anti is lower. To overcome this limitation, Jacobs et al. have developed a similar procedure by performing hydrogen peroxide disproportionation with lanthanum(III) ions incorporated into some zeolites (2.5%wt La) [171]. The reaction was then more chemoselective because La-peroxo species themselves were poor oxidants. In addition, the incorporation of La(III) ions in zeolite was crucial for the efficiency of the singlet oxygen generation in order to avoid the appearance of a dense La-oxo/hydroxo precipitate leading to mass transfer limitations, and reducing the efficiency of the system compared to the use of molybdate ions. As a representative example, the reaction of 4-methyl-3-pentenol 80 in the presence of 10 equiv. of H2O2 (50 %) at 40 °C for 24 h led specifically to HPA 81 in 51 % conversion with a 76:24 syn/anti ratio. Although the chemical generation of singlet oxygen seems easier to transpose to existing production units compared to photo-induced singlet oxygen generation, significant constraints remain associated with this process: (i) an exotherm which can be important during the hydrogen peroxide disproportionation, (ii) micro-emulsions are relatively complex reaction mixtures as they require water, an organic solvent, a surfactant and a co-surfactant, (iii) thermodynamic properties of micro-emulsions limit the amounts of hydrogen peroxide that can be used without phase separation, and (iv) the product recovery is somewhat tedious. Furthermore, the weakness of both photochemical and chemical singlet oxygen pathways is the singlet oxygen generation itself. A solution to overcome this drawback should be therefore to directly perform the reaction of allylic alcohols with natural triplet oxygen."
11,Thio-olefin co-oxygenation (TOCO) of substituted allylic alcohols,"4.3 Thio-olefin co-oxygenation (TOCO) of substituted allylic alcohols In the aim to synthesize new anti-malarial derivatives incorporating peroxo motifs, new methodologies to create peroxide bridges were developed from allylic alcohols and oxygen, via HPA formation. Indeed, thiol−olefin co-oxygenation (TOCO) of substituted allylic alcohols 83 led to HPA 84 that can be then condensed in-situ with various ketones to afford a series of functionalized 1,2,4-trioxanes 85 in 25–80 % yields by a simple one-pot procedure. Allylic alcohols reacted with arylthio in the presence of AIBN as activator under pure oxygen atmosphere under UV irradiation at 0 °C in order to prevent its thermal activation [16] (Scheme 41 ). In this transformation, a phenylthiyl radical was first generated from thiophenol by reaction with AIBN under hν conditions. The phenylthiyl then attacked the CC bond of the allylic alcohol following a Markovnikov selectivity, thus leading to a tertiary carbon radical intermediate which could be trapped by triplet oxygen. The obtained peroxy radical could perform a radical hydrogen abstraction from thiophenol giving HPA and regenerating phenylthiyl radical. However, although this article demonstrated the possibility to obtain HPAs via the TOCO type reaction, none of them were isolated."
12,Miscellaneous methods,"Apart alkenes, epoxides or allylic alcohols, other starting materials have also been used for the synthesis of HPA, namely β-hydroperoxy alkylperoxides and vicinal diols."
13,Kornblum-DeLaMare rearrangement of β-hydroperoxy alkylperoxides,"5.1 Kornblum-DeLaMare rearrangement of β-hydroperoxy alkylperoxides In 2012, Salomon et al. synthesized β-hydroperoxy alcohols using a base-catalysed disproportionation of an hydroperoxy endoperoxide [56] via the Kornblum−DeLaMare rearrangement [172] of β-hydroperoxy alkylperoxides such as 87, obtained by singlet oxygenation of the corresponding hydroperoxy diene [173] (e.g. 86). The disproportionation of the endoperoxide 87 was expected to produce β- and γ-hydroxyhydroperoxides 88 and 90 (Scheme 42 ). However, using bases such as triethylamine to catalyse the isomerization of endoperoxide 87, no HPA was isolated, but the product resulting from their decomposition, ketodiol 89 and a bicyclic hydroxydione hemiacetal 92, were isolated in 50 and 14 % yields, respectively. In order to prepare selectively the HPA 88, before the catalysed isomerization, hydroperoxy endoperoxide 87 was first protected by an acid-catalysed treatment with 2-methoxypropene leading to methoxyisopropyl derivative 93 in 84 % yield. The triethylamine catalysed isomerization of 93 then generated 94 in 58 % yield and the cyclic hydroxydione hemiacetal 92 in 13 % yield. Then, the deprotection of 94 under mild acidic conditions led to HPA 88 in 70 % isolated yield (Scheme 43 ). This protocol constitutes one of the scarce examples of synthesis of HPAs via a Kornblum−DeLaMare rearrangement of β-hydroperoxy alkylperoxides."
14,H2O2-mediated reaction of carbinols in acidic conditions,"5.2 H2O2-mediated reaction of carbinols in acidic conditions In order to prepare 1,2,4-trioxanes from different carbinols bearing cyclopropyl and phenyl substituents, Yadav et al. have developed a methodology via the formation of HPA intermediates [18]. Based on a previous report on the H2SO4 catalysed reaction of 30 % H2O2 with cyclopropyl-substituted alcohols leading to cyclopropyl-substituted hydroperoxides [174], 1,1-diphenyl-1,3-propanediol 95 was used to prepare in situ, the corresponding hydroperoxides 96, used for the synthesis of 1,2,4-trioxanes 97 (Scheme 44 ). Noticeably, this methodology seems to be restricted to substrates forming a highly stabilized carbocation such as diphenyl-substituted diols or cyclopropyl-substituted alcohols. However, other substrates lacking such substituents have also been used successfully. Indeed, recently, Das, Bez et al. optimized this methodology by treating 8-azido-2,6-dimethyloctane-2,3-diol 98 with 50 % H2O2 (8 equiv.), conc. H2SO4 (0.25 equiv.) in dry CH2Cl2 to form in situ HPA 99 which upon treatment with aldehydes or ketones in the presence of p-TsOH yielded the corresponding 1,2,4-trioxane derivatives 100 in inseparable diastereoisomeric mixtures in 44–86 % overall yields [175] (Scheme 45 ). Noticeably, the azido group can be tolerated under these conditions, and then permitted to the synthesis of 1,2,3-triazole linker."
15,Towards optically active HPAs,"One of the most impressive applications of β-hydroxy hydroperoxides being the preparation of 1,2,4-trioxanes, notably for the synthesis of natural chiral compounds, the efficient preparation of optically active HPAs is then an important goal which stimulated the group of Adam. Based on pioneering contribution dealing with enzymatic technologies of synthesis of optically active hydroperoxides based on kinetic resolution via a stereoselective catalysed reduction of the hydroperoxyl moiety to alcohol using a horseradish peroxidase (HPR) in the presence of guaiacol playing the role of sacrificial reductant, [176,177], he applied this technology for the preparation of optically active β-hydroxy hydroperoxides. Thus starting from racemic HPAs, a mixture of (R)-HPA (>95 % ee) and (S)-diol (>95 % ee) was obtained at 50 % conversion, with high enantiomeric excesses (>95 % for each product) [177]. (Scheme 46 ) Noticeably, using peroxidase active seleno-subtilisin, derived from serine protease subtilisin, similar reaction could be performed efficiently in a short reaction time (2 min) leading with excellent enantiomeric excess to the optically pure HPA but with the reverse absolute configuration [178]. Coprinus peroxidase enzyme can be also used, but with lower efficiency [179]. The kinetic resolution technique can be also used with various chiral β-hydroxy hydroperoxides derived from allylic alcohols. Similarly, HPAs with enantiomeric excesses up to 99 % were obtained (Scheme 47 ). [180] Even if this procedure is efficient for secondary HPAs, when it as applied to tertiary ones, the obtained HPA exhibited a low enantiomeric excess (9 %) [181]."
16,Conclusion,"In conclusion, the state-of-the-art reveals that miscellaneous substrates can be applied in synthesis of the useful β-hydroperoxy alcohol motif, an interesting and promising chemical platform. The generation of HPAs and their purification can be very challenging due to their high reactivity and easy conversion into biologically active 1,2,4-trioxane derivatives, diols or carbonyl compounds, which also constitutes their main uses and interests. Historically and for fundamental perspectives, radical cascade reactions involving alkenes were generally used. While they allowed the synthesis of various HPAs including natural product scaffolds or simple organic molecules, these reaction conditions involved harmful ionizing radiations or were specific to aryl alkene skeletons. Additionally, sequences involving electrophilic addition of alkenes leading to bromo-alcohols then nucleophilic substitutions seemed to be a more convenient synthetic pathway. However, the low HPA yields obtained and the large excesses of reagents required made these methodologies less attractive. In this context, application of epoxides ring-opening using H2O2 is more effective, especially in terms of atom economy, while it allows the use of different conditions. However, in many examples, highly concentrated or even anhydrous hydrogen peroxide was required in combination with Et2O to obtain selectively HPAs. This prerequisite can be highly dangerous and prevents any industrialization of such process. Additionally, reaction of epoxides with alkaline hydrogen peroxide solutions allowed the use of dilute H2O2 but generated an important amount of aqueous waste and had a fairly limited scope mainly due to the fast decomposition of HPAs into carbonyls under these conditions. Once more, the use of alkaline hydrogen peroxide can be dangerous in large scale level, even if some plants (bleach plants) use it under drastic safety conditions. Nevertheless, promising safer catalytic chemoselective perhydrolysis protocols using dilute hydrogen peroxide were developed based on a fine control of conditions with highly lipophilic starting materials. High chemo-, regio- and diastereoselective formation of HPAs are readily accessible by oxidation of allylic alcohols. Reported works highlighted that chemically or photo-chemically generated singlet-oxygen addition to allylic alcohols can be very efficient alternatives to other known procedures, offering milder reaction conditions. However, the main drawback of this approach is the generation of the singlet-oxygen itself, which limited these processes to the synthesis of high value-added molecule. Using triplet oxygen in a radical reaction, such as TOCO for sulphur-containing molecules, could be an alternative solution to be developed. Other starting materials such as β-hydroperoxy alkylperoxides or vicinal diols can be used, but their prior synthesis and the large excesses of hydrogen peroxide required explained the scarce examples reported. To conclude, the ever-increasing importance of peroxo-containing compounds like 1,2,4-trioxanes or high added value molecules such as aldehydes make HPA an interesting and promising chemical platform. Nevertheless, more efforts are still required in order to selectively and safely produce this useful HPA intermediate, especially for non-highly lipophilic derivatives. This review showcases the high potential of this HPA motif and may encourage organic chemists to carry out future research in this area."
