,sections,Text
0,Introduction,"Reactive oxygen species (ROS), such as superoxide anion (O2 −), hydrogen peroxide (H2O2) and hydroxyl radical ( OH), generally refer to a class of highly active reduction products of oxygen with one or more unpaired electrons [1]. Normal body metabolism produces part of ROS, and ROS at normal concentration are beneficial to cell growth and proliferation [2]. However, high level of ROS will damage nucleic acids and proteins, which is detrimental to cell survival. Furthermore, cancer cells often lack some key antioxidant enzymes, so they are more susceptible to damage by increased intracellular ROS concentration [3]. Take advantage of this characteristic of cancer cells, various ROS-based treatment approaches that kill cancer cells by further promoting the generation of ROS at tumor sites have received increasing attention in recent years [4–8]. This treatment strategy based on the different responses of cancer cells and normal cells to ROS has brought relatively specific tumor targeting and protection to normal cells. Among the ROS generation approaches, iron-mediated Fenton reaction is a promising method that converts less-reactive H2O2 into highly toxic OH in acidic condition [9]. Based on Fenton reaction, chemodynamic therapy (CDT), which uses iron-containing nanomedicine as catalyst to generate toxic OH at the tumor site, has attracted much attention in recent years [10,11]. The amount of ROS production is critical in ROS-based treatment strategies because insufficient amount of ROS can even promote the development of the tumor [12]. In general, H2O2 is overexpressed in weak acidic tumor microenvironment (TME); while insufficient in weak alkaline normal tissues [13]. The environmental difference between tumor tissue and normal tissue ensures high selectivity and low side effect of CDT [14]. The therapeutic effect of CDT often depends on the strength of Fenton response [15]. Therefore, it is increasingly important to find suitable ways to promote the Fenton response to improve efficacy. Various methods such as optimizing nanomaterials [16–19], adjusting the reaction environment [20], and introducing external energy [21,22] have been developed for improving Fenton reaction efficacy. However, as an important substrate of the Fenton reaction, the endogenous H2O2 in tumor is still insufficient to generate sufficient OH, which may be an important factor limiting the efficacy of CDT. In order to increase the concentration of H2O2 in tumor, targeted delivery of exogenous H2O2 through nanocarriers has been studied [23]. But the leakage of H2O2 during transportation may cause low delivery efficiency and damage to normal cells. Another method to increase intratumoral H2O2 level is promoting the production of H2O2 in tumor. In order to ensure the selective production of a large amount of H2O2 at the tumor site, various H2O2-generating nanomedicines containing catalytic enzymes or nanozymes, drugs, metal peroxides and even bacteria have been designed and developed for enhanced CDT (Fig. 1 ). Herein, we will briefly introduce the working mechanisms and applications of these nanomedicines (Table 1 ) [2,24–42]. The prospects and challenges are also discussed."
1,Enzymes and nanozymes,"One of the main methods for generating H2O2 in situ is utilizing catalysis of enzymes, of which the most widely used is glucose oxidase (GOD) [43]. GOD can convert glucose into H2O2 and glucose acid in the presence of oxygen, which provides the possibility to solve the hydrogen peroxide deficiency [44]. The large amount of glucose in TME provides favorable conditions for GOD to produce H2O2 [45]. And the production of glucose acid further enhances the acidity of TME, which can promote the efficiency of Fenton reaction. Recently, a large number of studies have reported GOD-mediated production of H2O2 for CDT [44]. Lin et al. prepared a manganese dioxide (MnO2)-coated iron carbide (Fe5C2) magnetic nanoparticle for GOD loading, the resulted Fe5C2-GOD@MnO2 could be used for CDT through Fenton reaction (Fig. 2 a) [27]. In response to the weak acidity of TME, MnO2 would decompose into Mn2+ and O2, leading to increased O2 concentration and GOD release. The O2 can promote the catalytic efficiency of GOD to produce sufficient H2O2 in tumor region. Finally, OH could be generated through Fe5C2-mediated Fenton reaction for triggering tumor cells apoptosis and death. As shown in Fig. 2b, in the presence of glucose, the characteristic peaks of OH were observed in electron spin resonance (ESR) spectrum of the Fe5C2-GOD@MnO2, indicated that OH was generated in this situation. However, no obvious signals were detected without glucose, indicating the key role of glucose in OH generation. The generation of OH in different conditions were further quantitatively analyzed by chromogenic 1,3-diphenylisobenzofuran (DPBF), which can be oxidized by OH into colorless radicals. As shown in Fig. 2c, under acidic condition with glucose, the absorbance of DPBF was decreased obviously, indicating a large amount of OH was generated; in contrast, under neutral conditions or acidic condition without glucose, the absorbance of DPBF did not decrease significantly. These results demonstrated that GOD-mediated H2O2 producing can effective enhance the OH generation. The intracellular ROS was detected by using a ROS probe, 2′,7′-dichlorofluorescin diacetate (DCFH-DA). As shown in Figs. 2d and e, cells incubated with Fe5C2@MnO2 did not show intracellular ROS level change when compared with control group, indicated that the GOD was the critical part in ROS generation process. In vitro cell viability and live/dead cell staining results proved that Fe5C2@MnO2 has good biocompatibility and negligible cytotoxicity; while Fe5C2-GOD@MnO2 exhibited strong inhibitory activity on HeLa cells (Figs. 2f and g). Furthermore, the therapy effect could be improved by magnetic targeting. The anticancer effect of Fe5C2-GOD@MnO2 was further demonstrated by in vivo experiment. The tumor growth was significantly inhibited by Fe5C2-GOD@MnO2, indicating the effectiveness of CDT. Importantly, magnetic targeted Fe5C2-GOD@MnO2 group displayed the best antitumor efficacy with the inhibition rate of 92% (Fig. 2h). Therefore, the nano-catalytic particles have the characteristics of magnetic targeting, TME response, high safety, and strong anti-cancer effect. In addition, GOD has been combined with a variety of Fe-containing nanomaterials including ultra-small Fe3O4 nanoparticles and metal–organic frameworks for H2O2 production-enhanced CDT [24,26]. However, as a natural protein, GOD suffers from the disadvantages of immunogenicity, high cost and short half-life in vivo [44]. These shortcomings severely hinder its bioapplications. Recently, alternatives to natural enzymes, catalytically active nanomaterials, which are often called ""artificial enzymes"" or ""nanozymes"", have become more and more attractive due to their advantages of easy manufacturing, low cost, and strong adaptability [46]. Nowadays, a large number of mimetic enzymes have been developed. For example, ultra-small gold (Au) nanoparticles (NPs) have been demonstrated to have catalytic properties similar to GOD. In the presence of dissolved oxygen, ultra-small Au NPs can oxidize glucose into glucose acid and H2O2, which is fully in line with the characteristics of GOD substitutes [47]. Shi et al. reported a dual inorganic nanozyme system for efficient tumor CDT [28]. As sown in Fig. 3 a, ultra-small Au NPs and iron oxide (Fe3O4) NPs were dispersed in the pores of dendritic mesoporous silica NPs (DMSN). After surface poly(ethylene glycol) (PEG) modification, the resulting nanozyme system (DMSN-Au-Fe3O4-PEG) without any toxic substances was obtained. The Au NPs can be used as a GOD mimic to catalyze H2O2 generation (process I); while Fe3O4 NPs can be used as a peroxidase mimic to catalyze OH generation (process II). To demonstrate the function of Au NPs, a colorimetric assay was performed to detect gluconic acid, which is a typical product of glucose oxidation reaction. As shown in Fig. 3b, the absorbance of DMSN-Au NPs solution increased with increasing glucose concentration, indicated that gluconic acid was produced through Au NPs-catalyzed reaction. In addition, with the process of reaction, the oxygen level of the solution containing DMSN-Au decreased rapidly, confirming oxygen consumption during catalytic process (Fig. 3c). These results confirmed that Au NPs have the GOD mimic function of catalyzing the production of H2O2 from glucose. Then 3,3′,5,5′-tetramethylbenzidine (TMB) colorimetric assay was used to confirm OH generation in process II. In the presence of DMSN-Au-Fe3O4 and glucose, absorption peaks were observed, indicating the cascade catalytic effects of DMSN-Au-Fe3O4 (Fig. 3d). The OH generation was also evaluated in 4T1 cells by using DCFH-DA. Strong green fluorescence was observed inside cells incubated with glucose and DMSN-Au-Fe3O4, demonstrated that the DCFH-DA was oxidized into fluorescent 2′,7′-dichlorofluorescein (DCF) by generated OH (Fig. 3e). Based on the efficient cascade catalysis of Au NPs and Fe3O4 NPs, the DMSN-Au-Fe3O4 showed great tumor-growth inhibition effect (Fig. 3f). It should be noted that the GOD-like activity of Au NPs was affected by many factors, such as size, shape, surface chemistry, concentration and environmental pH value. For example, the catalytic activity of Au NPs could be blocked by surface modification. Furthermore, it has been reported that Au nanorods (and other metals including Ag, Pd and Pt) also have intrinsic peroxidase-like and catalase-like activities. Under acidic and neutral conditions, Au nanorods mainly exerted peroxidase-like activity; while under alkaline condition they exerted catalase-like activity [48]. Therefore, in the development and application of nanozymes, their physical and chemical properties and application environment of nanozyme should be considered. In addition, the GOD- and nanozyme-mediated H2O2 generation is an oxygen-consuming process; therefore, improving the hypoxia of tumor microenvironment may be beneficial to the performance of these enzymes and nanozymes [49]. In another study, Qu et al. designed a nanozyme that can promote the effective accumulation of H2O2 at the tumor site by perturbing H2O2 balance [50]. The nanozyme (PZIF67-AT) was composed of metal–organic framework (ZIF-67) and inhibitor 3-amino-1,2,4-triazole (AT). The PZIF67-AT had superoxide dismutase-like activity, which can promote the production of H2O2. Meanwhile, the loaded AT can inhibit activity of catalase, resulting in decreased H2O2 decomposition. Therefore, the nanozyme could effectively promote the accumulation of H2O2. In addition, the PZIF67-AT can further convert H2O2 into OH through Fenton-like reaction to realize efficient CDT."
2,Drugs,"Besides enzymes and nanozymes, various chemotherapeutic drugs such as platinum drugs, doxorubicin (DOX), cinnamaldehyde (CA) and β-lapachone (Lap) have been used to promote the production of H2O2. Cisplatin is not only the first metal-based chemotherapy drug, but also one of the most effective chemotherapy drugs [51]. A large number of experiments have proved that cisplatin has a good inhibitory effect on a variety of tumors, making it a representative of chemotherapy drugs. The nature of cisplatin that can induce the generation of ROS has attracted much attention [52]. Specifically, cisplatin activates a family of enzymes called nicotinamide adenine dinucleotide phosphate (NADPH) oxidase (NOX) in cancer cells [53]. The activated NOX can catalyze NADPH to NADP+, and at the same time give an electron to O2 to convert it into O2 − [54], and then disproportionate by superoxide dismutase (SOD) to produce H2O2. Therefore, due to the characteristic of cisplatin to promote the generation of H2O2, the combination of cisplatin chemotherapy and CDT has become a promising approach, which can reduce the toxic and side effects of cisplatin and improve the efficacy. For example, Mao et al. constructed an organic nano-drug (PTCG NPs) by using epigallocatechin-3-gallate (EGCG), phenolic platinum (IV) prodrug (Pt-OH), ferric chloride and polyphenol-modified block copolymer (PEG-b-PPOH) for synergistic chemotherapy and CDT (Fig. 4 a) [29]. In response to low pH and glutathione (GSH) environments, the PTCG NPs will be disassembled and Pt-OH will be activated, leading to rapid release of cisplatin (Figs. 4b and c). The released active cisplatin will promote the generation of H2O2 through the abovementioned processes. Catalyzed by Fe ions, the OH will be further generated through Fenton reaction for CDT. The intracellular ROS levels inside cells with different treatments were determined by DCFH-DA. As shown in the confocal laser scanning microscopy (CLSM) images (Fig. 4d), very weak green fluorescence was observed in FeCl3 group, demonstrated that the endogenous H2O2 was insufficient for OH generation. It can be clearly seen that the PTCG NPs-treated HepG2 cells showed the strongest intracellular green fluorescence, indicating the enhancement of ROS generation. Both vitamin C (VC, ROS scavenger) and deferoxamine mesylate (iron chelator) could block the effect of PTCG NPs, demonstrated that the ROS was generated through an iron-involved reaction. Due to the synergistic effect of chemotherapy and CDT, the HepG2 cells incubated with PTCG NPs showed higher levels of apoptosis and necrosis than that incubated with EGCG or Pt-OH (Fig. 4e). Animal experiments also proved that PTCG NPs had the best inhibitory effect on tumors, and the inhibition rate of PTCG NPs was as high as 81.6%. Owing to the great therapeutic performance and biological safety of PTCG NPs, the survival time of PTCG NPs-treated mice was obviously prolonged. DOX is a clinical anthracycline drug for treatment of malignant tumor by inhibiting the synthesis of DNA and RNA. Due to the broad-spectrum anti-cancer and good curative effect of DOX, it has been widely used in the treatment of malignant lymphoma, leukemia, prostate cancer and various solid tumors [55]. However, excellent antitumor effect is often accompanied by serious side effects. The strong cardiotoxicity of DOX can cause heart failure [56]. Therefore, the development of combination treatment strategies is highly desirable for optimizing DOX-based therapy [57]. The effect of DOX on the promotion of ROS generation has attracted the attention of researchers [58–60]. The working mechanism of DOX is similar to that of cisplatin. Based on this property of DOX, Sun et al. developed a DOX and AT (a catalase inhibitor) co-loaded iron oxide mesoporous silica core–shell NPs (Fe3O4@MSN) for chemo/chemodynamic combination therapy [33]. After folate (FA) and triphenylphosphonium (TPP) modification, the DOX/AT@Fe3O4@MSN-TPP/PEG-FA can realize cancer cell and mitochondrial targeted therapy. In cancer cells, the released DOX could stimulate the activation of NOXs, converting O2 into O2 .−. Then the production of H2O2 was promoted by SOD. Moreover, AT could reduce the decomposition of H2O2 through inhibiting catalase activity. By combining the promotion of H2O2 production and inhibition of H2O2 decomposition, the intracellular H2O2 level could be significantly improved for efficient Fenton reaction (Fig. 5 a). Quantitative analysis of intracellular ROS by flow cytometry showed that the ROS levels in both breast adenocarcinoma cells (MCF-7) and human gastric carcinoma cells (MGC-803) were obviously improved by the incubation of DOX-containing nanomedicines (Fig. 5d). The addition of Fe3O4 can further amplify ROS level, which may attribute to the OH generation through Fenton reaction. The cytotoxicity results showed that the DOX/AT@Fe3O4@MSN-TPP/PEG-FA had a significant inhibitory effect on both MCF-7 and MGC-803 cancer cells, which was stronger than that of other groups (Figs. 5b and c). This result proved that the chemo/CDT combination treatment outcome could be further enhanced by AT. In addition, the induced apoptosis rate of the DOX/AT@Fe3O4@MSN-TPP/PEG-FA reached 88.1%, confirming the higher efficacy of the synergistic therapy. The characteristic of this study is not only the combination of chemo/chemodynamic therapy, but also the introduction of multi-level targeting and catalase inhibitors, which improves the targeting while further improving safety and therapeutic effects. In another study, Chen et al. developed a kind of metal-phenolic network NP by using DOX and cisplatin together to realize better O2 − production capacity [31]. The SOD-like activity of polyphenols could further promote the conversion of O2 − to H2O2, resulting in effective tumor inhibition. Lap, as an o-naphthoquinone, has been found to have a lethal effect on cancer cells in the late 20th century [61]. Since then, in-depth research has been carried out and the Lap has been demonstrated to have therapeutic effect on a variety of cancers such as pancreatic cancer, breast cancer and liver cancer [62]. In the process of studying Lap, its ability to promote the production of H2O2 in the presence of NAD(P)H: quinone oxidoreductase-1 (NQO1) was found. This property of Lap can be exploited to develop nanomedicines for CDT [63,64]. Furthermore, this process occurs specifically in cancer cells that overexpress NQO1, which has a protective effect on normal cells. Chen et al. developed a pH/ROS dual-responsive nanomedicine (denoted as PtkDOX-NM), which brought new ideas for the combined application of chemotherapy and CDT [34]. In this study, the PtkDOX-NMs were prepared by self-assembly of two types of amphiphilic polymers, pH-responsive PEG-b-polydiisopropylaminoethyl methacrylate-b-polydopamine (PEG-PDPA-PDA) and ROS-responsive PEG-b-polythioketal DOX prodrug (PEG-PtkDOX). Lap and ferric ions were co-loaded in the PtkDOX-NMs. After accumulating in the tumor area through the enhanced permeability and retention (EPR) effect and entering cancer cells, under the influence of the TME acidity, the PtkDOX-NMs were disassembled due to hydrophobic-to-hydrophilic conversion of PDPA segments, so that the loaded contents were quickly released. Then a large amount of H2O2 would be produced through Lap catalysis for Fenton reaction and OH generation. The generated OH could further cause DOX release by breaking thioketal bonds and thus realize combination therapy (Fig. 6 a). The Lap-induced intracellular H2O2 production was confirmed by DCFH-DA staining. With the increase of Lap concentration, the ROS level inside NQO1-overespressed A549 cells (Fig. 6b). Cytotoxicity study results showed that the inhibitory effect of nanomedicines without Lap on A549 cells was limited; while the anticancer effect of the nanomedicines was significantly enhanced by addition of Lap (Figs. 6c and d). These results indicated that the Lap-induced H2O2 production was the critical process in the cascade of OH generation and DOX release. Compared with control groups, the Lap-loaded PtkDOX-NMs showed the most potent anticancer effect, indicating combination effect of chemotherapy and CDT. In vivo experiments also demonstrated the great effect of PtkDOX-NMs on tumor inhibition (Fig. 6e). CA is an unsaturated aromatic aldehyde widely present in plants such as cinnamon. It is not only widely used as a flavoring agent in various foods, but also used in the field of medicine due to its antifungal and peripheral blood vessel relaxation effects [65,66]. In addition, at the beginning of the 21st century, the ability of CA to induce cell apoptosis by promoting the production of ROS was discovered [67]. In recent studies, CA-based drug/nanomedicine was developed to amplify oxidative stress by promoting H2O2 production and downregulating antioxidant systems, resulting in enhanced tumor cells killing effect [2,36]. By combining with Fenton catalysts, CA has also been used to enhance the efficacy of CDT by increasing the H2O2 level. For example, Zhao et al. reported a nanoreactor (HA-CD/Fc-CA NP) prepared by host-guest interaction of the bifunctional ferrocene-modified cinnamaldehyde prodrug (Fc-CA) with cyclodextrin-modified hyaluronic acid conjugate (HA-CD) [37]. HA not only improved the biocompatibility and biodegradability of the nanoreactor, but also endowed it with a strong targeting ability for CD44 receptor-overexpressed tumor cells. After cellular internalization, in response to an acidic environment, CA and ferrocene (Fc) will be released due to cleavage of pH-sensitive hydrazone bonds. Attributing to the CA-promoted H2O2 generation and Fc-mediated Fenton reaction, highly cytotoxic OH was generated for enhanced CDT (Fig. 7 a). The flow cytometry analysis proved that the intracellular ROS level could be amplified by CA. Compared with free CA, Fc-CA showed better effect, indicated that Fc could convert H2O2 into OH with stronger oxidation capability. The ROS amplification ability of HA-CD/Fc-CA NPs was comparable to that of free Fc-CA (Fig. 7b). The in vitro cytotoxicity results proved the anticancer effect of CA-containing groups. Importantly, the HA-CD/Fc-CA NPs showed higher cytotoxicity against 4T1 cells than free CA, indicating Fenton reaction-enhanced therapeutic effect (Fig. 7c). Furthermore, in vivo experiments also demonstrated that the HA-CD/Fc-CA NPs had a significant tumor suppressing effect, which was attributed to effective tumor targeting and synergistic chemo/chemodynamic therapy (Fig. 7d)."
