,sections,Text
4,Metal-based borohydrides,"2.3 Metal-based borohydrides Light alkaline-earth and alkaline metals based borohydrides like LiBH4 and Mg(BH4)2, are potential candidates for H2 storage materials. These presents high conceptual hydrogen storage capacities [42, 43]. The most common decomposition routes are shown in reactions (6) and (7) [44, 45]. These pathways lead to high gravimetric densities of the system. (6) L i B H 4 → L i H + B + ( 1.5 ) H 2 13 : 9 w t % (7) M g ( B H 4 ) 2 → M g B 2 + 4 H 2 14 : 9 w t % The above mentioned routes are the only options having various hydrogen exchange limitations in kinetic and thermodynamics properties obstructing the reversible dehydrogenation reaction. To minimize these limitations, it is proposed to proceed with a scaffolding of these hydrides in nanoporous structures [46]. The chemical steadiness of dehydrogenation stage will eliminate the dehydrogenation enthalpy and hence thermodynamic processing of storage materials can be controlled [47]. Li et al. [48] investigated that M(BH4) n (metal-borohydrides) having excessively high H2 densities are potential hydrides for hydrogen storage. However, the high temperature of reaction and slow kinetics of the system lessens its prospective for practical applications. The thermodynamic properties of metal borohydrides are estimated from the electronegativity of metal. The intermediate compound formed may continue with high temperature and moderate kinetics, whose development is prevented by the combination of M(BH4) n with other metal hydrides. This changes the path of reaction and improves H2 storage properties in prospects of both kinetically and thermodynamically. However, none of the present materials satisfies on-board hydrogen storage requirements, and hence continuous attempts are demanded to discover the novel material. Constructive designs to reach a fast reaction kinetics is a practical direction to research the field of on-board hydrogen storage in metal borohydrides. 2.3.1 Sodium borohydride Catalytic hydrogenation from NaBH4 in the liquid phase: NaBH4 is among the most focused chemical hydrides due to its outstanding high hydrogen capacity (10⋅8 wt% theoretically) [49], the operating conditions, and its control over hydrogen generation rate [50]. Hydrogen storage in NaBH4 is unconfined through hydrolysis or thermolysis. However, only hydrolysis (directed in the aqueous phase at lesser temperatures) is used in practical applications because the majority of hydrogen is generated from water in this technique, ensuring high volumetric density outputs of the system [51]. Besides this, the generated hydrogen is highly pure and undergoes humidification to facilitate its use in fuel cells. The hydrolysis of NaBH4 occurs at room temperature and releases a theoretical value of 10⋅8 wt% through the following reaction: (8) N a B H 4 + 2 H 2 O → N a B O 2 + 4 H 2 Reaction (8) represents that the 4 moles of hydrogen are released, which generally require more water in real conditions due to less solubility of borate byproducts and NaBH4 in water. By using excess water, the storage capacity of hydrogen is hindered [52]. Moreover, NaBH4 proceeds self-hydrolysis (i.e. without catalyst) with thermodynamically favored exothermic reaction. The initial hydrolysis of the components makes the intermediates basic and thus gets reduced at higher pH. This inhibits the production rate of hydrogen. To overcome this, stabilizers in the form of bases are employed to avoid premature reaction. In addition to this, acids in the form of catalysts are used to enhance the kinetics of NaBH4 hydrolysis [49, 50]. Moreover, studies have also shown metal-catalysts as potential candidates for hydrolysis reaction [51]. In early 1950s, acid-catalyzed hydrolysis was reported by Finholt et al. [50] at ambient conditions which released 90% of the stoichiometric quantity of hydrogen. However, the method employs excessive amounts of acids, resulting in heavy and bulkiness of the reaction. The use of acid-catalyst for hydrolysis of NaBH4 was not initiated due to difficulty in monitoring the reaction. Yet Prosini and Gilson [53] designed a hydrogen generator on the concept of “hydrogen in demand” using sodium borohydride in acid accelerators. Subramanian and Murugesan [54] further used dense NaBH4 and acidic water to generate hydrogen for transportation applications. The various acids used in tests were: organic acids; CH3COOH, H2CO2, and mineral acids: H3PO4, HCl, HNO3, H2SO4. The results of mineral acids suggested that increasing the concentration of the acid will enhance the production rate of hydrogen. Whereas, in the case of organic acids, high clusters are needed to produce hydrogen on a similar scale of mineral acids [51, 54]. The catalyst efficiencies of heterogeneous catalyst clusters with metals and alloys were reported [55, 56]. Initially, metal salts like RhCl3, IrCl4, RuCl3, etc. were investigated in the hydrolysis of NaBH4 through RuC3, RhCl3, and H2PtCl6 [50, 57]. These attempts were reported as the most active ones which gets reduced to its elementary state with the progress of reaction. The study by Amendola et al. [58, 59] suggested that ruthenium metal doped on anionic surface performs efficiently than cationic resins. Further, the observations were made about the lessening of water molecules for hydrolysis due to high concentrations of hydroxyl ions from NaOH. Kojima et al. [60] gave the first-ever claims about several oxides (LiCoO2, Co3O4, Ti2O3, TiO2, TiO, LiNiO3, CoO, SiO2, LiMn2O4, and NiO) supported by transition metals. 1⋅5 wt% of Pt/LiCoO2 catalyst gave the highest performance of more than 200 L(H2) min−1 g−1 (Pt) which is almost tenfold the rate showed by catalyst Ru as claimed by Amendola et al. [58, 59]. A combined alloy of both Ru and Pt as reported by Rangel et al. [61] when investigated, the efficiency of Pt-Ru/LiCoO2 came out almost two times that of single Pt-based and Ru-based catalysts. Overall, noble metals confirmed elevated activity than the non-noble metals [51]. Additionally, the production of hydrogen from NaBH4 in solvents (like alcohols) was also investigated [61]. When compared to ethanol, methanol showed more reactivity towards NaBH4. Reaction (9) depicts the reactivity of methanol towards sodium borohydride [62, 63]. (9) N a B H 4 + 4 C H 3 O H → N a B ( O C H 3 ) 4 + 4 H 2 Hannauer et al. [62] experimented with hydrogen production in CH3OH and its mixtures (NaBH4/H2O in molar ratios of 2 and 10) and the best system came out to be with the molar ratio 10. Demirci and team performed metal-catalyzed methanolysis with Ru/TiO2 and Co/TiO2 as a catalyst and the second catalyst processed higher catalytic performance. H2 production rates were increased from 144 to 644 L(H2) min−1 g−1 (Co) as the uptake of Co on TiO2 was reduced from 20 wt% to 1 wt% [62]. NaBH4 regeneration process: A cost-effective and environment friendly process of recycling spent fuel to NaBH4 is required to use it as an effective hydrogen fuel. In the hydrolysis of NaBH4, BH 4 − gets transformed into B(OH) 4 − [64, 65] with B(OH)3 as a principal by-product in aqueous solution at pH < 9, while B(OH) 4 − forms at pH > 9 [62]. The compounds when dried at < 110°C, NaBO ⋅ 2 4H2O and NaBO ⋅ 2 2H2O [66] were the only compounds that remained in the system. Traces of Na2B4O ⋅ 7 5H2O were also reported [66] along with the washed components. The borate components are thermodynamically stable [49] and hence need greater energies to redevelop the initial material. This demerit came out as a major concern regarding the development of stable paths to synthesis of NaBH4 from NaBO2 [51]. The general recycling cycle includes the splitting of borates from unreacted NaBH4 and drying it roughly at 300°C to get anhydrous NaBO2 [67, 68]. Few NaBH4 production paths reported in the literature are: • In the Bayer process for NaBH4 preparation [69], the reaction between SiO2 (silica), Na (metallic sodium), Na2B4O7 (borax) and H2 (hydrogen) is carried out at considerable higher temperatures. Further, the process is modified to utilize economical metal as a reducing agent like Mg (magnesium) [51, 70] or its hydride (MgH2) [71, 72] (as shown in reaction (10)) in place of Na. (10) N a B O 2 + 2 M g H 2 → N a B H 4 + 2 M g O However, fast kinetics through reducing metals cannot be achieved due to weak phenomenon of mass transfer over the solid particles. Also, the high pressure of H2 results in increased temperature of decomposition of MgH2. Thus demanding extra high-temperature conditions to reach the desired product. This finding contradicted the theoretical conditions which included the room temperature as per standard Gibbs free energy i.e. Δ G o = -269.7 kJ mol−1 [51]. Since the modified Bayer process demands special reaction conditions and few hazardous materials, hence the bulky production could be at high-risk to obtain the reasonable yield [73]. • A set of thermal synthetic processes [51] was proposed by Millenium Cell Inc. which were equipped to prepare for certain adjustments that will improve gas emissions, energy efficiencies, and cost of a response with boron compounds [73]. Apart from this, formaldehyde is utilized for carbon-based reductions [74]. • A single step thermal reduction of NaBH4 with the help of reducing agents (carbon, methane, or hydrogen) wasn't thermodynamically stable under rational conditions [75, 76]. • Cooper et al. [74] gave the first-ever electrolytic process. The reaction was carried in caustic solution of NaBO2 as depicted below: { Anodic end: 4H 2 O → 2O 2 + 8H + + 8e Cathodic end: BO 2 − + 6H 2 O + 8e → BH 4 − + 8OH − Overall reaction: NaBO 2 + 2H 2 O → NaBH 4 + 2O 2 Small amounts of NaBH4 was obtained in final product. Also, Na-B-O-H in the liquid state was recommended by Davis and Calabretta for electrolysis of BO 2 − to BH 4 − [77]. In the present scenario, none of the above mentioned methods promises the economical production NaBH4. However, the path to achieve the lowest of all costs still lies in the electrochemical processes and hence demands intensive research."
5,Metal-organic framework (MOF),"2.4 Metal-organic framework (MOF) Metal-Organic frameworks are in huge interests since 2003 when Yaghi and group [78] gave the first historically speaking determinations of hydrogen adsorption on MOF. A constraint of 4.5 wt% at 77 K at a pressure under 1 atm, and 1.0 wt% at room temperature with 20 bar pressure of the material Zn4O(bdc) (bdc implies 1,4-benzene dicarboxylate) (furthermore insinuated as MOF-5 and IRMOF-1) is being observed. MOFs always remained exceptional substitutes for zeolites and activated carbons, which are additionally the representations of physisorption-based materials. Most of MOF clusters are in loose powdered form and can be hard to install into significant devices [79, 80]. Small packing densities will affect the volume capacities of MOFs while installing them in the tank through pipe structures. Furthermore, the powder MOF may lead to contamination of fittings during running cycles. Moreover, loosely packed powders can easily be spread into the atmosphere, affecting the process of shaping [81]. Efforts have been made by the University of Michigan [82], BASF [83], and Ford [84] to accomplish higher volume densities at moderate conditions. These MOFs are mainly megalith, beds, or pellets with higher bulk densities [85]. Various manufacturing paths are available [86, 87, 88] for MOF processing, the selection of which depends upon the textural properties of the porous MOF compounds. Porosity and surface area are two basics for estimating the storage capacity of MOF for hydrogen fuel. These materials are produced from coordination bonding between multi-dentate ligands and little metal-containing groups. Solvent species from synthesis occupy pores and channels, which results in the breakdown of structure [89]. Factors of present interest, which would update the frameworks for promising hydrogen storage systems at ambient conditions includes SSA, pore-volume, pore size, and developing hydrogen binding sites with higher energies. Improving moisture tolerance is another major strategy to commercialize MOF materials. Investigations by Dingemans et al. and team member Yang et al. [90] found that MOF-5 attached to hydrophobic methyl shows stability for five days. Further, Yang et al. [91] synthesized a hybrid cluster of acid-based MWCNTs to improve stability whereas Yoo et al. [92] suggested adding surfactants in the drying process. These surfactants are consumed on MOF-5 prompting its hydrophobic surface, this builds the strength to face the moisture. Another major study includes the fabrication of MOF-5 with Ni as a dopant [93]. The fabrication was carried out through the solvothermal crystallization to enhance the hydro-stability. UiO-66 (Zr-based MOF) [94], KHUST-1 (Cu-based MOF) [95], and MIL-101 (Cr-based MOF) [96] are few compounds with excellent thermal, pressure and moisture stabilities and these are considered among the top options for system upgradation. However, verification of their hydro-stability characterization has to be done for the long run. Micropores with extensive volume and reasonable diameter can accomplish effective adsorption of hydrogen on materials [97, 98, 99]. In the underlying phases of study, the research is majorly focused in the synthesis of porous frameworks, which after a short time can be loaded up with hydrogen. This incorporates “MIL”, characterization of MOFs as portrayed by Latroche et al. [100] with pore sizes of the range higher than 25 Å and “IRMOF” arrangement given by Rowsell et al. [98] with non-interpenetrated networks. Such MOFs as given in Table 2 have a pore volume greater than 1.5 cm3g−1 and are likely to hold hydrogen at high pressure. The cutoff points are 6⋅01 wt% in MIL-101 and 6⋅7 wt% in IRMOF-20 at 77 K [89]. Despite this, still the 80% volume of the material is empty space as shown by Langmuir interpretation in Fig. 3 . The accompanying case reveals that molecules with pores size 4⋅5-5⋅0 Å store more hydrogen than comparatively larger ones. This estimation of pore sizes is analogous to kinetic diameter for H2 of the range 2⋅8 Å. Pores size of this range permit reaction of H2 with different parts of compounds. Furthermore, curvature of pores played an important factor as a dynamic factors but was probably difficult to claim it experimentally [104]. This is due to the immediate after effect of various techniques used in the assessment of pore sizes. Dublin-Astakhov examination on the Horvath-Kawazoe model of gas sorption data is effective among the most used methods to report pore size but is restricted to the adsorption data and gas used. The recently reported MOF system, Cu3(tatb)2 (tatb=triazine-4,4',4”-s-triazine-2,4,6-triyltribenzoate or PCN-6) incorporates a paddle-wheel of copper-carboxylate associated with trigonal triazine-based ligand. Interestingly, MOF experienced 41% development in surface area, 29% addition in gravimetric hydrogen uptake, and 133% enhancement in volumetric hydrogen uptake with this kind of material [105]. Two Grand Canonical Monte Carlo studies on the IRMOF series indicate that small pore size and multiplicity of the system permits di-hydrogen molecule to interact with a central portion of multiple ligands [105, 106]. Both the studies settle to the statement that overall pore volume becomes furthermore significant at higher pressures. The overall result of interpenetration increases the net interaction energy, ΔH a d s , and is redirected to increase in hydrogen uptake at 77 K and 1 atm. Mesopores of few MOFs are excessively large in order to uptake H2 efficiently. In such cases, the fabrication of composites by monitoring its pore magnitude is one of the ways to attain greater H2 capacity [107]. Besides this, a combination of two similar MOFs, or MOFs of different components has presented a good optimization of surface configuration and pore geometry [81, 108, 109]. The volumetric density of provided MOF can be enhanced by modeling powdered MOF material to a definite structure to obtain correct ratios between pore volumes, density, and secondary surface area [110]. Modeling methods like template method, uniaxial pressing, and powder extrusion were employed to synthesize fine surface MOF particles into contrasting compacted structures to boost up their H2 storage capacities [111, 112]. The most favorable approach to store H2 in MOF is based upon the spillover mechanism. Boudart et al. [113] discovered the term ‘spillover’ in the year 1969 to explain the movement of hydrogen atoms from the parent metal to a region with lesser activation energy. Hence to complete the desorption cycle, the adsorbed H2 migrates in a reverse manner from parent surface to the metal surface. Adsorption at room temperature is a sign of stronger bonding between the host material and the hydrogen atom. Spillover mechanism exhibits the property to function at room temperature and not at 77 K, which is regarded as the principle temperature needed for adsorption of H2 into porous sorbents without spillover. Although Prins et al. [114] stated that spillover does not take place in all conditions. And Talyzin and Luzan [115] conveyed no H2 stock enrichment through spillover. Also the Pt/C-doped MOF developed by Campesi et al. [116] did not report any spillover and claimed it to be below the limits of detection. The tremendous enthusiasm to improve non-petroleum alternative hydrogen power devices demands a dense storage system. MOF is considered as an ideal model with high porosity, surface area, and low thickness. These are continuous crystalline connecting metal particles through different natural linkers. Some encouraging models are stated in Table 2. Such MOFs having uncovered metal destinations prone to water present in air decrease the H2 uptake gradually with time. Some MOFs reduce readily because of their unsteadiness towards acids and bases. This classification may incorporate MOFs arranged from carboxylic acids. Another stability source is metal particle facing the amalgamation of MOF which is still under the process of development. It is recently reported that the synthesis of MOFs from ligands with hydrophobic functional groups can develop a water-stable MOF structure [117]. Table 2 may also be read by differentiating the connections between the heat of adsorption and the hydrogen uptake in free pore void volume. The geometric harmonization between the natural linkers and the sides of metals lead to very arranged and sometimes permeable materials [118, 103]. This empowers the material to have explicit pore diameters, substance functionalities, and topologies. It is required to know the dependence of material properties on adsorption to plan the engineering of the system. This strategy remains prominent because of less energy consumption and to desorb artificially bonded hydrogen."
6,Carbon nanotubes,"2.5 Carbon nanotubes Adsorption of hydrogen in carbon-based materials happens close to carbon surface because of Van der Waals forces applied by C-particles onto the atoms of hydrogen. The absorbed gas signifies the gas volume which could possibly be fed to the provided volume in correspondence to the total gas occupying the same volume in the absence of adsorption at identical pressure and temperature conditions [119, 120]. At steady temperature, the total absorbed gas is proportional to the pressure and is unconfined with decreasing pressure. This shows the reversibility of the system with respect to pressure [121]. Nanostructured materials are of huge interests due to their features like adsorption on the surface, short sub-atomic adsorption and desorption time, solid-state storage, high gravimetric and volumetric densities, and the grain boundaries. The thermodynamic and kinetic stabilities of hydrogen adsorption and desorption on parent material are not quite the same as that of chemical and metal hydrides. These are influenced by decreasing diffusion length and increasing the diffusion rate. The possibility of hydrogen adsorption on nanomaterial follows equilibrium-based figures, which are the function of pressure and temperature [122]. Simonya et al. [118] performed different assessments with carbon nanotubes as an effective hydrogen-storage material in the year 2002. In any case, the greater part of them did not reach the standards of the Department of Energy (DOE) of 6 wt% for applications in the transport. In the principal working, sending point charges on the surface of a material can enhance the storage limit and expand the binding capacity of hydrogen. Charge-induced dipole plays another important role in settling hydrogen particles. One among these is a Silicon-Carbon Nanotubes blended in 2001 [123] with point charges on material's surface to affirm their candidature for effective hydrogen storage substitute [124]. Fig. 4 demonstrates SiC-NT with Si and C particle substituted with point charges. More than half of the charge is consistently exchanged from Si to C [125]. Researchers from Germany have adequately structured 3D carbon nanotube lattices to uptake and release hydrogen at higher efficiencies and have shown good results to maintain the ecological hydrogen economy. Stefano Leoni's group at the Technical University of Dresden are utilizing a computer-based system to enterprize the structure of 3D carbon nanotube which could store more hydrogen at room temperatures as compared to some other carbon-based material. In the same way, the sorption of MgH2 (magnesium hydride) is recently investigated with a synergistic approach of doping Fe and Ti nanoparticle. The hydrogen storage properties are improved as the diffusion occurs in host lattice of MgH2 [126]. The intention of CNT/nanocatalyst for both NaAlH4 and MgH2 is to power-up the system and enhance its reversible hydrogen storage properties. Mechanical milling helps to pulverize the particles of MgH2 into nanocrystalline or micro phases and hence lowers desorption activation energy. Hydrogen sorption for nanocatalyst doped MgH2 is mechanically milled and the agglomeration of MgH2 is shown in Fig. 5 along with their activation energies. This also displays MgH2 nanocluster model and nanocatalyst distribution over active sites for efficient hydrogen storage onboard. The resulting material will be non-toxic, lightweight, and shoddy to make, and henceforth it would be ideal for applications at large scales. Aristizabal et al. [128] investigated that nanotube material supports 5⋅5 wt% hydrogen uptake at room temperature which is apparently an ideal chance to meet US DOE's goals of 6 wt% limit including total weight after gas adsorption. Hydrogen storage capacities can be helped by adding metals to carbon structures like B, Ca, K, Li, Ag, Ni, Pd, Fe, Pt, Ru, Ti, TiO2 [124, 125, 126]. Freshly synthesized CNT was found to uptake 0⋅1 wt% of H2 at 573 K and ambient pressures [117]. In addition to this, oxidation is the pathway to identify defects and doping with the Pd-Ni catalyst which upgrades the hydrogen storage up to 6⋅6 wt% at 610 K and ambient pressure. Another study reveals that 6-8 wt% H2 adsorption could be reached through polyaniline nanocomposite, but the experimental capacity reported is 1⋅4-1⋅7 wt% [125, 129]. Polyaniline is chosen as a nanocomposite matrix material due to its inexpensiveness and easiness to polymerize. It can be seen from Fig. 6 that the release and uptake of hydrogen of 4⋅0 wt% happen in the initial stages. Also, the kinetics and storage intake gets reduced with repeated cycles. Normal examinations and hypotheses have built a trust factor on carbon nanotubes doped with suitable material as the potential material for hydrogen storage system [131]. Various investigations of dimensions of doped CNT at various response conditions have proposed a few negative outlines of the H-system, which should be addressed in nearly future. For implementing carbon nanotubes in practical purposes, its large-scale manufacturing and applications are of yet far to go. The key focuses for further studies and trials on these materials can be considered as: 1. Low cost for mass production of CNTs with organized microstructures. 2. Operation of metal-doped CNT for increasing hydrogen storage capacities, energy, and volumetric density. 3. Explanation of adsorption and desorption kinetics [127]. 4. Monitoring of operational temperature and pressure conditions. 5. Designing and its improvements for hydrogen storage systems in running vehicles."
