,sections,Text
0,Introduction,"In the past few years, fossil fuel utilization, especially oil and gas has been in high demand and it affects the area of the interest of current researchers. The release of breathtaking toxins from burning of fuel includes oxides of nitrogen (NO x ), oxides of Sulphur (SO x ) [1, 2], and other fine particles which cannot be separated by the process of filtration. Dioxins produced during combustion are known as carcinogens. Similarly, fossil fuels also produce immense quality of ‘greenhouse gases’ mostly carbon dioxide (CO2) and all other environmentally harmful by-products [3, 4]. These challenges increased the concern of technologists, scientists, economists, and policy-makers to develop and generate other alternative energy sources. To overcome all these drawbacks, future energy sources needs to conquer the criteria of releasing environment-friendly by-products, renewability, and availability [1, 4]. Hydrogen is a clean and sustainable energy source, which turns it to be the best substitute for fossil fuels. Hydrogen is an achromatic, tasteless and non-poisonous molecule, which is a non-combustible source that resists the release of greenhouse gases and air pollutants. Hydrogen has an exceptionally high gravimetric energy density of (20 KJ g−1), which is almost thrice to the energy density of gasoline and seven times to the energy density of other fossil fuels [4]. However, it is not easy to use this economical clean fuel because once the production is completed, it becomes very difficult to store the hydrogen fuel for transportation and utilization [5, 6]. The main concern regarding the hydrogen economy is its low volumetric energy. These days, most of the transportation sectors are dependent upon refined petroleum fuels. But with time, petroleum fuels are seemingly becoming unaffordable and unavailable [7, 8]. To replace this traditional fuel, hydrogen plays an ideal role. However, before engaging it as a transportation fuel, it is essential to develop a high-density storage channel [7, 9]. Presently, several approaches (as presented in Fig. 1 ) are available for hydrogen storage [1, 4, 10], such as the high-weight tanks, which have high storage capacity (350 bars to 700 bars). Even though such pressure, the energy density is still lower than the customary sources of the energy system. The storage tanks ought to be comprised of solid and light weight material that can hold high-pressure conditions. The cryogenic liquefaction of atomic hydrogen has been one of the future strategies to store hydrogen fuel for the vehicle industry. Yet the fundamental concern is that the liquefaction of hydrogen happens at a low temperature of 20°C. Therefore, if the storage container cannot have good strength, the ambient heat flow will go through the tank and initiate the dehumidification of the hydrogen which will further increase the internal pressure of the tank, and finally, it will become one of the main reason for fuel loss (i.e. boil-off). According to the principle of hydrogen adsorption in solid metals (for an instance Li, Mg, or Al) by dissociation [1, 4], the chemical storage of solid compound is more feasible and safe as compared to the phase conversion of the material (e.g., liquefaction). This method is capable of restoring hydrogen on large-scale at ambient temperature and pressure conditions. The general structural energy of a material depends on its specific gravity. However, due to the higher endothermic enthalpy of desorption of hydrogen, this technique requires excessively high temperature to desorb hydrogen from its parent material. This reduces the energy efficiency of the material. Chemical hydrogen storage method signifies the trapping of hydrogen at relatively low pressures and releasing it at higher temperatures by covalent bonding in either solid or liquid form. However, there are a lot of potential benefits of chemical storage, but there are still some problems that need to be resolved. The general issues include the structural and thermal instability of the material towards consistent temperature and pressure. To overcome these issues, we need to use highly porous adsorbents, such as zeolites [11], and porous polymers [12]. On the other hand, the efficiency of adsorbents used for physisorption solemnly depends on the specific surface area (SSA) and void characteristics (size and shape) [13]. The carbonaceous substances are one of the best highly porous adsorbents with characteristics like high SSA, high chemical and thermal stability, excellent kinetics, and lightweight. Moreover, it can be easily synthesized from a variety of organic compounds [5, 14, 15]. Finally, before start using hydrogen fuel, it is very important to do a brief investigation about its storage methods. This paper is mainly focused on the techniques to store hydrogen fuel safely for a long period. The theme of this study is to explain all the viable developments which have been conducted in the previous studies and to discuss its kinetic and cyclic stabilities."
1,Developments,"The industrial revolution, environment aspects, and energy problems have activated the ever-increasing concern to exploit renewable clean energy in the current situation. Hydrogen fuel has been considered as a new energy currency for the past few years. High gravimetric energy density, renewable affordability, and environmental benefits of hydrogen enhanced its credibility. As a vital application of hydrogen energy, hydrogen fuel cells are capable of converting chemical energy into electric energy with high efficiency, which can be used in all transportation applications. However, to store this novel fuel we required very high-quality and stable supply pressure containers. The aim of this paper is to analyze few recent developments in the field of hydrogen fuel storage. We covered all the aspects of the developed systems and their catalytic doping properties to store the highest volumetric density fuel safely."
2,Sodium alanate system,"2.1 Sodium alanate system Bogdanovich and Schwickardi [16] proposed sodium alanate framework (NaAlH4 and Na3AlH6) for on-board storage of hydrogen fuel. These when activated with Ti, the material immediately acts as a reversible hydrogen storage system at moderate conditions for powering PEM (polymer electrolyte energy) unit [17, 18, 19]. Baldé et al. [20] investigated Ti-doped NiAlH4 isotherm as shown in Fig. 2 with the heating ramp of 5°C min−1. The curve clearly shows that nano-meter sized particles between the range of 2-10 nm are desorbed easily between the temperature range of 50-100°C. Whereas the reported particles of size between 1-10 micro-meter desorbs hydrogen at a moderately higher the temperature of around 160°C. Because of its ideal execution potential, it is commonly used as the basis of an investigation in hydrogen storage materials. The rate of absorption and desorption is increased when the system is doped at TiCl3. The response is shown in the following reaction: (1) 3 N a A l H 4 ⟶ N a 3 A l H 6 + 2 A l + 3 H 2 + 3 N a H + 3 A l + ( 4.5 ) H 2 In 1985, Bureau et al. [21] determined the crystal structure of NaAlH4 through single-crystal X-ray diffraction. The compound when doped with certain catalysts, can discharge and take hydrogen reversibly as per the following reactions. (2) 3 N a A l H 4 ⟶ N a 3 A l H 6 + 2 A l + 3 H 2 ( 3.7 w t . % H 2 , Δ H = 37 K J m o l − 1 H 2 ) (3) N a 3 A l H 6 ⟶ 3 N a H + A l + ( 1.5 ) H 2 ( 1.8 w t % H 2 , Δ H = 47 K J m o l − 1 H 2 ) In reaction (2), NaAlH4 releases around 3⋅7 wt% H2 at 190°C and the reaction (3) does the same at 225°C with 1⋅8 wt% on heating. Likewise, dehydrogenation of NaH develops only at excess temperature of 400°C. This is because temperature for decay is different for various application. Hence, this is not satisfactory for fuel-cell controlled automobiles [22]. The presumed equilibrium for first and the second decomposition curves are not stable under 100°C (for instance 0⋅1 MPa at around 30°C for first decomposition step and almost similar at 100°C for second decomposition step). It is not suitable to apply on PEM control systems where different heat collectors will be used to descent hydrogen release [23]. Various doping methods of NaAlH4 are available for improving the fundamental properties of the compound. Among all these, high-energy ball milling is widely preferred due to the following reasons: 1. High surface area. 2. Generation properties of nanostructures. 3. Responsible for creating lattice imperfections on the surface and at the inner of complex hydride. The improvement in surface area contact with the catalyst during high ball-milling degenerates the energy of separation and recombination of hydrogen. Sodium alanate material used was manufactured on mechanical scale-based milling equipment, enhanced towards fast kinetics using titanium-based economical catalysts [17, 19]. The whole process was carried out in purified Ar (argon) atmosphere. Before synthesis, the NaH and Al were pre-mixed in the molar extent of 1⋅08 to 1 according to the reaction (4) [18]. (4) ( 1.08 ) N a H + A l + 0.02 ( T i C l 3 + ( 0.5 ) A l C l 3 ) → N a H + ( 1.0067 ) A l + ( 0.08 ) N a C l + ( 0.02 ) T i + ( 0.0 ) 4 H 2 To escape through the aggregation of mass, wet milling using cyclohexane was used. The resulting stage was followed by the evacuation of milling to dry sections. To monitor the effect of carbon on the hydrogenation reaction, some part of the material was prepared in analogous with an extra 5 wt% of carbon after ball milling as shown in Table 1 . This mixture was mixed for an extra 30 minutes. Ball milling makes the surface defects in an economical process and can broadly be connected to achieve great properties of complex metal hydrides [24, 25]. The time for the reaction of high ball-milling is much shorter when contrasted with the direct synthesis of NaAlH4 in the organic solvent. Also, the response temperature is low and material which is to be prepared have progressively reactive properties during hydrogen uptake and discharge reactions [26, 27, 28]. Sodium alanate (NaAlH4) is a highly perceived hydrogen storage material that forms Na3AlH6 and Al with the arrival of hydrogen in gas structure. The response rates are irrationally moderate for fuel cell applications except if it is doped with transition metals (especially Ti). Through wide hypotheses, it has been presumed that the flux of point defects conveys the extended scope of metal transference going with the absorption reaction. The Al-H framework is much porous and the tweaks in reaction interface results in the development of the Al phase. 2.1.1 Catalyst-doped NaAl H 4 As the foremost method to be considered for the storage of hydrogen, properties of catalyst and the doping technique can strongly impact the kinetic and thermodynamic execution of NaAlH4 systems. Catalysis is the major factor that governs the sorption and desorption kinetics of the system of complex metal hydrides that leads to effective separation and recombination of H 2 molecules [29]. A wide number of catalysts have been tested for hydrogenation and dehydrogenation of NaAl H 4 . Ti-doped NaAlH4 came out to be important progress for reversible NaAlH4 and was seen as a potential system for onboard hydrogen storage. However, the capacity quickly decreased from 4⋅2 wt% to 3⋅1 wt% after 31 cycles. It also displays inadequate dehydrogenation kinetics for practical H 2 storage applications. Later on, efforts were made for catalytic enhancement of NaAlH4 on the mechanical mixing of Ti-dopant [30]. The kinetic and cyclic properties were claimed to be much closer to the demands of the system [30, 31]. Bogdanovich et al. [32] found an outstanding result of colloids-doped NaAlH4 in 2003. These reported the sensitivity of hydrogenation and stability properties of the system towards the particle size of dopants. The storage capacity remained above 4⋅5 wt% H2 even after 25 cycles. But at the same time, hydrogenation rate decreased immensely. Though the cost of synthesis and preparation time of colloid-Ti was too high, the method was no longer considered for the doping. Fan et al. [33] investigated energy and hydrogen desorption thermodynamics of CeAl4-doped NaAlH4 and found the separation level for second-step desorption to be 0.096 MPa at 120°C. More recently synthesized Ti B 2 and TiN catalysts for the synthesis of sodium-alanate through mechanical milling reported remarkably mild recharging conditions of 90°C at 4 MPa H2 pressure. The results were similar for high-pressure hydrogen (50 bar H 2 ), suggesting good reversibility of TiN-doped NaAlH4 [34]. Furthermore, several other compounds like Hf, Cr, Sc, Nb, Zr, Fe, La, and V-based catalysts also improved NaAlH4 performances [35, 36, 37]. These findings enhanced the H 2 storage properties of sodium-alanate and further widens up the path for developing high-performance catalysts. The noted problem of NaAlH4 is that the raw materials NaH/Al or commercial samples are not pure, which degrades the capacities of hydrogen storage systems. This could be overcome by recrystallization of raw materials. Moreover, dopant is also responsible for the reduction of reversible storage capacity. This is because of the increase in overall sample weight and it may react with sodium alanate to decrease its amount in the system. Subsequently after dehydrogenation, the agglomeration of lighter particles brings about the development of heavier particles which may be used for reduction in limiting further cycles. Even though the significant augmentation in kinetic and thermodynamic properties, a sequence of scientific and technological concerns of the system still needs to be focused on. The properties that should be enhanced can be summarized as: 1. The cyclic steadiness of NaAlH4 system is not fully explained for PEM fuel cells. Working on important points such as linking chemical and physical paths is required. Also, an operational nanoscale hydride storage material still needs to be engineered. 2. The storage capacity of the system is low and needs to be improved through light-weight complex hydrides [29, 30]. Interestingly, two different multi-functioning hydrides doped into nonporous framework materials can be promising agents [22]. 3. Kinetic properties of NaAlH4 are not preferred to use in combination with PEM fuel cells. These may achieve the goal by modifying the catalytic properties and changing the doping methodology. Collective use of catalyzed and nano-confined samples are the potential candidates for application in fuel cell. 4. A comprehensive exploration of the fundamental mechanism for uptake and release of hydrogen around NaAlH4 system is yet required."
3,Lithium amide - magnesium hydride,"2.2 Lithium amide - magnesium hydride The limit of hydrogen in interstitial hydrides of many alloys is confined to 1⋅7 wt% [38]. This estimation is lower than the preferred value utilized for vehicular applications. However, magnesium hydride is a special case because of its ability to approach nearer to practically 8⋅2 wt% [39]. Chen et al. [40] in 2002 synthesized another system of lithium nitride (Li3N) which uptakes 11⋅5 wt% H2 reversibly in comparison to NaAlH4 system with 5⋅6 wt% H2 storage. Hydrogenation of Li is a two-step reaction as shown below: S t e p 1 : L i 3 N + H 2 → L i 2 N H + L i H S t e p 2 : L i 2 N H + H 2 → L i N H 2 + L i H 5⋅74 wt% H2 and 11⋅5 wt% H2 is consumed by Li3N for the initial step and overall reaction respectively. The pressure for hydrogen corresponding to the first reaction is 0⋅01 bar at 255°C. The findings by Chen et al. [40] confirm the high relative pressure of 1 bar at a moderately high temperature of 285°C for imide hydrogenation. Storage material with such property should be destabilized before applying it to the practical purpose of vehicular transport. In the first-ever study by Weifang Luo et al. [41] in 2002, two samples were used for examination. The first sample was employed for investigating hydrogen sorption characteristics of the reaction (LiNH2 + LiH) to validate the results of Chen et al. [40]. Likewise, second sample was used for the investigation of newly synthesized material. S a m p l e 1 : L i N H 2 + L i H S a m p l e 2 : L i N H 2 + M g H 2 Central compounds like lithium amide and lithium hydride were utilized without pretreatment. These were blended in the molar ratio of LiNH2:LiH = 1:1⋅1 for the first and LiNH2:MgH2 = 2:1⋅1 for the subsequent sample. To avoid decomposition of amide over the range of the reaction, 10% excess of lithium hydride and magnesium hydride was incorporated. Glove box with argon climate was utilized for sample transportation followed by ball milling with SPEX 8000-high industrial facility. Desorbed gas was assessed by mass spectroscopy to recognize any NH3 from the self-deterioration of amide in both of the samples. Hydrogen uptake in the precedents was assessed as the wt% of the whole model weight. (5) 2 L i N H 2 + M g H 2 ↔ L i 2 M g ( N H ) 2 + 2 H 2 According to the condition depicted in reaction (5), the theoretical limit of system is 5⋅35 wt% for the second sample whereas the experimental limit is around 4⋅5 wt%. Such a difference in values may result from segregate surfaces of two strong reactants. Desorption kinetics can likewise be enhanced by better sample blending. It was additionally inferred that the plateau pressure of 3 bar at 100°C would justify the essential weight extend for transportation applications. In the examination coordinated from the findings of Chen et al. [40], the calculated reaction enthalpy came close to the proposed value. Replacing LiH by less stable hydride, for instance, MgH2 in lithium amide/hydride storage system reduces its stability. Even after continuous cycles, there is no degradation of hydrogen storage limits. This innovative storage material can absorb hydrogen reversibly at a pressure of 32 bar at 200°C and is useful for powering hydrogen based fuel cells."
