,sections,Text
9,Hydrothermal and solvothermal method,"3.3 Hydrothermal and solvothermal method Hydrothermal and solvothermal synthesis are typical bottom-up approaches to prepare defect-rich 1T-MoS2 and hybrids of defect-rich 1T-MoS2 to other carbon materials such as graphene and carbon nanotube. Compared with the exfoliation method and gas treatment method, hydrothermal method has the advantages of simple operation, large quantities of preparation, and high defect concentration and pure 1T phase of products. In the reported literatures, MoO3, NaMoO4•2H2O and (NH4)6Mo7O24•6H2O are commonly used Mo sources, while CS(NH2)2 and CH3CSNH2 (TAA) are widely adopted as sulfur sources. Xie and co-researchers reported that defect-rich MoS2 nanosheets were successfully fabricated by utilizing (NH4)6Mo7O24•6H2O and CS(NH2)2 as precursors and employing excess CS(NH2)2 in the hydrothermal process [26]. In this case, thiourea is not only used as a reducing agent but also can be adsorbed on the formed nanocrystallites, thus resulting in a quasi-periodic structure and a large number of defects on the basal planes. Furthermore, Liu et al. found that NH3 molecules generated from the hydrolysis of excessive thiourea could be inserted into the MoS2 layers and caused electron transfer between interfaces, thus inducing the phase transformation from 2H-MoS2 to 1T-MoS2 [42]. The intercalated NH3 molecules can also be produced by adding additional ammonium bicarbonate (NH4HCO3) [56] or urea (CO(NH2)2) [54]. However, it must be emphasized that the hydrothermal temperature cannot exceed 200 °C although excess NH3 molecules are produced, otherwise 2H-MoS2 will finally be obtained because the formation of 1T-MoS2 is more favorable at low temperatures [80]. Therefore, the key to synthesize defect-rich 1T-MoS2 by hydrothermal method lies in the use of excessive sulfur sources, the generation of a large number of NH3 intercalated molecules and the use of appropriate hydrothermal temperature. For example, Zhang et al. reported the preparation of defect-rich O-incorporated 1T-MoS2 nanosheets under hydrothermal conditions of S/Mo molar ratio of 4.25 and 200 °C (Fig. 6c) [102]. Besides, defect-rich 1T-MoS2/carbon nanotubes [104] and defect-rich 1T-MoS2/3D reduced graphene oxide hybrid materials [105] could be easily fabricated by adding carbon materials such as graphene oxide and carbon nanotubes to the feedstock at the same time through one-pot hydrothermal method. Also, some other inorganic materials such as CdS could react with the as-prepared defect-rich 1T-MoS2 through electrostatic interaction to form composite materials [102]. Solvothermal method with N, N-dimethylfumarate (DMF) and ethanol as solvents is also an effective way to prepare defect-rich 1T-MoS2. Recently, researchers found DMF was an excellent solvent because it could not only provide NH4 + but also has a better solubility than water during the solvothermal process. For instance, Zhang et al. reported that the 1T phase ratio of defect 1T/2H-MoS2 could be adjusted by changing the DMF/H2O ratio, and a highest 1T content of 70.14% was obtained when the DMF content was 50%[25]. Solvothermal treatment in ethanol could also create sulfur vacancies and induce 1T-MoS2 on MoS2 nanosheets. A two-step synthetic strategy was developed by Cai et al., i.e. the first step was hydrothermal synthesis with (NH4)6Mo7O24•6H2O/CS(NH2)2 ratio of 1:30 to obtain pure 2H phase, and a second critical solvothermal treatment in ethanol was conducted to introduce sulfur vacancies on 2H-MoS2 ultrathin nanosheets which promotes the transformation of the surrounding 2H-MoS2 local lattice into a trigonal (1T-MoS2) phase (Fig. 6d) [103]. Furthermore, Li et al. adopted a second ethanol solvothermal treatment to improve the stability of NH4 +-intercalated defect-rich 1T-MoS2 [47]. They found a strong interaction between ethanol and MoS2 surface which could decrease the total energy and strengthen the stability of 1T phase from 15 days to 360 days."
10,Elemental doping,"3.4 Elemental doping The elemental doping can affect the local electronic structure of MoS2 and form new interstitial states, thus inducing the phase transition and the generation of S vacancies. The commonly used doping elements are generally metals with single metal or bimetal doping, and in the form of atomic scale. The metal incorporating methods can be post-treatment doping or one-step doping approach. Recently, Zhang et al. reported a simple one-step post-impregnation method to prepare single-atom Ru doped MoS2 catalyst (SA-Ru-MoS2) [106]. HAADF-STEM images clearly showed that single Ru atoms precisely occupied the Mo atoms sites and bonded with S atoms in the lattice, favoring the 2H-to-1T transition and the formation of defects and lattice distortions (Fig. 7 a). The same phenomenon was also observed on atomic Pd doped MoS2 nanosheets, which simultaneously introduced sulfur vacancy and converted the 2H phase into the stable 1T phase [86]. In addition to precious metals, non-precious metals can also be doped on the basal planes with single atom state. For example, Qi et al. adopted an assembly/leaching strategy to prepare atomic cobalt array covalently bound to distorted 1T-MoS2 nanosheets [107]. The first step was modification of MoS2 nanosheets by Co nanodisks through sonication, and the second step was electrochemical CV leaching which resulted in the disappearance of Co-Co bond and in situ formation of single-atom Co array anchored onto the MoS2 surface. Ji et al. reported the one-pot solvothermal synthesis of single-atom Cu doped 1T-MoS2 nanosheets with a large number of S vacancies and variable pores (Fig. 7b) [90]. Ding et al. reported the successful co-doping of Fe and Mn into freestanding coral-like 1T-MoS2 by a facile one-pot hydrothermal method, which had a concentration of 1T phase about 90.6% and a number of lattice defects [108]. Although metal doping is the most common used way, there are still very few reports that non-metallic doping can also cause S vacancies and induce phase transition. Recently, a P, W-doped MoS2 catalyst was synthesized by hydrothermal method using Na3O40PW12•xH2O as P and W source [109]. Due to the large atomic radius of P and W, lattice expansion and atomic rearrangement will be caused when incorporated into the MoS2 lattice, thus promoting the formation of 1T phase. At the same time, the distortion of lattice also produced a certain number of defect sites."
11,Novel strategies,"3.5 Novel strategies In addition to these traditional synthesis methods summarized above, some novel strategies have been reported in recent years for the preparation of defect-rich 1T-MoS2. For instance, Zhang et al. reported a facile microwave irradiation method to prepare the defect-rich 1T-MoS2 nanosheets, where the first step was a microwave-assisted route to obtain high purity 1T-MoS2 and the second step was sunlight-induced redox reactions to create a large number of defects [110]. The key step of this method was the reduction and oxidation reaction initiated by light radiation in the second step, which reduced the S/Mo molar ratio from 1.72 to 1.41, indicating that the loss of S is far greater than the loss of Mo during the generation of numerous defects (Fig. 7c). Anjum et al. developed a NH3-intercalated and reduction two-step method to prepare an all-in-one MoS2 catalyst [94]. The first step was hydrothermal treatment using phosphomolybdic acid, melamine and thiourea as raw materials, which generated intercalated NH3 molecules in situ to form ammoniated MoS2 (A-MoS2). Then, the subsequent reduction of A-MoS2 resulted in the removal of intercalated NH3 and H2S to form an all-in-one MoS2 nanosheets with a considerable concentration of 1T phase, exposed Mo edges, defects and S-vacancies (Fig. 7d). Gao et al. prepared a 3D follower-like defected 1T/2H MoS2 by magnetron sputtering, in which the 1T phase and S vacancies were caused by the Ar ions bombardment during the deposition [111]. A facile synthesis of 1T-MoS2 nanoflowers with rich defects was realized by anion exchange using MoO3 nanosheets as the exchange template [112]. In this process, the O2− of MoO3 nanosheets were exchanged with S2− anion to form MoS3, then MoS3 was soon reduced to MoS2 with phase change and defect formation."
12,HER performance of defect-rich 1T-MoS2 catalysts,"The electrocatalytic performance comparison of different defect-rich 1T-MoS2 catalysts in hydrogen evolution reaction was classified into three categories: (1) bare defect-rich 1T-MoS2 catalysts, (2) element doped defect-rich 1T-MoS2 catalysts and (3) defect-rich 1T-MoS2/carbon material composites. Several key parameters such as overpotential (η), Tafel slope, exchange current density (j0), electrochemically active surface area (ECSA), turnover frequency (TOF) and stability have been utilized to evaluate the HER performance [20]. Generally, the overpotential at a certain current density can be obtained through linear sweep voltammetry (LSV) curve, and a lower overpotential indicates a better performance. The overpotential at the current density of 10 mA/cm2 is usually adopted as reference (η10). The Tafel slope and exchange current density are obtained from Tafel curve, which reflects the information of electron transfer rate and HER kinetics. An excellent HER catalyst should have a small Tafel slope and a large exchange current density. ECSA is calculated from cyclic voltammetry data which represents the actual exposed active surface area of HER catalyst. In addition, TOF refers to the number of transformed molecules converted by each active center, which is a reference to measure the intrinsic activity of different catalysts. Stability is also an important factor to measure the performance of an HER catalyst, which can generally be judged by the long term chronoamperometric test (V-t or I-t curve) or the change of LSV curve after several thousand cycles. It should be emphasized that HER performance is related to the pH value and concentration of the electrolyte solution, so the catalyst performance comparison in this paper was all carried out in 0.5 M H2SO4. In acidic medium, there are two main different mechanisms for HER process. No matter which pathway is going through, the first step is the generation of an adsorbed hydrogen atom (Hads) at the surface of catalyst (H+ aq + e− → Hads, Volmer step). Then, the next step could be two adsorbed hydrogen atom bonded to form a hydrogen molecule (2Hads → H2, Tafel step), or one adsorbed hydrogen atom bonded to another electron and proton to form H2 (Hads + H+ aq + e− → H2, Heyrovsky step). The Tafel slopes of Volmer step, Tafel step, and Heyrovsky step as rate-determining steps are 116, 29, and 38 mV decade−1, respectively. Therefore, we can infer whether the reaction pathway is Volmer-Tafel or Volmer-Heyrovsky by obtaining the Tafel slope."
13,Bare defect-rich 1T-MoS2 catalysts,"4.1 Bare defect-rich 1T-MoS2 catalysts For bare MoS2 catalysts, the phase change from 2H to 1T can significantly improve the electrical conductivity and activate the original inert basal surfaces. Also, the formation of defect-rich structure creates numerous additional active sites, and all these factors above contribute to improved HER performance. For example, Liu et al. reported a 1T/2H-MoS2 mixed nanosheets in which the induced 1T phase not only enhanced the electronic conductivity but also produced more active sites [53]. Besides, some defects were formed at the 1T and 2H phase interfaces due to lattice mismatch. Thus, a small overpotential of 220 mV at 10 mA/cm2, Tafel slope of 61 mV dec−1 and good stability were resulted. Yang et al. developed a spatial confinement strategy using layered double hydroxides as support to prepare ultra-thin 1T-MoS2 flakes [113]. Due to the dual advantages of highly active 1T phase and rich defects, this catalyst had a η10 of 254 mV and a small Tafel slope of only 64 mV dec−1. The Tafel slope suggested a Volmer-Heyrovsky mechanism, and Heyrovsky process is the key step. A prickly pear-like three-dimensional porous MoS2 (ZT-MoS2) was reported by Lu et al. utilizing hydrothermal synthesis and ZnO as hard template [114]. Due to excess thiourea was added, the ZT-MoS2 had a high concentration of 1T-MoS2 phase and rich defects. Meanwhile, the prickly pear-like structure of ZT-MoS2 enabled it expose a large number of edge sites. Consequently, a low η10 overpotential of 110 mV, a Tafel slope of 63 mV dec−1 and a long-term stability of 5000 cycles were obtained, which shed light on the design of 3D defect 1T-MoS2 catalysts for efficient HER process. One of the most interesting work in the field of MoS2-based HER catalysts was conducted by Yin et al., which studied the influence of phase, edges and sulfur vacancies on the HER activity [99]. The authors prepared a porous metallic MoS2 (P-1T MoS2) and another four MoS2 catalysts including 1T-MoS2, 2H-MoS2, porous 2H-MoS2 (P-2H MoS2) and sulfur-compensated porous 2H-MoS2 (P-2H MoS2 + S) as comparison. The results showed that the 1T-MoS2 was more active than all the 2H-MoS2 catalysts, which suggests phase is the most important factor affecting the HER performance. The better performance of P-1T MoS2 than 1T-MoS2 indicated that both edge and S-vacancies contributed to enhanced HER activity. Finally, by comparing the performance of P-2H MoS2 and P-2H MoS2 + S, it is concluded that increased S-vacancies contents helped to improve the HER performance. Therefore, through combining all of the above advantages, the P-1T MoS2 showed a prominent HER activity which had a low η10 of 153 mV and a small Tafel slope of 43 mV dec−1 (Fig. 8 a-8c). This work provides guidance on how to design efficient MoS2-based HER catalysts from the perspective of basic research."
14,Element doped defect-rich 1T-MoS2 catalysts,"4.2 Element doped defect-rich 1T-MoS2 catalysts The elemental doping can effectively modulate the electronic state and intrinsic conductivity of MoS2, thus significantly improving its HER performance. Luo et al. activated the inert basal planes of MoS2 by atomic Pd doping, which induced sulfur vacancies and 1T phase formation [86]. The optimized catalyst had a very small η10 of 78 mV, a large exchange current density of 805 μA cm−2 and excellent stability. Density functional theory calculations showed that Pd replaced the Mo and strongly activated the neighboring sulfur sites which had a low hydrogen adsorption free energy of -0.02 eV (ΔGH). Similarly, a single-atom Ru doped MoS2 exhibited a superior HER performance in alkaline medium with η10 of 76 mV and Tafel slope of 21 mV dec−1 [106]. The high HER activity was attributed to the electronic structure regulation by S vacancies formation and phase transition, which significantly reduced the energy barriers of the Volmer step and adsorption/desorption of H*. The enhanced HER activity was also reported on a non-noble metal single-atom Cu doped porous 1T-MoS2, which displayed a small Tafel slope of 51 mV dec−1 and a low η10 overpotential of 131 mV [90]. The enhanced HER activity was caused by the synergistic effect of atomic Cu doping, metallicity and a large number of defects. Theoretical calculation results showed that Cu doping could not only stabilize the 1T phase, but also enhance the electron transfer ability. More importantly, an extraordinary high HER activity was obtained on a single-atom cobalt array covalently bound to distorted 1T MoS2 nanosheets (SA Co-D 1T MoS2) [107]. The η10 was extremely low of only 42 mV, and a lowest Tafel slope of 32 mV dec−1 was obtained compared with the reported non-Pt-based materials. Besides, SA Co-D 1T MoS2 showed negligible current density loss after 10000 cycles, indicating the long-term durability. The characterization and theoretical calculation results showed that atomic Co is the main active center, and the ensemble effect between Co adatom and S was the reason to significantly promote the increase of HER activity (Fig. 8d-8f). Non-metallic dopants can also interact with 1T-MoS2 and act as electron donors, thus improving the stability of 1T phase and HER activity. For instance, Xiong et al. prepared a phosphorous-doped 1T-MoS2 supported on N, P, S-codoped hierarchical carbon microflower (P-MoS2@HCMF) which possessed a series of advantages such as high concentration 1T phase, defective structure, P doping and high conductive carbon material as support [116]. Hence, an ultra-small η10 of only 86 mV and a small Tafel slope of 42.35 mV dec−1 for P-MoS2@HCMF in acidic electrolyte was obtained. Since the Tafel slope is close to 40 mV dec−1, it indicates that the HER mechanism proceeded along the Volmer-Heyrovsky path, and the Heyrovsky step was the rate-determining step in the whole process. The XPS characterization results showed that P dopants in 1T-MoS2 mainly played the role of electron donor because P has a smaller electronegativity than S, thus resulting an extraordinary stability of P-MoS2@HCMF."
15,Defect-rich 1T-MoS2/carbon material composites,"4.3 Defect-rich 1T-MoS2/carbon material composites Although the electrical conductivity of MoS2 has been greatly improved from 2H phase to 1T phase, it can also be grown on the conductive carrier to further improve the electrical conductivity and expose more active sites. For example, Jayabal et al. developed defect-rich 1T-MoS2/carbon nanotubes (defect-rich 1T-MoS2/CNTs) which showed a low overpotential of 173 mV at 10 mA cm−2 and a small Tafel slope of 54 mV dec−1 [104]. The excellent HER performance was attributed to the synergy effects between 1T-MoS2 and carbon nanotubes, which induced a high electronic conductivity, defect-rich structure and a large number of active sites. The theoretical calculation results also showed that the hydrogen adsorption free energy (ΔGH) was smaller than that of defect 1T-MoS2 and pure 1T-MoS2. Besides, a good stability was exhibited due to the negligible loss of activity after 1000 cycles. Zhang et al. integrated 1T-2H MoS2 nanosheets with a 3D porous N-doped graphene with highly exposed active sites, enhanced conductivity and excellent HER activity in acidic media [115]. This hybrid catalyst had a small η10 of 157 mV, a low Tafel slope of 45.8 mV dec−1 and a large TOF value of 1.51 s−1 at 0.15 V (Fig. 8g-8j). Zeng et al. prepared a stable 1 T-MoS2 monolayer formed at edge aligned 2H-MoS2 and a reduced graphene oxide heterointerface (EA-2H/1T/RGO) by a precursor-in-solvent strategy [117]. The EA-2H/1T/RGO displayed a small η10 of 186 mV, Tafel slope of 46 mV dec−1 and an excellent stability of 10 h in acidic media. The superior activity was attributed to defect formation during 2H-to-1T phase transition, which decreased the ΔGH to 0.07 eV. In addition, the good stability was caused by the interfacial charge transfer between MoS2 and graphene. Carbon cloth (CC) is also an excellent conductive support for the vertical growth of MoS2 nanosheets. Liu et al. fabricated 1T-MoS2 with defects vertically supported on CC which exhibited a small η10 of 151 mV and Tafel slope of 55 mV dec−1. The excellent HER performance was assigned to the high conductivity and proliferated active sites of 1T phase. At the same time, the self-supported structure of catalyst provided a large number of accessible active sites and facilitated the charger transfer [118]. The above works provide new insights for us to design HER catalyst with better performance and study the synergistic effect between MoS2 and carbon materials. Table 1 lists the recent HER performance (η10, Tafel slope and stability) of defect-rich 1T-MoS2 based catalysts in 0.5 M H2SO4 electrolyte. It can be clearly seen that although 1T phase and rich defects can improve the HER performance of MoS2, the activities of most bare defect-rich 1T-MoS2 catalysts are not very high. However, the HER activity can be further enhanced by integrating defect-rich 1T-MoS2 with conductive carbon to form hybrid self-supported materials. More interestingly, elemental doping is a more efficient way to significantly improve the HER activity of defect-rich 1T-MoS2. The best activity in the reported literatures was observed on a single-atom Co array doped distorted 1T-MoS2 catalyst, which had the lowest η10 of 42 mV and smallest Tafel slope of 32 mV dec−1."
16,Summary and outlook,"In this review, we introduced the crystal structure and defect types of MoS2 firstly, then listed in detail how to confirm the existence of 1T-MoS2 and defects through some advanced characterization means and also quantitatively obtain the concentration of 1T phase and the number of defects. Next, the synthesis method to prepare defect-rich 1T-MoS2 materials were introduced, which mainly including top-down, bottom-up and novel synthesis strategies. Among them, hydrothermal method is the most widely used and easiest approach to synthesize defect-rich 1T-MoS2. The key to this method is the addition of excessive S source, suitable hydrothermal temperature, and the generation of a large number of intercalated NH3 molecules. Finally, we summarized the HER performance of bare, elemental doped and carbon materials integrated defect-rich 1T-MoS2 catalysts, respectively. Interestingly, doping elements is the most efficient way to significantly improve the HER activity. However, there are still some bottlenecks for the development of more efficient defect-rich 1T-MoS2 HER catalysts, and these problems point out the future research directions: (1) Developing simpler and safer exfoliation methods to prepare defect-rich 1T-MoS2. In this case, we could firstly adopt a mild exfoliation method such as using alcohols as exfoliating reagent to prepare high purity 1T-MoS2, and then utilize etching methods for post-treatment to produce a large number of defect sites. (2) Improving the stability of 1T-MoS2 phase induced by NH3 intercalation. (3) Precise and controllable synthesis of defects, in-depth mechanism investigation about the influence of defect type and content on the HER performance. (4) Combining the advantages of elemental doping and integration with conductive support to prepare more efficient defect-rich 1T-MoS2 catalysts. This review also provides insights for designing defect-rich 1T-MoS2 materials in other related energy conversion and storage applications."
