,sections,Text
7,The influence of the US on the current efficiency of the ECHSA process,"3.3 The influence of the US on the current efficiency of the ECHSA process The c.e. of the ECH is directly proportional to the ratio of the catalytic hydrogenation rate (Eqs. (4)–(6)) over the H2 generation rate (Eqs. (2) and (3)) [16,51], which can be used to measure the efficiency of the ECH process. The ratio hydrogenation/H2 generation can be affected by parameters like temperature and US power. The sonication provides an increase in the c.e. for a variety of electrosyntheses. For the electroreduction of p-methylbenzaldehyde, Nokata et al. [52] reported that the c.e. was increased in 54% under sonication when comparing to the absence of stirring solution, using only 0.5 F mol−1 of charge and ultrasonic power of 12 W. The maximum hydrogenation/H2 generation ratio, i.e., the maximum c.e. should correspond to a complete saturation of both organic substrate adsorption sites and Hads sites [24,51]. The ratio is also affected by factors which influence the coverage of the electrode by M(H)ads and the activity of M(H)ads. As shown in Table 1 (entries 2, 4, 6, 11, 13, 15–17), after consumption of 2 F mol−1, regardless the US mode, power and control of temperature used, the c.e. of the US-ECHSA process were reproducible and higher than 79%. At this condition, the chemisorbed hydrogens (M(H)ads) generated by electrochemical route reacts with the substrate M(Y = Z)ads, consequently there was a slight formation of H2 (Eqs. (2) and (3)), and both the atomic hydrogen formation and the diffusion of (+)-(1) to the electrode surface (Eqs. (1) and (4)) becomes more important. Surprisingly, after consumption of 1 Fmol−1, i.e., one mole of electron per mole of substrate, half of the required charge for complete hydrogenation of the CC bond, the c.e. of all reactions, regardless the US mode, power and control of temperature used, is dramatically increased (Table 1, entries 1, 3, 5, 10, 12 and 14). This paradoxical effect can be explained by the formation of H radical, generated by US irradiation, in the medium. It is known that the high temperature and pressure created within a collapsing cavitation bubble produced by US irradiation cause the formation of H and OH radicals through the break of the HO bond of the water. The detection of some intermediates has been difficult, and the unequivocal confirmation of the US-generated H radicals could only be obtained by electrochemical methods in recent decades [53]. For instance, Liang, Sheng and Han [54] reported a novel method for the preparation of water-soluble and small-size CdSe quantum dots under high-intensity ultrasonic irradiation. The authors proposed a possible mechanism for the formation of CdSe quantum dots in which the H radical is capable to reduce the SeSO3 2− specie to Se2−, leading to the formation of above mentioned quantum dot. Hence, in the present work, the bubbles formed by cavitation may be trapped at certain fixed pores locations by the effects of acoustic radiation force. As previously discussed, due to US action and cavitation processes, the catalytic surface stands more accessible to the substrate, increasing the probability of the catalyst coverage by adsorbed H radical generated by both US irradiation and electrochemical process. Notice that the application of 14 W of US, in the absence of electric current (Table 1, entry 9) does not form hydrogenation products. Therefore, additionally to the results described in Table 1, entries 7 and 8, it is noteworthy that the use of US, in detriment of the electric current, was not capable to carry out the hydrogenation of (+)-(1). Hence, a more pausible explanation for these results would be a synergism between the US irradiation and the ECHSA process, in which H radicals are produced from the sonication process, improving the coverage of the catalyst pores with M(H)ads (in addition to the electrochemical process), thus explaining the high c.e. values observed."
8,The influence of the temperature control on the US-ECHSA process,"3.4 The influence of the temperature control on the US-ECHSA process The temperature control plays an important role in the US process. If the temperature is not controlled, effects like degradation of the compounds of interest, volatilization of analytes [55] can occur. The temperature control is a difficult task. However, three strategies can be adopted to avoid the above mentioned effects. The first one is the use of ice or thermostatic bath that can be applied for a short sonication time. In the second one, the ultrasonic irradiation is intermittently interrupted (pulse mode), at this mode the amplifier switch turns “on” and “off” repeatedly, thus avoiding the buildup of the reaction temperature [56]. In a third one, the two strategies can be combined. As can be noticed in Fig. 4 , the use of ice bath decrease the temperature of the system for both continuous (61.2±0.7ºC to 23.9 ± 0.7ºC) and pulsed mode (41.3±0.7ºC to 13.7±0.7ºC). These behaviors can be more accurately viewed through the thermograms A–B and C–D, respectively, which show the temperature profiles of the systems by using ice bath system. Since the bath ensures a rapid dissipation of heating, the bulk temperature of the solution is colder than those without temperature control. The influence of the temperature control is more pronounced in the pulsed mode than the continuous mode (Table 1, entries 16 and 17, respectively). Indeed, at lower temperatures, the adsorbed species (Eqs. (1) and (4)) are less mobile and the probability of the reactions is lower, hence lower is the hydrogenation yield. On the other hand, without temperature control, the efficiency of the continuous mode (Table 1, entry 4) is not changed, being the conversion rate, c.e. and selectivity within the experimental error, when compared to the pulse mode (Table 1, entry 13). In this context, it is known that the continuous application of US during catalysis is claimed to give improvements in mass transport, and consequently in the product yields. Hence, the continuous application of US (14 W) without temperature control, is the most effective technique if compared with pulses of 0.2 s applied after each second, regardless the temperature control employed."
9,US effects on the cathode morphology,"3.5 US effects on the cathode morphology Cavitation erosion is predominantly mechanical in nature and has two possible sources: the shock wave of isolated imploding cavities attached to the surface and the jet impact with velocities estimated to be as high as 100 m s−l, which are generated by clusters of cavities collapsing near the surface [34,57]. The most popular theory is that erosion of metals results from asymmetric collapse of single bubbles attached to, or very close to the surface, which produces shock waves and liquid jets of sufficient force to deform the surface increasing the number of edges, crevices and kinks that expose fresh and highly active surfaces [40,57,58]. The synergetic effect of a metal deposited on a matrix has been studied, and the behavior of a deposit is different from a pure solid material [12–14,17,24]. Undoubtedly, the surface composition and morphology of the electrocatalyst plays a major role in the electrochemical performance towards the ECH process. As already pointed out, sonochemical approach is a versatile method of modification of metallic surfaces. Thus, regarding the morphology, the pre-sonication of the catalyst surface is as effective as a continuous sonication. Our group [24] has investigated the effects of US on particle morphology and catalyst reactivity, where the electrode irradiation in US bath changes the surface morphology (shape, spacing, homogeneity and size of the particles) of the Ni catalyst, enhancing the hydrogenation yields of 5%. In this procedure, the wall of the electrochemical cell difficult the propagation of the US irradiation, and the amount of energy that reaches the reaction in an US bath system, is low, ca. 5 W cm−2. Despite this, a smoothing effect was observe on the nickel surface. Conversely, ultrasonic probes delivers their energy directly into the system, thereby providing more efficient cavitation in the liquid and enhancing the US effects on the catalyst surface, as can be seen from the following SEM analyses. In this work, a nickel sacrificial anode was used in an undivided cell with the aim to provide a constant renewal of the catalyst surface. This procedure was used in electro-reductive systems to avoid side oxidation reactions on the anode [59], during the ECH process [12–14,24,60]. In general, the results in Table 1 point to the edges and/or corners (small particles) favoring hydrogenation of the CC bond (selectivity of 98% on average, entries 1–6 and 9–16) whereas the planes (large particles) favor hydrogenation of the CO bond given saturated alcohols (selectivity of 21.5%, on average, entries 7 and 8). This seems to be true when we analyze the SEM of the cathode surface (Fig. 5 A). The structure of a naked nickel cluster differs from a Ni surface irradiated by continuous US (Fig. 5B–D). The SEM of the Ni surface electrochemically deposited on Ni matrix during US irradiation, revealed that the surfaces are smoothed, and the particles are uniformly distributed and consolidated into extended aggregates (Fig. 5B–D). The clusters of electrodeposited nickel are smaller on the matrix treated by US and reveal the pitting of the Ni surface, which acts to expose a new surface to the substrate and increases the effective surface area available for US-ECHSA reaction leading to high efficiency in the hydrogenation process (Table 1, entries 1 and 2). The particle size decreasing was a result of the cavitation energy generated by US. Conversely, the SEM of Ni deposit on the Ni cathode matrix, treated under silent condition (Fig. 5E and F), revealed bigger particles than those formed under US treatment, which justify the low efficiency of the silent process as mentioned earlier (Table 1, entry 7)."
10,Application of chitosan microspheres in the removal of nickel ions of the aqueous medium,"3.6 Application of chitosan microspheres in the removal of nickel ions of the aqueous medium The use of a nickel sacrificial anode in an undivided cell provide a simple electrochemical system for hydrogenation of several organic compounds with high durability of the catalyst due the constant renewal of the electrode coating (Eq. (7)). Despite the advantages and results discussed throughout this work, the use of a nickel sacrificial anode brings an inconvenience from the point of view of the environment, since nickel ions are generate in solution (Eq. (8)). (7) Ni2+ +2e− → Ni(M) (8) Ni → Ni2+ + 2e− Accordingly to the first of the twelve principles of green chemistry: it is better to prevent waste than to treat or clean up waste after it has been created. However, there is no way to prevent the generation of nickel ions by using the sacrificial anode with undivided cell technique. Nevertheless, an interesting alternative to circumvent this disadvantage is the use of chitosan as an adsorbent matrix to removal heavy metals of solution [61–63]. In this sense, and aiming the remediation of the residue, chitosan/polyvinyl alcohol (Chitosan/PVA) composite spheres were prepared and applied as an adsorbent for the removal of Ni2+ ions from the aqueous solution. Fig. 6 shows the micrograph of a Chitosan/PVA sphere produced. It can be observed that the microsphere is homogeneous and have a diameter of approximately 1 mm. Also in Fig. 6, the macroscopic appearance of the beads before and after exposure to the nickel-containing residual solution can be observed. After adsorption, it is noteworthy that the blue color of the spheres and the colorless supernatant solution are evidences of the nickel residue extraction generated during the US-ECHSA process. The EDXRF analysis showed that the concentration of Ni2+ ions in the original solution was reduced from 591.5 ppm to 209.9 ppm (64%). The obtained spheres have a nickel adsorption capacity of approximately 3.816 mg/g, which is in agreement with other works of literature [61–63]."
11,"US-ECHSA of α,β-unsaturated ketones in water","3.7 US-ECHSA of α,β-unsaturated ketones in water Hydrogenation selectivity control of α,β-unsaturated ketones and aldehydes is a widely studied topic [11–14,24,60]. Considerable efforts has gone into learning how to hydrogenate the CO bond and retain the CC bond to produce α,β-unsaturated alcohols (allylic alcohols), which are useful in the fine chemicals industry. As already pointed out, it is a difficult task since CC bond hydrogenation is thermodynamically favored over CO hydrogenation. In this sense, the hydrogenation of α,β-unsaturated ketones gives a saturated ketone (SONE) as majority product, while the CO bond hydrogenation gives an unsaturated alcohol (UOL). Both SONE and UOL can be further hydrogenated in saturated alcohol (SOL). Table 2 shows the comparison between different ECH procedures described in the literature and the US-ECHSA process described in this work for a variety of α,β-unsaturated ketones. As expected, the conjugated CC bond of the 2-cyclohexen-1-one was more easily hydrogenated than CO (Table 2, entry 1) and 2-cyclohexenol was not detected in the reaction mixture. After 1 F mol−1, the use of US improves the ECH process leading to hydrogenation product yield of 100% (Table 2, entry 1), being this result comparable others well established ECH procedures (Table 2, entries 3–5) and 2.5-fold higher than the control reaction in silent condition (Table 2, entry 2). The US-ECHSA of isophorone leads to production of 85.5% of SONE and 5.5% of the SOL (91% total yield, Table 2, entry 6), which represents an increase of 66% in the hydrogenation product yield when compared to the control reaction at silent conditions (Table 2, entry 7). The ECH of isophorone to dihydroisophorone has been extensively studied under different experimental conditions, on nickel electrode material (Table 2, entries 8–10). The hydrogenation of isophorone in methanol systems (32–51% of c.e.; Table 2, entries 8 and 9) was more difficult than in aqueous solution (68% of c.e.; Table 2, entry 10). In recent work, our group [60] observed that, using β-CD as inverse phase transfer catalyst on ECHSA of isophorone, both c.e. and hydrogenation yield increases. The authors attribute the results to the enhancement of isophorone concentration in the aqueous media due to the formation of inclusion complex with β-CD. In aqueous systems, the c.e. in presence of β-CD was approximately 3-fold lower (68%, Table 2, entry 10) than that obtained in aqueous solution irradiated by US (193%, Table 2, entry 6). Concerning the selectivity, the presence of gem-dimethyl and methyl groups at C5 and C3, respectively, hinders isophorone adsorption at the catalyst surface (Eq. (4)) and, as a consequence, increase the selectivity of the ECH/ECHSA process, except in presence of US (94% of selectivity, Table 2, entry 6). Interestingly, at the experimental conditions used, the yield of dihydroisophorol was clearly improved by the presence of US (5.5%, Table 2, entry 6) showing that, not only steric hindrance influences the selectivity but also the energy released into the system by the US irradiation, as previously discussed. The (S)-(+)-carvone, a conjugated cyclohexenone which contains an additional exocyclic CC bond was also hydrogenated in presence of US (Table 2, entry 11). Similarly to the other previously cited substrates, under US irradiation occurs the enhancement of the hydrogenation yields (89.5%, Table 2, entry 11) when compared to that obtained in silent reaction (26%, Table 2, entry 12). As expected, the conjugated endocyclic CC bond was hydrogenated in preference to the vinylic bond and trans-dihydrocarvone was the main product formed (88%, Table 2, entry 11). Indeed, the trans isomer of dihydrocarvone is kinetically favored due to the adsorption of the conjugated double bond of the (S)-(+)-carvone on the nickel catalyst surface (Eq. (4)) be less hindered since the two alkyl groups substituents be located in the equatorial orientation. The ECH of the exocyclic CC bond occurred at low rate producing small amounts of carvomenthone (1.5%, Table 2, entry 11). Finally, the US-ECHSA of (S)-(+)-carvone was more selective than others well established ECH/ECHSA procedures and, concerning to the c.e., was much more efficient (Table 2, entry 11) regardless the type of solvent and catalyst used (Table 2, entries 13 and 14). Acetylcyclohexene, with a trisubstituted endocyclic double bond, is more difficult to hydrogenate (Table 2, entry 15) than 2-cyclohexen-1-one with a disubstituted double bond (Table 2, entry 1), as expected again from steric effects. Under US irradiation, the hydrogenation yields increases (83%, Table 2, entry 15) when compared to that obtained in silent reaction (37%, Table 2, entry 16). In aqueous-methanol systems, the charge required to hydrogenate the acetylcyclohexene was 4-fold higher (4.2 and 4 F mol−1, Table 2, entries 17 and 18, respectively) than that obtained in aqueous solution irradiated by US (1 F mol-1, Table 2, entry 15). Finally, regarding the electrochemical efficiencies observed in entries 1, 6, 11 and 15, notice that the easy of CC bond hydrogenation decreases in the following order: 2-cyclohexen-1-one > acetylcyclohexene > isophorone > carvone, corroborating the literature data [14]. Apocarotenoids are a class of terpenoid compounds, which include some important volatile compounds such as β-ionone and α-ionone. As expected for both apocarotenoids, the CC bond was hydrogenated faster than the CO bond, producing SONEs with good hydrogenation yields (77.5% and 71%, Table 2, entries 19 and 21). Due to the extension of the conjugation of the β-ionone, the US-ECHSA produced dihydro-β-ionone (60.5%), as major product, and tetrahydro-β-ionone (17%) as minor product. Conversely, the ECH of β-ionone at fractal Ni cathode in aqueous methanol leads to hydrogenation of the less substituted CC, i.e, to dihydro-β-ionone with 99% of selectivity after 89% conversion and 28% of c.e (Table 2, entry 20). Regarding to α-ionone, the US-ECHSA was selective to produce dihydro-α-ionone with 71% of c.e. (Table 2, entry 21). The US-ECHSA process revealed to be useful to synthesize methyl isobutyl ketone (93.5% yield, Table 2, entry 22), a valuable industrial solvent used for paint and other protective coatings. The process was also suitable to produce 2-methyl-cyclopentanone from 2-methyl-2-cyclopenten-1-one with excellent hydrogenation yields (Table 2, entry 23)."
12,Conclusion,"Ultrasound-assisted approach resulted in significant enhancement of the ECH process, reaction time and product yields where improved when compared to other well stablished ECH procedures describe in literature. The optimum US parameters observed were 20 kHz frequency, 14 W of power in continuous mode without control of temperature. The ECHSA process was facilitated by the high temperature and pressure associated with cavity implosions near electrode surface. The chemical reactivity of the catalyst surface was altered by acoustic streaming and cavitation. At low power, pulses of ultrasound had a small stereochemical effect in the distribution of the (R)-(+)-pulegone hydrogenated products. Conversely, at higher power, pulses of ultrasound restore the product distribution. The production of H radicals under US irradiation, occurred in addition to the electrochemical method; this synergetic effect undoubtedly improves the ECHSA process, leading to excellent yields and c.e. over 100%. Based on this investigation, US-ECH of α,β-unsaturated ketones using a sacrificial anode could be a very promising process for saturated ketones production in water."
