,sections,Text
0,Introduction,"Catalytic hydrogenation (CH) is one of the most useful and important catalytic methods used in synthetic organic chemistry. It has been largely studied in both laboratory and large-scale production [1,2]. The CH process technology is well established and the laboratorial experiment scale up presents low difficulty levels. In most cases, extreme conditions (high pressure and temperature) are necessary to accelerate the process, leading to by-products and a significant increase of the operating costs [1,3,4]. The main reason for the increase in operating costs is related to the production and storage of the molecular hydrogen, since it is mostly produced from fossil fuels. It is estimated that 49% of the hydrogen production comes from natural gas sources, and only 4% is resulting from electrolysis processes [5]. Otherwise, the electrochemistry is a clean technology that allows in situ hydrogen generation for the CH process; this technique will henceforth be referred to as electrocatalytic hydrogenation (ECH). The ECH provides an alternative synthetic route for the hydrogenation of some organic molecules under mild conditions (room temperature and normal pressure) and is considered an attractive process because it dispenses a molecular hydrogen supply, since atomic hydrogen is produced on the electrode surface and also eliminates inconveniences such as catalyst poisoning [6–9] The main difference between the CH and ECH processes concerns the generation of chemisorbed hydrogen. Hydrogen is a clean and environmentally friendly energy carrier that can be produced by means of hydrogen evolution reaction (HER) during water electrolysis. According to classical theory [10], overall HER on the metal (M) surface may proceed via elementary steps. At the first step, the catalyst surface undergoes a primary discharge (Eq. (1)) in which the reduction of hydronium ions form atomic chemisorbed hydrogen (MHads). This discharge step is believed to be fast and followed by both desorption and/or recombination steps (Eqs. (2) and (3)). (1) H3O+ + e− + M → MHads + H2O (Volmer reaction) (2) 2MHads → M + H2 (Tafel reaction) (3) H3O+ + MHads + e− → M + H2 + H2O (Heyrovsky reaction) Either reaction, Heyrovsky or Tafel, is considered to be a rate-limiting step. Thus, the HER mechanism may be represented as Volmer–Heyrovsky or Volmer–Tafel [10]. In the ECH process, the chemisorbed hydrogen (MHads) reacts with unsaturated organic molecules (Y = Z) (Eqs. (4) and (5)) adsorbed on the catalyst (cathode) surface, followed by desorption of the hydrogenated product (Eq. (6)) and regeneration of the adsorption sites [11–14]. (4) Y = Z + M → M(Y = Z)ads (5) 2MHads + M(Y = Z)ads → M(YH-ZH)ads (6) M(YH-ZH)ads → M + YH-ZH The electrocatalysis is a procedure exploring the rates of electrochemical reactions as a function of the electrode surface properties. Thus, a metal is considered catalytically active if it is able to chemisorb both atomic hydrogen and unsaturated bonds of the substrate. The most important classes of metals with catalytic activity are those in Groups 8–11 of the Periodic Table, i.e. Fe, Co, Ni and Cu groups. The choice of cathode material is a difficult task and is generally governed by economic factors. In the last decades, extensive studies have been carried out on this subject, looking for efficient, robust, and low-cost catalysts for the ECH [6,13,14,15–22], which could potentially replace the widely used Pd and Pt electrocatalysts. Nickel is among the most abundant transition elements in the Earth’s crust and is, for instance, 100-fold and more than 130-fold cheaper than Ru and Pd, respectively [23]. This makes its use as catalyst for both ECH and HER extremely attractive. For example, Navarro et al. [11] investigated the development of an ECH system using undivided cells and Ni as the sacrificial anode (referred as to ECHSA), which permits a fine deposit of Ni during ECH process. In other work [24], the optimum conditions for the ECHSA of benzaldehyde in water, using β−cyclodextrin (βCD) as inverse phase transfer catalyst (IPTC) were determined. The morphology of the nickel deposited on the cathode matrix (Cu, Fe, Ni or Fe/Ni alloy (64:36)) during a pre-electrolysis was investigated. The results showed that the hydrogenation yields for the cathode matrices of Fe:Ni alloy, Fe, and Cu were the same, remaining within the experimental error. Substrates like olefins [25], arenes [26], aromatic and aliphatic nitriles [27], unsaturated aldehydes [28] and ketones [29] have been hydrogenated by the electrocatalytic process. However, the use of insoluble substrates leads to an overall yield drop of the ECH method, due to the mass-transport limitation between the bulk solution and the electrode surface. Consequently, the use of co-solvent is generally the only alternative wishing to hydrogenate highly hydrophobic substrates in water. However, the ECH field have a marked tendency for using different co-solvents making recycling difficult owing to cross contamination [9,11–14,16–19,22]. Although co-solvents might solve the mutual insolubility problem, they can also cause certain disadvantages such as competing hydrolysis pathways and difficulties in their purification and removal. The absence of the solvent should be the ideal situation, once it implies efforts and energy to remove it from the reactional system [30,31]. Therefore, a promising alternative to circumvent the aforementioned disadvantages is the use of ultrasound (US) in the ECH process. US has been recognised as a key technique for green and sustainable synthetic processes, allowing the use of non-active metals and crude reagents as well as aqueous media [32]. The sonoelectrochemistry is the science that couples US to electrochemistry and provide a powerful combination for the surface activation of materials toward HER [33,34]. The first application of US in an electrochemical procedure dates back to the 1930s, when Moriguchi [35] showed that under sonication, the water electrolysis (Pt electrode) took place at lower voltages and faster rates than under normal (silent) conditions. The many benefits of US in electrochemical process are well known. The particular advantages which accrue from the use of sonoelectrochemistry include: 1) the enhancement of the mass transport to/from an electrode and in bulk solution, which affects concentration-dependent phenomena; 2) the diminution of the diffusion layer, which affects electron transfer; 3) the modification of the electrode surface phenomena (adsorption/desorption), the diminution of the electrode fouling and removal of electrode coatings [28,30,31]. When US is applied to a liquid, several processes can occur that often create unusual physical conditions: acoustic streaming, turbulent convection, microstreaming in the presence of oscillating bubbles and cavitation [36,37]. The chemical and physical effects of US arise from a cavitation phenomenon, which produces localized extreme conditions (short-lived hot spots). Cavitation is the origin of sonochemical effects. The significance of cavitation to sonochemistry is not so much on how the bubbles form, but rather what happens when they collapse. Cavitation arises from the rapid compression and rarefaction phases of the longitudinal sound wave propagating throught the liquid. When cavitation occurs in a liquid close to a solid surface (e.g. a cathode matrix/electrode), the dynamics of the cavity collapse is rather asymmetric and produces high-speed jets of liquid, termed “microjets”. The impact of the jets on the surface is very strong causing damages and leading to cleaning, ablation and, sometimes, fracture of the structure, increasing the number of edges, crevices and kinks that expose fresh and highly active surfaces [37–40]. Ultrasound-enhanced electrochemical systems with different electrodes have been widely reported for oxidation of variety of organics such as chlorinated organics [41], dyes [42] and phenolic substances [43]. The US-assisted chemical reduction method has been successfully applied in the preparation of amorphous alloys with homogeneous particle sizes [44]. However, the number of articles in the field of ECH reporting the use of US is limited. For instance, US was used as a pre-electrolytic treatment in the ECH of benzaldehyde, in water using a Ni electrode, leading to an increase of 5% in the hydrogenation yields [24]. In this context, the present investigation explored the use of US in the ECH of α,β-unsaturated ketones and aldehydes in water using a simple undivided cell with a sacrificial anode (US-ECHSA). (R)-(+)-Pulegone ((+)-(1)) was adopted as the standard substrate. This study is relevant from both sonoelectrochemistry and green standpoint because, besides meeting the principles 2, 3, 5, 6, 7 and 9 of sustainable and green chemistry [31], no study have yet been reported concerning the use of US to assist the ECHSA of (+)-(1) in water."
1,Experimental,
2,Chemicals,"2.1 Chemicals (+)-(1) (96%) was purchase from Acros. Diethyl ether, ammonium chloride (supporting electrolyte), acid chloride, sodium hydroxide and sodium sulphate were purchased from Vetec. Acetylcyclohexene, 2-cyclohexen-1-one, isophorone, (S)-(+)-carvone, β- and α−ionone, 2-methyl-2-cyclopenten-1-one, mesityl oxide, chitosan, polyvinyl alcohol and glutaraldehyde were purchase from Aldrich and used as received. Water was of Milli-Q® grade."
3,Procedures,"2.2 Procedures 2.2.1 Electrochemical procedure The controlled current preparative electrolyses were carried out with an Autolab PGSTAT101 potentiostat/galvanostat, using a 30 mL undivided cell. A cylindrical nickel rod was used as sacrificial anode (0.1 dm diameter; 0.078 dm2 area). Another Ni bar (0.1 dm diameter; 0.078 dm2 area) was also used as the working electrode, which can be reused several times after removing the nickel deposit by abrasion and polishing processes. Water was the solvent in all electrochemical experiments. A Bandelin Sonopuls ultrasonic homogenizer HD 2070 was used for the approach of ultrasound-assisted electrolyses. The basic setup consists of a 30 mL undivided electrochemical cell (Fig. 1 ), which was filled with the 25 mL of 0.2 M of the supporting electrolyte and 0.5 mmol of substrate. The ultrasonic irradiation at a frequency of 20 kHz ± 500 Hz was used for passage of ultrasound into the reaction mixture through a titanium cylindrical horn, submerged 3.0 cm into reaction mixture. Ultrasonic horn had a diameter of 13 mm and maximum rated power output of 70 W. The probe was connected and isolated from the transducer by the introduction of a Teflon® disc. The transducer connected to the generator transforms the high-frequency power from the generator to ultrasound (continuous (7, 14 or 35 W) or pulse mode (0.2 s)), converting it to a form of mechanical energy. A thermocouple (0.7 °C of accuracy) was inserted into the cell to measure the inside temperature. The distance between both electrodes was 1.5 cm and their distance for the probe was 0.5 cm, respectively. The schematic representation of experimental set up has been shown in Fig. 1. The procedure followed for the US-ECHSA were carried out by using a constant current density of 350 mA dm−2 until consumption of the charge required for the complete hydrogenation of the CO or CC double bond, i.e. 2 F mol−1. The cell voltage varied between −1.71 V and −1.85 V. The influence of temperature control of the solution on the efficiency of the process was studied. For this purpose, an ice bath was used, in which the temperature was measured with a probe type digital thermometer. A Flir i7 infrared thermometer (2% accuracy, ε = 0.95 and thermal sensitivity of 0.1 °C) were used to check variations in bulk temperature profile of the system. After electrolysis, the water solution was extracted with diethyl ether, dried with Na2SO4 and analyzed by gas chromatography (GC). Gas chromatogram/mass spectra were recorded with a Varian 3380 GC or Shimatzu GC/MS model GC17A, a 70 eV ion trap, fitted with a 30 m capillary DB5 (HP) column, using a 60–220 °C temperature range (10 °C min−1). Comparisons with authentic samples were performed by GC (acetylcyclohexene, 2-cyclohexen-1-one, α−ionone and mesityl oxide), in order to identify the hydrogenation products and reagents. Toluene (0.067 mmol) was used as an internal standard to quantify the products and reagents. Scanning electron microscopy (SEM) was used for the morphologic analyses of the electrodeposited nickel particles on the cathode and was carried out with a SHIMADZU SS-550. 2.2.2 Synthesis of chitosan microspheres To prepare the chitosan beads, initially a 20 mL aliquot of the 4% chitosan solution (w/v in 0.1 M HCl) was mixed with 20 mL of the 4% PVA solution and the mixing until completely homogeneous. The solution obtained from Chitosan/PVA was dripped in 200 mL of a 4% NaOH solution under constant stirring. The Chitosan/PVA solution was slowly dripped onto the NaOH solution, causing the coagulation of the droplets and consequent formation of the polymer spheres. After dripping of the entire polymer mixture, the spheres formed were kept in the NaOH solution for 2 h to complete coagulation. Then, the spheres were taken out of alkaline solution and washed thoroughly with deionized water. The spheres were add to a 2.5% aqueous solution of glutaraldehyde and hold in that solution for 2 h. After that, the spheres were wash with deionized water and kept in a beaker with water for 2 h to remove uncrosslinked glutaraldehyde. Finally, the spheres were kept in an oven at 60 °C for a period of 48 h. For the characterization of the spheres obtained, as for their surface morphology, a SEM analyzes were performed, after metallization of the spheres with gold. For the feasibility study of the spheres obtained in the removal of Ni+2 ions from the residual solution of the hydrogenation process, 1 g of spheres were added to 10 mL of the aqueous hydrogenation residue and the mixture was kept under slow stirring for 24 h. After this time the supernatant solution was filtered. Finally, an aliquot of the original residue solution and an aliquot of the supernatant after adsorption assay were analyzed for Ni+2 concentration by Energy Dispersive X-ray Fluorescence (EDXRF) using the SHIMADZU equipment Rayny 720."
4,Results and discussion,
5,US-ECHSA of (+)-(1),"3.1 US-ECHSA of (+)-(1) 3.1.1 Continuous US mode The synthesis of a large number of fine chemicals, particularly in the field of flavor/fragrance chemistry and pharmaceuticals, involves the selective hydrogenation of unsaturated carbonyl intermediates as a critical step [3]. The hydrogenation of α,β-unsaturated carbonyls into saturated carbonyls is comparatively easy to achieve because the CC bond is usually both thermodynamically and kinetically favored over the hydrogenation of the CO bond by ca. 35 kJ mol−1 [45]. (+)-(1) is a monoterpene ketone containing an exocyclic double bond, present in the leaves and flowering tops of several members of the mint family Lamiaceae. The hydrogenation of ((+)-(1)), generally proceeds via Scheme 1 , giving (−)-menthone ((−)-(2)) and (+)-isomenthone ((+)-(3)), which in turn produces four diastereoisomeric alcohols: (+)-neomenthol ((+)-(4)), (−)-menthol ((−)-(5)), (+)-neoisomenthol ((+)-(6)) and (−)-isomenthol ((−)-(7)) [13]. In this work, (+)-(1) was hydrogenated using the US-ECHSA procedure. Regardless of the charge used and the power of US employed in the experiments, only (-)-(2) and (+)-(3) were produced (average ratio of 1.21, Table 1 entries 1–6). The main product in every experiment described in Table 1 (entries 1–6) was (−)-(2) (trans configuration of the methyl and isopropyl group, diequatorial conformation). On the other hand, (−)-(2) and (+)-(3) (cis configuration) are susceptible to epimerization, changing the configuration of the carbon atom neighboring the CO group and remaining in equilibrium. The production of (+)-(4), (−)-(5), (+)-(6) and (−)-(7) was barely existent, indicating that the US-ECHSA, at continuous mode, proceeds according to the path (a) of Scheme 2 . Concerning the stereochemistry of the hydrogenation of (+)-(1), the use of continuous US, in different powers, was not influenced when comparing the ratio of the products (−)-(2) and (+)-(3) (Table 1, entries 1–6) with those obtained by using mechanical stirring (Table 1, entry 7). In addition, the US-ECHSA of (+)-(1) showed a more efficient conversion rate, selectivity and current efficiency (c.e.) than both the uniquely electrochemical procedures with or without mechanical stirring (Table 1, entries 7 and 8, respectively). 3.1.2 Pulsed US mode US pulses of 0.20 s per second were applied aiming to compare the ECH results of this procedure with those obtained at US continuous mode. Slight differences were observed among the hydrogenation conversion rates, i.e., the effect caused by US continuous or pulsed modes are within the experimental error (Table 1, entries 1–6 and 10–15, respectively). Conversely to the results obtained with the continuous US irradiation mode, the use of US pulses seems to change the equilibrium between (−)-(2) and (+)-(3) (average ratio of 0.93, Table 1 entries 10–13). However, high US power (35 W) seems to restore the original equilibrium and product distribution of (−)-(2) and (+)-(3) (average ratio of 1.05, Table 1, entries 14 and 15). According to Cervený and Kukula [46], the distribution of the products depends on both the hydrogenation and the epimerization rates. The authors assert that if the hydrogenation rate is high, the epimerization equilibrium between (−)-(2) and (+)-(3) is stabilized fast enough, and the disorder in the distribution of products does not occur. Indeed, the use of high US pulse (Table 1, entries 14 and 15) leads to an increase of the bulk solution temperature (Fig. 2 ), and to a high probability of reaction of M(Y = Z)ads and M(H)ads, corroborating the previously cited affirmation. In turn, the lowering of the US power leads to lower solution temperature (Fig. 2), diminishing the hydrogenation rate (Table 1, entries 10–13, 16, 17). In this sense, the use of low US pulsed power can, in some way, promote a competition between the epimerization and the hydrogenation reaction and shift the equilibrium between (−)-(2) and (+)-(3). Therefore, it is clear that the sonication presents, under certain experimental conditions (Table 1), a small stereochemical effect, and its magnitude depends on both the US power and the mode. However, it is know that stereochemical effects are uncommon in sonochemistry and various hypotheses can be employed to explain this behavior [47]. Thus, a reasonable interpretation along this line is premature and is beyond the scope of this work. Lastly, it is apparent from Table 1 (entries 7–8 and 13–17) that the production of axial hydroxyl group, resulting in the production of (+)-(4) and (+)-(6), was preferred and depend on the reaction condition. The selective production of axial hydroxyl can be explained by the substrate adsorption on the catalyst surface. (−)-(2) and (+)-(3) get adsorbed on the catalyst surface by the chair conformation, i.e., from the less restrained equatorial carbonyl side [46]. Thus, the axial hydroxyl group is produced indicating that the US-ECHSA of (+)-(1), at pulsed mode, proceeds according to the paths (b–d) of Scheme 2 ."
6,The effect of the US power on the ECHSA process,"3.2 The effect of the US power on the ECHSA process Since ECH occurs on a solid/liquid (electrode/electrolytic solution) interface, various effects, as previously mentioned, should be induced by the electrolytic solution sonication. The induction of convective movement of species in the reaction medium is the main effect of the acoustic streaming, resulting in the decrease of the thickness of the diffusion boundary layer, enhancing the mass transfer of electroactive species to the electrode surface, thus, accelerating the diffusion-controlled reactions [48,49]. When US is applied to an electrochemical system, parameters such as frequency (Hz), intensity (W cm−2), power (W), the source of ultrasound release and the temperature should be considered. The strength of acoustic streaming is directly proportional to the ultrasonic power intensity and inversely proportional to the bulk viscosity of the electrolyte [50]. Indeed, when applying the US power of 7 W in the ECHSA reactions, it was observed an average increase of 63.5% on the product yields, (Table 1, entries 1–2), if compared to the mechanical stirring reaction (Table 1, entry 7) and 74.5% when compared to the without stirring process (Table 1, entry 8). Doubling the US power (14 W) led to a slight average increase of 4.5% yield, (Table 1, entries 3–4) if compared to those obtained with US power of 7 W (Table 1, entries 1–2). The use of a 5-fold higher US power (35 W) did not change the hydrogenation yields (Table 1, entries 5–6), showing that the US-ECHSA reaction seems to reached a plateau. In fact, the ultrasonic energy that a system can take is limited. When a large amount of US power enters a system, a large amount of cavitation bubbles are accumulated around the ultrasonic probe. In these cases, the bubbles attenuate the sound waves, hindering the transport of acoustic energy (absorption) and the heat evolution occurs through the medium [38]. Furthemore, temperature is a factor that can influence conversion rate, selectivity, c.e. and catalyst life time. As shown in Fig. 3 , the higher the US power the higher the temperature of the solution. It is well know that faster diffusion rates occur at high temperatures. In fact, the increase of the bulk solution temperature corresponds to a higher probability of reaction of the adsorbed species, M(Y = Z)ads and M(H)ads, which could justify the hydrogenation yields observed in Table 1 (entries 1–6). However, the rate of the electrochemical desorption is not significantly affected by the temperature [51]. Therefore, at temperatures higher than the optimum temperature (Fig. 3) the amount of adsorbed species becomes stable and no significant changes are observed in the product yields."
