,sections,Text
0,Introduction,"Hydrogen (H2) is considered to be one of the most promising fuels of the future [1] due to high energy content (122 kJ/g) as compared to hydrocarbon fuels [2–4]. Hydrogen gas is also a clean fuel with no CO x , SO x and NO x emissions. Besides, H2 is an important energy carrier and can be used in fuel cells for generation of electricity [5,6]. However, hydrogen gas is not readily available in nature like fossil fuels and natural gas, but can be produced from renewable materials such as biomass [2,7] and water [3]. Hydrogen gas production technologies has gained special attention during the last fifty years due to the increasing energy demand, rapid consumption of non-renewable fossil fuel reserves and hydrocarbon fuel based atmospheric emissions [7–9]. Steam reforming of natural gas and water electrolysis are the most commonly used processes for H2 gas production [1]. Due to energy intensive nature of those processes more energy efficient H2 production methods are searched for [6]. Hydrogen gas production from renewable resources (e.g. biomass) and carbohydrate rich waste materials by bioprocesses offers distinct advantages over energy intensive methods used [2,10]. Major drawbacks in bio-hydrogen production are low yields and productivities requiring large reactor volumes and long residence times [2,11]. Main bio-hydrogen production processes are direct/indirect bio-photolysis, dark and photo-fermentations [1,6,10,11]. A brief comparison of those processes is depicted in Fig. 1 . Bio-photolysis of water under sunlight is considered as the cleanest approach for bio-hydrogen production. However, low H2 gas productivity [12], strict light requirement and oxygen inhibition are the main problems in bio-photolysis of water [2,12]. Fermentative hydrogen gas production from carbohydrates is a much faster process than bio-photolysis [8,10,13] with volatile fatty acids (VFAs) and H2 gas formation [14,15]. However VFAs need to be fermented for further H2 gas production [16,17]. Photo-fermentative bacteria have the ability to use VFAs for H2 production under light irradiation [2,6,13] for which dark fermentation effluent can be used as feedstock [14,15,18–20]. Hydrogen gas formation can be enhanced by integration of dark and photo-fermentations in the form of sequential or combined fermentations [8,14,15,18–21]. Both the dark and photo-fermentations can be realized by using suspended and immobilized-cell reactors operating in batch, continuous and fed-batch modes. Major mechanisms for bio-hydrogen production by dark and photo-fermentations have been elucidated. However, development of an effective bio-hydrogen production process at industrial scale is still a challenge. Recent reviews published on fermentative hydrogen gas production summarized studies using different raw materials, bacterial cultures, operating conditions (T, pH, ORP) and pre-treatment methods [1–3,6,10,11,13]. The reported rates and the yields of fermentative hydrogen gas production were not high enough to make the process economically viable. The most suitable raw materials, pre-treatment methods, bacterial cultures, operating conditions, cultivation types, operating modes and processing schemes are yet to be determined for an effective and economically viable fermentative hydrogen production process. Operating modes of bioreactors affect the rate and the yield of hydrogen gas formation during dark and photo-fermentations by affecting the biomass, substrate and product concentrations in the reactor. None of the published review articles considered the effects of operating modes and processing schemes as factors affecting hydrogen production rate and the yield. Therefore, the main objective of this study is to overview the reported studies on bio-hydrogen production by different operating modes. Sequential and combined dark and photo-fermentations operated in batch, continuous and fed-batch mode were compared in terms of hydrogen gas formation rates and yields. Some conclusions were drawn to identify the most suitable cultivation type (suspended or immobilized cultures) and operation mode (batch, continuous, fed-batch) for effective bio-hydrogen production."
1,Dark fermentation,"A wide variety of heterotrophic bacteria have the ability to ferment carbohydrates under anaerobic conditions to produce H2 gas, volatile fatty acids (VFAs) and CO2 [8,22–24]. In general, spore forming Clostridium species, facultative Enterobacter sp, Bacillus sp [2,13,25], some thermophilic bacteria [22,24,26,27] and anaerobic acidogenic sludge [2,22,28–30] are the most widely used cultures for this purpose. Hydrogenase is the key enzyme catalyzing molecular H2 formation by combining protons and electrons in dark fermentation [31,32]. Usually, monosaccharides are main carbon sources [22,33–35] which can be generated by acid or enzymatic hydrolysis of polysaccharides like starch or cellulose [23]. Dark fermentative conversion of glucose to H2, acetic acid and CO2 is presented in (Eq. (1) [10]). Negative free energy indicates that the reaction proceeds toward product formation spontaneously with no external energy requirement. Theoretically, a maximum of 4 mol of H2 can be produced per mole glucose when acetic acid is the only VFA product. However, lower yields are obtained in practice since part of the glucose is used for microbial growth and maintenance [34]. Butyric acid formation is accompanied with formation of 2 mol of H2 per mole of glucose and propionic acid formation consumes 1 mol of H2 per mole of propionic acid [36,37]. Lactic acid and ethanol fermentations do not result in H2 formation or consumption. When both acetic and butyric acids are produced in dark fermentation of glucose, theoretically 2.5 mol H2 is formed per mole glucose [38]. (1) C6H12O6 + 2 H2O → 2 CH3COOH + 4 H2 + 2 CO2 ∆Go = −206 kJ Presence of H2 consumers such as homoacetogens, methanogens [22,39,40], nitrate and sulfate reducing bacteria [7,22] in mixed non-sterile cultures are other factors reducing the hydrogen yield [22,39,41]. Some seed culture pre-treatment methods like heat shock, acid or alkaline treatment, sonication, freezing and thawing, chloroform, sodium 2-bromoethansulfonate or 2-bromoethansulfonic acid (BESA), iodopropane treatments [22,42,43] and control of operation conditions (e.g. acidic pH and short HRT) [7] can be used to eliminate H2 consuming bacteria to some extent. Other important factors affecting the performance of dark fermentation are operating conditions such as pH and temperature [7,22,24]. Hydrogen gas production occurs at acidogenic stage of anaerobic metabolism [2,22]. Therefore pH values between 5.5 and 6.5 were reported to be the optimal [2,44,45]. Low pH values (pH = 4.5) were stated to result in solvent formation since Clostridium acetobutylicum, Clostridium butylicum, and Clostridium beijerinkii have the ability to produce ethanol, butanol and acetone at low pH ranges reducing H2 formation [46,47]. On the contrary, Zhao et al. [48] recently proposed operation of dark fermentation at alkaline pH of 10 to avoid formation of propionic acid and effective inhibition of acetogenic bacteria responsible for H2 consumption when waste activated sludge was used as the substrate. Therefore, pH control at the optimum level is of great importance for effective H2 gas formation in dark fermentation. Dark fermentation can be realized under mesophilic (25–40 °C), thermophilic (40–65 °C) or hyper-thermophilic (>80 °C) conditions [11]. Mesophilic temperature range has been used more widely as compared to thermophilic temperature [26] due to less energy requirement [27]. However, thermophilic operation was reported to yield higher H2 yields due to limited growth of H2 consumers and faster metabolic activity of bacteria [26]. Optimum oxidation–reduction potentials (ORP) for Clostridium sp. vary between −200 and −250 mV [49]. ORP values out of this range might result in sub-optimal conditions for H2 producing bacteria. Nitrogen (N), phosphorous (P), Iron (Fe) and sulfur (S) are required nutrients playing crucial roles in H2 production by dark fermentation [24]. Nutritional requirements of acidogenic bacteria depend on the type of bacteria and the experimental conditions. Various studies were reported in literature investigating the optimal C/N and C/P ratios in dark fermentation [33,50]. Optimum ratios ranged between 11.4/1 and 200/1 for COD/N and 73/1 and 970/1 for COD/P ratio, respectively [24]. Hydrogen gas formation rate and yield are the two most important criteria used in selecting the most suitable bacteria for fermentative H2 production. The yield is defined as the amount of H2 produced per amount of substrate consumed (mol H2/mol glucose) [51,52]. Hydrogen gas production rate (HPR) is defined as the amount of H2 (ml) produced per unit time and per unit reactor volume (volumetric rate) or per unit biomass (specific rate) [52]."
2,Batch dark fermentation,"2.1 Batch dark fermentation Most of the dark fermentation studies for hydrogen gas production were realized by batch operation where different types of bacteria and substrates were used. Batch fermentations are usually subject to substrate and product inhibitions yielding low hydrogen gas productivities. The reported batch studies were mainly aimed to identify conditions enhancing H2 production by substrate and culture selections and adjustment of operation parameters. Due to the excessive number of articles on dark fermentative H2 production, only striking reports are summarized below. H2 formation yields are usually between 1.5 and 2.5 mol H2 mol−1 glucose in most of the dark fermentation studies. However, H2 yields between 3 and 4 mol H2 mol−1 glucose have been reported recently. One of those studies was done by Ntaikou et al. [53] where Ruminococcus albus was used as inoculum culture for H2 production from sweet sorghum biomass. R. albus was stated as promising culture able to ferment hexoses and pentoses as well as cellulose and hemicelluloses present in sorghum biomass. Hydrogen formation yield of 3.15 mol H2 mol−1 glucose was reported when 3 g L−1 glucose equivalent sorghum stalks was used as substrate in batch experiments. Vegetable waste supplemented with sewage was used by Mohanakrishna et al. [54] for H2 production by dark fermentation. A high H2 yield of 25.8 ± 0.6 mol H2 kg COD was obtained with a substrate concentration of 4.8 kg COD m−3 when vegetable waste was supplemented with sewage. About 65% of total TVFA concentration consisted of acetic acid resulting in high H2 yields. High concentrations of TVFAs formed at high substrate concentrations resulted in lower pH values adversely effecting H2 gas formation. Hydrolyzates produced from steam explosion of corn stover were used by Datar et al. [47] for H2 production by batch dark fermentation. Heat pre-treated anaerobic sludge was used as inoculum culture with major products of H2, CO2, acetic and butyric acids. Fermentation of corn stover acid hydrolyzate (20%, v/v) followed by steam explosion resulted in the highest H2 yield and rate of 3.0 mol H2 mol−1 glucose and 275 mL H2 L−1 h−1, respectively. The anaerobic sludge was unable to ferment lignocellulosic solids without acid hydrolysis unless supplemented with cellulase enzymes. pH control at pH = 5.5 was reported to be necessary for high H2 gas yields. Effects of glucose concentration on H2 formation rate were also investigated by the same authors [47]. The rate increased from 191.25 to 905 mL H2 L−1 h−1 when glucose concentration was increased from 3 to 25 g L−1. The same trend was also stated by Lee et al. [55] who was able to increase the H2 formation rate from 534 to 1119 mL H2 L−1 h−1 by increasing the initial starch concentration from 8 to 24 g L−1. Further increases of the substrate concentration resulted in decreases in the rate due to accumulation of inhibitory VFAs in the medium [47,55]. Hydrogen gas production by thermophilic–anaerobic fermentation was reported to be more effective than mesophilic fermentation [56,57]. In this context, Zeidan and van Niel [56] recently reported high H2 yields close to the theoretical yield of 4 mol H2 mol−1 glucose. A co-culture of Caldicellulosiruptor kristjanssonii and Caldicellulosiruptor saccharolyticus resulted in a yield of 3.8 ± 0.2 mol H2 mol−1 glucose [58]. In another study of the same author, Caldicellulosiruptor owensensis strain OLT (DSM 13100) was used in anaerobic–thermophilic fermentation using glucose (10 g L−1) supplemented with a rich vitamin solution. The highest hydrogen yield was reported to be 3.8 ± 0.1 mol H2 mol−1 glucose with a formation rate of 15 mmol H2 L−1 h−1. pH control and N2 gas flushing to reduce hydrogen gas partial pressure were reported to be important factors resulting in high H2 yields [56]. Product inhibition on H2 gas formation in dark fermentation was investigated by increasing acetate concentration in fermentation medium [59]. Heat pre-treated anaerobic sludge was used for the fermentation of sucrose containing synthetic wastewater (25 g COD L−1) with pH control at 5.5. Acetate was externally added to the fermentation media. The highest yield (1.06 ± 0.05 mol H2 mol−1 glucose) and SHPR (74.2 ± 1.2 mL H2 g−1 VSS h−1) were obtained in control flasks where no external acetate was added. Almost 50% of the substrate was converted to VFAs consisting of 60% butyric acid. Increases in acetate concentration gradually decreased the rate and the yield of H2 formation. A non-competitive product inhibition model was used to describe acetate inhibition. Chen et al. [60] operated a fermenter in sequencing batch mode for H2 production from carbohydrate rich organic wastewater. Effects of pH (4.9, 5.5, 6.1, and 6.7), and cyclic duration (4, 6, and 8 h) were investigated by using pre-treated anaerobic sludge. The highest H2 formation yield of 2.53 mol H2 mol−1 sucrose was obtained at pH 4.9, HRT = 16 h, and with the feed COD of 25 g COD L−1 using 4 h cycles. High VFA accumulations were reported to lower the pH of fermentation medium. pH and durations of the cycles were reported to affect H2 gas production by sequencing batch operation. Argun et al. [33] investigated the effects of C/N and C/P ratios on H2 gas formation rate and yield by dark fermentation of wheat powder solution (WPS). Nitrogen and phosphorous were externally added to the fermentation media in the desired concentrations. The highest yield (281 ml H2 g−1 starch) and SHPR (98 ml H2 g−1 biomass h−1) were obtained at C/N/P ratio of 100/0.5/0.1 (ww−1 w−1). Hydrogen gas can be produced from various resources through dark fermentation by the utilization of both sterile and non-sterile inoculum cultures. Notable yields were reported when complex and pure carbon sources were used. Yields around 3 mol H2 mol−1 glucose were reported at low glucose concentrations (<5 g L−1) resulting in low VFA formation with no considerable product inhibition [47,53,61]. At higher initial carbohydrate concentrations above 10 g L−1, H2 formation yields were around 1.0 to 2.0 mol H2 mol−1 glucose which is probably due to the VFA inhibition. On the other hand, H2 formation rate had an increasing trend with increasing initial substrate concentration up to 20 g glucose L−1 followed with a decrease at higher substrate concentrations [47,55,62]. Hydrogen formation yields and rates need to be further improved for effective hydrogen gas production in batch dark fermentation."
3,Continuous dark fermentation,"2.2 Continuous dark fermentation Although most of the dark fermentation studies were performed by batch operation, continuous operations were also reported using different substrates and microbial consortia. Continuous operation provides constant product quality, production rate and the yield with high productivities at the steady-state as compared to batch fermentation. Suspended and immobilized cultures were used by employing continuous stirred tank reactors (CSTRs) and upflow anaerobic sludge blanket reactors (UASB) for bio-hydrogen production. Reported H2 yields in continuous dark fermentation are between 0.58 mol H2 mol−1 glucose [63] and 2.80 mol H2 mol−1 glucose [64] which are lower than the highest yields obtained in batch studies. In a study performed by Ren et al. [65] continuous H2 production from diluted molasses was realized in a flocculated activated sludge reactor. High cell density was maintained in order to achieve faster conversions at low HRTs. The reactor was reported to provide a maximum yield value of 26.13 mol H2 kg−1 COD at 27.58 kg COD m−3 d−1 loading rate and HRT of 6 h. The highest SHPR (31.25 mL H2 g−1 ML VSS h−1) and VHPR (232.08 mL H2 L−1 h−1) were obtained with 68.21 kg COD m−3 d−1 loading rate at HRT of 4 h. By using the ratio of 1.066 g COD/g glucose [66] the highest yield can be calculated as 4.55 mol H2 mol−1 glucose which is quite higher than the theoretical yield of 4 mol H2 mol−1 glucose. This is probably due to the contribution of different carbon sources for H2 production rather than glucose. In another study, hydrogen gas was produced from cheese processing wastewater by anaerobic–thermophilic fermentation using a CSTR [67]. Heat pre-treated anaerobic sludge was used as the inoculum culture. Effects of HRT and substrate loading on the rate and yield of H2 gas formation were investigated. The yield was 22 mmol H2 g−1 COD corresponding to 590 mL H2 g−1 glucose (55 °C, 1 atm) with a mean H2 formation rate of 62.5 mL H2 L−1 h−1 at 13.42 kg COD m−3 d−1 loading rate at HRT = 3.5 days and T = 55 °C. Fluctuating patterns of H2 formation rates, COD removal efficiencies and total biogas production were reported. Krupp and Widmann [38] produced H2 gas from waste sugar media using a 30 L CSTR inoculated with anaerobic sludge. H2 yield of 1.78 mol H2 mol−1 glucose was obtained at HRT = 15 h with a substrate loading rate of 14 kg VS m−3 d−1. pH control around 5.5 was reported to be an important factor yielding high H2 gas formation. Effects of HRT (10, 5.0, 2.5, 1 h) and glucose loading rate (0.5–18.9 g COD h−1) on the rate and yield of H2 gas formation were examined by Van Ginkel and Logan [64] using heat shocked agricultural soil as inoculum in dark continuous fermentation [64]. The most favorable operating conditions of 2.5 g L−1 feed glucose, 6 kg glucose m−3 d−1 loading rate, and HRT = 10 h were reported to result in a yield of 2.8 mol H2 mol−1 glucose and H2 formation rate of 81 mL H2 L−1 h−1, respectively. High feed glucose concentrations at low HRT levels resulted in flocculation adversely effecting H2 formation. Continuous operation was found to be more advantageous for immobilized-cell systems. An immobilized-cell fluidized-bed bioreactor was used by Zhang et al. [68] for continuous H2 production from glucose where pre-treated anaerobic sludge was immobilized in the reactor yielding biomass concentrations between 34 and 37 g VSS L−1. The highest H2 yield (1.7 mol H2 mol−1 glucose) and formation rate (7600 mL L−1 h−1) were obtained with a feed glucose of 10 g L−1, organic loading rate of 960 g glucose L−1 d−1, at HRT = 0.25 h, pH = 5.5 and T = 37 °C. Stable biogas production with nearly 45% H2 content was achieved for 50 days. Another study reporting high H2 formation rate by continuous dark fermentation from fructose (20 g COD L−1, 480 kg COD m−3 d−1) was reported by Lee et al. [69] where a membrane cell recycle reactor (MCR) along with a CSTR fermenter was used. MCR provided high cell concentrations in the fermentor allowing operation at high dilution rates. The highest yield (1.36 mol H2 mol−1 hexose) and H2 formation rate (2750 mL H2 L−1 h−1) were obtained at HRT = 1 h, pH = 6.7 and T = 35 °C. Cheng et al. [70] studied continuous H2 production using agitated granular sludge bed reactor (AGSB) fed with starch (20 g L−1, 960 kg starch m−3 d−1). Anaerobic sludge immobilized on powdered activated carbon was used as inoculum. Effects of pH (5.5 and 6) and HRT (12, 2, 1, 0.5 h) on H2 gas formation were investigated in continuous dark fermentation. The highest yield (5.06 mmol H2 g−1 starch = 0.83 mol H2 mol−1 glucose) with the lowest rate (700 mL H2 L−1 h−1) was obtained at HRT of 12 h. The lowest yield (2.74 mmol H2 g−1 starch = 0.45 mol H2 mol−1 glucose) with the highest rate (1770 mL H2 L−1 h−1) occurred at HRT of 0.5 h. Presence of Clostridium sp. and Bifidobacterium sp. in the microbial consortia was reported to play crucial role in H2 gas formation. As presented above, continuous operation yielded much higher H2 formation rates (up to 7600 mL H2 L−1 h−1) as compared to batch systems (max. 1119 mL H2 L−1 h−1) with relatively lower yields (<3 mol H2 mol−1 glucose). Considerable differences were noticed in H2 production performances of continuous suspended (CSTR) and immobilized-cell reactors. High biomass concentrations in immobilized-cell reactors provided considerable advantages over CSTR such as high substrate loading rates (960 kg glucose m−3 d−1 vs. 68.21 kg glucose m−3 d−1), low HRTs (0.25 h vs. HRT > 10 h) with extremely high H2 formation rates (7600 mL H2 L−1 h−1 vs. 233 mL H2 L−1 h−1). On the contrary, suspended cell CSTRs provided higher yields (2.8 mol H2 mol−1 glucose vs. 1.78 mol H2 mol−1 glucose) at low substrate feeding concentrations (<5 g glucose L−1) when compared to immobilized systems. CSTRs could not tolerate high substrate loadings at low HRTs < 10 h due to rapid biomass flocculation adversely affecting H2 production performance [64]. Immobilized-cell reactors seem to be more advantageous than suspended cell CSTR in terms of high H2 productivities. However, lower H2 yield obtained in immobilized-cell reactors is an important disadvantage. Neither continuous suspended cell, nor immobilized systems were found to be capable of providing both high H2 yield and high rates under high substrate loading rates and low HRT levels. High cell density fed-batch cultures may overcome the shortcomings of continuous suspended and immobilized-cell systems."
4,Fed-batch dark fermentation,"2.3 Fed-batch dark fermentation High cell density fed-batch operation has considerable advantages as compared to batch and continuous operation and is usually used to overcome substrate/product and toxic compound inhibitions encountered at high substrate concentrations. Fed-batch operation is also used to adjust the metabolic rates by adjusting the feed flow rate and composition. The substrate solution is added with a rate sufficient to support the bacterial community and to eliminate the substrate and product inhibitions with no effluent removal. When the substrate consumption rate is equal to the feeding rate the reactor substrate concentration reaches a low quasi steady-state level. When the reactor is full, the contents are settled, the supernatant containing the products are removed and another cycle of fed-batch operation is started. Part of the settled bacteria may also be removed in order to adjust the cells retention time. Despite considerable advantages, fed-batch operation has not been used widely in Hydrogen gas production by dark fermentation. Few studies on the subject matter are summarized below. Chin et al. [71] reported H2 production by fed-batch operation with an extremely high feed glucose concentration (500 g L−1). Constant H2 formation yield of 2 mol H2 mol−1 glucose with a rate of 930 mL H2 h−1 was reported for long term fed-batch operation. Prevention of VFA accumulation during dark fermentation was recommended for more efficient H2 production. In another study Kargi and Pamukoglu [72] investigated H2 production from boiled waste wheat powder (WP) by fed-batch operation. Effects of substrate loading rate on the rate and the yield of H2 gas formation were investigated. The highest yield (3.1 mol H2 mol−1 glucose) and rate (36 mL H2 h−1) were reported with 20 g L−1 feed WP concentration with loading rate of 4 g WP d−1. Yokoi et al. [73] performed H2 production experiments from sweet potato starch by using repeated fed-batch operation. Pure culture of Clostridium butyricum and co-culture of C. butyricum and Enterobacter aerogenes were used to compare H2 production capabilities in the presence of 0.1% polypeptone as nitrogen source. Co-culture of C. butyricum and E. aerogenes was found to be more effective than pure culture of C. butyricum. A stable and high H2 yield between 2.3 and 2.4 mol H2 mol−1 glucose was obtained up to 2.0% feed starch concentration. A yield of 2.7 mol H2 mol−1 glucose was reported by Yokoi et al. [74] using a similar co-culture approach through repeated fed-batch operation in the presence of corn steep liquor as nitrogen source."
