,sections,Text
5,Photo-fermentation,"Photosynthetic non-sulfur (PNS) bacteria have the ability to convert VFAs to H2 and CO2 under anoxygenic conditions [2,6,13,75]. PNS bacteria also have the ability to use carbon sources like glucose, sucrose, succinate rather than VFA for H2 production [76–78]. The most widely known PNS bacteria used in photo-fermentative H2 production are Rhodobacter sphaeroides O.U001, Rhodobacter capsulatus, R. sphaeroides-RV, Rhodobacter sulfidophilus, Rhodopseudomonas palustris and Rhodospirillum rubrum [79]. Both hydrogenase and nitrogenase enzymes were detected in PNS bacteria [6,8]. However, nitrogenase is the main enzyme responsible in molecular H2 production under anoxygenic conditions [8,80]. Eq. (2) [10,81] presents H2 gas formation from acetic acid by photo-fermentation. Due to positive free energy change, the reaction is not spontaneous requiring external energy input in the form of light which could be provided as artificial or solar light source [18,21,82]. As presented in Eq. (2) [10,81], theoretically 4 mol of H2 can be produced from 1 mol of acetic acid when acetic acid is the only VFA present in fermentation medium. (2) CH3COOH + 2 H2O → 4 H2 + 2 CO2 ∆Go = +104 kJ, Strict control of environmental conditions is essential for efficient H2 production by photo-fermentation [83–85]. Optimal pH and temperature ranges were reported to be 6.8–7.5 and 31–36 °C, respectively [79]. Suitable wavelength and light intensities for photo-fermentation were reported to be between 400 and 1000 nm [80,86], 6 and 10 klux, respectively [79]. Fe and Mo are known to be the most important cofactors required by the nitrogenase enzymes in H2 production [87]. The limited use of nitrogen source is of special importance since even 20 μM of ammonia was reported to cause inhibition on the nitrogenase enzyme responsible for H2 formation [80]. Malate/glutamate ratio larger than 1 is recommended for effective H2 formation by photo-fermentation [80]. Optimum VFA concentrations were reported to be between 1800 and 2500 mg L−1 [88–90]. Major problems in photo-fermentation were reported to be lack of preferred C-sources such as malate and lactate, non-uniform light distribution through fermentation broth and metabolic shift from H2 production to PHB synthesis [79,80,91]. H2 production performance of PNS bacteria is evaluated on the basis of the H2 yield and the light efficiency [86]. The yield coefficient is the ratio of the amount of produced H2 to the consumed carbon source. The light efficiency denotes the ratio of generated H2 energy to the supplied light energy. Depending on the carbon source, H2 formation yields up to 80% of the theoretical yield were reported in literature [86,92–94]. Light conversion efficiencies varied between 0.2 and 9.3% [80,86]. A light efficiency of 10% for PNS bacteria corresponds to the theoretical maximum of photochemical efficiency [86,95]. As presented in Eq. (3) [86] the light efficiency could be increased by reducing the supplied light energy to the reactor. Light efficiencies at around 10% level were obtained only at low light intensities and low H2 rates which is dependent on the fraction of energy absorbed by the bacteria and the energy loss during the several steps of excitation and electron transfers [86]. Dasgupta et al. [8] proposed genetic strain development by modification of light-harvesting antenna complexes responsible for capturing solar energy, reduction in pigment content of bacteria, improvement in the nitrogenase enzyme efficiency and reduction of uptake hydrogenase enzymes. Convenient reactor geometry and light distribution are the key factors for efficient conversion of solar energy to H2 [79,80,96]. (3) Light efficiency ( % ) = H 2 production rate × H 2 energy content absorbed light energy Design of photo-bioreactors enabling efficient H2 production is still a challenge [96]. Light distribution inside photo-bioreactors constitutes the most important parameter effecting H2 production rate [86]. Thus, optimization of light distribution with high reactor surface area was reported as an essential factor to enhance the light efficiency in photo-fermentation [8,86]. Operating parameters also affect the photo-fermentation process efficiency. The concept of net energy ratio (NER) is used to determine the process efficiency which is the ratio of total energy produced to the energy required for plant operations like mixing, pumping, aeration and cooling [97]. The objective is to obtain NER > 1 by improving the light conversion efficiency to H2 [8]. (4) NER = ∑ Energy Produced ( biomass / hydrogen ) ∑ Energy input ( mixing , aeration , pumping , cooling , etc . ) Immobilization of PNS bacteria on solid matrix was reported to yield higher H2 formation rates than the suspended culturing [13]. H2 formation rates between 3600 and 3800 mL H2 L−1 h−1 were expected by using immobilized PNS bacteria on porous glass [98]. The expected rate was calculated by scaling up the small scale experimental results of 3.6–3.8 mL H2 mL−1 h−1 and is not guaranteed at production scale."
6,Continuous photo-fermentation,"3.2 Continuous photo-fermentation There is limited number of continuous culture studies on photo-fermentative H2 production. Most studies on this subject are realized by sequential dark and photo-fermentation which are summarized later in this article. Hydrogen yields and rates varied in continuous photo-fermentation depending on the substrate, inoculum culture and experimental conditions. Yields up to 80% of the theoretical yield were reported depending on the substrate used [93]. Reported H2 formation rates varied between 1.12 and 165.9 mL H2 L−1 h−1 [78,83]. Long HRTs from 25 h [87] to 120 h [103] were required indicating slow conversion of VFAs to H2 and CO2 by the PNS bacteria. Najafpour et al. [104] conducted continuous hydrogen gas production experiments from carbon monoxide (CO) using R. rubrum. A 2 L fermenter was continuously fed with acetate (4 g L−1) for cell growth and CO (14 mL min−1) which was further used for H2 gas production. The reactor was operated at pH = 6.5, HRT = 55.5 h with 4 klux illumination by tungsten lamp. In photo-fermentation CO was oxidized to CO2 while water was reduced to H2 by R. rubrum. Hydrogen gas was produced with a rate of 397.5 mL H2 g−1 h−1 and 80% of the theoretical yield, respectively. Fermentation of lactic acid by R. sphaeroides-RV was realized in a two stage chemostat for H2 production [93]. The first reactor was used for nitrogen removal and for bacterial growth while the second reactor was for H2 production. The feed lactic acid, ammonium and yeast extract concentrations were 100 mM, 4.7 mM and 0.5 g L−1, respectively. Illumination was provided by tungsten lamps (10 klux). HRTs were 10 h and 20 h for the first and the second reactors, respectively. Hydrogen gas formation yield and SHPR were 4.8 mol H2 mol−1 HLa and 75 mL H2 g−1 h−1, respectively. Increasing nitrogen concentration adversely effected H2 formation due to inhibition of the nitrogenase enzyme. Fascetti et al. [87] investigated continuous H2 production from dark fermentation effluent (DFE) of source selected municipal solid wastes. R. sphaeroides-RV was used in photo-fermentation of DFE containing 4.1 g L−1 acetic acid, 0.38 g L−1 lactic acid and 59 mg L−1 total nitrogen as carbon and nitrogen sources, respectively. The photo-bioreactor (1 L) was operated at HRT = 25 h and was illuminated with 10 klux tungsten lamp to yield the highest SHPR of 100 mL H2 g−1 h−1. Continuous H2 production in a pneumatic flat panel photo-bioreactor was performed by using Rhodobacter pseudomonas as an inoculum culture [105]. The reactor was first operated in batch mode followed by continuous operation at HRT = 28.5 h, 175 W m−2 illumination, 30 °C and pH = 6.8–7.0. Mixing was provided by recirculating argon gas through the reactor. However, no H2 production was observed due to high residual NH4 levels (>4 mM) from batch operation and high acetate concentrations. VFA and ammonium concentrations were recommended to be below certain limits (VFA < 2500 mg L−1, NH4 < 2 mM) for effective photo-fermentation. CO2 was identified as an essential nutrient for growth of PNS bacteria and should not be removed by continuous gas sparging [105]. Studies for continuous photo-fermentation have been realized mostly by suspended cultures rather then using immobilized cells. High H2 gas formation rate of 1300 mL H2 L−1 h−1 with 75% substrate conversion efficiency was reported in a study where R. sphaeroides-RV was immobilized on porous glass indicating an advantage over suspended culture [106]."
7,Fed-batch photo-fermentation,"3.3 Fed-batch photo-fermentation As stated in Section 2.3, fed-batch operation for H2 production offer distinct advantages. However there is limited number of fed-batch photo-fermentation studies reported in literature. Rhodopseudomonas faecalis strain RLD-53 was used for bio-hydrogen production from acetate by using fed-batch operation with H2 yields nearly 80% of the theoretical yield [107]. The reactor was illuminated by 4 klux incandescent lamp source. pH and temperature were controlled at 7.0 and 35 °C, respectively. Initial acetate and Na-glutamate concentrations were 50 mM and 10 mM, respectively. Acetate was injected to the fermenter below certain limits. The highest yield and volumetric rate of H2 gas production were 3.17 mol H2 mol−1 acetate and 37.2 mL H2 L−1 h−1, respectively. Control of the feed acetate concentration and pH was identified as important factors effecting fed-batch H2 production. Boran et al. [108] operated a 80 L pilot scale photo-bioreactor in fed-batch operation mode during winter time in Ankara–Turkey. The experiments were performed at outdoor conditions in a greenhouse. The system was fed with 40 mM acetic acid and 2 mM glutamate containing feed solution. Rhodobacter capsulatus was used as the inoculum culture. The system resulted in an overall yield of 0.6 mol H2 mol−1 acetic acid with a productivity of 7.7 mL H2 L−1 h−1. The highest light conversion efficiency was reported as 1%."
8,Sequential dark and photo-fermentations,"As presented above dark fermentative H2 production suffers from low H2 yields due to accumulation of VFAs in the medium [94]. However, the VFA fermentation capability of PNS bacteria provides a unique opportunity for valorization of dark fermentation effluent (DFE) as a substrate for photo-fermentation [14,15,18–20,83]. When dark and photo-fermentations were operated simultaneously, the maximum theoretical H2 yield would increase to 12 mol H2 mol−1 glucose when acetic acid is the sole product of the dark fermentation [18,19,83]. The DFE has to meet certain conditions for effective photo-fermentation such as TVFA and NH4 + concentrations must be below 2500 mg L−1 and 40 mg L−1, respectively [83,84,110–113]. Dilution, ammonium stripping, centrifugation and sterilization of DFE have been used as pre-treatment steps to reduce TVFA and NH4 + below certain limits [21,84]. Residual glucose in the DFE is also a problem since a shift from glucose to VFA fermentation by the PNS bacteria takes a long time resulting in low H2 gas productivities [109]. Therefore, DFE has to be ammonia and glucose deficient with desirable VFA concentration (<2500 mg L−1) for effective H2 gas production by photo-fermentation [84]. Bio-process schemes for bio-hydrogen production from biomass by sequential dark and photo fermentations are described in Fig. 2 . Acid hydrolysis of biomass can be used before fermentations (Fig. 2a) or bio-hydrolysis step can be incorporated into dark fermentation (Fig. 2b). Direct photo-fermentation of carbohydrates derived from acid hydrolysis of biomass is also possible (Fig. 2c). Pre-treatment of DFE prior photo-fermentation and neutralization after acid hydrolysis are important steps to be considered. Sequential dark and photo-fermentation of glucose can be represented by the following reactions [10] when acetic acid is the only VFA produced. Dark fermentation: (5) C6H12O6 + 2 H2O → 2 CH3COOH + 4 H2 + 2 CO2 ∆Go = −206 kJ Photo-fermentation: (6) 2 CH3COOH + 4 H2O → 8 H2 + 4 CO2 ∆Go = 104.6 × 2 = 209.2 kJ Sequential or combined dark and photo-fermentation (overall reaction): (7) C6H12O6 + 6 H2O → 12 H2 + 6 CO2 ∆Go = 3.2 kJ As presented in Eqs. (5) and (6), the overall maximum theoretical yield in sequential fermentation is 12 mol H2 mol−1 glucose when acetic acid is the only VFA. However, real yields are much lower than that due to formation of a mixture of VFAs and utilization of part of the substrate for growth, maintenance and PHB formation [21,84]. An overall yield of at least 8 mol H2 mol−1 glucose is aimed for an economically viable process [18]. Hydrogen gas production studies from waste and pure carbon sources by sequential dark and photo-fermentation using different operational modes have been reported in the literature. Results of striking studies are summarized in Table 1 . The reported overall yields are considerably higher than single-stage dark or photo-fermentation. However, H2 formation rates in sequential fermentation are lower (<700 mL H2 L−1 h−1) than those of dark fermentation alone. PNS bacteria require long HRT levels (up to 5 days) for efficient conversion of VFAs to H2 in continuous mode of operation. The highest H2 productions were obtained using repeated-batch operation mode where the substrate concentrations varied between 5 and 25 g glucose L−1. The highest H2 formation yield of 7.2 mol H2 mol−1 glucose was reported by Yokoi et al. [74] where medium containing 10 g L−1 sweet potato starch was fermented by sequential dark and photo-fermentation operated in fed-batch mode. Co-culture of E. aerogenes HO-39 and Clostridium butyricum was used in dark fermentation producing H2 and VFAs. R. sphaeroides efficiently converted VFAs present in DFE by photo-fermentation. Individual yields of repeated-batch dark and photo-fermentations were 2.7 mol H2 mol−1 glucose and 4.5 mol H2 mol−1 glucose, respectively. Addition of Na2MoO4·2H2O and EDTA was stated to be crucial in enhancing photo-fermentation yield. Similar approach was used in another study and total yield of 7.0 mol H2 mol−1 glucose was obtained from sweet potato starch in sequential dark and photo-fermentation [73]. Ozgur et al. [111] investigated H2 production from sugar beet molasses in sequential dark and photo-fermentations both of which were operated batchwise. Strains used as inoculum in the first and second fermenters were thermophile C. saccharolyticus and PNS bacteria, respectively. Dark fermentation was operated with initial sucrose concentration of 15 g L−1 at 70 °C and pH = 6.9 ± 0.1 resulting in a yield of 2.1 mol H2 mol−1 glucose. The dark fermentation effluent was centrifuged, diluted and sterilized prior to PNS bacteria inoculation. Photo-fermentation took place at 30–33 °C, pH = 6.7 and with illumination at 150–200 W m−2 using tungsten lamp. Phosphate buffer, Fe and Mo source were added to the second stage to enhance H2 production in photo-fermentation. The highest H2 yield was 4.75 mol H2 mol−1 glucose by the PNS strain hup_mutant of R. capsulatus. The overall yield of dark and photo-fermentations was reported to be 6.85 mol H2 mol−1. In another study H2 was produced from waste wheat starch by sequential dark and photo-fermentation by Argun et al. [21]. The substrate was first fermented by dark fermentation with an initial starch concentration of 6.7 g L−1 for about 70 h. The DFE was subjected to NH4–N removal, centrifugation and dilution process in order to obtain suitable initial TVFA and NH4–N concentrations for photo-fermentation. About 60% of initial TVFA (2.1 g L−1) was fermented by R. sphaeroides-RV at 5 klux illumination with halogen lamp. H2 formation yield of dark and photo-fermentations was 1.87 and 2.68 mol H2 mol−1 glucose, respectively. Su et al. [113] performed two stage dark and photo-fermentation in order to enhance H2 production from glucose. C. butyricum and R. palustris were used as dark and photo-fermentative bacteria, respectively. Glucose (20 g L−1) was fermented to H2, CO2 and VFA by dark fermentation and the resulting acetate and butyrate containing DFE was subjected to photo-fermentation after centrifugation, filtration and dilution. Contributions of dark and photo-fermentative yields were 1.32 mol H2 mol−1 glucose and 4.16 mol H2 mol−1 glucose, respectively resulting in a total yield of 5.48 mol H2 mol−1 glucose. Hydrogen gas production from glucose in dark fermentation (100 mL H2 L−1 h−1) was faster than that of the photo-fermentation (26.9 mL H2 L−1 h−1). More than 90% of VFA was fermented during photo-fermentation with a light conversion efficiency of 2.96% [113]. Simultaneous H2 gas production along with COD removal was studied by Chen et al. [52] using sequential dark and photo-fermentation of sucrose. Dark fermentation took place at sucrose concentration of 20 g L−1, pH = 7, T = 32 °C using Clostridium pasteurianum CH4. The resulting effluent was centrifuged (13,000 rpm), diluted and inoculated with R. palustris (0.875 g L−1) for continuous photo-fermentation at 32 °C, pH = 7.1 and 95 W m−2 illumination using tungsten lamps. Dark and photo-fermentation yields were reported to be 1.9 and 3.11 mol H2 mol−1 glucose, respectively. Photo-fermentation yield was increased to 5.10 mol H2 mol−1 glucose by illumination using optical fibers (95 W m−2) with 2.0% (w/v) of clay carriers. A yield of 5.11 mol H2 mol−1 glucose was maintained for 10 days when continuous photo-bioreactor was operated at HRT = 96 h. A three step integrated system consisting of starch hydrolysis, dark fermentation and photo-fermentation was performed by Lo et al. [114]. Starch feedstock (35 g L−1) was first subjected to hydrolysis by Caldimonas taiwanensis On1 and the resulting sugar rich (17 g L−1) hydrolysate was fed continuously from a storage tank to the sequential dark and photo-fermentation reactors. Dark fermentation was operated at pH = 5.8–6.0, 37 °C and HRT = 12 h. The photo-bioreactor was fed from another storage tank containing pre-treated dark fermentation effluent (3800 mg L−1 HAc and HBu) and was operated at 35 °C, 100 W m−2 irradiation, pH 7.0, HRT = 48 h. R. palustris WP3-5 was used as inoculum culture in photo-fermentation. The overall yield of dark and photo-fermentations was 16.1 mmol H2 g−1 COD or 3.1 mol H2 mol−1 glucose with COD removal efficiency of 54.3%. In general, sequential dark and photo-fermentations improved H2 yields to more than 5 mol H2 mol−1 glucose. However, H2 gas production by photo-fermentation was slow reducing H2 productivity. Pre-treatment of the DFE prior photo-fermentation has been used in almost all studies. Operation modes providing high cell density and high substrate loadings such as immobilized-cell reactors and fed-batch operations have not been investigated in details."
9,Combined dark and photo-fermentation,"Simultaneous dark and photo-fermentation can be realized in a single reactor where VFAs produced by dark fermentation are converted to H2 and CO2 by photo-fermentation. Theoretically, 12 mol of H2 per mole glucose can be obtained by combined dark and photo-fermentations (Eq. (7)). In order to realize the same conversion thermochemically, 600 °C and 34.5 MPa pressure need to be provided [115]. However, the same conversion can be realized at room temperature and atmospheric pressure [2] by combined fermentation with a slower rate [13]. A typical process scheme for bio-hydrogen production by combined dark and photo-fermentations is described in Fig. 3 . Bacterial hydrolysis of biomass and dark-photo fermentations can be realized in the same reactor (Fig. 3a). Alternatively, hydrolysis and photo-fermentations can be realized by some special photo-fermentative bacteria with starch hydrolysis capability (Fig. 3b). Typical combined fermentation proceeds at initial glucose concentration of less than 5 g L−1, at pH = 7, T = 30 °C with supplementation of Fe (II) and Mo, using a proper biomass ratio of PNS/DF bacteria and a suitable dark/light illumination cycle [109,116]. The major problem in combined fermentation is the fact that PNS bacteria are capable of fermenting carbohydrates along with dark fermentation bacteria producing VFAs. Once PNS bacteria are adapted to carbohydrate fermentation, it takes a long lag time time to switch the metabolism for VFA fermentation [117]. In other words, the growth and product formation by the PNS bacteria behave like ‘diauxic growth and substrate utilization’ utilizing glucose first and VFAs later with some lag time in between [118]. This behavior causes accumulation of VFAs in the medium resulting in inhibition of dark fermentation and PNS bacteria [119]. Simultaneous removal of VFAs from the medium and utilization of low carbohydrate concentrations may partially overcome this problem. Operating conditions in combined fermentation was recommended to be closer to that of the photo-fermentation (pH = 7–7.5, ORP = −150 mV, 30 °C) rather than dark fermentation since PNS bacteria are known to be more sensitive to changes in environmental conditions [117]. For effective VFA fermentation by combined continuous fermentation, HRTs more than 6 days were advised by Argun et al. [117]. Combined fermentation has not been studied as extensively as sequential dark and photo-fermentations. The reported studies on the subject matter are summarized in Table 2 . Hydrogen yields are considerably higher than the single-stage dark or photo-fermentation. However, H2 formation rates are extremely lower than single-stage dark fermentation (<35 mL H2 L−1 h−1). Most combined fermentation studies were carried out by suspended and immobilized cultures in batch operation mode. No information was provided about light conversion efficiencies in any of the reviewed articles. Repeated fed-batch operation enabled use of higher feed substrate concentrations up to 50 g starch L−1 as compared to conventional batch operations usually operated with 5 g substrate L−1. Among the combined fermentation studies, the highest yield (7.1 mol H2 mol−1 glucose) was reported by Asada et al. [123] where a co-culture of Lactobacillus delbrueckii NBRC 13953 and R. sphaeroides-RV were used. The experiments were performed in 200 mL roux bottles with initial glucose concentration of 4.5 g L−1 at pH = 6.8, 30 °C and 0.19 μEinstein m−2 s−1 illumination by halogen lamps. Acetate and lactate were the major VFAs formed. Optimum optical density ratio of Lactobacillus delbrueckii to R. sphaeroides-RV resulting in highest H2 formation was reported to be 1/5. Statistical experiment design methods were used for enhancing H2 production through combined dark and photo-fermentation from sucrose under 4 klux light illumination [121]. Important factors were first screened by Plackett–Burman design followed by a central composite design for determination of optimum levels of the selected parameters. The optimal substrate concentration, initial pH, and inoculum ratio of used C. acidisoli to R. sphaeroides strains were 11.43 g L−1 sucrose, pH = 7.13, and C/R = 0.83. At the optimal operating conditions, the highest H2 yield was reported to be 10.16 mol H2 mol−1 sucrose corresponding to 5.08 mol H2 mol−1 hexose. Hydrogen gas was produced from starch by combined fermentations operated in fed-batch mode [126]. Rhodobacter sp. M-19 and C. butyricum were used as inoculum cultures with an initial biomass ratio of R/C = 10/1. The fermenter containing 1 g L−1 starch was fed with 1 mL of 50 g L−1 starch solution at 24 h intervals for four times. pH, temperature and light intensity were pH = 6.8, T = 30 °C and 5 klux, respectively. The system resulted in a high yield of 6.6 mol H2 mol−1 glucose. Argun et al. [117] investigated continuous combined dark and light fermentation in a hybrid annular bioreactor. Effects of HRT on H2 formation yield and rate were studied. Clostridium beijerinkii DSM 791 and R. sphaeroides-RV were used as microbial strains with a biomass ratio of 1/3.9. Boiled waste ground wheat containing 5 g L−1 wheat starch was used as feed substrate with different loading rates depending on the HRT. The system was operated under 10 klux illumination with halogen and fluorescent lamps. pH and temperature were kept around 7–7.5 and 32 ± 2 °C, respectively. Hydrogen yields, SHPR and VHPR at steady-state were 0.6 mol H2 mol−1 glucose, 9.16 mL H2 g−1 h−1, 5.95 mL H2 L−1 h−1, respectively. VFA accumulation and sub-optimal conditions for dark and light fermentation were identified as major problems resulting in low H2 formation rates and yields."
