,sections,Text
5,Gene inactivation using the ClosTronsystem and pMTL80000 shuttle vectors,"4.2 Gene inactivation using the ClosTronsystem and pMTL80000 shuttle vectors Prior to 2007, clostridial mutants were constructed almost entirely by homologous recombination. Recently, ClosTron, a Group II intron directed mutagenesis system for clostridia, was developed (Heap et al., 2007). The bacterial group II introns are a relatively newly characterized type of mobile element which can be used for the directed construction of stable mutants (Lambowitz and Zirnmerly, 2004). The mobile group II intron from the ltrB gene of Lactococcus lactis (Ll.ltrB) can insert into a specific target site via an RNA-mediated ‘retrohoming’ mechanism, achieved primarily by base-pairing between the excised intron lariat RNA and the target site D. Therefore, introns can be reprogrammed to the appropriate target site by alteration of the DNA sequence of the appropriate part of the intron. Recently, several significant improvements have been made in The ClosTronsystem has been improved recently to allow the construction of strains with multiple mutations through marker recycling using FLP/FRT, or delivery of trans genes to the chromosome (Heap et al., 2010). Automated ClosTron design bioinformatics and information about pMTL80000 modular plasmids are now available online (http://clostron.com). This group II intron delivery system has now been successfully used in Clostridium difficile, C. acetobutylicum, Clostridium sporogenes, Clostridium botulinum, Clostridium beijerinckii and Clostridium perfringens. In addition, a modular system of Clostridium–E. coli shuttle plasmids called pMTL80000 is now available (Heap et al., 2009). With different Gram+replicons, selectable markers, Gram−replicons and specific application elements, a total of 400 different vectors can be constructed into which additional elements can be inserted using four unique rare restriction sites. This very flexible system allows researchers to identify combinations of components potentially suitable for particular clostridial hosts and applications. These newly developed and described tools open the door for the engineering of a variety of pathways to increase biofuels, including hydrogen, production. As yet, no studies to this effect have been reported."
6,Genetic manipulation in thermophillic clostridia,"4.3 Genetic manipulation in thermophillic clostridia Although group II intron technology has been used to inactivate gene targets in clostridia that were previously regarded as genetically intractable, the systems described to date have a temperature restriction that make such approaches incompatible with thermophilic clostridia. Of particular interest as a target for metabolic engineering is Clostridium thermocellum, a promising anaerobic hydrogen producing bacterium capable of rapid cellulose degradation (Levin et al., 2006). Recently, a gene deletion system using a native dual selection marker around pyrF was developed for C. thermocellum (Tripathi et al., 2010). The ΔpyrF strain, a uracil auxotroph, can be restored to prototrophy via the ectopic expression of pyrF from a plasmid, providing a positive genetic selection. A toxic uracil analog, 5-fluoroorotic acid (5-FOA) can be used to select against plasmid expressed pyrF, creating a selection pressure for plasmid loss. Development of the pyrF-based genetic selections along with the elaboration of a reliable simplified electroporation-based transformation protocol, removes a significant barrier to routine transformation and genetic manipulation of C. thermocellum. Proof of principle for the application of these newly described genetic tools in the context of metabolic engineering was shown by deleting pta, thus creating a C. thermocellum strain that does not produce acetate (Tripathi et al., 2010). Since the genome sequence of C. thermocellum ATCC24705 is available, the field is now ripe for the application of metabolic engineering to the further development of C. thermocellum and related organisms as biocatalysts for the conversion of lignocellulosic biomass to biohydrogen."
7,New perspectives in metabolic engineering for clostridia,"4.4 New perspectives in metabolic engineering for clostridia Flow cytometry (FC) technologies, including fluorescence assisted cell-sorting (FSC), have the potential to greatly accelerate the development and analysis of the complex microbial phenotypes that might be produced through application of the modern powerful techniques of metabolic engineering, synthetic biology, and evolutionary engineering (Tracy et al., 2010). FC-FISH (Fluorescent In Situ Hybridization) can be used as a rapid screening tool to identify organisms with particular 16S-rRNA or desired mRNA characteristics, for example, the dominate hydrogen producing cells of a mixed culture. Indeed, in one study, FLOW-FISH with oligomer probes designed to target clostridial hydrogenase genes was used as a screening tool to find hydrogen-producing clostridial species (Jen et al., 2007). Multiparametric flow cytometry is a powerful technique capable of the detection of a variety of metabolic activities and thus has the potential to provide great insight into the physiology of individual cells as well as populations of bacterial cells. Previously, it has been used for the study of the endospore-forming bacterium C. acetobutylicum where the morphologies and metabolic states of wild-type C. acetobutylicum ATCC 824, strain 824 (pSOS95del) and the asporogenous strain M5 were analysed (Tracy et al., 2008). The results generated strong evidence that challenges the long-accepted view in the field that the clostridial cell form is the solvent-forming phenotype. As the percentage of rod-shaped cells decreased and the clostridial-forms increased, butanol production and organic acid uptake rates decreased, suggesting that sporulation detracts from solvent production and that clostridial-form cells are not the major butanol-producing phenotype. Thus, in the future, multiparametric FC (MPF) could also be used to assess viability and improve the discrimination of physiological states in order to correlate phenotypes with metabolic flux analysis leading to hypotheses about which cell morphology is mainly responsible for hydrogen production."
8,Metabolic engineering of hydrogen production by facultative anaerobes,"In the past, many studies have attempted to optimize hydrogen production through metabolic engineering of E. coli. Some powerful new tools have now become available for metabolic engineering studies with E. coli. As discussed previously, simple and highly efficient disruption of chromosomal genes have allowed the creation of “Keio” and “ASKA” collections, valuable new resources for metabolic engineering allowing; the systematic analysis of unknown gene function, gene regulatory networks, and genome-wide testing of mutational effects in a common background. Different metabolic engineering strategies for increasing biohydrogen production under dark fermentative conditions have been described (Fig. 3 and Table 3 ). Some of these involve the disruption of lactate and/or succinate production. These studies show that hydrogen production is increased by directing carbon flow into making formate. Thus an FHL over-expressing E. coli strain (deleted for the FHL repressor gene (hycA) and containing a plasmid that overexpresses (fhlA) shows increased hydrogen yields in the E. coliSR15 strains lacking lactate and succinate production (Yoshida et al., 2006, 2007). Likewise, Penfold et al. (2003) developed a hycA null E. coli strain HD701 which has 14-fold increase in hydrogen production over wild type, especially when it had been grown in low glucose concentrations. Similarly, a strain, DJT135, in which ldhA has been inactivated and that activates the formate regulon since it expresses a N-terminally truncated FhlA, has been shown to be capable of producing nearly 2moles hydrogen/mole glucose (Bisaillon et al., 2006; Turcot et al., 2008). Thus, the over-expression of the FHL complex leads to greater hydrogen production and this can be achieved by either eliminating the repressor HycA or truncating the N-terminus of FhlA making it formate-independant and causing it to activate the hyc operon (Self et al., 2001). Maeda et al. (2007b) performed successive rounds of P1 transduction from the Keio E. coli K-12 library to introduce multiple, stable mutations into a single bacterium to direct metabolic flux towards hydrogen production. The regulation of FHL was altered by inactivating the repressor hycA and by overexpressing the activator encoded by fhlA, eliminating hydrogen uptake activity eliminated by deleting hyaB (hydrogenase 1) and hybC (hydrogenase 2), redirecting glucose metabolism to formate using mutations in fdnG, fdoG, narG, focA, focB, poxB, and aceE, and production of succinate and lactate eliminated by deleting frdC and ldhA. The best of the metabolically engineered strains, BW25113 hyaB hybC hycA fdoG frdC ldhA aceE, showed a 4.6-fold increased hydrogen production from glucose with a 2-fold increased hydrogen yield (0.65–1.3moles H2/mole glucose). Likewise, a similar strain construction gave a mutant with 141-fold increased hydrogen production from formate, achieving the theoretical yield for hydrogen from formate (Maeda et al., 2008b). In addition, the hydrogen yield from glucose was increased by 50%, and there was threefold higher hydrogen production from glucose with this mutant. Up until now, most of the modifications have been at the single gene level, or at most operons, and little is known about how changes in global regulatory circuits could affect hydrogen production. For example, the modification of global transcriptional regulators to modulate the expression of multiple operons required for the biosynthesis of formate hydrogen lyase could represent one approach to improving hydrogen production. One study has shown that disruption of focA (formate transport) and narL or fnr (anaerobic metabolism regulators) gives modest increases in hydrogen production rates and yields (Fan et al., 2009). Finally, although one of the advantages of E. coli is its ability to produce hydrogen from a wide range of substrates (Ghosh and Hallenbeck, 2009), including sugars typically derived from deconstruction of lignocellulose, increasing its substrate range further would make accessible a number of potentially abundant substrates. For example, introduction of plasmid born invertase allows E. coli to produce hydrogen from sucrose, available in crude form as a waste product of the sugar refining industry (Penfold and Macaskie, 2004)."
9,Perspectives,"Ultimately, surpassing the metabolic barriers of 2moles H2/mole glucose (facultative anaerobes) or 4moles H2/mole glucose (strict anaerobes) will be required since incomplete substrate conversion is not competitive with the production of other biofuels from the same substrates and leaves behind substantial amounts of by products that would represent an enormous waste disposal problem. Some solutions to this problem could be provided by the development of two-stage systems, as discussed elsewhere (Hallenbeck and Ghosh, 2009). In the context of metabolic engineering, extensive remodeling of existing pathways would be required to achieve anywhere near the theoretical stoichiometry of 12moles H2/mole glucose. As previously suggested, one possibility would be to gain additional energy and reducing power through limited respiration (Hallenbeck and Benemann, 2002; Hallenbeck, 2005; Hallenbeck and Ghosh, 2010). A functioning TCA cycle allows for the complete dissimilation of glucose: C 6 H 12 O 6 + 10 NAD + + 2 FAD + 4 ADP + 6 H 2 O → 10 NADH + 10 H + + 2 FADH 2 + 6 CO 2 + 4 ATP While it might be suggested that 10moles of hydrogen could be derived directly from the NADH so produced: 10 NADH + 10 H + → 10 NAD + + 10 H 2 this is in fact thermodynamically unfavorable and additional energy must be added to the system to drive reverse electron transport to hydrogenase. This could of course be obtained by reoxidation of the FADH2 by the respiratory chain, generating either additional ATP or an electrochemical gradient: 2 FADH 2 + O 2 + 4 ADP → 2 FAD + 2 H 2 O + 4 ATP . The net effect would be to generate 10moles of H2 per mole of glucose: C 6 H 12 O 6 + 8 ADP + O 2 + 4 H 2 O → 10 H 2 + 6 CO 2 + 8 ATP Of course, a number of modifications would be required to achieve this, among them the introduction of mutations in NADH dehydrogenase and the ability of hydrogenase to function under microaerobic conditions. Achieving this, or introducing other high-yielding pathways, is the critical challenge for the metabolic engineering of hydrogen production by dark fermentation."
10,Conclusions,"Dark fermentation holds promise as a technology to convert a variety of lignocellulosic residues or various waste streams to hydrogen. However, although diverse organisms with different metabolic pathways are naturally capable of hydrogen fermentations, none can do so at acceptable yields. Thus there is a need for metabolic engineering to overcome this barrier and past attempts at metabolic engineering at the level of single genes have provided proof of principal for this approach. Recent advances in the metabolic engineering tool box suggest that more extensive future modifications could result in novel organism capable of producing hydrogen at high yields."
