,sections,Text
12,Cycle test in double fixed-bed,"3.4 Cycle test in double fixed-bed 3.4.1 Gas analysis The 0.1LN/MCM was used to studied behavior of cycles based on optimum conditions for producing hydrogen rich syngas at 800 °C and S/C (0.8). Fig. 8 (a) shows gas composition in every cycle display same trend which hydrogen gas is the main component, and LHV vary from 3740.0 kJ/Nm3 to 3899.9 kJ/Nm3. In cycle process, the gas yield of hydrogen and carbon dioxide show decrease from 61.9 Nm3/kg to 48.6 Nm3/kg and from 15.6 Nm3/kg to 11.2 Nm3/kg, respectively. Whereas, the gas yield of carbon monoxide displays an increase from 25.1 Nm3/kg to 33.6 Nm3/kg. The results illustrate that the carbon deposited could be decreased activity of Ni. The Ni shows higher catalysis activity of C–H bond, which is prone to produce hydrogen gas [49]. However, the surface of 0.1LN/MCM catalyst after five-time cycles shows amorphous carbon which is easily removed, keeping catalyst activity (In Section 3.5). The blank experiment without 0.1LN/MCM catalyst on the same conditions was demonstrated whether 0.1LN/MCM catalyst lost activity after five-time cycles. Compared with 0.1LN/MCM catalyst steam reforming of in-situ tar, the gas yield without 0.1LN/MCM catalyst significantly decrease. The gas yield in every cycle displays higher than it on the blank experiment. Hence, the 0.1LN/MCM catalyst shows good stability after five-time cycles. 3.4.2 Liquid analysis The identification of the major components on steam reforming of in-situ tar after cycling with and without 0.1LN/MCM catalyst were displayed by GC-MS at 800 °C and S/C (0.8), and the results are present in Table 3 . As shown in Table 3, the major production of steam reforming of in-situ tar is phenol and phenol, 3-methyl on with and without 0.1LN/MCM catalyst. The composition of in-situ tar mainly include phenols compound, which is attributed that lignin is the major composition on rice husk [50]. Lignin pyrolysis produces mainly, CO, C1–C3 hydrocarbons, phenols, etc, and phenol as tar model compound to catalyze steam reforming for hydrogen production were many reported [51–53]. From liquid production result, the content of phenol show obviously decrease by 3.13% after 1st reaction, which is explained that 0.1LN/MCM catalyst is effective to convert phenols compound. Phenol is adsorbed due to the interaction of aromatic –OH group and π-electron system on the perovskite oxide, and the steam dissociate to hydroxyl group over the perovskite oxide surface for the adsorption phenol by Baamran et al. reported [54]. Phenol adsorbed over the perovskite oxide surface occur interaction due to several successive steps, resulting in break phenol ring and format small molecule, such as H2, CO, CO2, etc [55]. The 0.1LN/MCM catalyst after five-time cycles at the same conditions also shows higher catalyst activity for conversion phenols compound than without catalyst. Though, the activity of 0.1LN/MCM displays slightly decrease with the increasing cycle number, which could be attributed to carbon deposition and it can cover activity site, decreasing catalystic activity. 0.1LN/MCM catalyst keeps catalyst activity after five-time cycles, compared with no catalyst. These results were corresponded to gas distribution on steam reforming of in-situ tar (in Section 3.4.1)."
13,Carbon deposition analysis,"3.5 Carbon deposition analysis The weight loss curves of spent 0.1LN/MCM catalyst after first-time and five-time cycles on optimum conditions were shown in Fig. 9 (a)-(b), respectively. In this process, the curve was shown two stages. a) The curve increased slightly before 450 °C. b) The curve decreased rapidly after 450 °C, which is attributed to decompose carbon deposition. The metal Ni separated from 0.1LN/MCM catalyst could be oxidized under air condition in stage (a). Li et al. [56] shows the same results. From the DTG profiles, 0.1LN/MCM catalyst after first-time and five-time cycles appears one weight loss peak, which is attributed to decompose carbon deposition. These temperatures of weight loss peaks are 539.8 °C and 541.5 °C, respectively. Koike et al. [57] suggested that the amorphous carbon can be decomposed at a lower temperature while graphitic carbon is contrary. These peaks should be attributed to amorphous carbon species on the spent 0.1LN/MCM catalyst surface. In order to further explain type of carbon, Fig. 9(c) shows the Raman spectral after cycling samples. One peak at 1342 cm−1 (D-peak) is ascribed to the amorphous carbon and one peak at 1580 cm−1 (G-peak) is ascribed to the graphitic carbon [58]. The intensity of IG/ID can be evaluated the structure of surface carbon due to order of graphitic carbon structure, and the IG/ID value represents the degree of order. From these results, the IG/ID is slightly enhanced from 0.77 to 0.79, indicating the surface carbon deposition could trend to produce graphitic carbon after five-time cycles. Hence, the temperature of loss weight is increased due to graphitic carbon with better thermo-oxidative stability [59]. However, the value of IG/ID is less than 1 after first-time and five-time cycles, suggesting most amorphous carbon is produced. Amorphous carbon species are prone to easily gasify in oxide agent, such as steam, resulting in the retention of catalytic activity the 0.1LN/MCM catalyst [60]. Whereas, Kelarakis et al. [61] suggested the amorphous carbon could be converted to graphitic carbon because it was gasified in time. It was illustrated that the MCM-41supported LaNiO3 could suppress the production of graphitic carbon, compared with previous work [13]."
14,SEM analysis,"3.6 SEM analysis Surface electrical microscope was used to evaluate morphology of LN and 0.1LN/MCM catalyst as shown in Fig. 10 a-b. There are only few pores on the surface of LN catalyst while pore of 0.1LN/MCM catalyst shows a significant enhancement. Hence, 0.1LN/MCM catalyst reveals a higher specific surface area and pore volume, which result was illustrated in Section 3.1. Fig. 10(b) shows partial agglomerates spots on outside pore. It could be attributed to migration of the LN species out of the supports during the calcination procedure [62]. The fresh 0.1LN/MCM catalyst was analyzed by EDX mapping to evaluate surface (O, Si, La and Ni) and atom ratio as shown Fig. 10 c-d. From this result, the approximate La/Ni atom ratio was 1:1 and elements uniformly distribute. Fig. 10 e-f shows surface morphology of spent 0.1LN/MCM catalyst after first-time and five-time cycles. The pore structure was not destroyed after first-time cycle. The results showed that the structure was stable and kept higher catalyst activity. Also, Fig. 10(f) shows spent 0.1LN/MCM catalyst after five-time cycles. Its surface pore was blocked due to carbon deposition which is mainly amorphous carbon after first-time and five-time cycles as shown in Section 3.5. The amorphous carbon can be removed, such as Eq. (8), which is beneficial to prevent the deactivation of the catalyst to some extent [63]. Hence, the catalyst activity of in-situ tar reforming was kept after five-time cycles. (8) C + 2 H 2 O = C O 2 + 2 H 2"
15,XPS analysis,"3.7 XPS analysis The XPS analysis of fresh LN and 0.1LN/MCM catalysts was conducted to characterize chemical status of O. As shown in Fig. 11 , there were three peaks observed in the O 1s. 528.6 eV and 529.6 eV are attributed to lattice oxygen (O2−, Oβ). 530.0 eV–533.0 eV which is assigned to the different adsorbed oxygen species [64]. Compared with the LN catalyst, the 0.1LN/MCM catalyst shows other peaks centered at around binding energy 533.10 eV–533.23 eV, which is corresponding to oxygen of Si–O–Si [65]. The peak centered on lattice oxygen slight shift towards the high binding energy, which could be due to the connection with Si. Yang et al. [66] suggested the MoO3/MCM-41 shows the same results. The peak shift is found to form Mo–O–Si bond. Similarly, the M-O-Si (M = La and Ni) could be formed. Compared with the fresh 0.1LN/MCM catalyst, the 0.1LN/MCM catalyst after first-time and five-time cycles shows three peaks. However, the peak area ratio of lattice oxygen with fresh 0.1LN/MCM and 0.1LN/MCM after five-time cycles catalyst is decreased from 36.9% to 1.9% as shown in Table S1. This results illustrated the lattice oxygen participates in steam reforming of in-situ tar. Huang et al. [67] suggested that lattice oxygen can release oxygen [O] to oxidize carbon as Eq. (9). Hence, the surface carbon deposition could be removed to keep catalyst’s activity after five-time cycles. (9) C + 2 [ O ] → C O 2"
16,Conclusions,"The double fixed-bed system was developed and employed in steam reforming of in-situ tar for hydrogen rich syngas production. In the first-stage fixed-bed, the rice husk pyrolysis format in-situ tar at 450 °C. Simultaneously, the conditions of steam reforming reaction were studied in second-stage fixed-bed, such as different loading mole amount of XLaNiO3/MCM-41 catalysts (X = 0.025, 0.05, 0.075 and 0.1), reforming temperature (500 °C–900 °C) and S/C (0.6–1). These results revealed the 0.1LaNiO3/MCM-41 catalyst displayed a good performance of gas yield of hydrogen (61.9 Nm3/kg), LHV (3740.0KJ/Nm3) and H2/CO (2.4) at 800 °C and S/C (0.8). The results were attributed that the 0.1LaNiO3/MCM-41 shows good dispersion and stable structure. Under this condition and after five-time cycles, 0.1LaNiO3/MCM-41 showed a stable hydrogen composition of around 50%, and 0.1LaNiO3/MCM-41 effectively catalyzed the phenol compound in in-situ tar. Furthermore, 0.1LaNiO3/MCM-41 catalyst remained catalytic activity after five-time cycles. It was attributed that the carbon deposition was mostly amorphous, and lattice oxygen released for removing deposited carbon was a possible reason for 0.1LaNiO3/MCM-41 catalyst’s stable catalytic performance."
