,sections,Text
8,Electrodeposition and photodeposition,"3.2 Electrodeposition and photodeposition The deposition process in the SILAR method was divided into several reaction cycles to slow the deposition rate and control CdS loading. However, rapid deposition when using aqueous precursor solutions resulted in the clogging of CdS quantum dots at the mouth of the TiO2 nanotubes, which was unfavorable for the diffusion of precursors into the TiO2 nanotubes and the formation of CdS quantum dots inside the TiO2 nanotubes. Additionally, the process was time-consuming because it required repeated immersion and washing steps. Electrodeposition and photodeposition were also reported for the synthesis of the TiO2/CdS nanocomposite film. The formation of CdS quantum dots in electrodeposition and photodeposition occurred via an electrochemical and photochemical process, respectively. Therefore, varying the applied potential value or the light irradiation intensity can control the deposition rate of CdS. Banerjee et al. [108] prepared CdS quantum dot-sensitized TiO2 nanotubes using the electrodeposition method with CdCl2 and Na2S2O3 as precursors. A solution temperature of 70°C and an applied potential of -0.65 V versus a saturated calomel electrode (SCE) were found to be the best conditions for a rapid and controlled deposition. Yu et al. [109] reported an in situ constant current electrodeposition method for the synthesis of CdS quantum dot-sensitized hierarchical TiO2. Electrodeposition was completed at 90°C with a current density of 0.5mAcm− 2. Cd(NO3)2 and thiourea were used as precursors of CdS and 1/1 (v/v) dimethyl sulfoxide (DMSO)/water was used as a solvent. The authors believed that the in situ electrodeposition ensured a high surface coverage of TiO2 and direct attachment between the CdS quantum dots and the TiO2 matrix. Shao et al. [110] reported similar electrodeposition. CdS quantum dot-sensitized TiO2 nanotube arrays were prepared via one-step electrodeposition in the presence of TiO2 and CdS precursors. Electrodeposition prevented the assembling or clogging of CdS nanoparticles at the mouth of the TiO2 nanotubes and improved the contact area between CdS and TiO2. Furthermore, the size and distribution density of the CdS nanoparticles can be tuned easily by controlling the electrolyte concentration. Liu et al. [111] introduced sonication into the electrodeposition process and developed a sonoelectrochemical deposition method. The sonication-assisted synthesis improved the combination between the CdS and TiO2 nanotubes as well as the dispersion and stability of the CdS nanoparticles. Jin-nouchi et al. [114] reported a photodeposition technique for the preparation of the TiO2/CdS nanocomposite film. The in situ photodeposition process was completed in an ethanol solution of S8 and Cd(ClO4)2 under UV irradiation. Additionally, the SILAR and self-assembled monolayer methods were studied for comparison. The results of Jin-nouchi et al. [114] indicated that the CdS quantum dots were distributed in the mesopores of the TiO2 film without pore-blocking in the photodeposition sample and with partial pore-blocking in the SILAR sample, whereas only the upper portion of the film is covered with the CdS quantum dots in the self-assembled monolayer sample. Other advantages of photodeposition included the ability to control the particle size and loading of CdS quantum dots by irradiation time and the efficient charge transfer between CdS and TiO2 due to the photocatalytic formation of the heteronanojunction."
9,Other synthesis methods,"3.3 Other synthesis methods CBD, electrodeposition and photodeposition are within the scope of solution methods. The interfacial charge transfer from the CdS quantum dots to TiO2 in the TiO2/CdS nanocomposite film prepared using these solution-based deposition methods may be affected negatively by the chemical species at the interface between CdS and TiO2. Chemical vapor deposition (CVD) provides an interfacial method for the direct growth of a CdS sensitizer on a TiO2 substrate. Compact physical contact and increased loading of CdS quantum dots typically were reported in the CVD method. For example, CdS and CdSe nanorods were deposited onto TiO2 nanorod arrays by CVD based on a vapor-solid process with CdS and CdSe powders as precursors in Luo et al. [116]. Lee et al. [117] reported the growth of CdS nanorod-coated-TiO2 nanowires on conductive glass using the CVD method. Other methods, such as spray pyrolysis deposition, have also been used for the preparation of a TiO2/CdS nanocomposite film. A mixture solution containing CdCl2 and thiourea in Hwang et al. [119] was sprayed onto a mesoporous TiO2 film heated on a hot plate, and deep yellow CdS quantum dots were formed with the increase in spraying time."
10,Microstructure and application,"3.4 Microstructure and application A TiO2 film with one-dimensional or mesoporous structures has advantages in terms of surface area and interfacial charge transfer as mentioned above. Therefore, TiO2 nanotubes, TiO2 nanorods, mesoporous TiO2 and TiO2 inverse opals typically were selected supports for CdS quantum dots in the TiO2/CdS nanocomposite film. TiO2 nanotube arrays were prepared using electrochemical anodization of a Ti substrate. The length, orientation and diameter of the nanotubes can be tuned by controlling electrochemical reaction conditions. TiO2 inverse opals with a three-dimensional periodical pore structure offered a high specific surface area and porosity for CdS loading and facilitated electron transport and light trapping due to multiscattering. Fig. 2 shows scanning electron microscopy (SEM) images of the TiO2/CdS nanocomposite film in the literature. Well-ordered nanorod arrays, nanotube arrays and inverse structures were observed in Fig. 2. The CdS nanoparticles were deposited on the inner and outer surfaces of the TiO2 nanotubes and TiO2 opal and on the top of the TiO2 nanorods and nanotubes. The TiO2/CdS nanocomposite film was used primarily as an electrode in a photoelectrochemical cell for photoelectrical water splitting and in quantum-dot-sensitized solar cells. The photocatalytic activity and photoelectric properties of the TiO2/CdS nanocomposite film reported in the literature were compared, as presented in Tables 2 and 3. Photocatalytic water splitting in the photoelectrochemical cell provides an ideal method for hydrogen fuel production. Sensitized solar cells are considered alternatives to silicon-based solar cells and other semiconductor photovoltaic devices Quantum-dot-sensitized solar cells in contrast to dye-sensitized solar cells have the advantages of a tunable band gap, high extinction coefficients and improved stability. Though the power conversion efficiency of quantum dot-sensitized solar cells has grown rapidly to over 4% in the past few years, the efficiency remains much lower than that of dye-sensitized solar cells (11–12%) and requires further optimization [109,123–125]. The photoelectric performance of the TiO2/CdS nanocomposite film was typically evaluated using incident photon to current conversion efficiency (IPCE) and power conversion efficiency (PCE). Researchers indicated that IPCE, PCE and the photocatalytic activity of the TiO2 photoelectrode increased significantly after modification with CdS quantum dots. The microstructure and synthesis method significantly influenced the photoelectric properties of the TiO2/CdS nanocomposite film."
11,TiO2/CdS-based multiple nanocomposite,"The composite of different semiconductors may facilitate the charge separation and transfer because of the formation of a potential gradient at the interface between different nanostructures. Other components were added and a variety of TiO2/CdS-based multiple nanocomposites were developed to further improve the photocatalytic properties of the TiO2/CdS nanocomposite [126–144]. Kim et al. [126] reported a ternary hybrid of CdS/TiO2/WO3. The TiO2/WO3 binary hybrid was first synthesized using a sol–gel method, and then CdS quantum dots were deposited onto the TiO2/WO3 binary hybrid using the CBD method with Na2S and Cd(Ac)2 as precursors. The photoreduction of polyoxometalate and photocurrent tests indicated that the photocatalytic and photoelectrochemical activities of the CdS/TiO2/WO3 ternary hybrid were much higher than those of the bare CdS and any binary hybrids. The enhancement in activity was ascribed to the cascadal electron transfer from CdS to TiO2 to WO3 through the interfacial potential gradient. The authors believed that such a cascadal electron transfer in the hybrid structure facilitated charge separation and retarded charge recombination. TiO2/CdS in Zhao et al. [127] was loaded on activated carbon fibers using a dip-coating method. The ternary hybrid showed enhanced activity for the photocatalytic degradation of methylene blue. Meng et al. [128] reported the synthesis of a fullerene modified TiO2/CdS nanocomposite. The delocalized conjugated electronic structure and electron-accepting ability of fullerene were believed favorable to the interfacial charge separation. The enhanced photocatalytic activity was attributed to the increase in specific surface area and photo-absorption as well as the cooperative effect of CdS and fullerene. Wu et al. [129] designed and fabricated a triple heterojunction of CdS/TiO2/BDD. The TiO2 nanotubes were grown on p-type boron-doped diamond (BDD), and then the CdS nanoparticles were assembled onto the surface of TiO2 and BDD using S-CBD. The triple heterojunction showed a 36.5% improvement in the initial photocurrent and a 78% reduction in the photocorrosion rate in contrast to the TiO2/CdS single heterojunction. The authors believed that TiO2 acted as acceptor for photogenerated electrons, while BDD acted as a sink for photogenerated holes. The charge transfer in the triple heterojunction promoted charge separation and led to an enhanced photocurrent and remarkably inhibited photocorrosion. Lv et al. [130] reported the synthesis of CdS–TiO2-chemically reduced graphene oxide (RGO) composites. RGO in this TiO2/CdS-based multiple system acted as an electron acceptor and transport material. The introduction of RGO improved the photocatalytic activity of TiO2/CdS due to the increase in specific surface area, the adsorption of the substrate and the reduction of charge recombination. White et al. [131] prepared a multiple nanocomposite of Pt/TiO2/CdS/zeolite Y. The zeolite-based assembly promoted a statistical colocalization of the three nanoparticles. The new components in the TiO2/CdS-based multiple nanocomposites introduced above can be divided into an inert component and an active component. Activated carbon fiber and zeolite Y were inert components, and they were used as adsorbents or supports and were not involved directly in the charge separation and transfer process. Meanwhile, WO3, fullerene, BDD and RGO were active components. WO3 and BDD are inorganic semiconductors. WO3 in the TiO2/CdS-based nanocomposite acted as an electron acceptor, while BDD acted as a sink for photo-generated holes. The positions of the semiconductor valence and conduction bands should match so that a potential gradient could form at the interface to promote the separation and transfer of photo-generated electrons and holes. Fullerene and graphene belong to the carbon family. They act as electron acceptors and transport materials because of the well-known delocalized conjugated structure."
12,Interfacial charge transfer,"The interfacial charge transfer between CdS and TiO2 is shown in Fig. 3. The processes include (1) electron injection from the excited CdS quantum dots to TiO2, (2) electron transport and collection, (3) electron trapping, (4) recombination of electrons and holes, (5) electron reactions with species in the electrolyte, and (6) hole reactions with species in the electrolyte [109,145]. The mechanism and kinetics of the excited-state interfacial charge transfer and energy conversion efficiency are influenced greatly by CdS quantum dot size, surface functionalization and the interface between donor and acceptor nanostructures. Related research achievements in recent years are introduced below [146–151]. Blackburn et al. [146] studied the electron transfer dynamics in the TiO2/CdS nanocomposite prepared using the S-CBD method. The transient absorption dynamics were found to be multiexponential. A comparison of the transient absorption dynamics for TiO2/CdS and ZrO2/CdS in the visible and mid-IR regions indicated that electron transfer occurred on a time scale of approximately 10–50ps. Another work showed that a time-resolved microwave conductivity technique was used to investigate charge injection from CdS into TiO2 in the TiO2/CdS nanocomposite [147]. The authors confirmed that efficient electron injection from CdS quantum dots to TiO2 produced long-lived charge carriers. The quantum yield for electron injection into TiO2 per photon absorbed by the CdS sensitizer was near unity. Tachibana et al. [148] studied the controlling parameters in charge recombination kinetics at the interface of TiO2/CdS using sub-microsecond to millisecond transient absorption. The transient absorption spectra suggested an efficient electron injection from CdS to TiO2. Charge recombination kinetics for TiO2/CdS appear multiexponential, similar to the transient absorption dynamics observed for dye-sensitized TiO2. A detailed analysis of the charge recombination dynamics using nonadiabatic electron transfer theory revealed that the recombination half time correlated with the crystallinity size of CdS. Excited-state electron transfer from CdS quantum dots to TiO2 via molecular linkers was studied in addition to direct electron transfer. Chain length and molecular linker properties influenced excited-state deactivation and interfacial electron transfer. Dibbell et al. [149] prepared the TiO2/CdS nanocomposite using mercaptoalkanoic acid as bifunctional molecular linkers. Varying the chain length of the mercaptoalkanoic acid controlled the interparticle separation between CdS and TiO2. Electron injection and interfacial charge recombination were investigated using steady-state emission quenching, nanosecond time-resolved emission, and nanosecond transient absorption. The electron injection yield decreased with increasing chain length and interparticle separation. Electron injection occurred on multiple time scales. A fast component (<10− 8 s) accounted for the majority of injections, while the remainder occurred on the microsecond time scale. Interfacial charge recombination occurred on the microsecond time scale, and the kinetics were independent of chain length. Bifunctional phenylene-containing linkers were used by Dibbell et al. [150] to improve the electronic coupling of CdS and TiO2. Electron injection through 4-mercaotobenzoic acid occurred on multiple time scales, with faster component (<10− 8 s) and slower components (10− 7–10−6 s). The fast component was approximately as efficient as that through short-chain mercaptoalkanoic acid."
13,Conclusion,"TiO2/CdS nanocomposites are members of a class of materials with potential applications in the photocatalysis and photovoltaic industry. Improvements to TiO2/CdS nanocomposite photocatalytic and photoelectric performance are a challenge. The photocatalytic performance of nanostructured materials is closely related to microstructure and surface properties. Therefore, synthesis method development and microstructure optimization are expected to further improve the photoelectric properties and power conversion efficiency of the TiO2/CdS nanocomposite. Additionally, further extensive studies on the charge transfer processes would provide useful guidance for the design and preparation of TiO2/CdS nanocomposites."
