,sections,Text
0,Introduction,"In the last decades, lignocellulosic wastes have been pointed as a key for the development of a sustainable economy, since biomass is the only renewable raw material oil-like potential for organic molecules production [1]. Lignocellulosic biomass can produce many renewable platform molecules. Among them, γ-valerolactone (GVL) obtained by hydrogenation of levulinic acid (LA) is a stable and low toxic molecule that has great applicability, which can be used in the production of liquid fuels, as an intermediate in the synthesis of fine chemicals and directly as solvent, food ingredient, flavoring agent, oxygenated gasoline additive [2,3]. The hydrogenation of levulinic acid to γ-valerolactone has been performed in gaseous or liquid phase in the presence of homogeneous or heterogeneous catalysts at 100 - 270 °C, using high H2 pressures (30 - 150 bar) [1,4]. Few studies in the literature have been dedicated to the continuous hydrogenation of LA [5–8] and most of them perform the reaction in the gas phase [9–11] or use noble metals-based catalysts [12,13]. The main advantage of gas phase reaction is the continuous production of GVL, but the high energy consumption required to vaporize the levulinic acid makes this approach not very attractive. In this sense, it is more interesting to carried out the reaction in liquid phase [3]. In general, the conversion of levulinic acid in liquid phase can be performed using three different sources of hydrogen: molecular hydrogen provided by an external source; hydrogen formed in situ by the decomposition of formic acid or by Meerwein - Ponndorf - Varley reaction (MPV) using alcohols. The use of formic acid would be a highly attractive alternative since this compound is produced in equimolar amounts to LA during the acid hydrolysis of cellulose. However, in this case, higher reaction temperatures should be used for both decomposition of formic acid (H2 + CO2) and subsequent conversion of LA [14]. For MPV reaction, mild reaction conditions (boiling point of alcohol and under an ambient pressure) are required to LA conversion, however by-products of the transesterification process decrease the selectivity to GVL. Then, the hydrogenation of LA to GVL has been extensively studied using molecular hydrogen and heterogeneous catalysts, with the main advantage the easy separation of liquid products [15]. Although precious metals exhibit better performance for the hydrogenation of LA, the commercial use of these materials is not advantageous and, therefore, they must be replaced. Nickel is a low-cost metal used industrially for hydrogenation, methanation and steam reforming reactions [16]. Due to its hydrogenation capacity, several nickel-based catalysts have already been tested in the reduction of levulinic acid [8,17–23]. In general, these catalysts are actives to hydrogenate the LA but suffer deactivation mainly due to leaching or sintering. The occurance of leaching required metal recovery from the solution and can generate toxic waste depending on its solubility, valence state and particle size [24]. Therefore, the appropriate catalyst for LA hydrogenation has to be inexpensive as well as stable under the liquid medium. Hengst et al. [8] tested several Ni/Al2O3 catalysts prepared by different methods in the aqueous hydrogenation of LA at 200 °C and 50 bar. The best performance was observed for 5 % Ni/Al2O3 catalyst prepared by wet impregnation method, which resulted in smaller nickel particle size. However, catalyst deactivated after 4 h of reaction due to the sintering of Ni particles as a result of weaker metal-support interactions by the transformation of γ–Al2O3. The promotion in the stability of Ni/Al2O3 catalysts was achieved by switching from water solvent to dioxane (180 °C and 30 bar) [21]. Although dioxane improves the stability of nickel catalysts, the use of this solvent is not recommended since it is carcinogenic [25]. Nickel-based N-doped multi-chambered mesoporous carbon microspheres (Ni@NCMs) were prepared by Liu et al. [17] as a strategy to control the nickel particle size during the LA hydrogenation reaction (200 °C, 30 bar, dioxane). This catalyst exhibited excellent activity and improved stability compared to Ni/Cactivated catalyst. The catalyst was stable after six runs (4 h). Meanwhile, Mai et al. [7] observed an improvement in the performance of molybdenum carbides (Mo2C) when supported on carbon nanotubes (CNT) compared to activated carbon (AC). The authors reported that the support plays a key role in the activity and stability of the molybdenum carbide, particularly, when the nanoparticles are positioned within the carbon nanotubes. The high performance of the Mo2C/CNT catalyst was comparable to the Ru/C catalyst for the hydrogenation of LA to GVL at same reaction condition. In this way, the use of carbon nanotubes (CNTs) as support can also favor the stability of Ni-based catalysts due to its known confinement effect [26,27]. Carbon nanotubes are formed by graphene sheets rolled into a cylindrical shape. This geometry promotes a difference in electronic potential caused by a displacement of the π electron density from the internal to the external cavity, which results in different chemical properties and reactivities by the molecules and nanomaterials located inside the nanotubes [28–30]. It seems that the space restriction of the metal particles in carbon nanotubes contributes to avoid sintering and favors the metallic dispersion in catalysts [31]. In addition, it was observed in some works [26,32,33] that when the metal particles are confined within the nanotubes they are more easily reduced in comparison to the particles located in the carbon nanotubes outer surface. Furthermore, CNTs exhibit high mechanical resistance and thermal stability [34]. The use of carbon nanotubes as support for nickel catalysts has been studied for many reactions: methane dry reforming [26], hydrogenation of benzene [27], fenol [35], furfural [36], hydrodeoxygenation of guaiacol [37], CO methanation [38], methane decomposition [39], biomass pyrolysis [40], reduction of aromatic nitro compounds [41]. Despite the advantages of Ni confinement in the CNT, no study has yet been carried out on the levulinic acid hydrogenation reaction. Thus, the aim of the present work is to investigate the performance of Ni supported on CNT for hydrogenation of LA. The effect of different nickel precursors salts (nickel nitrate, acetate and hydroxide) on the Ni particle size and on the positioning of nickel particles on the carbon nanotubes was evaluated. Two different synthesis methods were used to drive the location of the metal particles toward the inside or outside of the CNT."
1,Experimental,
2,Catalyst preparation,"2.1 Catalyst preparation Commercial carbon nanotubes were used as support to prepare Ni catalysts. The carbon nanotubes (purity > 95 %, external diameter of 9.5 nm and internal diameter of 5 nm, pore volume =2.81 cm³ g-1) were provided by Nanocyl. Prior to the synthesis of catalysts, the CNTs were dried overnight at 110 °C. All the nickel catalysts were synthesized by incipient wetness impregnation method using an appropriate amount of nickel solution to achieve 10 (wt.) % of nickel. The precursors of nickel were: nickel nitrate hexahydrate (Ni(NO3)2.6H2O, Vetec), nickel acetate tetrahydrate (Ni(CH3COO)2.4H2O, Sigma-Aldrich) and nickel hydroxide (Ni(OH)2, Sigma-Aldrich). The first two salts were solubilized in water and the last one, in a mixture of water and nitric acid (HNO3, Vetec), since it was not soluble in pure water. In order to prepare 10 g of catalyst (10 % Ni), the concentrations of the metal precursors in the impregnating solutions were: 4.34 mol L-1 of aqueous solution of nickel nitrate; 0.62 mol L-1 of aqueous solution of nickel acetate; 2.12 mol L-1 of acid solution of nickel hydroxide. The Ni catalysts were prepared in order to obtain Ni particles located inside or outside the CNTs. For the preparation of catalysts with nickel particles inside the CNT channels (denoted as CNTIN), several impregnation and drying steps were carried out depending on the metal precursor: 3, 4 and 10 steps for the catalysts prepared with nickel nitrate, nickel hydroxide and nickel acetate, respectively. After the impregnation, the samples were dried overnight at 110 °C. To prepare catalysts with nickel particles located preferentially on the CNT outer walls (denoted as CNTOUT), p-xylene (Sigma-Aldrich) was used to fill the pore of nanotube before nickel solution impregnation. In this case, a larger number of impregnation/drying steps were carried out compared to CNTIN catalysts (7 steps for nickel nitrate, 9 steps for nickel hydroxide and 25 steps nickel acetate). After the impregnation, the samples were dried overnight at 150 °C to evaporate the p-xylene, according to Pan and Bao [42]. All the samples were treated at 300 °C (5 °C min-1) for 5 h under flow of He (50 mL min-1). The catalysts were designated as Nix/CNTy where x corresponds to the precursor salt used (nitrate-NIT, hydroxide-HYD, acetate-ACET), and Y, the desired nickel particles position (inside-IN, outside-OUT)."
3,Characterization,"2.2 Characterization The chemical composition was determined by inductively coupled plasma optical emission spectrometry (ICP-OES) using a SPECTRO ARCOS ICP-OES instrument. The samples digestion was carried out by alkaline fusion with lithium tetraborate, followed by dissolution with nitric acid. The solutions resulting from the digestions were used for analysis in duplicate. N2 adsorption-desorption isotherms were measured by nitrogen adsorption at −196 °C using Micromeritics ASAP 2020 equipment. The treated samples were previously outgassed under vacuum at 200 °C for 18 h. The specific areas were estimated using the Brunauer-Emmett-Teller (B.E.T.) method. The X-ray diffraction (XRD) analysis of support and catalysts (dried, treated and reduced) were performed using a Rigaku Miniflex diffractometer employing a Cu Kα radiation (λ =1.542 Å). The diffractograms were obtained over a 2θ range of 10-90° at a scan rate of 0.02°/step and a scan time of 1 s/step. The crystallite diameters (Dc) of metallic Ni were estimated by Scherrer equation using the line characteristic of Ni0 (2 0 0) at 2θ = 51.8º and considering that the particles have a spherical geometry (shape factor equal to 0.9). The thermogravimetric analysis (TGA) was carried out using a HITACHI STA 7300 equipment. For that, about 5 mg of sample were heated up to 1000 °C (5 °C min-1) in an atmosphere of N2 (80 mL min-1). The decomposition of the different nickel salts was evaluated by temperature programmed desorption (TPD) in a multipurpose unit coupled to a Pfeiffer Vacuum mass spectrometer (MS) model QME 200. The dried catalysts (0.1 g) were heated in a flow of He (50 mL min-1) up to 800 °C (5 °C min-1). The signals of the ions m/z = 2 (H2), 4 (He), 12 (C), 14 (N or C2H2O), 15 (CH4), 16 (O), 17 (OH), 18 (H2O), 25 (C2H4), 28 (CO or N2), 30 (NO), 31 (C2H6O), 32 (O2), 37 (C3H4), 44 (CO2), 46 (NO2 or CH2O2), 58 (C3H6O), 56 (C4H8) and 60 (C2H4O2) were continuously monitored on the mass spectrometer. Temperature programmed reduction (TPR) were performed in the same multipurpose system used for TPD analysis. Before reduction, the treated catalysts (0.1 g) were heated under He (50 mL min-1) at 150 °C (10 °C min-1) for 1 h and then cooled to 30 °C. The He was replaced by pure H2 (100 mL min-1). After that, temperature was increased until 800 °C (5 °C min-1) and the H2O signal (m/z = 18) was measured at the spectrometer. The density of exposed Ni sites of the catalysts was measured by CO chemisorption using a Micromeritics ASAP 2020C equipment and the double isotherm method. Before the analysis, the catalysts (0.1 g) were pretreated at 150 °C (10 °C min-1) for 1 h in He (30 mL min-1) and then reduced with H2 (30 mL min-1) at 400 °C (5 °C min-1, for 1 h) to obtain the metallic nickel phase. The catalyst’s surface was cleaned under vacuum and the CO chemisorption was performed at 30 °C. For that, it was assumed a stoichiometry of one CO per surface Ni. The morphological analysis, the particle size distribution and determination of mean particle size was performed by transmission electron microscopy (TEM). The images were obtained using the Tecnai G20 FEG microscope operating at 200 kV. The samples were previously reduced with pure H2 (200 mL min-1) at 400 °C for 1 h and passivated with 0.5 % O2/N2 for 18 h. Then, the catalysts were ultrasonically dispersed in ethanol for 50 minutes and finally dropped onto a Lacey carbon grid, which was taken to analysis. The Ni diameters of 300 particles were counted using AxioVision software."
4,Catalytic experiments,"2.3 Catalytic experiments The hydrogenation of levulinic acid to γ-valerolactone was carried out in an automatic continuous-flow trickled bed reactor (Microactivity Efficient, from PID Eng & Tech) at 180 °C and 30 bar of H2 for 6 h. The stainless steel tubular reactor of 9 mm of internal diameter and 195 mm in length was coupled to the unit. Preliminary tests were performed to ensure that external and internal transfer limitations were eliminated under the conditions employed. The catalyst bed was packed in the reactor between two layers of quartz wool, and the powder catalyst (0.3 g, 200 mesh) was diluted with inert material, SiC (150-270 mesh, mcatalyst/mSiC = 1/5) to avoid hot spots. Prior to each catalytic test, the nickel catalyst was reduced in situ with pure H2 (200 mL min-1) at 400 °C (5 °C min-1) for 1 h. The reactant mixture was composed of 5 (wt.) % of levulinic acid (Sigma-Aldrich, 98 % pure) in distilled water and 0.13 % (wt) of 1.4-dioxane (Sigma-Aldrich, 99.8 % pure) used as an internal standard. Each catalyst was evaluated using a weight hourly space velocity (WHSV) of 1 h-1. The post-reaction collected liquid samples were analyzed by gas chromatography and mass spectrometry – GCMS (Agilent – 7890-5975C model) and a flame-ionization detector (FID) using a VF-WaxMs column (30 m x 0.25 mm x 0.25 μm). The levulinic acid conversion (XLA) was calculated using the following equation: X L A % = A L A A D I O X 0 - A L A A D I O X t A L A A D I O X 0 x 100 where ALA is the chromatographic area of LA (a.u.), ADIOX is the chromatographic area of dioxane (a.u.), 0 corresponds to the beginning of the reaction and t at any time."
5,Results and discussion,
