,sections,Text
7,Hydrogen and VFAs production from cellulose,"3.3 Hydrogen and VFAs production from cellulose Fig. 4 (a) shows the cumulative biohydrogen production from cellulose. The biohydrogen yield was in the range of 15.4–19.5 ml/g cellulose in all the experimental groups. At thermophilic temperature, Xia et al. obtained a biohydrogen yield of 5 ml/g cellulose [52]. Cellulose is made up of β (1 → 4) linked glucose units, tightly packed via hydrogen bonds. It is highly resistant to deconstruction by hydrogen-producing bacteria. The fibrillar compartment in the cell wall of algae formed mainly of cellulose was considered the major factor that hinders the biohydrogen production from algae species [17,53]. As shown in Fig. 4, the addition of different carbon materials did not significantly (p > 0.05) change the biohydrogen yield or the peak production rate in comparison with the control group. The kinetic parameters for cellulose fermentation are shown in Table 8 . There was a difference between the predicted and the measured peak production rate with distinct R2. Nonetheless, the kinetic parameters in Table 8 suggested that the addition of carbon materials did not significantly change the lag-phase time and the peak fermentation time for cellulose fermentation. Notably, the low biohydrogen yields were potentially due to the inefficiency of the cellulolytic enzyme activity, which is responsible for hydrolysis of cellulose to easily fermentable glucose. Zhao et al. found that cornstalk derived biochar had no effect on the cellulase activity and did not promote the saccharification of lignocellulose by the external cellulase [54]. Considering the low biohydrogen production from cellulose, the VFAs production from cellulose was also reasonably low as shown in Fig. 5 . In the control group G10, no detectable acetic acid was observed during fermentation. On Day 1, the addition of graphene (G6) and Wood_Biochar (G9) enhanced the yield of acetic acid to 72–73 mg/L. From Day 2 to Day 4, the addition of graphene increased the accumulation of butyric acid by 133% compared with G10, whilst the addition of Draff_N2_Biochar, Draff_CO2_Biochar, and Wood_Biochar did not significantly impact the final production of butyric acid. However, in the graphene and Wood_Biochar amended groups, the acetic acid was reduced over the fermentation process. The consumption of acetic acid might take place through the reaction R4 [50]: 2CH3COOH + 2H2 → CH3CH2CH2COOH+ 2H2O (R4)."
8,Hydrogen and VFAs production from L. digitata,"3.4 Hydrogen and VFAs production from L. digitata The biohydrogen yield from L. digitata is shown in Fig. 6 (a). Seaweed polysaccharides are more complex when compared to glucose and cellulose. Therefore, the bacteria took a longer time to acclimatise and start to break down the cell walls of L. digitata. The yield in the control group was 40.6 ml/g VS. Wet L. digitata was used in this study and it was expected to be less degradable than dried L. digitata due to the intact cell wall of the wet L. digitata [55]. The addition of the four carbon materials did not significantly (p > 0.05) change the biohydrogen yield. Fig. 6 (b) shows the biohydrogen production rate. From a perspective of statistics, the addition of the four carbon materials did not change the peak production rate significantly (p > 0.05) due to the large deviations between the triple values in the control group. However, all the carbon materials significantly (p < 0.05) reduced the lag-phase time and antedated the production peak. The kinetic parameters for the fermentation of L. digitata are shown in Table 9 . The predicted maximum biohydrogen yield (Hm) exhibited a good fit with the measured data. A significant difference (2%−38%) between the predicted and the measured peak production rate was observed with distinct R2. As compared with the control group, the lag-phase time was reduced by 47%, 36%, 37%, and 49% by graphene, Draff_N2_Biochar, Draff_CO2_Biochar, and Wood_Biochar, respectively. The peak fermentation time was reduced by 44%, 31%, 39%, and 45% by graphene, Draff_N2_Biochar, Draff_CO2_Biochar, and Wood_Biochar, respectively. Generally, the two draff-derived biochars Draff_N2_Biochar and Draff_CO2_Biochar were less effective than graphene and Wood_Biochar in terms of reducing lag-phase time and accelerating the fermentation. Draff_CO2_Biochar led to slightly better performance with shorter lag-phase time and peak fermentation time as compared to Draff_N2_Biochar. The production of VFAs in the fermentation of L. digitata is shown in Fig. 7 . During the lag phase (the first three days), a small amount of VFAs was produced. It was inferred that these VFAs were produced from the readily digestible component exposed during the physically mincing of wet L. digitata. From Day 4 to Day 10, the VFAs accumulated gradually. In the control group G15, the final concentration of total VFAs was 932 mg/L. The final concentration of VFAs in the graphene amended group G11 was 53% higher than that in G15. In the Draff_N2_Biochar amended group G12 and the Draff_CO2_Biochar amended group G13, the final concentration of VFAs was slightly lower than that in G15. The Wood_Biochar amended group G14 accumulated a 6% higher amount of VFAs compared to G15 on Day 10. The molar ratio of acetate/butyrate in G15 was 0.84, close to the value of ca. 0.8 in a continuous hydrolysis reactor treating L. digitata at mesophilic temperature [9]. The addition of graphene, Draff_CO2_Biochar, and Wood_Biochar increased the acetate/butyrate ratio to 1.57, 1.10, and 0.89, respectively. The addition of Draff_N2_Biochar slightly decreased the acetate/butyrate ratio to 0.78. There are arguments over the relationship between the biohydrogen yield and the acetate/butyrate ratio. Some studies concluded that higher biohydrogen yields were associated with higher acetate/butyrate ratios [56]. However, some studies had a contrasting conclusion [57]. This might be ascribed to the complex metabolic network in fermentation, as different pathways could lead to the production of acetic acid and butyric acid either with or without biohydrogen production. The addition of graphene significantly facilitated the production of acetic acid. A similar phenomenon was observed in the thermophilic fermentation of glucose, in which activated carbon facilitated the production of acetic acid rather than butyric acid and ethanol [57]. Graphene increased the overall production of VFAs but did not significantly increase the production of biohydrogen. The following may describe the reasons: (1) Graphene as an electron conductor between acid-producers and homoacetogens may simultaneously have enhanced homoacetogenesis, which may have converted biohydrogen and CO2 into acetic acid [58]; (2) High levels of acetic and butyric acids may have been produced through other non-hydrogenogenic pathways such as mediated by heterotrophic/autotrophic homoacetogenes. The fermentation process was dominated by several overlapping and competing fermentation pathways, which might reduce the biohydrogen yield in comparison to the relatively high yield of VFAs [59,60]."
9,Bacteria community affected by carbon materials,"3.5 Bacteria community affected by carbon materials Fig. 8 shows the microbial community in the fermentation of L. digitata with different additives. At the phylum level, the bacteria community in the inoculum consisted of Firmicutes (8.7%) and Proteobacteria (91.3%). The control group G15 consisted of primarily Firmicutes (97.3%), Proteobacteria (1.4%), Actinobacteria (1.0%), and other phyla with relative abundance less than 1%. Firmicutes included the main hydrogen-producing microbes, which could utilize a wide range of substrates [61]. In the graphene amended group G11, the predominant phyla were Firmicutes (97.6%). Firmicutes were also the predominant phyla in Draff_N2_Biochar amended group G12 and Draff_CO2_Biochar amended group G13. In the Wood_Biochar amended group G14, the major phyla included Firmicutes (95.1%), Proteobacteria (2.1%), Actinobacteria (1.6%). Proteobacteria were the most abundant bacteria in bioreactors treating high concentration wastewaters [62]. Actinobacteria were reported as the major drivers of hydrolysis and acidification [59,62]. At the genus level, the predominant genera in the inoculum were Pseudomonas (91.2%) and Clostridium sensu stricto 7 (6.5%). Pseudomonas contained heterotrophic bacteria species which were unbeneficial to hydrogen production. The predominant genera in the control group included Thermoanaerobacterium (24.6%), Bacillus (65.8%), Clostridium sensu stricto 7 (3.4%), and Syntrophaceticus (1.6%). Thermoanaerobacterium and Bacillus were significantly enriched. Thermoanaerobacterium grew rapidly at 55–70 °C and all of the known Thermoanaerobacterium species were reported to possess hydrolase benefiting fermentative hydrogen production. Some Thermoanaerobacterium species (for example, the T. thermosaccharolyticum) were identified as efficient hydrogen producers, even more efficient as compared to Clostridium and Enterobacter species [63]. Jia et al. observed that the abundance of Thermoanaerobacterium positively correlated with hydrogen production rate [64]. The addition of graphene, Draff_N2_Biochar, Draff_CO2_Biochar, and Wood_Biochar increased the relative abundance of Thermoanaerobacterium to 90.4%, 55.6%, 31.9%, and 80.1%, respectively. This might be responsible for the accelerated biohydrogen production with the addition of these carbon materials. The addition of Wood_Biochar slightly increased the abundance of Clostridium sensu stricto 7 (3.9%) compared to the control group. Clostridium sensu stricto 7 is a typical hydrogen-producing genus identified in thermophilic fermentation [51]. Almost all Clostridium sensu stricto strains produce butyrate as the main metabolic product, not excluding the production of various organic acids and alcohols (such as formic acid and ethanol) [65,66]. Althuri and Mohan demonstrated that some species of Clostridium sensu strict 7 could use carbon sources such as glucose and cellulose to produce ethanol [67]. The enrichment of Clostridium sensu stricto 7 was also observed in the fermentation with the addition of activated carbon or transition elements such as Fe and Ni [51,58]. In comparison to the control group, the addition of graphene, Draff_N2_Biochar, and Wood_Biochar decreased the relative abundance of Bacillus. Bacillus include many species that have diverse metabolic activities. Some of Bacillus species were able to produce biohydrogen [8]."
10,Proposed role of carbon materials in facilitating fermentation of L. digitata,"3.6 Proposed role of carbon materials in facilitating fermentation of L. digitata Table 10 summarises the reported studies investigating the effects of carbon materials (including biochar, activated carbon, and carbon cloth) on biohydrogen fermentation. The positive effects of different carbon additives included improving the yield of biohydrogen and VFAs, accelerating production rate, and reducing lag-phase time. In this study, the carbon additives did not statistically increase the biohydrogen yield from L. digitata, but an increase of 53% in the VFA yield was observed with the addition of graphene. Porous carbon materials could support the formation of biofilm to increase microbial density, mitigate the inhibitory accumulation of soluble metabolites, and increase the dehydrogenase activity [30,68,69]. It was also observed that algae cell walls were physically disrupted in the presence of biochar, which increased the availability of macromolecular organic substrates for further hydrolysis during the fermentation of algae [70]. Moreover, conductive carbon materials were found to promote the potential bacterial electron transfer [28,31], which facilitated microbial metabolic activities. The physicochemical properties of the carbon materials were the major factors in determining their functions in the fermentation process. The fermentation performance of L. digitata was evaluated in terms of the biohydrogen yield, peak production rate, acetic acid production, total VFAs production, and lag-phase time. The properties of the carbon materials were determined in terms of the total carbon and nitrogen content, molar O/C and H/C ratios, the relative abundance of each surface functional group (such as the carbon species, oxygen-containing groups, and nitrogen-containing groups), the specific surface area, and the EC. Mathematic correlations between the enhanced fermentation performance and the key properties of the carbon materials were analysed to establish relationships between them. As the variations in biohydrogen yield and peak production rate among different fermentation groups were statistically insignificant, the biohydrogen yield and peak production rate were excluded from the correlation assessment. As shown in Fig. 9 (a), the acetic acid production and the total VFA production were positively correlated to the EC of carbon materials and the slopes were significantly different from zero at the p = 0.05 level. The lag-phase time was negatively correlated to the total carbon content and the relative abundance of sp2 carbon as shown in Fig. 9 (b) and (c), but positively related to the abundance of total oxygen-containing functional groups as shown in Fig. 9 (d). The positive effects of promoting the acetic acid and VFAs production and reducing the lag-phase time were postulated as being associated with the high EC, high carbon content, high abundance of sp2 carbon, and low abundance of oxygen-containing functional groups of the carbon materials. These properties of carbon materials were also intrinsically related to each other. A carbonaceous material with a high carbon content, high abundance of sp2 carbon, and low abundance of oxygen-containing functional groups typically indicated a high graphitic degree, which normally leads to a high EC. It could be inferred that the graphitic carbon core and electrical conductivity of the carbon materials might be crucial parameters in facilitating the fermentation of L. digitata by enhancing the bacterial electron transfer. Conductive carbon materials can enhance bacterial metabolism through the stimulation of transmembrane and extracellular electron transfer, which has been demonstrated by the augmentation of representative bacteria S. oneidensis with carbon dots [71]. However, further investigation is necessary to reveal the direct fundamental drivers that contribute to the enhanced fermentation and the mechanisms of the carbon-microbes interaction. Specific surface areas showed no apparent correlations with all fermentation indicators, suggesting that the specific surface area might not be a crucial parameter affecting the fermentation performance. The two draff-derived biochars presented similar elemental compositions. Draff_CO2_Biochar presented a lower specific surface area and porosity but led to a better fermentation performance such as a shorter lag-phase time and peak fermentation time compared to Draff_N2_Biochar. This observation was in agreement with Wang et al. [72]. However, this observation did not deny the potential significance of supporting biofilm on the surface of carbon materials. The cell attachment and biofilm development might be a prerequisite to realise the enhancement of bacterial electron transfer as the direct bacterial electron transfer happens on the interface between the bacteria and carbon materials. Cheng et al. demonstrated that bacteria were immobilized on the carbon cloth by comparing the protein attached to the carbon cloth and the protein content in the supernatant [28]. The weak relationship between the specific surface area and the fermentation performance might arise from the fact that the cell attachment occurred principally on the external surface of the additives instead of their internal micropores [31]. Based on the discussion, the possible mechanisms for enhancing biohydrogen fermentation with conductive carbon materials were proposed as illustrated in Fig. 10 . The conductive carbon materials, particularly graphene and Wood_Biochar, promoted metabolic activities possibly by supporting the development of biofilms and facilitating the transmembrane and extracellular electron transfer. In the absence of conductive materials, the c-type cytochromes are involved in the transmembrane electron transfer and the flavins are involved as a free mediator in the extracellular electron transfer. Their co-existence could indicate the formation of an electron transfer pathway between electroactive bacteria in fermentation systems. It has been proven that extracellular electron transfer could be conducted directly by conductive carbon materials between electroactive microorganisms [73]. The replacement of conductive secreta by conductive carbon materials could possibly reduce the consumption of energy/matter for electron transfer, which may be an important reason for improving the hydrogen production efficiency [74]. Further integration of the fermentation with other valorisation processes will enhance both economic and environmental benefits of the addition of carbon materials. As outlined in a previous study, the enhanced production of carboxylic acids (such as acetic acid and butyric acid) can not only lead to a higher economic return compared with biomethane, but also can serve as versatile precursors for even higher-valued chemical synthesis, such as medium-chain carboxylic acids, polyhydroxyalkanoates, single-cell proteins, and multi-carbon alkanes [4]. In addition to the acceleration of biohydrogen and VFA production, the addition of carbon materials in fermentation may also lead to a range of co-benefits, such as enhancing the process stability, improving the feedstock biodegradability, and offering biofertilizer production (the presence of biochar in digestate can increase soil organic carbon when applied to land at the end of the supply chain [77]). However, the following challenges need to be addressed before the implementation of large-scale application: (1) the understanding of the mechanisms of the carbon-microbes interaction needs to be improved to optimise the yield, production selectivity, and fermentation performance; (2) the net gains from hydrogen and other desirable products have to offset the energy cost for the production and application of carbon materials to achieve economical sustainability; (3) when the enhanced fermentation process is further integrated with other bio/thermo/electrochemical processes, the carbon footprint of the cascading circular bioenergy systems needs to be assessed to verify the environmental sustainability."
11,Conclusion,"This study investigated the effects of four carbon materials on facilitating biohydrogen fermentation of glucose, cellulose, and seaweed L. digitata. The impacts of the carbon materials varied among different carbon materials and different feedstocks. In the fermentation of glucose, graphene and Wood_Biochar improved the VFAs production by 75% and 29%, respectively. Polysaccharide cellulose proved a difficult substrate for hydrogen fermentative bacteria; thus, the fermentation of cellulose was not enhanced by the carbon additives. All the carbon materials significantly reduced the lag-phase time for fermentation of L. digitata. Graphene and Wood_Biochar reduced the lag-phase time by 47% and 49%, respectively. Correlations between the fermentation parameters of L. digitata and the properties of the carbon materials (such as the carbon content, relative abundance of sp2 carbon and total oxygen-containing functional groups, and electrical conductivity) suggested that the graphitic carbon core and electrical conductivity might play an important role in facilitating the fermentation. The possible mechanisms were postulated as the support for biofilms and the enhancement of the transmembrane and extracellular electron transfer induced by carbonaceous additives."
