,sections,Text
7,Calcined precursors characterization,"3.2 Calcined precursors characterization 3.2.1 X-ray diffraction The ex-LDH oxides were obtained by calcination at 723 K of the corresponding LDH-precursors. XRD patterns of the ex-LDH oxides are shown in Fig. 3 . Calcination of the LDH-precursors leads to the destruction of the layered LDH network (Fig. 3 with regard to Fig. 1), giving rise to the characteristic diffuse signals corresponding to amorphous components and the formation of some simple oxides and spinels, depending on the chemical composition of the LDH-precursor. Thus, the formation of Co-spinel phase (Co3O4, JCPDS: 80-1545) is observed in all Co-samples (Fig. 3a–c), while the Co single oxides, CoO or Co2O3, are not detected in the Co ex-LDH samples. The formation of the crystalline Co-spinel could be explained as a segregation of Co out of the ex-LDH matrix [33]. Traces of the crystalline simple oxides of the corresponding modifying cations, ZnO and MgO, appear in CoZnAl (Fig. 3b) and CoMgAl (Fig. 3c) samples, respectively. The high loading of modifying cations (Table 1) should produce well defined peaks of the corresponding simple oxides, thus the almost absence of ZnO and MgO crystalline phases could indicate the complete incorporation of the modifying cations into amorphous oxide phases. The comparison of the three ex-LDH oxides with Mg as modifying cation allows studying the influence of the presence of Co, Ni or Cu in the formation of the oxides after calcination. The CoMgAl (Fig. 3c), NiMgAl (Fig. 3d) and CuMgAl (Fig. 3e) ex-LDH samples show the formation of the Co-spinel phase, NiO phase and CuAl-spinel phase, respectively. The CuMgAl sample also shows traces of tenorite–CuO phase, together with the main CuAl-spinel phase. Crystalline particle sizes calculated by the characteristic peaks of each phase using the Debye–Scherrer equation of the ex-LDH oxides are summarized in Table 2. From the analysis of the particle sizes of the segregated Co-, Ni- and Cu-oxides (Table 2), it seems that there exists a relation between the high crystallinity of the corresponding LDH-precursor (Fig. 1) and the small size of the particles segregated oxide phases (Table 2). Thereby, CoMgAl-LDH, which shows the highest LDH crystallinity (Fig. 1c), is the sample with the smallest crystal size of the corresponding oxide (Table 2). In the same line, the sample with the highest particle size (CuMgAl ex-LDH) was the sample which showed the lowest crystallinity of its corresponding LDH-precursor (Fig. 1e). From the results derived from the Mg-containing precursors it could be inferred that the crystal size of the segregate oxide decreases when the crystallinity of the LDH-precursor increases. Accordingly, the active divalent cation, outside of the HT structure, could form upon calcination the corresponding segregated oxides or spinels with a very small particle size, while Zn2+, Mg2+ and Al3+ could produce amorphous oxide phases [33]. On the other hand, CoAl ex-LDH sample does not show a large particle size, regarding its high Co-loading (three times more Co than CoZnAl and CoMgAl samples, see Table 1). Therefore, it seems that the CoAl sample displays a higher Co-exposure than the CoMgAl and CoZnAl ex-LDH ones, due to its higher metallic loading. 3.2.2 N2 adsorption–desorption isotherms The textural properties (BET and external specific surface areas) of the ex-LDH oxides have been calculated from the N2 adsorption–desorption isotherms recorded at 77 K (isotherms not-shown here), and they are summarized in Table 2. All isotherms of the ex-LDHs were type IV, according to the IUPAC classification. The isotherms exhibit slight adsorption at low relative pressure due to the presence of micropores. All ex-LDH isotherms show a sharp increase at high relative pressure originated from interparticle porosity, which seems to indicate that ex-LDHs consist mainly of non-porous nanoparticles within the nanometer range. The high meso, macro and external specific surface area values show the non-microporous nanoparticle nature of the ex-LDH materials. Ex-LDH oxides formed after calcination exhibit high specific surface area values (Table 2), taking into account their bulk nature. The calcined samples with Mg as modifying cation show the highest specific surface area among the measured samples. 3.2.3 Temperature-programmed reduction (TPR) Fig. 4 shows the TPR-profiles of the ex-LDH oxides. All Co-containing samples (CoAl, CoZnAl and CoMgAl) present two reduction peaks. The two reduction peaks of Co ex-LDHs withCo3O4-phase are assigned: (i), peak-1, at ca. 700 K, to the reduction of Co3+ to Co2+, and (ii), peak-2, at 880–930 K, to the reduction of Co2+ to Co0 [14,37]. Nevertheless, CoAl ex-LDH TPR profile shows certain heterogeneity suggested by the shoulder at 784 K and the tail at 1038 K. This heterogeneity can be caused by the higher Co-loading in the CoAl ex-LDH (Table 1). The reduction temperature of the supported Co3O4 phase reported in literature, including when Co is supported on MgO [14], is lower than that obtained for the Co-containing ex-LDH samples shown in this work (Table 2). The high reduction temperature measured in both peaks in the Co ex-LDHs indicates a higher interaction between Co2+/3+ ions and (Zn2+ or Mg2+)-Al3+ amorphous matrix. This strong interaction can be favoured by the low particle size of the Co spinel, which allows a high dispersion and a close contact of these crystalline phases (Fig. 3) with the amorphous (Zn or Mg)-Al oxide. On the other hand, the presence of Zn in the structure decreases the reduction temperature of the peak at high temperature, peak-2 (Table 2), while the incorporation of Mg increases the reduction temperature of this peak-2. Both facts suggest a close interaction between the modifying cations (Zn2+ or Mg2+) in the amorphous phase and the Co2+ ion [37]. The NiMgAl ex-LDH sample shows a broad reduction peak from 773 to 1123 K. This reduction profile is far from that corresponding to bulk NiO (that reduces at 653 K) and it is indicative of a strong interaction between Ni2+ ions with the Mg2+–Al3+ oxide matrix, including the Ni-incorporation into the Mg–Al matrix [27]. The non-symmetrical shape of the broad Ni reduction peak suggests heterogeneous environments for Ni2+, which involves different types of the Ni2+–Mg2+ and Ni2+–Al3+ interactions. A complex TPR profile was obtained for CuMgAl ex-LDH sample, which is formed by a narrow peak at 510 K with a shoulder at 528 K, a broad peak at 593 K and a small peak at 843 K (Fig. 4). From this reduction behaviour at least four different Cu2+ environments can be found. This fact contrasts with the simple CuMgAl ex-LDH XRD pattern (Fig. 3e), in which a main Cu-spinel crystalline phase with traces of tenorite–CuO phase were only observed. The reduction peak at 510 K could be assigned to the reduction of Cu2+ cations in tenorite–CuO phase, since the pure bulk CuO reduces close to this temperature [25,30]. The reduction peak at 593 K can be attributed to the reduction of Cu2+ in the CuAl2O4 mixed oxide (Fig. 3e) or in non-stoichiometric copper aluminate phases. From the hydrogen consumption corresponding to this peak, which is similar to that of the peak at 510 K (Fig. 4), it could be inferred that most of the CuO phase is amorphous and cannot be detected by XRD (Fig. 3e). The H2 consumption peak at 843 K is likely due to reduction of copper in the spinel phases as Cu1−x Mg x Al2O4 phases [30]. In summary, the reducibility of oxide precursors follows the order: CuMgAl > CoZnAl > CoAl > CoMgAl > NiMgAl. The temperature of the reduction used in the activation process of the samples done before the oxidative reforming of ethanol was selected taking into account the above differences in reducibility observed in the samples, using a reduction temperature close to the temperature corresponding to the start of the final reduction peak, except for the case of CuMgAl catalyst, where the temperature was the one corresponding to the end of the main reduction peaks (Table 3). On the other hand, a strong interaction between the active metal oxides (Co- and Ni) and the amorphous (not detectable by XRD) (Mg or Zn)-Al oxide phases have been indirectly detected by the high reduction temperatures of the active cations."
8,Catalytic activity,"3.3 Catalytic activity All ex-LDH catalysts were active in the oxidative reforming of ethanol performed at 848, 898 and 948 K. Table 3 shows the main catalytic results obtained with the five ex-LDH catalysts. The Co- and Ni-catalysts exhibited a complete and stable conversion of ethanol in the temperature range (Table 3). The sample CuMgAl shows lower activity achieving 67 and 71% of EtOH conversion at 848 and 898 K, respectively. The exceptional catalytic performance of CuMgAl ex-LDH will be commented below. The main products of the reaction over CoAl, CoZnAl, CoMgAl and NiMgAl catalysts were H2 and CO2 with a minor formation of CH4 and CO (Table 3). CoAl, CoMgAl and NiMgAl do not produce any measurable amount of other by-products. The CoZnAl catalyst produces, at 848 K, low quantities (<1% molar) of C2 and C4 by-products (Table 3), such as ethylene (C2H4), ethane (C2H6), acetaldehyde (CH3CHO) and crotonaldehyde (CH3CHCHCHO). The low formation of C2 and C4 by-products observed in these four catalysts (CoAl, CoZnAl, CoMgAl and NiMgAl) is indicative of the high activity of the catalysts for the C–C bond cleavage. The product distribution, expressed as the molar composition in the reformed gases over the four most active catalysts are shown in Fig. 5 at the three studied reaction temperature stages: 848 (Fig. 5a), 898 (Fig. 5b) and 948 K (Fig. 5c). It can be noticed that hydrogen is the main reaction product in the outlet gas over any of the four most active catalysts in all temperature range, obviously, with a concomitant high CO2 production. When increasing the temperature from 848 to 948 K, the CO concentration in the outlet gas increases. It is probably due to the participation of the CH4 reforming at a larger extent, which is favoured at high temperature, and a concomitant increase in the production of H2 and CO is produced. Therefore, the H2 production is determined by dehydrogenation–decomposition ethanol reaction together with a consecutive CH4 reforming. In this sense, Fig. 6 shows the H2 production rates over CoAl, CoMgAl, CoZnAl and NiMgAl catalysts. From these results the hydrogen production capacity of the catalysts at low temperature (848 K) decreases following the sequence: CoZnAl > CoMgAl > CoAl > NiMgAl. At higher temperatures, the sequence is maintained with the exception of CoZnAl catalyst that shows some deactivation, as is derived from the decrease in the relative amount of the H2 produced with the raise in temperature observed in Fig. 6. The differences in the H2 production with the raise in temperature are obvious to study the relative H 2 selectivity (Table 3), which was calculated with Eq. (4) (defined in the Experimental Section). For all catalysts, the relative H 2 selectivity increases with the temperature, reaching values close to 90%. However, to increase the temperature from 848 to 948 K, the relative H 2 selectivity of CoZnAl increases in 2%, while CoAl or CoMgAl increase in 10 and 8%, respectively. This increase in H2 production is related to CH4 reforming capacity. CoZnAl catalyst produces the lowest amount of CH4 (and the highest CO production) and the highest H2 production at 848 K (Table 3). Nevertheless, at higher temperature (948 K) there is a higher capacity of CoMgAl and CoAl samples to catalyze the CH4 reforming (CH4 concentration decrease and CO concentration increase) than the CoZnAl-counterpart. Two alternative explanations can be argued. The first one is related to the different basicity/acidity of the (Zn or Mg)-Al matrix in the catalysts. CoZnAl ex-LDH catalyst keeps chloride compensating anions on its surface (see Thermogravimetry Section). This residual Cl− anions have not been removed during any different thermal treatments used with this material, neither the LDH-precursor calcination treatment to obtain the ex-LDH oxide, nor the reducing pretreatment to obtain the catalyst, since the temperature required to remove these residual anions is higher (above 970 K, Fig. 2) than that employed in both treatments (both at 723 K as indicated in the Experimental Section and Table 3, respectively). Thus, Cl− anions presence makes the CoZnAl catalyst surface more acid than the CoMgAl and CoAl ones. The higher basicity of the surface of the CoMgAl and CoAl catalysts favours the CH4 reforming (a decrease the CH4 concentration and an increase of the CO one), which requires higher temperature (948 K) to carry out, respect to the capacity to reform this molecule observed for the CoZnAl catalyst, i.e. it can be noticed the CH4 decrease with CoZnAl is lower than the CoMgAl and CoAl ones. On the other hand, the differences in the Co2+ cation reducibility, previously observed by TPR (Fig. 4), could also explain the differences in the catalytic performance of the samples in the temperature range studied. The highest reaction temperature (948 K) is close to the temperatures at which the peak-2 (corresponding to Co2+ reduction) is observed for the three Co ex-LDH samples (from 874 to 929 K in the Table 2). Likewise, it is possible that changes in the oxidation state of Co under reaction at high temperature could be involved in the different behaviour of the catalysts at these temperatures. Thereby, it seems that the differences in stability of the Co2+ species under reaction conditions and related with the close interaction with the amorphous oxide phase, in such a way that the close interaction of Co2+ ions with Zn2+ (Fig. 4), may also justify the observed catalytic behaviour of the samples at high reaction temperatures. Regarding the influence of the active metal (Co or Ni), it appears that CoMgAl catalyst is slightly more active than the Ni counterpart, i.e., the Ni-catalyst requires higher temperature to reach the same conversion level as the Co-ones, as other authors have previously observed [16,21]. In order to compare the selectivity to the rest of the reaction products, Fig. 7 plots the molar percentage of CH4 (Fig. 7a), CO2 (Fig. 7b) and CO (Fig. 7c) as a function of the hydrogen production over the CoZnAl, CoMgAl, CoAl and NiMgAl ex-LDH catalysts. It is observed that all Co-containing catalysts show a similar behaviour in the production of CH4, CO and CO2. On the other hand, the NiMgAl catalyst showed a slightly different behaviour compared to Co-counterparts, presenting a lower CH4 and CO2 production and a concomitant higher CO production. This fact indicates the higher CH4 reforming capacity of the Ni species compared with Co-counterparts in line with previous works published in literature [3,18,30], although, its catalytic activity in the EtOH decomposition is lower than Co-ones, due to the fact that Ni ex-LDH requires a higher temperature to reach the same H2 production levels as the Co-ones. In order to determine the participation of the different processes during the reaction, the (H2 + CO)/CO2 ratio was calculated. This ratio could be used as an indication of the relative participation of the reforming processes with respect to the total oxidation process because our reaction conditions involve oxygen as reactant in the inlet gases. In this way, if only oxidative reforming process were carried out, the (H2 + CO)/CO2 ratio would be 2.64, in accordance with Eq. (4). On the contrary, when the total oxidation process increases its participation, the (H2 + CO)/CO2 ratio reaches values lower than 2.64. The experimental (H2 + CO)/CO2 ratios obtained for all ex-LDH catalysts at 848, 898 and 948 K are summarized in Table 3. It can be observed that the (H2 + CO)/CO2 ratio for most catalysts show values below 2.64, i.e. most of the catalysts favour the reforming processes, and consequently the H2 production. Only CoAl and NiMgAl at the lowest temperature (848 K) show (H2 + CO)/CO2 ratios lower than 2.64, indicating that part of the EtOH consumed with both catalysts at 848 K do not produce hydrogen, because part of EtOH is burnt. The (H2 + CO)/CO2 ratios increase when the temperature increases at 898 and 948 K. At temperatures above 848 K, the (H2 + CO)/CO2 ratio values increase to above 2.64. Thus, the temperature increase favours the EtOH and CH4 reforming and the EtOH decomposition processes, with respect to the total oxidation process. On the other hand, different amounts of coke were detected on the different used catalysts (Table 3). As expected, the Ni-catalyst produced larger amount of coke, since Ni favours the polimerization of the carbonaceous residues. The Co-catalysts show different amounts of coke on their surface, following the decreasing order of coke produced: CoZnAl > CoAl > CoMgAl. The sequence in carbon formation follows the same order than the sequence of catalysts acidity. Therefore, it seems that the acidity of the catalyst surface could favour the formation of carbon deposits. This acidity in CoZnAl ex-LDH catalyst is produced by residual chloride anions (see Thermogravimetry Section). An exception to all that has been discussed above is the performance of CuMgAl ex-LDH catalyst observed under the reaction conditions chosen for this work. Fig. 8 shows the product distribution, the EtOH conversion and the relative H 2 selectivity of all five ex-LDH catalysts at 898 K, in order to compare the behaviour of the Cu-catalyst with the Co- and Ni-ones, previously analyzed. As indicated before, the EtOH conversion on the CuMgAl catalyst is not complete at 898 K (Table 3). The main product obtained with CuMgAl catalyst was CO (31%) along with CH4 (23%), acetaldehyde (19%) and H2 (18%). These results seem to indicate that CuMgAl ex-LDH catalyst is less selective to hydrogen production than the Co- and Ni-ones, due to the low capacity of Cu to cause the C–C bond cleavage. These evidences cast doubt on the use of this CuMgAl ex-LDH catalyst for the oxidative steam reforming of EtOH in reaction conditions chosen in this work, as it happened in the case of ethanol steam reforming reaction published previously [16]. In summary, the five ex-LDH catalysts studied are active in the EtOH oxidative steam reforming reaction. CoZnAl, CoMgAl, CoAl and NiMgAl reach complete EtOH conversion which is maintained stable in time for all the temperatures studied. At moderate temperature (848 K), CoZnAl catalyst shows the highest H2 production and consequently the highest H2 selectivity, while at higher temperature (898 K) CoMgAl and CoAl are the most active catalysts in the H2 production. It seems that NiMgAl ex-LDH is more selective to H2 production than the Co-catalysts, although the Ni-catalyst requires more temperature to reach the same H2 production levels that the Co-ones reach at lower temperatures. The high H2 conversion level can be reached because the reaction temperatures were appropriate. In general, these high reaction temperatures can be studied due to the high stabilization and dispersion of small particles of the active metal oxides into the ex-LDH amorphous oxide network. Thus, these results prove that all Co- and Ni-catalysts are very selective to hydrogen production in the chosen reaction conditions."
9,Conclusions,"The results obtained in this study show that the catalysts obtained from ex-LDH like precursors are good systems to produce hydrogen from the oxidative steam reforming of EtOH. The high crystallinity of the LDH-precursors obtained through the urea method guarantees the formation of oxides of very small particle size, in a strong interaction with the (Zn or Mg)-Al oxide matrix, as it was confirmed by TPR by the high reduction temperatures needed to reduce the active metals of the ex-LDHs obtained. This strong interaction between active metals and oxide matrix stabilizes the active metals. The use of chloride anions as compensating anions in the LDH structure seems to affect neither the ex-LDH oxide formation nor the active metal stabilization. Summarizing the ex-LDHs’ catalytic performance, the five ex-LDH catalysts studied in this work were active in the oxidative steam reforming of EtOH. However, four of the five catalysts reached the total EtOH conversion (CoZnAl, CoMgAl, CoAl and NiMgAl), while CuMgAl showed a lower catalytic activity and a lower selectivity to H2 production. Co- and Ni-catalysts show a similar performance in this reaction, although, there are slight differences between the Co- and Ni ex-LDHs’ catalytic behaviour. Thus, Co-catalyst reached a higher H2 production level at lower temperatures compared to the Ni-one. Consequently, higher H2 selectivities can be achieved by the Co-catalyst, which seems to be due to the higher EtOH reforming capacity of the Co-catalyst, while Ni species show higher CH4 reforming capacity, which requires higher reaction temperatures. At lower temperature (848 K), the best catalyst for hydrogen production is CoZnAl, in which the Zn presence increases the reducibility of Co2+. This seems to be the cause of the higher H2 selectivity with CoZnAl at lower temperature. When temperature is increased, the lower cobalt stabilization into the Zn–Al matrix slows down in the H2 production. On the contrary, the high cobalt stabilization in the matrix of the CoMgAl and CoAl ex-LDH samples increases the H2 production."
