,sections,Text
11,XPS analysis of different WAS cascading treatment systems,"3.4 XPS analysis of different WAS cascading treatment systems Four WAS samples after 192 h of cascading treatment were analysed by XPS C 1s, O 1s, N 1s and P 2p spectra. Overall, C and O occupied the two largest proportions in the four samples (Table 2 ). The spectra of C 1s (Fig. 5A1 and A2 ) contained four representative peaks. The characteristic peak of C1 (C- (C, H), 284.8 eV) was from hydrocarbon-like compounds (i.e., lipids, amino acid side chains and polysaccharides) (Wang et al., 2018a). The abundance of C1, the predominant component of EPS, increased after pretreatment, which implied the efficient decomposition of EPS. The peak at 286.1 eV (C2) was attributed to C- (O, N) bonds from ethers, alcohols, amines and amides (Wang et al., 2018a). AD-FPMEC showed the most apparent decline in the binding area of C2 compared with that of AD-RMEC, which indicated that co-pretreatment indirectly caused the most effective transformation of macromolecular organics in the cascading system (Table 2). The weak peak (C3) at 288.0 eV was closely related to O–C–O and C O, which mainly existed in amide, carboxylate, carbonyl, acetal and hemiacetal groups. Notably, the bonds of C4 (O C−OR and O C–OH, 288.5 eV) and O2 (C O, 531.2 eV), commonly from carboxyl or ester groups (Appala Raju et al., 2008), increased in AD-FPMEC, further proving that co-pretreatment led to considerable accumulation of VFAs during the prefermentation step. After bioelectrolysis utilization, the residual VFAs were still much higher than those in AD-RMEC, which was consistent with the results of Fig. 3A and B. As shown in Table 2, the binding area of N1 (N–C-R, 399.6 eV), from the amide functions of proteins and peptide chains (Yu et al., 2018), achieved the minimum in AD-FPMEC, indicating that co-pretreatment led to the most effective utilization of proteins. This result is also intuitively reflected in Fig. 5B1 and B2 by the accumulation of H–N–CO (N2, 400.4 eV), the typical bond of amino acids, in AD-FPMEC (Yu et al., 2018). The binding energies of 530.8, 532.0 and 532.7 eV were assigned to O–H (O1), P O/P–O (O3) and O–C (O4), respectively (Fig. 5C1 and C2) (Martı́Nez et al., 2003; Tan et al., 2012). Notably, the binding areas of O3 and P3 (C-O-PO3, 134.1 eV), assigned to the typical bonds in phospholipids, sharply dropped to 27.3% and 26.6% in AD-FPMEC, respectively. This result implied that the phospholipid bilayer of the cytomembrane was seriously damaged by co-pretreatment and further converted into inorganic phosphorus in the cascading conversion system (Rumble et al., 2010; Yu et al., 2018). This result could further be proven by the increase in P2 (133.6 eV) from ortho-P/pyro-P (Fig. 5D1 and D2) (de Carvalho Eufrásio Pinto et al., 2019; Zhang et al., 2019). This result was also consistent with our previous study on the shifts in phosphorus speciation between sludge and supernatant (Zhou et al., 2019)."
12,Microbial community analysis,"3.5 Microbial community analysis A total of 34660-51218 effective reads were obtained from eight 16S rRNA gene libraries by Illumina MiSeq sequencing (Table S3). The alpha diversity indicated that pretreatment and cascading conversion significantly decreased the richness of the bacterial community and AD-FPMEC had the lowest richness (Table S3). To illustrate the interactions among all OTUs, three OTU networks were constructed (Fig. S6). In total, there were 1877 OTUs in the eight samples, of which only 385 (20.5%) OTUs were shared. For the prefermentative and bioelectrolytic groups, in each of the 4 samples, 744 (40.9%) and 508 (27.1%) OTUs were shared, respectively, but exhibited quite different compositions. The dominant phyla of the prefermentative group were Proteobacteria (37%), Bacteroidetes (12%) and Chloroflexi (10%), while those of the bioelectrolytic group were Proteobacteria (32%), Firmicutes (17%) and Bacteroidetes (16%). This result revealed the dissimilarity in the microbial communities participating in the two steps during cascading conversion. The bacterial structure and composition at the phylum and class levels are displayed in Fig. S6 C-D. Proteobacteria and Firmicute, typical anaerobic or bioelectrochemical communities (Bonmati et al., 2013; Cerrillo et al., 2016), were highly enriched during the bioelectrolysis step. Co-pretreatment led to a noticeable increase in Proteobacteria (62%) compared with that in AD-FMEC (50%) and AD-PMEC (51%). At the class level, Gammaproteobacteria, Bacteroidia, and Clostiridia, which can convert soluble organics to VFAs (Kato et al., 2004), were clearly enriched in the prefermentative samples. Deltaproteobacteria, a reported representative anodic bacteria, increased to 43% in AD-FPMEC, a value much higher than that in AD-FMEC (15%) and AD-PMEC (31%). At the genus level (Fig. 6 A), representative anaerobic fermentative bacteria (AFB), consisting of Citrobacter (class Gammaproteobacteria), Macellibacteroides (class Bacteroidia) and two genera of class Clostridia (Proteiniclasticum and Sedimentibacter), were enriched after prefermentation and became the predominant bacteria in AD-FPWAS. Proteiniclasticum, responsible for the degradation of proteins to produce HAc, propionic acid (HPr) and iso-butyric acid (iso-HBu) (Zhou et al., 2018), had an abundance of 6.0% in AD-FPWAS. Macellibacteroides can metabolize various carbohydrates for HAc, HBu, and iso-HBu generation (Jabari et al., 2012); its proportion in AD-FWAS was 5.5%, and it was further enriched to 6.3% in AD-FPWAS. The genera Citrobacter and Sedimentibacter can degrade organics to produce VFAs and hydrogen during acidogenesis and acetogenesis (Imachi et al., 2016; Wang et al., 2018c) and displayed abundances of 5.7% and 6.9%, respectively, in AD-FPWAS, followed by AD-FWAS (1.4% and 5.7%) and AD-PWAS (0.3% and 1.3%). In addition, other fermentative genera, such as Terrimonas, Petrimonas, Anaerovorax and Rhodobacter (Grabowski et al., 2005; Kapdan et al., 2009; Matthies et al., 2000; Zhang et al., 2012), were detected during prefermentation. The ultimate enrichment of AFB peaked in the prefermentative sample at 28.1% (AD-FPWAS), followed by 24.5% (AD-FWAS) and 16.1% (AD-PWAS) (Fig. 6B). Notably, Diaphorobacter and Thauera, the main nitrate-reducing bacteria (NRB) (Khardenavis et al., 2007; Yoshifumi et al., 2004) in AD-FWAS and AD-FPWAS, play important roles in nitrite removal, and their cumulative proportions reached 4.0% and 5.0%, respectively. The structure and abundance of key microbiomes were substantially changed during the bioelectrolysis step. Six kinds of EABs, including Geobacter, Pseudomonas, Desulfovibrio, Comamonas, Shewanella, and Acinetobacter, were enriched in the four bioanodic samples (Lovley, 2011). Two genera of class Deltaproteobacteria (Geobacter and Desulfovibrio), as well as Pseudomonas (class Gammaproteobacteria), represented the main EABs in AD-FPMEC. Geobacter had the highest accumulation of 39.0% in AD-FPMEC, followed by AD-PMEC (23.6%), AD-FMEC (9.2%) and AD-RMEC (3.3%). Pseudomonas and Desulfovibrio can conduct respiration by acting as a bioanode and biocathode (Lin et al., 2019) and were enriched to 13.6% and 3.8%, respectively, in AD-FPMEC. Ultimately, as shown in Fig. 6B, the total proportion of EAB reached 57.0% in AD-FPMEC, which was much higher than those obtained in AD-FMEC (31.3%) and AD-PMEC (42.1%). Additionally, two homo-acetogens, Acetobacterium and Acetoanaerobium, were promoted by electro-stimulation compared with the values detected in the prefermentation step. Although very little methane was detected in each group (Table S4), methanogens were still identified in the WAS samples. The composition and structure of archaea at the genus level are presented in Table S5. The overall abundance of archaea accounted for 0.02–1.18% in the eight sludge samples. Methanosaeta (acetotrophic methanogen) was the main methanogen in AD-RWAS (76%) and AD-FWAS (87.5%), whereas Methanobacterium (hydrogenotrophic methanogen) was the preponderant genus in AD-PWAS (63.6%) and AD-FPWAS (58.82%). In the bioelectrolysis step, the proportion of Methanosaeta decreased, and Methanocorpusculum appeared. Methanocorpusculum has also been reported to be a typical hydrogenotrophic methanogen. Although the occurrence of hydrogenotrophic methanogen may lead to the loss of some hydrogen through methanogenesis (Liu et al., 2016), the influences exerted by the low abundance of archaeal sludge samples could be ignored."
13,CCA and MENs analysis of the key microbiome,"3.6 CCA and MENs analysis of the key microbiome The relationship between process variables and microbial populations was revealed by CCA analysis. VFAs and HAc showed positive correlations for axis 1 (representing 63.4% of the variance), while all the environmental variables, except methane production, were positively related to axis 2 (explaining 24.3% of the variance) (Fig. 6C). Detailed information is provided in Table S6. VFA production was closely correlated with soluble proteins and carbohydrates according to their small angles (<90°), implying that the hydrolysis process was the basis of acidification. The accumulation of soluble organics was mainly attributed to the enrichment of hydrolytic bacteria. Furthermore, dominant acid-producing bacteria, such as Acinetobacter, Citrobacter and Sedimentibacter, gathered along the positive direction of axis 1 and contributed to VFA production. Two homo-acetogens, Acetobacterium and Acetoanaerobium, were closely related to hydrogen. Moreover, the current was strongly associated with hydrogen, which indicated the effective transfer of protons and electrons in the solution and at the electrodes. It was apparent that EABs, including Geobacter, Pseudomonas, Shewanella and Desulfovibrio, played vital roles in the generation of hydrogen and current. Methanocorpusculum is also related to hydrogen due to its function of converting hydrogen to methane. The overall MENs of the key microbiomes in the prefermentation and MEC steps are shown in Fig. S7. Based on the network size (OTU numbers) and total links of functional consortia, the network complexity of the MEC samples was higher than that of the prefermentative samples. Specifically, the MEC samples had a higher averaged connectivity (7.83), shorter averaged path distance (3.59) and less modularity (0.41) than the prefermentative samples (Table S7). To further explore the complex biological relationships (i.e., co-existence or competition) among the key microbiomes, two subnetworks were constructed (Fig. 7 ). Obvious positive correlations were observed among AFBs in the prefermentative samples (Fig. 7A). For example, Proteiniclasticum (OTU149) was positively related to Sedimentibacter (OTU60 and 39), Anaerovorax (OTU439) and Pseudomonas (OTU253). A positive correlation was also observed among Macellibacteroides (OTU579), Petrimonas (OTU15 and 19), Sedimentibacter (OTU39) and Bacteroides (OTU119). This result indicated similar symbiotic and underlying cooperative relationships between fermenters, which promoted hydrolysis and acidification. Regarding NRB, Diaphorobacter (OTU695), which can utilize various organics to accomplish denitrification, was positively related to Sedimentibacter (OTU147), Petrimonas (OTU15 and 19) and Macellibacteroides (OTU579). Nevertheless, Comamonas (OTU160), another NRB, was negatively correlated with several AFBs, including Macellibacteroides (OTU579 and 162), Citrobacter (OTU29), Bacteroides (OTU119) and Klebsiella (OTU28). This result indicated their potential competitive relationships. During the bioelectrolysis step, EAB, homo-acetogens and hydrogenotrophic methanogens were promoted. Geobacter (OTU24) showed a positive correlation with two AFBs, Rhodobacter (OTU326) and Lentimicrobium (OTU13 and 18). Pseudomonas (OTU4) was positively related to Proteiniclasticum (OTU909) and Desulfovibrio (OTU38). This result implied an analogical ecological niche or symbiosis between EAB and AFB, accelerating a “generation-consumption” pattern of organics to further promote electron transfer and hydrogen production. Desulfovibrio (OTU88) shared a negative relationship with Macellibacteroide (OTU30), Terrimonas (OTU780) and Sedimentibacter (OTU361), signifying a possible competing relationship. Regarding homo-acetogens, Acetobacterium (OTU25), displayed positive correlations with two AFBs, Proteiniclasticum (OTU909) and Macellibacteroides (OTU579), as well as the EAB Pseudomonas (OTU4), suggesting mutualistic symbiotic and cooperative interactions among homo-acetogens, AFB and EAB that enhanced the cascading utilization of organics through direct or indirect electron respiration from the electrode or intraspecies and interspecies electron transfer processes (Nagarajan et al., 2013). Regarding methanogens, Methanobacterium (OTU5 and 670) displayed positive correlations with Rhodobacter (OTU326) and Acinetobacter (OTU1810), respectively, suggesting potential niche division. Hydrogenotrophic methanogens, including Methanocorpusculum (OTU9) and Methanobacterium (OTU22), may have an underlying syntrophic relationship with Geobacter (OTU10, 316 and 152). The same phenomenon was found for Methanobacterium (OTU144) and Desulfovibrio (OTU306), while these genera exhibited a negative relationship with Shewanella (OTU776), indicating niche separation among these genera. Additionally, some OTUs from the same genus (e.g., OTU258 and 909 from Proteiniclasticum and OTU780 and 860 from Terrimonas) exhibited opposite correlations with Acetobacterium (OTU300), indicating a possible exclusion mechanism or niche partitioning among versatile genera (Lin et al., 2019)."
14,Perspectives,"3.7 Perspectives With the development of city population and the increased quantity of treated wastewater, it will be keeping increasing on the amount of WAS production from WWTPs. However, safe disposal and efficient treatment of the WAS are still lacking for many plants (Lu et al., 2019). Energy consumption and resource recovery through anaerobic digestion will be fully characterised in a life-cycle assessment (Foley et al., 2010). The flows of chemical and energy input have to be considered to fulfil deep sludge utilization (Batstone et al., 2015). Considering the low hydrogen conversion from WAS due to the enmeshment of organics by EPS matrix and microbial cells, this work innovatively proposes the co-pretreatment of FNA and PAA for accelerating organics transformation from WAS to hydrogen in prefermentation-bioelectrolysis cascading system. Especially, the introduced PAA can assist with FNA to prompt EPS decomposition from WAS. The conceptual scheme of enhanced hydrogen recovery from cascading treatment of WAS accelerated by FNA + PAA co-pretreatment was illustrated in Fig. 8 . The co-pretreatment has the synergetic effect on EPS decomposition and organics release without any residuals (NO2 −-N, PAA or H2O2). FNA can be generated in situ as a byproduct from anaerobic digestion liquor (Law et al., 2015). Based on the price of PAA (12%, 1100–1200 €/t) (Luukkonen et al., 2015), 100 mg/g VSS would cost 9.2–10 €/m3 (assuming a VSS of 10 g/L) or 184–200 €/t dry solids (98% moisture content). As the pivotal WAS treatment process, prefermentation-electrolysis system shows the great superiority with the short treatment time (8 d), high hydrogen recovery (10.8 ± 0.3 mg H2/g VSS) and current density (6.3 A/m2) compared with sole AD or MEC process. Beegle et al. pointed out AD-MEC is more suitable for wastewater treatment than AD or MEC, on the premise of moderate capital cost, operation and maintenance and high revenue potential (Beegle and Borole, 2018). Although the application of MEC in large-scale is still facing some challenges (i.e., material costs and external energy input) (Wang et al., 2019c, 2020), various efforts have made to accomplish the process economically feasible. Escapa et al. estimated that MEC would be economically feasible under the current density of 5 A/m2 with the capital expense of 1220 €/m3-anode (Escapa et al., 2012). Aiken et al. proposed that the target current density of 2–3 A/m2 may accomplish break-even if reducing relative materials cost of 90% such as electrodes and current collector (Aiken et al., 2019). Based on the current density (6.3 A/m2) obtained in this study, the prefermentation-bioelectrolysis system would be economically feasible for the future implement, and can be further improved by several aspects, like employing cheaper cathode materials (e.g., stainless steel, nickel-or MoS2-based cathodes), upgrading the reactor scale and exploring cost-effective route for higher current density. Additionally, our previous study found that the cascading system is effective for organic phosphorus release; that is, a high content of N and P in the effluent could be further recovered as bio-fertilizer, e.g., struvite and vivianite, which could provide additional economic incentive (Zhou et al., 2019). Ultimately, lower disposal and transfer costs would be required for the handling of residual sludge due to the efficient degradation of WAS during the cascading system."
15,Conclusions,"This work offers an innovative approach for accelerating EPS decomposition and hydrogen recovery from WAS via PAA and FNA co-pretreatment in a prefermentation-MEC cascading system. The major conclusions include the following: (1) PAA, FNA and their intermediates, i.e., •NO, •NO2, N2O3, N2O4, ONOO−/ONOOH, •OH and •O2 −, contributed to effective EPS decomposition and WAS disintegration. (2) Co-pretreatment improved VFA accumulation (1.2- to 2.5-fold that of sole pretreatment) in the prefermentation step and the utilization of organics to produce hydrogen (1.4- to 1.7-fold that of sole pretreatment) in the bioelectrolysis step. (3) XPS analysis confirmed that co-pretreatment destroyed the phospholipid bilayer of the cytomembrane and accelerated the transformation from macromolecular organics to amide, carboxylate and carbonyl groups. (4) MiSeq sequencing showed that co-pretreatment stimulated the enrichment of AFB (28.1%) and EAB (57.0%) in the prefermentation and bioelectrolysis steps, respectively. (5) CCA and MENs revealed the intrinsic correlation between the functional microbiome and environmental factors as well as the interrelation among AFB, homo-acetogens, NRB, EAB and methanogens."
