,sections,Text
0,Introduction,"The research into the synthesis of methanol and higher alcohols from syngas (H2/CO) has been thoroughly developed during the 1930–1945s. Mixed alcohols are an octane booster for clean gasoline. Indeed, higher alcohols could be added to gasoline in all proportions and make them miscible under a broad range of operating temperature. Since both tetraethyl lead and short ether compounds (MTBE, ETBE, etc.) were banned as gasoline octane improvers in North America, mixed alcohols have been used as additives for reformulated gasoline and their demand has recently undergone in an impressive growth [1,2]. Up to now, the synthesis of higher alcohols from syngas is an interesting subject for both industrial application and fundamental research. This synthesis usually requires a complex composition catalyst working in severe conditions and produces a mixture of either branched or linear primary alcohols ranging from methanol to hexanol [3,4]. Based on the product distribution, two main types of higher alcohol synthesis catalysts have been reported [5,6]. The first type was established primarily from either high-temperature–pressure Zn-Cr-based catalysts or low-temperature–pressure (Cu-Zn-Al/Cr) methanol synthesis catalysts. The addition of alkali promoters into such systems significantly enhances the selectivity towards higher branched-alcohols [7–12]. Thus, the formation of higher alcohols in this case is generally assumed to be a combination of hydrogenation and carbon–carbon bond formation via aldol condensation of lower alcoholic intermediates and/or oxygenated compounds [13–17]. In this case, among C2 +-alcohols, isobutanol (2-methyl-1-propanol) is always formed as a major branched product because it lacks the two α-hydrogens required for the successive aldol-condensation-chain growth steps [8,18,19]. As a result, this category mainly produces methanol and branched-alcohol products which therefore do not follow a classical Anderson–Schulz–Flory (ASF) product distribution. In contrast, the second type developed from Fischer–Tropsch (FT) and the VI–VIII metal-based catalysts yields a series of linear primary alcohols and gaseous hydrocarbons both with ASF carbon number distribution [4–6,20–26]. Table 1 summarized a series of typical performances established experimentally for selected representative catalysts. This selection of literature data was made for experiments conducted in conditions close to the ones in this work in order to allow some comparisons with our proposed catalyst. As seen from Table 1, modified Fischer–Tropsch catalysts (for example, catalysts # 5–7 in Table 1) produce a mixture of straight alcohols in addition to hydrocarbons and carbon dioxide [20–23,25]. Molybdenum sulfide catalyst (MoS2) promoted with alkali (for example, # 8) also yields a homolog of linear primary alcohols, hydrocarbons [26,30] while Rh-based catalysts (Rh-Mn/SiO2, LaRhO3, # 9) tend to be more selective for C2-oxygenates (alcohols and aldehydes), methane, CO2 [31,32]. Like some modified methanol synthesis catalysts, the modified FT catalysts (# 5–7) show a better selectivity to higher alcohols if a proper amount of alkali promoter is introduced. Both mentioned types of higher alcohol synthesis catalysts are rather active for the water–gas-shift (WGS) reaction and for methanation. A high selectivity to linear primary alcohols is achievable if the catalyst surface contains CO dissociating sites in the vicinity of non-dissociating sites [6,21–23]. Therefore, it is suggested that for all alcohol synthesis catalysts, the transition metals distributed in the crystal structure (e.g., spinel, perovskite) of oxide precursors may be very highly dispersed after being reduced under hydrogen atmosphere [6,21,31,33–34]. Among transition metals, cobalt is known to be very active for the Fischer–Tropsch synthesis while copper tends to form methanol and other alcohols [20,21,34,35]. This leads to the assumption that a Co-Cu mixed oxide with a definite structure such as perovskite or spinel could be a promising catalytic material for conversion of syngas (H2/CO) into alcohols and hydrocarbons [25,31,33,36–38]. Accordingly, one might expect that a close contact between cobalt and copper phases may yield an active component for higher alcohol synthesis. By this way, a variety of perovskite systems prepared by conventional methods have been applied in CO hydrogenation in an effort to produce higher alcohols from syngas [31,33,39]. However, such materials have some limitations for this synthesis because their specific surface area is always rather low [33]. In previous studies [40,41], we have reported the reduced Co-Cu metals from nanocrystalline perovskites prepared by mechano-synthesis, acting as catalysts for the synthesis of higher alcohols and hydrocarbons from syngas. A small amount of residual alkali introduced during catalyst preparation has significant effects on alcohol productivity and selectivity [41]. This article is to further optimize the catalyst composition of Co-Cu-based perovskites, preparation, and reaction conditions for the synthesis of higher alcohols from syngas."
1,Experimental,
2,Perovskite precursor preparation,"2.1 Perovskite precursor preparation LaCo0.7Cu0.3O3−δ perovskite-type mixed oxide (GM) was synthesized by the reactive grinding method also designated as mechano-synthesis in literature [40–43]. The stoichiometric proportions of commercial lanthanum, copper, and cobalt oxides (99%, Aldrich) were mixed together with three hardened steel balls (diameter=11mm) in a hardened steel crucible (50ml). A SPEX high-energy ball mill working at 1000rpm was used for mechano-synthesis. Milling was carried out for 8h prior to a second milling step with an alkali additive. Then, the resulting powder was mixed to 50% sodium chloride (99.9%) and further milled under the same conditions for 12h before washing the additives with distilled water. A sample was added into a beaker containing 1200ml water and stirred by magnetic stirring for 90min prior to being sedimented for 3–5h. After the clean water is removed, the slurry was dried in oven at 60–80°C before calcination at 250°C for 150min. A reference sample without any alkali promoter, LaCo0.7Cu0.3O3−δ designated as CIT, was prepared by thermal decomposition of the corresponding amorphous citrate precursor [33,43]: a stoichiometric amount of La(NO3)3 was added into distilled water while slowly heating the mixture on a magnetic stirrer. After a clear transparent solution was obtained, stoichiometric amounts of cobalt and copper nitrates were added. Then 1mole of citric acid per mole of metal atom was added to the dark pink/red translucent solution. The resulting solution was heated slowly to dryness and then dehydrated at 100–120°C overnight in a vacuum oven, yielding an amorphous solid precursor. The sample was calcined at 800°C for 6h with a ramp of 3°C/min under air."
3,Characterization,"2.2 Characterization The chemical analysis (Co, Cu, Na) of the perovskites and the residual impurities was performed by atomic absorption spectroscopy using a Perkin-Elmer 1100B spectrometer. Prior to each analysis, a weighed amount of sample was digested in a 10% HCl solution at 60–70°C overnight. The specific surface area of all obtained samples was determined from nitrogen adsorption equilibrium isotherms at −196°C measured using an automated gas sorption system (NOVA 2000; Quantachrome). Three hundred to five hundred milligram of each sample was degassed at 200°C for 6–7h in order to remove the humidity prior to N2 adsorption measurements. Phase analysis and particle size determination were performed by powder X-ray diffraction (XRD) using a SIEMENS D5000 diffractometer with Cu Kα radiation (λ =1.54059nm). Bragg's angles between 20° and 60° were collected at a rate of 1°min−1. Average crystal domain sizes (D) were evaluated by means of the Debye-Scherrer equation D = Kλ/β cos θ after Warren's correction for instrumental broadening. SEM images were recorded using a JEOL JSM-840 electron microscope with magnification of 25,000. The acceleration voltage was 10kV. The samples were dispersed on an aluminum stub and coated with Au//Pt film. Elemental analysis was performed using an X-ray fluorescence spectrometer (Bruker-AXS) at 15kV beam voltage. Temperature-programmed reduction (TPR) experiments were carried out using a multifunctional catalyst testing and characterization apparatus (RXM-100 from Advanced Scientific Designs, Inc.). The reactor was connected to a thermal conductivity detector (TCD). Prior to each TPR analysis, a 50mg sample was calcined at 500°C for 90min under flowing 20% O2/He (20ml/min, ramp 5°C/min). The sample was then cooled down to room temperature under flowing pure He (20ml/min). TPR of the catalyst was then carried out by ramping under 4.65vol.% of H2/Ar (20ml/min) from room temperature up to 800°C (5°C/min). The hydrogen consumption was determined using a TCD with a reference gas of same composition as the reducing gas (H2/Ar). The effluent gas was passed through a cold trap (dry ice/ethanol) in order to remove water prior to detection."
4,Catalytic test,"2.3 Catalytic test The catalytic tests were carried out in a stainless-steel continuous flow fixed-bed micro-reactor (BTRS-Jr PC, Autoclave Engineers). The reaction pressure was controlled using a back-pressure regulator. The syngas mixture (H2/CO=2/1, Praxair) was supplied from a pressurized manifold via individual mass flow controllers. The catalyst pellet size was 40–60 mesh. Catalysts were pretreated in situ under flowing 5vol.% of H2/Ar (20ml/min) prior to each reaction test. The temperature was kept at 250°C (3h) and 500°C (3h) with a ramp of 2°C/min. Then, the reactor was cooled down to the reaction temperature while pressure was increased to 1000psi by feeding inert gas before switching to the reaction mixture. The GHSV was set at 5000h−1 unless otherwise stated. Butane/helium (4.98vol.%) was used as an internal calibration standard. The products were analyzed using a gas chromatograph equipped with two capillary columns and an automated online gas-sampling valve maintained at 170°C. The temperature of transfer line between the reactor and the valves was kept at 220°C in order to avoid any product condensation. Carbon monoxide and carbon dioxide were separated using a capillary column (Carboxen™ 1006 PLOT, 30m×0.53mm) connected to the TCD. Quantitative analysis of all organic products was carried out using the second capillary column (Wcot fused silica, 60m×0.53mm, Coating Cp-Sil 5CB, DF=5.00μm) connected to a FID detector (Varian CP-3800) and mass spectrometer (Varian Saturn 2200 GC/MS/MS). The selectivity to a given product is defined as its weight percent with respect to all products excluding CO2 and water. Productivity is defined here as a weight (mg) product per gram of catalyst per hour."
5,Results,
6,Characterization,"3.1 Characterization Table 2 summarizes some physical properties of the LaCo0.7Cu0.3O3 samples prepared by the two different methods. As compared with the conventional citrate method [33], mechano-synthesis always produces nanocrystalline perovskites having higher specific surface area, in agreement with several results reported earlier [40,41]. XRD patterns are presented in Fig. 1 . The ground perovskite sample without any washing (Fig. 1a) shows some strong reflections of NaCl additives in addition to those of perovskite. After leaching, no clear lines corresponding to NaCl are observed in spite of a small amount of additive being detected from AAS (Table 2). The other samples have essentially perovskite structure as compared with JCPDS data (Card Nos. 48-0123 and 81-2124). For sample CIT, two minor peaks at 35.7° and 38.9° ascribed to CuO crystals (Card No. 45-0937) appear, indicating the presence of a small amount of copper oxides. Fig. 2A and B shows the very significant difference in topography between the two studied samples (GM and CIT). The SEM photograph of sample CIT shows a foam-like phase with a nonporous structure while that of sample GM presents a micro-porous structure of primary particles with pore diameter of ∼18nm (Table 2), in agreement with previous observations [40,43]. The crystal domain sizes calculated by the Scherrer equation from XRD line broadening are about 9–10nm for the ground perovskite sample. As reported earlier in Refs. [40–42], the introduction of a grinding additive during the second milling step resulted in the partial separation of the crystalline domains, leading to an increased surface area and a decreased volume of grain boundaries. Therefore, this process of catalyst preparation has affected the specific surface area by changing the internal porosity of agglomerates. In this case, the porous system of ground perovskite (GM) is presumably constituted of slit-shaped spaces between primary nanoparticles. These differences in the catalyst morphology account for the difference in physical properties and catalytic activity between the two samples, GM and CIT."
7,H2-TPR,"3.2 H2-TPR In order to shed light on the reducibility of Co-Cu-based perovskites, temperature-programmed reduction was carried out from room temperature to 800°C. Fig. 3 shows such H2-TPR curves for both samples. Two main peaks are observed in the temperature range of 180–750°C. For sample CIT, the small shoulder at 220°C which is observed at a higher temperature for sample GM, is attributed to the reduction of a tiny amount of extra-perovskite framework copper as indicated by X-ray diffraction (Fig. 1). According to the calculation of H2 balance, the first sharp peak with maxima at 275, 357°C for samples CIT, GM, respectively, is ascribed to the two successive reductions of intra-perovskite lattice Cu2+ and Co3+ to Cu0 and Co2+, respectively, though a minor amount of Co0 formed in the case of sample (GM) under these conditions is not ruled out [40,41,43]. In order to verify this stage of reduction, both samples were collected at the end of the first reduction peak (350 and 400°C for CIT, GM samples followed by sintering at 325 and 375°C, respectively, in He for 90min) and their XRD spectra were recorded. The sintering was made here in order to enhance the metal diffraction peaks that are very low with highly dispersed metals [40]. Fig. 4 shows these spectra and the two typical reflections of copper at 2θ =43.32° and 50.34° (JCPDS card No. 04-0836) for both samples studied. Under these reduction conditions, the perovskite framework is still preserved although a strong modification in structure is observed. Accordingly, the reduced metallic copper along with Co2+ ions are assumed to be atomically dispersed in the perovskite at the end of the first reduction process (Cu2+/Cu0 and Co3+/Co2+) [40,43]. The further reduction of Co2+ to Co0 requires an essentially higher temperature [40,41,44]. Therefore, the second peak is definitely assigned to the reduction of the remaining cobalt ions. In the case of ground perovskite, this broad peak from 400 to 650°C is resulting from the reduction of cobalt ions at different locations and coordination numbers [41,44]. Moreover, H2-TPR results also indicate that cobalt ions in La-Co-Cu perovskite lattice are more reducible than those in Co-based perovskites (not shown here) [40,41,44]. The reduced copper promotes the reduction of cobalt, apparently by providing hydrogen dissociation sites [40,45]. H2-TPR studies also indicate that the presence of sodium additive inhibits the reduction of Cu2+ and Co3+ during H2 pretreatment (Fig. 3) [41]. This phenomenon is explained by the inhibition of H2 activation and by the blockage of copper/cobalt sites by the residual sodium ions [41,44,45]. Under hydrogen pretreatment, the perovskite was strongly depleted in Cu and Co, yielding finely divided Co-Cu clusters as observed from the SEM photograph (Fig. 2C). The average particle size in the pretreated sample GM (Fig. 2C) is significantly smaller than that in the parent one (Fig. 2A). This is in good agreement with the XRD studies of the reduction of LaCoCuO3 reported previously [40]."
