,sections,Text
7,Zr-MOFs/metal sulfide,"3.3 Zr-MOFs/metal sulfide Great progress has been made in photocatalytic removal of organic pollutants by Zr-MOFs/metal oxides systems. However, most of these composites are large band gap and low conduction band which restricted their application for energy production [122]. To solve this problem, metal sulfides, one of traditional semiconductor materials such as CdS, In2S3, ZnIn2S4 etc, has attracted widespread attention owing to their superior photoelectric properties [123,124]. Furthermore, due to the adjustable structure and thermochemical stability of Zr-MOFs, metal sulfides combined with Zr-MOFs can synthesize new photocatalytic materials with higher catalysis properties and stability [115]. So far, many Zr-MOFs/metal sulfide heterogeneous materials have been of great significance for photocatalytic environmental remediation and energy production under visible light irradiation [125-137]. Most of them presented the performance of photocatalytic energy production (H2 evolution and CO2 reduction), which is one aspect that Zr-MOFs/metal sulfides are better than Zr-MOFs/metal oxides. For example, MoS2 nanosheets modified UiO-66-(COOH)2/ZnIn2S4 heterogeneous materials was designed by a simple hydrothermal methods [129] (Fig. 23 f). The pristine ZnIn2S4 exhibited as flower-like microspheres (Fig. 23a), and the structure had no apparent change after the incorporation of MoS2 and UiO-66-(COOH)2 (Fig. 23(b-d)). Among the reported Zr-MOF/metal sulfides, this composite presented the highest photocatalytic efficiency for H2 evolution [128,133,134,136,137]. The optimized UiO-66-(COOH)2/MoS2/ZnIn2S4 showed the maximum H2 evolution rate of 18.794 mmol h−1 g−1. The remarkable improvement of photocatalytic activity could be due to the formation of Z-scheme heterojunction improved the redox ability and separation efficiency of e- and h-. In addition, the large surface area of UiO-66-(COOH)2 provided more active sites to adsorbed reactants (Fig. 23g). Overall water splitting has always been a bottleneck in the field of photocatalysis. Photocatalyst should not only be stable in aqueous solution, but also fulfill the thermodynamic requirements of water splitting. In 2020, the photocatalytic water splitting efficiency of Zr-MOF/metal sulfide was studied by Subudhi et al. [130]. The UiO-66-NH2/MoS2 composite was prepared through a facile hydrothermal technique, the fabrication of MoS2 on exposed surface of MOF. The p-n junction heterojunction of UiO-66-NH2/MoS2 was confirmed by UV-DRS and Mott–Schottky analyses. Therefore, the internal electric field generation caused effective separation of e- and h+. When UiO-66-NH2/MoS2 was used as photocatalyst, the optimum yield of H2 and O2 evolution reached 513 μmol/h and 264 μmol/h respectively. These results showed that Zr-MOFs has a broad prospect for photocatalytic energy production by compounding with metal sulfides."
8,Zr-MOFs/metal halides,"3.4 Zr-MOFs/metal halides Metal halide semiconductors have aroused considerable concern because of their excellent light capture capability. Most notably, silver halides AgX (e. g., AgCl, AgBr, AgI) often forms metallic Ag on its surface which produced surface plasmon resonance (SPR) effect. In addition, the emergence of small amount metallic Ag bringing about the transformation from AgX/Zr-MOF type II heterojunction to AgX/Ag/Zr-MOF Z-scheme heterojunction. For instance, Pan et al. [138] constructed AgI/UiO-66-NH2 photocatalyst by an facile ion exchange strategy (Fig. 24 a). Through the immobilized of AgI on the surface of UiO-66-NH2, the photocatalytic tetracycline (TC) degradation of composite enhanced obviously compared to pure UiO-66-NH2. Considering the presence of a small amount of Ag and great photocorrosion inhibition performance of AgI/UiO-66-NH2, the Z-scheme mechanism was suitable in elucidating the charge transfer mechanism (Fig. 24b). The tiny amounts of Ag could be used as the charge transfer bridge of Z-scheme heterojunction and bring SPR effect thus improving the separation efficiency of photogenerated carriers [139]. Other AgX/Zr-MOF, such as AgBr/UiO-66-NH2 [140], AgCl/UiO-66-NH2 [141] were also constructed and they also had similar Z-scheme heterostructures. These works illustrated the great application potential of AgX/Zr-MOF heterogeneous photocatalyst in environment remediation."
9,Zr-MOFs/metal free semiconductors,"3.5 Zr-MOFs/metal free semiconductors As a low cost, easy synthesis, environment friendly nonmetallic semiconductor, graphitic carbon nitride (g-C3N4) has been the focus of intense interest in the field of materials in recent years [142-144]. Because of the narrow band gap and π–π conjugated structures, g-C3N4 has also aroused a lot of interest for photocatalysis [145]. However, the photocatalytic activity of pure g-C3N4 is strictly restricted due to its weak surface adsorption capacity and low light utilization [146]. Zr-MOF has been considered to an ideal material to solved these deficiencies of g-C3N4 due to its strong adsorption. For instance, Zhang et al. [147] designed g-C3N4/UiO-66 nanohybrid via a facile hydrothermal strategy. The visible light driven photodegradation efficiency of the heterogeneous photocatalyst for Rh B was 6.0 and 3.3 times faster than pure g-C3N4 and UiO-66 respectively. The composite displayed strong photocurrent response caused efficient transmission of optically excited electrons between UiO-66 and g-C3N4. Recently, some studies have further explored the photocatalysis of other Zr-MOF/ g-C3N4. In 2020, UiO-66-NH-BT@g-C3N4 heterogeneous materials were synthesized by the benzothiadiazole functionalized Zr-MOF doped with g-C3N4 through a facile step-by-step assembly strategy [148]. Fig. 25 a showed that UiO-66-NH-BT and UiO-66-NH-BT@g-C3N4 possessed an improved absorption for visible light. The photocurrent measurements further determined that benzothiadiazole could efficiently promote the transmission of photogenerated carrier (Fig. 25b). The result of photocatalytic removal of sulfamethoxazole (SMZ) showed the heterogeneous photocatalyst had an excellent degradation efficiency (97.6%) compared with pure UiO-66-NH2 and g-C3N4 also verified the above optical properties. Additionally, the production of an n–n heterojunction boundary between UiO-66-NH-BT and g-C3N4 further enhanced the efficiency of charge transfer (Fig. 25c). In addition to g-C3N4, the heterojunction interaction between other metal free semiconductors and Zr-MOFs has also been reported in recent years. For example, The UIO-66-NH2/GR (graphene) was designed in situ assembly by a microwave-assisted synthesis route. This method made UIO-66-NH2 nanocrystals highly dispersed on GR surface which resulted in highly improved the interaction between GR and UiO-66-NH2 and allowed more active surface for visible light absorption [21]. Zhang et al. [20] prepared a g-C3N4/UiO-66-NH2@CDs ternary photocatalyst by incorporating CDs (Carbon nanodots) into the pores of UiO-66-NH2. This ternary photocatalyst displayed a H2 production rate of 2.930 mmol·g−1·h−1 which was 32 and 39 times higher than that of pure g-C3N4 and UiO-66-NH2, respectively. By combining VB2 (vitamin B2) and UiO-66, the VB2@UiO-66 was prepared though one-step synthesis strategy and displayed highly activity for visible light transformation of benzyl alcohol to benzaldehyde [149]."
10,Zr-MOFs/polyoxometalates,"3.6 Zr-MOFs/polyoxometalates Polyoxometalates (POMs) are soluble anionic metal oxide clusters of d-block transition metals in high oxidation states (e. g. W6+, Mo5+, Mo6+, V4+, V5+) exhibiting specific properties in different fields [150,151]. POMs possess efficient redox characteristics and reversible multi-electrons transformation. However, the low specific area and self-aggregation in solution greatly hindered the catalytic efficiency of original POMs. Researchers around the world are committed to resolve these shortcomings, among which the incorporation of POMs to heterogeneous photocatalysts was widely studied [152,153]. Recently, the successful incorporation of POM into Zr-MOF cavities had been reported. These materials integrated the advantages of Zr-MOF and POM, which has been confirmed to be a novel efficient photocatalyst [154-158]. For example, Parida et al.[155] constructed HPW@UiO-66 composites via a hydrothermal strategy. The composite exhibited outstanding photocatalytic activity of H2 evolution and antibiotic tetracycline hydrochloride degradation which might be attributed to the interaction of Zr–O–W between the metal nodes of UiO-66 and PW12O40 −3, resulting in effective exciton splitting. Furthermore, by introducing a POM ([(PW9O34)2Co4(H2O)2]10−) into the cavities of a Zr-porphyrins MOF (MOF-545), a noble metal-free heterogeneous photosystem, named P2W18Co4@MOF-545 had been constructed [154]. As is shown in Fig. 26 a and Fig. 26b, the side and top views of P2W18Co4@MOF-545 reflected the POM was encapsulated in two Zr6 clusters linked by two porphyrin linkers. The composite was immobilized by a tight hydrogen bonds meshwork on the POM–MOF interface (Fig. 26c). These results determined that the successful combination of the two components. Furthermore, the photocatalytic water oxidation performance of P2W18Co4@MOF-545 was evaluated. The result revealed that the composite displayed excellent activity with a turnover number (per POM) of 70 after 60 min reaction. For comparison, pure MOF-545 did not showed any O2 evolution under same condition (Fig. 26d). The reaction mechanism illustrated in Fig. 26e, the excited TCPP-MOF was produced in the existence of sun light and sacrificial reagents, then the singer electron redox occurred on POMs. After accumulation of this oxidizing essential factors on the POM, water was oxidized to O2."
11,Photocatalysis application of Zr-MOFs,
12,H2 evolution,"4.1 H2 evolution Photocatalytic hydrogen production has been demonstrated as an alternative environmentally method, because it can get clean H2 from water splitting by using solar energy [159]. However, the production of highly active and economic photocatalyst still has some limitations [35]. To date, various light-harvesting materials for hydrogen production have been reported, for example, metal sulfide, metal oxide and nitride semiconductors. Recently, because of its excellent surface adsorption properties, modified crystalline structures, tunable band-gap, and controlled chemistry and functionality, MOFs have been studied for photocatalytic H2 evolution [160-162]. However, due to the weak visible light utilization, instability in aqueous solution and high recombination possibility of electron and hole for most of MOFs, the H2 production efficiency remains low. It’s even harder to build an effective structure on MOFs to overcome the shortcoming and improve the H2 production activities. Despite some water stable MOFs such as Zr-MOFs was constructed and several functional ligands or dye sensitizing system were introduced to enhance the light visible adsorption of MOFs, the first two problems were solved to some extent. However, the recombination of photogenerated e- and h+ still remain as a big obstacle to the development of Zr-MOFs for H2 evolution. Since Silva open the door that use Zr-MOF applied to the field of H2 evolution under the UV light, more and more researchers are looking for methods expand the light range from UV to visible region. Herein, the photocatalytic H2 production activity of Zr-MOFs based systems are summarized in Table 2 . It isimportanttonotethat the H2 evolution ability of pure Zr-MOFs are poor due to their broad bandgap [163]. However, Zr-MOFs can be combined with other components with high photocatalytic efficiency by synergistic effect. In addition, Zr-MOFs display excellent stability could improve the stability and recovery of the composites. Among the reported methods, Zr-MOF/noble metal NPs showed excellent photocatalytic performance for H2 evolution (Table 2). However, because of exorbitant cost and scarcity, the production and application of metal NPs are limited. Recently, metal sulfides have been considered as qualified substitutions of precious metals owing to their outstanding light absorption capacity and electrical properties. As illustrated in table 2, the productivity of Zr-MOF/metal sulfide for H2 evolution is close to that of Zr-MOF/metal NPs. Furthermore, the ternary light harvesting system also attracted the attention. For example, Hao et al. [164] constructed MoS2 QDs/UiO-66-NH2/Graphene composite though a simple solvothermal method and the optimum visible light driven activity of MoS2 QDs/UiO-66-NH2/Graphene for H2 evolution reached 62.1 μmol h−1. The excellent catalytic performance was attributed to the high specific surface area of UiO-66-NH2/Graphene which supported the formation of MoS2 QDs. The introduction of MoS2 QDs increased the generation and migration efficiency of photogenerated carriers. Hou et al. [165] successfully fricated UiO-66-NH2@Au@CdS photocatalyst via a hydrothermal process. By comparing the production of H2, Z-scheme UiO-66-NH2@Au@CdS exhibited higher photocatalytic activity for H2 production with the rate rose to 39.5 μmol h−1. In the photocatalyst system based on Zr-MOFs, Zr-MOFs provides attachment space for active components and effectively reducing the particle size and increasing the dispersion of this components. In addition, the formation of heterojunction in Zr-MOF photocatalyst system successfully extended the lifetime of photogenerated charge carriers and improved the utilization of visible light of Zr-MOFs. Photogenerated electrons are collected to decreased the adsorbed H to evolved H2, finally, the yield of H2 increased significantly (Fig. 27 )."
13,CO2 reduction,"4.2 CO2 reduction Excessive carbon dioxide (CO2) emissions caused numerous environment issues such as seawater acidification and greenhouse effect. Photocatalytic reduction of CO2 to carbon-based supplies (e.g., CO, CH4, CH3OH, etc.) is one of crucial way to resolve energy shortage as well as a strategy of alleviation the increasing amount of CO2 [22,169,170]. In particular, the conversion of CO2 by solar energy obtained great attention due to the economy and renewability [171]. So far, some studies have focused on CO2 photoreduction, including homogeneous transition metal-based complexes and semiconductor materials. However, due to the high cost, these method are still challenging [55]. Zr-MOFs could be an ideal candidate due to their structural adaptivity, flexibility and high CO2 capture capacity [172-175]. On the one hand, they can act as photocatalysts themselves, using open metal sites, unsaturated metal centers and organic ligands with visible light photocatalytic activity. Furthermore, Zr-MOFs can behave as semiconductors to form heterojunction by doping other semiconductors. The recent significant progresses of Zr-MOF based systems in the photocatalytic CO2 reduction have been summarized in this section and Table 3 . By introducing appropriate light harvested components, Zr-MOFs can adjust their photochemical properties to achieve light capture. Furthermore, Zr-MOF has been determined a promising material due to its high CO2 capture capacity and semiconductor-like behaviors with many reactive metal sites [21]. Table 3 has presented the Zr-MOFs with good photocatalytic CO2 reduction effect reported in recent years. For example, in 2020, Cheng and co-workers [176] designed UiO-66-NH2-tpy catalyst for photocatalytic CO2 reduction. 2,4,6tris(4-pyridyl)pyridine (tpy) possessed great electron donating ability and promoted the conversion of CO2, The tpy modified NH2-UiO-66 exhibited great enhanced visible light driven photocatalytic CO2 revolution (184.03 μmol·g−1·h−1) which was 5 times higher than pure Zr-MOF. Liu et al. [55] designed a novel Zr-porphyrin MOF (Rh-PMOF-1(Zr)) by self-assembly of Rh(TCPP)Cl ligand with ZrCl4 (Table 1). Without the addition of photosensitizer, Rh-PMOF-1 significantly catalyzed CO2 conversion into formate anion with up to 99% selectivity. In the reported Zr-MOFs in this paper, AUBM-4 showed highest conversion rate for CO2 to HCOOH which reached 366 μmol·g−1·h−1 due to the long lifetime of excited Ru(cptpy)2 group and the fast charge transfer between metal and ligands [48]. Normally, photosensitive organic ligands generate excited state elements and photogenerated electrons under visible light. The excited ligands could directly convert CO2 to carbon-based fuel while the photogenerated electrons sensitize the Zr-O cluster and reduced CO2 near the Zr-O cluster (Fig. 28 ). Another way to enhance the light driven CO2 reduction rate of Zr-MOFs is to form heterojunction by hybridizing with other semiconductors. For example, Wang et al. [177] constructed Cu2O@Cu@UiO-66-NH2 heterogeneous photocatalyst through a facile hydrothermal method for efficient CO2 conversion. Benefiting from the p–n junctions of the heterogeneous photocatalyst, the yields of CH4 and CO reached to 8.3 and 20.9 μmol g−1h−1. GR/UiO-66-NH2 was prepared though a microwave-assisted strategy [21]. The results showed that the HCOOH evolution rate of heterogeneous catalyst reached 443.75 μmol g−1h−1, it was 11 times higher than that of pure Zr-MOF."
14,Removal of organic pollutants,"4.3 Removal of organic pollutants Recently, researchers have done a lot of researches on removal of organic pollutants and pointed out that photocatalytic process is an effective strategy [12,179-183]. Since Garcia et al. [184] firstly determined that MOF-5 served as a photocatalyst with outstanding activity in the removal of organic pollutants, more and more MOF materials have been used in photocatalysis (e.g., MIL-53, MIL-68, TMU and JUC-138) [185-188]. Zr-MOFs exhibit superior thermal and chemical stability to water, which make it as an ideal material for photocatalytic removal of organic pollutants. Herein, the photocatalytic removal of organic pollutants of Zr-MOF systems was summarized in Table 4 . In recent years, pure Zr-MOF has been extensively reported as a visible light driven photocatalyst for organic pollutants removal. For example, DUT-67(Zr) was constructed for selective oxidation of thioanisole [49]. He et al. [87] proposed the incorporation of Ti in Zr-porphyrins MOFs via a simple PSM process and used as a photocatalyst for the removal of MB. Although Zr-MOFs has been determined to be capable of degrading organic pollutants, the degradation efficiency is still very low. Recently, the preparation of Zr-MOF based composites has made significant progress for the removal of organic pollutants (Table 4). For example, Tong et al. [25] successfully synthesized the BiOCl/UiO-66 composite to degrade RhB by simple hydrothermal method. Under visible light irradiation, compared with pure BiOCl(28.31%) and UiO-66(14.55%), the hybrid material displayed obviously higher photocatalytic activity on Rh B degradation with the degradation rate of 97.34% after 2 h under LED light irradiation. The reason was explained as that, the two materials were bonded together by chemical bonds(C-Cl), due to these changes, the composite had good adsorption of RhB and could realize effective electron transfer in hybrid materials. Ding et al. [23] constructed UiO-66/Bi2MoO6 photocatalyst for degradation of RhB by a self-assembly method. The participation of Bi2MoO6 improved the response range of visible light and the existence of UiO-66 promote the adsorption and diffusion of RhB on it. The results of photocatalytic experiment showed that the Bi2MoO6/UiO-66 composites displayed enhanced photodegradation efficiency. In addition to organic dyes, there are some studies on the removal of other organic substances in water by Zr-MOFs system. For example, Yao et al. [24] prepared TiO2@MOF nanocomposites by the introduction of TiO2 within UiO-66-NH2 and applied to VOCs (volatile organic compounds) purification. The removal rate of VOCs reached 90% in 80 min. Li et al. [189] synthesized a series of UiO-66/BiOI heterojunction photocatalysts via a simple hydrothermal process and applied to the photodegradation of salicylic acid. The degradation efficiency up to 90% in 2 h under the irradiation of visible light. Wang and co-workers [190] constructed AgI/UiO-66 mixture and made great progress in degradation of sulfamethoxazole under LED light irradiation. Within 20 min, the contamination was almost completely removed."
15,Hexavalent chromium reduction,"4.4 Hexavalent chromium reduction Hexavalent chromium (Cr (VI)) has been widely applied in many fields such as leather tanning, paint, paper, printing and electroplate [194-196]. However, Cr (VI) mainly discharged into the environment through industrial wastewater which is a serious threat to human beings due to its carcinogenicity and mutagenicity [197]. Therefore, the efficient degradation of Cr from high toxicity hexavalent chromium form to low valent chromium with low toxicity is extremely crucial for environmental protection. Due to the high porosity, tunable surface functionalities and chemical stability, Zr-MOF materials are extremely important to eliminate Cr (VI) from wastewater. Recent examples of Zr-MOF and its complexes for the removal of Cr (VI) are given in Table 5 and the applications of Zr-MOFs based system for hexavalent chromium reduction are introduced in this chapter. The pure Zr-MOFs possess absorb and remove ability for Cr (VI) because of their adsorption and semiconductor properties [198]. Under visible light, Zr–O clusters acted as catalytic active sites for Cr(VI) reduction, organic ligands were excited to produce photogenerated electrons and adsorb the generated Cr(III) (Fig. 29 ). The redox reaction occurred as follows: (1) Cr2O7 2− + 14H+ + 6e− → 2Cr3+ + 7H2O (2) 2H2O + 2 h+ → H2O2 + 2H+ For instance, Wang et al. [199] prepared UiO-66-OH and UiO-66-(OH)2 for removal of Cr(Ⅵ) via a modified solvothermal approach. The –OH functional group in Zr-MOF are not only a reductive site for efficient Cr(Ⅵ) removal, but also serve as pivot point for capturing Cr(III). The electrostatic attraction between Cr(VI) and organic ligands of MOFs played an important role. Du et al. [200] constructed UiO-66-NH2(Zr/Hf) membrane through a reactive seeding method. The membrane exhibited excellent photocatalytic activity to reduce Cr(VI) and easily separate them from the treated wastewater under visible light irradiation. After 20 cycles, the membrane still maintained over 94% degradation efficiency due to its excellent chemical stability and water stability. Liu et al. [56] synthesized a new Zr-porphyrin MOF, JLU-MOF60 ([Zr6O4(OH)8(H2O)4(TCPP)4]·9DMF·3.5H2O) by a facile hydrothermal reaction (Table 1). This new framework displayed excellent photodegradation performance for Cr(VI), the degradation efficiency reached 98% under the irradiation of visible light. Additionally, The Zr-MOF based heterogeneous photocatalyst also exhibited great photocatalytic degradation performance for Cr(VI), and these complexes were listed in Table 5."
