,sections,Text
3,Post synthesis modified of photosensitive Zr-MOFs,"2.2 Post synthesis modified of photosensitive Zr-MOFs PSM is an important method to produce new functionalized MOFs. The pre-synthesized functional units (metal center or organic ligands) lead into the synthetic tunability and modularity of MOFs might result in interesting structures with the desired characteristics. In particular, the ability to encapsulate photo-active molecules and catalytically active molecular species within the confined nano spaces of MOFs affords the opportunity to construct powerful solar energy conversion systems [70]. In addition, the stability of these new MOF materials in aqueous solution and high temperature environment is an important factor to be considered. In this case, it has been widely reported that new photocatalytic materials prepared by post synthetic modification of photoactive molecules embedded in Zr-MOFs. According to the different synthetic sites on Zr-MOF, it can be divided into three types: covalent linking of functional groups, postsynthetic photoactive ligands and postsynthetic exchange of metal center (Fig. 9 ). 2.2.1 Covalent linking of functional groups The reaction based on the covalent Linking with pendant functional groups of Zr-MOFs has been widely reported by PSM method (Fig. 8a), such as amine groups, azide groups and sulfonic acid groups [71]. In this pendant groups, the amine groups of UiO-66-NH2 with the wealth of chemical transformations possible and had been extensively studied. In 2012, the covalent synthesis modifications for –NH2 functional group of UiO-66-NH2 by vapor method was reported for the first time. In the next few years, by covalently linking with the amine group of UiO-66-NH2, many novel Zr-MOFs had been prepared and applied in many fields such as heterogeneous catalyst [72,73], adsorption [74,75] and anticancer [76]. Recently, the researchers found that covalently linking the photosensitive materials with the functional groups of Zr-MOFs can improved the photocatalytic efficiency of Zr-MOFs without losing the stability and large specific surface area of Zr-MOFs. For example, in 2020, PIU (PI-UiO) were prepared by an amidation reaction between UiO-66-NH2 and 3,4,9,10-perylenetetracarboxylic dianhydride (PTCDA) [77]. Considering –NH2 pendant spread on the surface of UiO-66-NH2, the PTCDA molecule and –NH2 pendant of UiO-66-NH2 to form PI by amidation reaction (Fig. 10 a). The TEM and SEM images showed that the morphology of PIU unchanged with the increase of PTCDA content (Fig. 10(b-e)). The covalently linking PTCDA with UiO-66-NH2 broadens the response wavelength range to 700 nm. Moreover, the PI was a system conjugated planar which displayed sustained electronic affinity and great efficient separation of electron and hole. For the above reasons, PIU exhibited excellent performance for TC photocatalytic degradation and remained good catalytic stability after three cycles. Kumar and coworkers [78] reported a new Zr-MOF by utilizing PSM of an amine functionalized UiO-66(Zr) formed amide linkage with EOSIN-Y. EOSIN-Y is one of organo-photo redox dyes with high efficiency photocatalytic ability. However, the difficulty of separation and toxicity limit its further development. In this work, the post modified EY@UiO-66-NH2 avoided the difficulty of homogeneous catalytic separation and the adverse effects of toxic organic dye on the environment had been controlled. Furthermore, UiO-68-Fe-bpy (Fig. 11 a) was synthesized by amine–aldehyde condensation between UiO-68-NH2 and 4′methyl-[2,2′-bipyridine]-4-carbaldehyde [79]. Compared with pure UiO-68, the visible absorption boundary of UiO-68-Fe-bpy was extended to 750 nm. UiO-68-Fe-bpy exhibited outstanding photocatalytic performance for CO2 reduction (about 10 times that of UiO-68-NH2), suggesting that the incorporated Fe(bpy)Cl3 played an important role in photocatalytic process (Fig. 11b). Additionally, the recycling experiments showed that UiO-68-Fe-bpy remained good catalytic stability during the three runs (Fig. 11c). The above work proved that the covalent linkage of functional groups is an efficient method for the modification of Zr-MOF on the premise of retaining the original morphology and structural. Although this strategy has been explored less as photocatalysis, the research results in recent years are encouraging. Compared with the incorporation of another catalytically materials (especially those containing precious metal) into Zr-MOFs, the covalent linking with functional groups of Zr-MOFs is simpler, lower cost and effectively avoid the separation of heterogeneous catalyst. 2.2.2 Postsynthetic photoactive ligands By incorporation of metal complex-based photosensitizers into the organic ligands of pre-synthesised Zr-MOF has been considered an effective strategy to prepare novel photocatalysts. Compared to the metal ions embedded in Zr-MOF by direct synthesis, the PSM increase the conversion rate of metal ions thus providing more active sites for catalytic reaction [80]. For example, UiO-67-Co and UiO-67-Re was constructed though a post metallization strategy [81]. The exchange capacity of Co and Re was determined by inductively coupled plasma massspectrometry (ICP-MS). The result displayed 53% and 82% of the original ligands had been functionalized with Re and Co respectively, therefore, UiO-67-Co showed superior photocatalytic efficiency for CO2 reduction compared with UiO-67-Re. Furthermore, the introduction of photosensitive contained organic ligands into pre-synthesized Zr-MOFs could significantly improve the absorption capacity for visible light. UiO-67 is a representative Zr-MOF, the poor visible light absorption capacity limits its development as a photocatalyst. Recently, four Ru- or Rh-based visible light responsive organic ligands were incorporated into pre-synthesized UiO-67 as metal linkers by PSM to exchange the original dicarboxylate bpdc ligands [82]. The light absorption boundary of these post synthesized Zr-MOFs reached 500 nm. Therefore, the optical absorption range of UiO-67 was successfully extended to visible light. Zr-MOFs can be used as a platform for connecting metal photosensitizers and catalytic active centers. In this case, the integration of photosensitizers and catalytic active centers in a molecular platform was achieved, which could enhanced the charge transfer between antennas and catalytic active centers [83]. For instance, Karmakar et al. [70] synthesized a train of Zr-MOFs (Zr-MBA-MOF, Zr-MBA-MOF(Ru), Zr-MBA-MOF(Re) and Zr-MBA-MOF(Re/Ru)) via post-synthetic ligand exchange. Zr-MBA-MOF(Re/Ru) was synthesized by using RuII-based clusters ([Ru(bpy)2]2+) as photosensitizer and ReI-based group ([Re(CO)5Cl]) as molecular catalyst. Zr-MBA-MOF(Re) and Zr-MBA-MOF(Ru) was prepared by the same method when only ReI-based molecular catalyst or RuII-based photosensitizer was added (Fig. 12 ). Finally, the author tested the photocatalytic CO2 reduction of Zr-MBA-MOF(Ru), Zr-MBA-MOF(Re) and Zr-MBA-MOF(Re/Ru) in aqueous solution with no sacrificial electron donor added. The results indicated that Zr-MBA-MOF(Re/Ru) displayed highly efficient conversion of CO2-to-CO with an optimum yield rate of 440 mmol g-1h−1 while only a few CO2 reduced product was obtained by using Zr-MBA-MOF(Re) and Zr-MBA-MOF(Ru) as the photocatalyst. In addition, the rate of CO2 reduction with Zr-MBA-MOF(Re/Ru) heterogeneous catalyst was 53 times higher than [MBA-Ru(bpy)2]Cl2 and [MBA-Re(CO)3Cl] homogeneous catalysts. In summary, postsynthetic metalation of organic ligands of pre-synthesised Zr-MOF has been determined as an effective strategy to synthesize new Zr-MOFs with excellent photocatalytic ability. This new heterogeneous photocatalyst combines the advantages of Zr-MOF and photosensitive molecular complexes, and display a higher photocatalytic performance than the original homogeneous catalyst. However, molecular polymers contained noble metals such as Pt, Ru and Ir incorporated into Zr-MOFs are most reported, the economic problem of material synthesis hinders its development. In the future development, lookingforsuitable molecular complexes based on abundant elements in earth is necessary. Furthermore, the purpose and performance of these photocatalyst need to be further improved, and the photocatalytic mechanism needs to be further implemented. 2.2.3 Postsynthetic exchange of metal center Completely or selectively exchanging metal centers is another way of PSM to promote the light capture capability of Zr-MOF. UiO-66(Zr) is the most reported Zr-MOF for metal center exchange and Ti4+ is a common ion exchanged with Zr4+ in UiO-66(Zr) [84]. Partial substitution of Zr by Ti can effectively increase light absorption range though the introduction of intra band gap states into frameworks. The pioneering research of Ti4+ introduced into the metal center of Zr-MOF through PAM to form Zr/Ti-MOF was proposed by Lee et al. [85], and its photocatalytic performance under illumination of visible light was also studied. As is illustrated in Fig. 13 , UiO-66(Zr/Ti)–NH2 and 1(Zr/Ti) (Zr4.3Ti1.7O4(OH)4(C8H7O4N)5.17(C8H8O4N2)0.83) were synthesized via two steps facile hydrothermal reaction. The diffuse reflectance spectra showed that two band edges were obtained for 1(Zr/Ti) at 503 nm and 748 nm. It was indicated that a new energy level was introduced into 1(Zr/Ti), which made 1(Zr/Ti) showed great photocatalytic efficiency and stability for carbon dioxide reduction. The previously reported solvothermal approach usually takes several days. In order to shorten the preparation time, Tu et al. [86] developed a microwave-assisted method to introduce Ti into the UiO-66(Zr) which was completed within a few hours. Specifically, TiCp2Cl2 and UiO-66(Zr) were thoroughly mixed in 60 mL DMF, then the mixture was transferred to microwave reactor, incubated at 120 ℃, finally, UiO-66(Zr/Ti)-M (synthesized though microwave assisted) were successfully prepared after filtration and rinsing. The results showed the exchange rate of UiO-66(Zr/Ti)-M rose to 50% after only 4 h. For comparison, UiO-66(Zr/Ti)-S displayed (designed via a solvothermal method) only about 35% exchange rate after 2 days and still less than 60% after 8 days. This developed method greatly shortened the synthesis time compared with the traditional method previously reported, which was very promising in practical utility. He et al. [87] proposed the incorporation of Ti in Zr-porphyrins MOFs (PCN-224) via a simple PSM process (Fig. 14 a). After cation exchange for 48 h, the Ti-Zr exchange rate reached 33.7%. UV–vis spectra (Fig. 14b) illustrated the introduction of Ti shortened the band gap of original PCN-224. Mott-Schottky plot (Fig. 14d and Fig. 14e) indicated the replacement of Ti made significant effect to the VCB which improved charge transfer efficiency between TCPP and oxo-clusters thus transformed more adsorbed O2 into ·O2 − (Fig. 14c). Therefore, the photocatalytic efficiency of PCN-224(Zr/Ti) for MB degradation and Se(VI) reduction was outstanding which obviously higher than ZrO2, TiO2, and other reported MOFs (Fig. 14(f-g)). As we all known, the incorporation of precious metal to porphyrinic core could improve the photocatalytic activities of Zr-porphyrins MOFs, however, it requires high cost for amplification production. Fortunately, this study provided a replaceable suggestion for the improvement of photocatalytic efficiency of Zr-porphyrins MOFs. Except for Ti, the complete or partial metal substitutions with Cerium (Ce), hafnium (Hf), Thorium (Th) and Uranium (U) in the Zr6O4(OH)4 nodes have become feasible as well [88]. Among these new UiO-66 frameworks, only UiO-66(Ce) is favorable for ligand-to-metal charge transfer (LMCT) because the low-lying nature of the empty 4f orbitals of Ce4+ leads to a negative ELMCT. Therefore, the incorporation of Ce4+ into the metal center of MOFs is considered to be a promising strategy to stabilize the excited state of LMCT and improve the photocatalytic activity [89]. Inspired by this conclusion, Melillo et al. [90] constructed a series of UiO-66(M) (M: Zr, Ce, Zr/Ti, Zr/Ce and Zr/Ce/Ti) by partially or completely replacing Zr in UiO-66(Zr). The absorption spectrum showed that the introduction of Ti4+ resulted in the red shift of original UiO-66(Zr) and the absorption band of UiO-66(Zr/Ce/Ti) expanded up to 600 nm (Fig. 15 b). The photocatalytic performance of these MOFs for overall water splitting was studied. Comparison of Fig. 15c and Fig. 15d showed that UiO-66 only showed photocatalytic activity in the UV region. UiO-66(Ce) remained almost unchanged photocatalytic activity when it was under the the UV–vis or visible light, which means that the light response of UiO-66(Ce) was mainly from visible light. UiO-66(Zr/Ce/Ti) showed the best photocatalytic performance for water splitting, no matter under the irradiation of UV–vis or visible light. It was worth noting that UiO-66(Ce) displayed highest visible absorption capacity, but it was much less active than UiO-66(Zr/Ce/Ti) indicated that polymetallic composition played an important role. The emission spectra of acetonitrile suspensions of sample illustrated that UiO-66(Zr/Ce/Ti) showed lower emission intensity, which meant that the possibility of charge recombination was lower than other samples (Fig. 15e). Therefore, the polymetallic composition was conducive to higher charge separation, which improved the photocatalytic efficiency of the material. In addition, Ti was acting as a mediator in the charge transfer, which enhanced the separation and migration of photogenerated exciton and thus resulting in overall water splitting. In a word, the mixed metals MOFs can effectively improve the photocatalytic efficiency through adding intra band gap states to narrow the band gap of original MOF. In addition, multimetallic center can also promote the photocatalytic performance by improving the possibility of charge separation and the survival time of excited state Specifically, for Zr-MOF, the CB and VB are dominated by organic linker, the metal center is the most important factor that restricts its photocatalytic efficiency."
4,Doping of Zr-MOF photocatalyst,"The photocatalytic activity of Zr-MOFs or other light-harvesting materials in photocatalytic process is intensely related to the efficient generation of e− and h+, fast transmission path, and as many reactive active site as possible [91]. However, almost no Zr-MOF monomer meets all the above requirements. As a result, the selection of appropriate co-catalysts or other light-harvesting materials for doping with Zr-MOF has raised concern [92]. The Zr-MOF based heterogeneous photocatalysts could exhibit obvious superiority than the original MOFs due to the synergistic effect [93-95]. In this section, the heterogeneous photocatalytic systems by doping co-catalyst or light-harvesting materials in Zr-MOFs in recent years are introduced, including Zr-MOFs/metal NPs, Zr-MOFs/metal oxide, Zr-MOFs/metal sulfides, Zr-MOFs/metal halides, Zr-MOFs/metal free semiconductors and Zr-MOFs/polyoxometalates. Normally, co-catalyst or light-harvesting materials are usually compounded with Zr MOF in three ways: on the surface, in the pore and as membranes loaded with Zr-MOF (Fig. 16 ). Additionally, the photocatalytic mechanisms of these heterogeneous structure will be described in detail."
5,Zr-MOFs/metal NPs,"3.1 Zr-MOFs/metal NPs Because of high fermi energy levels, metal nano particles (NPs) are expected to be use as co-catalyst to achieve the efficient photocatalytic process. Normally, metal NPs doped Zr-MOFs can improve the visible light response range compared with the pure Zr-MOFs. In the last decade, UiO-66(Zr) was the most commonly used Zr-MOF as the carriers of doped metal NPs, and the most commonly used metal NPs are precious metal such as Au, Ag, Pt and Pd [96-100]. Furthermore, the bimetallic alloys doped Zr-MOFs were also reported recently. For example, AgPd@UIO-66-NH2 was constructed presented excellent activity for H2 evolution from formic acid without any additives [101]. Yin et al. [102] successfully synthesized Au/Pd@UiO-66-NH2 composite though a facile absorption/reduction process [103]. By comparing the conversion of benzaldehyde under the same reaction, Au/Pd@UiO-66-NH2 composites showed high catalyst activity for the removal of benzaldehyde (100%). Furthermore, Parida et al. [104] tested the visible light driven liquid-phase Suzuki–Miyaura coupling (SMC) reaction of Au/Pd@UiO-66-NH2 [104]. Not only UiO series Zr-MOFs, but also other Zr-MOFs doped with metal NPs have been reported recently. For example, MOF-808 (Zr6O4(OH)4(BTC)2(HCOO)6, BTC = 1,3,5-trimesic acid) showed strong adsorption capacity, good chemical stability, reusable and other excellent characteristics which had been widely studied for hydrolysis [105], catalytic [106], heavy metal removal [107] and so on. However, the broad band gap (3.9 eV) restricted the application of MOF-808 for photocatalyst. Recently, Xu et al. [51] successfully synthesized two kinds Pd@MOF-808(Pd@MOF-808-a and Pd@MOF-808-b) by simple solution method (Fig. 17 ). After introducing Pd NPs of MOF-808, because of the strong conductivity of Pd NPs, its enriched photoelectrons and improved the absorptivity and light utilization of MOF-808 materials. In addition, the band gap of Pd@MOF-808 decreased and its photocatalytic activity was enhanced. Photocatalytic H2 production experiments displayed the optimum productivity of Pd@MOF-808 was up to 236 μmol g-1h−1, while MOF-808 presented no H2 production capacity under the same conditions. Another example was NNU-28(Zr) (Table 1), which was first synthesized in 2016 [22]. Recently, Xing et al. [108] explored the photocatalytic H2 production performance of NNU-28 by loading Pt NPs on the surface of NNU-28. The optimum visible light driven H2 evolution of Pt/NNU-28 (1.0 wt% Pt loaded) reached 0.70 mmol·h−1·g−1, it was 220 times higher than original NNU-28 under same condition. because of the π–π* transitions [109] of the ADBEB ligand (Table 1), NNU-28 presented broad absorption bands in 300–580 nm region. The band edge kept almost unchanged demonstrated the introduction of Pt NPs did not changed the band gap of NNU-28 (Fig. 18 b). Photoluminescence (PL) spectrum (Fig. 18c) illustrated that Pt NPs was effective to inhibit the recombination of the e- and h+. However, the PL spectra of NNU-28 with different Pt NPs loaded were similar, their photocatalytic performance was quite different. It was suggested the limited recombination of e- and h+ by Pt loaded was not the key reasons for the improved photocatalytic activity of NNU-28. The mechanism of enhanced H2 evolution was further studied by surface photovoltage (SPV) technique. As shown in Fig. 18d, the SPV response of either the pristine NNU-28 or the Pt/NNU-28 was negative value, which indicated the downward band bending toward surface/interfaces [110,111]. In this case, the photogenerated charge carriers transferred from NNU-28 to Pt NPs so that the photocatalytic efficiency was improved (Fig. 18e). Zr-MOFs/metal NPs photocatalytic system has been widely studied and reported in recent ten years. In early studies, Zr-MOFs/metal NPs has been proved to have excellent photocatalytic ability and stability [96,112]. However, high expense of metal nanoparticles and the fussy synthesis process limit the application of Zr-MOFs combined with metal nanoparticles. In recent years, researchers focus on finding efficient methods to prepare efficient and economic Zr-MOFs/metal NPs photocatalytic system. Recently, Yin and coworkers [113] made delightful achievements by depositing and encapsulating non-precious metals (Cu) on UiO-66(Zr). As shown in Fig. 19 , Cu@UiO-66(Zr) was constructed by traditional double-solvent process. In this case, Cu quantum dots (QDs) only to be covered in the cavities of Zr-MOF. Through an advanced double-solvent process, Cu/Cu@UiO-66 were synthesized by the incorporation of Cu QDs into the cavities while load Cu NPs onto the surface of MOF. Cu/Cu@UiO-66 displayed optimum photocatalytic efficiency for oxidation of aromatic alcohols. This phenomenon was the result of synergism between Cu-MOF Schottky junction and Cu plasmon resonance. Considering that Cu/Cu@UiO-66 was composed of UiO-66 and nonprecious metal Cu, this was a significant breakthrough of this study."
6,Zr-MOFs/metal oxide,"3.2 Zr-MOFs/metal oxide Metal oxide semiconductors have been widely used and considered as an effective photocatalytic material due to their excellent structure-directing effect with the modifiable and tunable energy band structures that exhibit novel physical and chemical properties [114]. However, the short carrier lifetime, low carrier mobility and uncontrollable particle size are seriously restricted the photocatalytic activity of metal oxide semiconductors [115]. The combination of Zr-MOFs and metal oxide semiconductors can absorb the characteristics of both sides and make up for their shortcomings. Specifically, the well-distributed nanopores in Zr-MOFs provide a fixed microenvironments for the restricted growth of metal oxide semiconductors, and the organic ligands of Zr-MOF can be used as anchors to stabilize these nanoclusters. Furthermore, Zr-MOFs exhibits high chemical, thermal stability and high structural stability which can improve the application range and stability of metal oxide semiconductors. On the other hand, metal oxides semiconductors make up for the low visible light utilization of Zr-MOFs. For example, α-Fe2O3@UiO-66(Zr) composites was constructed through an absorption and transformation process [116]. UiO-66(Zr) was enlarged the pore diameters by thermally treated to remove a part of the functional group, then the neutral iron acetylacetonate was encapsulated into the UiO-66(Zr) and formed α-Fe2O3 nanoclusters by a thermal conversion (Fig. 20 a). The diameter of the prepared α-Fe2O3 was effectively controlled at 3 nm, which restricted the recombination of photoinduced e- and h+ (Fig. 20(b-e)). Additionally, the band gap of UiO-66 decreases from 3.90 eV to 2.07 eV after the introduction of αFe2O3 nanoclusters. Other Zr-MOFs/metal oxide semiconductors composites with similar mechanism were also been reported such as UiO-66/BiVO4 [32], ZnO/Zr-MOF(bpy) [117], UiO-66/Ag3PO4 [118] UiO-66/Bi2MoO6 [23] and so on. All these researches indicated that Zr-MOFs/metal oxide semiconductors composites were promising photocatalytic materials. Furthermore, Zr-MOFs can exhibit photocatalytic activity upon visible light by ligand modification, which has been described above. In this case, Zr-MOFs doped metal oxides can form typical heterojunction to improve the effectively generation and transfer of photogenerated carriers. Normally, the common heterostructures reported including Type I, Type II, Schottky junction, p-n heterojunction and Z-scheme heterojunction [119]. For instance, Subudhi et al. [120] constructed a p-n junction architecture of CoTiO3 integrated UiO-66-NH2 via hydrothermal method. CoTiO3 was p-type semiconductors, while UiO-66-NH2 acted as typical n-type semiconductors. Under the irradiation of sun light, they were excited to produce e- and h+. Subsequently, the hole will divert from CoTiO3 to the Zr-MOF while the electrons shift from Zr-MOF to the CoTiO3. In the end, an electric field was formed at the heterointerface between Zr-MOF and CoTiO3. The photoinduced electron and hole will be effective separated by electric field assist. Fig. 21 a illustrated the HRTEM of the composite (1:1) CoTiO3/ UiO-66-NH2 showed a distinct different boundary slices verified the formation of heterojunction and SAED pattern confirmed the intimate contact of CoTiO3 with UiO-66-NH2 (Fig. 21b and Fig. 21c). Fig. 21d showed a smaller circle indicated the recombination probability of electron-hole pairs was reduced by electric field assist, which led to an improvement of electrical conductivity of the composites. Additionally, compared to original Zr-MOF, CoTiO3/ UiO-66-NH2 (1:1) showed higher transient current which indicated the lifetime of charge carriers was improved (Fig. 21f). Recently, a novel oxygen-defective Z-scheme photocatalyst, UiO-66-NH2/O-ZnO, was synthesized [121]. The formation of HCOOH and Mott–Schottky plots determined the formation of Z-scheme heterojunction (Fig. 22 a and Fig. 22b). Commonly, the VCB of O-ZnO (−0.39 V vs NHE) was more positive than the potential of CO2/HCOOH (−0.61 V vs NHE), the formation of HCOOH was thermodynamically unavailable. In this case, Z-Scheme heterojunction could be considered (Fig. 22c). Both O-ZnO and UiO-66-NH2 generated electron and hole under the sun light, subsequently, the e- and h+ deposited in the CB of UiO-66-NH2 and VB of O-ZnO because of effect of internal electric field. Therefore, the lifetime of photogenerated e- and h+ was extended. The results of photocatalytic reduction of CO2 further proved that Z-scheme O-ZnO/UiO-66-NH2 had excellent photo reductive activity, with the yields of HCOOH and CH3OH reaches 6.40 and 34.85 μmol g-1h−1. It is significantly superior than type II O-ZnO/UiO-66-NH2."
