,sections,Text
0,Introduction,"With the progress of social development and the continuous improvement of industrialization, the serious environmental pollution and energy shortage have become an urgent hindrance need human being to solve [1-4]. Scientists invested heavily in exploring renewable and clean energy in recent decades. Among all kinds of renewable energy, solar energy as a clean and abundant energy has attracted great attention of researchers [5-9]. Photocatalyst has become the most attractive way of solar energy utilization because of its simple synthetic method, low consumption, high photocatalytic efficiency, and has made great progress in recent years [10]. However, photocatalytic performance is still below par for the industrial viability due to low specific surface area, poor response for visible-light and fast recombination of photogenerated electron holes of photocatalysis [11-13]. Therefore, further exploration of new photocatalysts with more effectively and stably is an interesting and significant field. As an emergent three-dimensional microporous material, metal organic frameworks (MOFs) with considerable surface adsorption capacity, adjustable aperture and numerous catalytically active sites have a great vogue in various fields [14-17]. Among these applications fields, the most classical is to utilize the high adsorption capacity and regulable pore of MOFs, regarding MOFs as microporous materials focused on storage of gases such as H2, CH4 and CO2 [18]. Typically, MOFs are designed via the self-assembly of metal ions center and organic linkers, the existence of different metal centers and acid binders allows the pore size, hydro- and/or thermal stability of MOFs to be customized to achieve the desired properties. In recent years, through reasonable selection of metal ions with photosensitive organic ligand, MOFs widely studied as promising photocatalysts for H2 production [19,20], CO2 reduction [21,22], degradation of organic pollutants [23-25] and heavy metal removal [26,27]. However, most of current results are considered conceptual, because the over idealized experimental requirements and economical inapplicability can’t ensure the suitability of the materials. In addition, the limited light absorption and low stability in aqueous solution also restrict the application of MOFs in photocatalysis. In all reported MOFs, Zr-MOFs have shown excellent stability due to the strong Zr–carboxylate interactions as well as the high connection number of the secondary building units (SBUs) [28]. For most reported MOFs, the thermal stability is limited among 350–400 °C, while UiO-66 (UiO = University of Oslo), a type of Zr-MOF, exhibits relatively high thermal stability at the decomposition temperature of 540 °C due to strong Zr-O bonds [29]. This excellent chemical and thermal stability make Zr-MOFs extensively applied to thermal catalysis, encapsulation and drug delivery [30-32]. In addition, Zr-MOFs have been proved that they show excellent water-tolerant across a wide pH range in aqueous media which makes them as prospective materials for the photocatalysis process [30]. Lillerud et al. [33] designed Zr-MOFs for the first time in 2008, which named as UiO-66(Zr). Due to the outstanding structural stability in aqueous solution, the development of UiO-66(Zr) based photocatalysts has attracted wide publicity. Silva et al. [34] first used UiO-66(Zr) as photocatalyst for H2 production under ultraviolet (UV) light. From then on, Zr-based MOF has been widely reported as a photocatalyst (Table 1 ). However, further research have shown that Zr-MOFs exist some inherent weaknesses which limited the application in photocatalysis, such as the Zr-MOFs have suffered from poor photoactivity because of the unsatisfactory exciton productivity and charge migration rate as well as the inconformity between adsorption and catalytic sites [35]. Therefore, it is obliged to design new Zr-MOFs materials according to the targeted requirements [36]. As far as we know, many reviews of MOFs in the field of photocatalysis have been published. However, there are few specific reviews of Zr-MOF in the field of photocatalysis. At the same time, much attention has been concentrated on the research progress of only UiO series Zr-MOFs [37,38]. In this review, we concentrate on the various Zr-MOFs with excellent photocatalytic properties reported in recent years, not limited to the UiO series. It includes photosensitive Zr-MOFs by direct synthesis, post synthesis modified (PSM) photosensitive Zr-MOFs and the composite of Zr-MOF with other photoactive materials. Furthermore, the strategies of improving photocatalytic activity of Zr-MOFs and their application in H2 evolution, CO2 reduction, removal of organic pollutants and Cr(Ⅵ) reduction are discussed systematically. Additionally, the mechanisms of these processes are also described in detail. This review aims to focus on the research progress of the whole Zr-MOFs in the field of photocatalysis and provide suggestions for the future development direction."
1,Photosensitive Zr-MOFs,
2,Direct synthesis of photosensitive Zr-MOFs,"2.1 Direct synthesis of photosensitive Zr-MOFs Most of the reported Zr-MOFs were prepared by the reaction of Zr metal precursor, organic ligand and modulator under specific experimental conditions via a direct one-step synthesis. Particularly, stable Zr-MOF photocatalytic materials can be constructed by designing organic ligands with excellent light absorption ability and combining with Zr-clusters according Zr–O bonds. Organic ligand is the primary factor to determine the photocatalytic performance of Zr-MOFs. In this section, visible light driven Zr-MOFs by direct synthesis in recent years are introduced (Fig. 1 ), according to different types of organic ligands, they can basically be divided into Zr-carboxylate MOFs, Zr-Porphyrin MOFs and Zr-Pyridine MOFs. In addition, Zr-MOFs synthesized by other ligands for photocatalysis are also summarized in Table 1. 2.1.1 Zr-carboxylate MOFs The typical Zr-carboxylate MOF is Face-centered cubic (fcu) UiO-66 (Zr6O4(OH)4(CO2)12), which is formed via the assembly of 6 Zr atoms with 8 μ3-O or μ3-OH bridged oxygen atoms connect with 12 BDC (1,4-benzene-dicarboxylate) linkers. A representation of this structure is shown in Fig. 2 a. The robust coordination interlinkage between the Zr-O cluster and carboxylate ligand lead to the outstanding chemical and thermal stabilities of UiO-66. Subsequently, a series of Zr-carboxylate MOFs were reported by changing different carboxylate-based ligands, such as UiO-67 and UiO-68 (Fig. 2b and c) with 4,4′ biphenyl-dicarboxylate (BPDC) and terphenyl dicarboxylate (TPDC) as linker, respectively. Normally, the surface properties of the UiO-66(Zr) can be regulated by selecting organic ligands with different functional groups such as amines, hydroxyls, halogens, alkyls, nitro, etc. [57]. In addition, though functionalizing the matrix structure of UiO-66(Zr), extra catalytic active sites could be introduced into MOFs, which can artificially adjusted band gap of Zr-MOFs, so that Zr-MOFs can also show photocatalytic activity under visible light. The most typical functional group is –NH2 which has been demonstrated to be the most efficient component to narrow the raw band gap of UiO-66 framework compare with other UiO-66-X Zr-MOFs (e. g. UiO-66-OH, UiO-66-NO2 UiO-66-Cl, UiO-66-Br) [43,58,59]. Researches showed that the improvement of visible-light utilization was mainly attribute to the conjugated Π electron diversion from the amine-containing chromophores to the Zr center and creating Lewis-basic sites in the structure. For this reason, absorption band-edge of UiO-66-NH2 could reached 450 nm [39], the corresponding band gap energy (Eg) is 2.72 eV. Due to its narrowed band gap (compared with UiO-66(Zr), 4.13 eV) with more efficient light absorption ability and electron donor properties, UiO-66-NH2 widely studied as an outstanding photocatalyst for H2 evolution [34], CO2 reduction [60], degradation of organic pollution [39] and reduction of heavy metal [40]. In previous researches, the improvement of photocatalytic activity of Zr-MOFs is mostly described the wide visible absorption range, so that the researches of UiO-66-NH2 in photocatalysis are more common than others UiO-66-X. However, Mu et al. [61]. constructed a series of UiO-66-X (X = H, Br, NH2, (OH)2) and investigating their photodegradability for Rhodamine B (Rh B). Surprisingly, the result showed that UiO-66-(OH)2 and UiO-66-NH2 which had relatively narrow bandgaps (the Eg of UiO-66-(OH)2 = 2.69 eV and the Eg of UiO-66-NH2 = 2.83 eV,) did not presented higher photodegradability compared to UiO-66 (Eg = 3.91 eV) and UiO-66-Br (3.69 eV. Mott–Schottky plots and photocurrent spectra were performed to defined the band potential of UiO-66-X and elucidated the surprising phenomenon. The result showed that the VCB of UiO-66 and UiO-66-Br (−0.72 V and −0.76 V vs. NHE) were more positive than the potential of the excited Rh B (Rh B*, −1.09 V vs. NHE) which made the electron transfer from the Rh B* to the CB of UiO-66 or UiO-66-Br was thermodynamically advantageous. However, the VCB of UiO-66-NH2 and UiO-66-(OH)2 (−1.01 V and −1.06 V vs. NHE) were very close to Rh B*. Therefore, the transfer of electrons between Rh B* and Zr-MOF was limited. This leaded to the rapid recombination of photogenerated carriers, while the Rh B* also easily go back to the unexcited state. Combined with the above analyses, compared with the band gap of photocatalyst, the efficient and rapid electronic transfer and dye sensitization effect were more important element for photodegrade Rh B. To further explore the mechanism of functional groups on the photocatalytic process of Zr-MOFs, Chen et al. [62] constructed a variety of UiO-66-X2 (X = SO3H, SH and SCH3) (Fig. 3 a). The UV–vis spectra illustrated that the band edges of UiO-66-(SCH3)2, UiO-66-(SH)2 and UiO-66-(SO3H)2 were reached 470, 440 and 425 nm, the corresponding Eg was 2.8 eV, 3.0 eV and 3.2 eV, respectively (Fig. 3b). With platinum (Pt) (1.5 wt%) as co-catalyst, the H2 production value of Pt/UiO-66(SCH3)2, Pt/UiO-66-(SH)2 and Pt/UiO-66-(SO3H)2 after 60 min were 6.96, 2.97 and 0 μmol/g, respectively (Fig. 3c). Surprisingly, the Eg of UiO-66-NH2 (2.72 eV) was similar to UiO-66-(SCH3)2 (2.80 eV), while UiO-66-NH2 had no photocatalytic activity for H2 production even with Pt as co-catalyst under the same conditions [43]. This difference in photocatalytic effect can be explained by the different effects of –NH2 and -SCH3 on the aromatic ring of terephthalate linker in UiO-66(Zr). Therefore, these facts suggest that Eg is not the only element determining the photocatalytic performance of functional group modified Zr-carboxylate MOFs. Different molecule sizes and geometries of functional group display different influence on the aromatic ring of the terephthalate bonds of Zr-MOFs. In addition, the potential relationship between contaminants and Zr-MOFs were significant to be considered. 2.1.2 Zr-porphyrin MOFs Because of the broad range of light response range, porphyrins as a type of photosensitizers have shown outstanding long lifetime of the triplet excited state [63]. Furthermore, Zr-porphyrin MOFs which composed of Zr center and porphyrins or metallo porphyrin-based linkers have drew wide attention due to their excellent textural property, tunable functionalities and chemical stability [30]. The porphyrins-based ligand in Zr-MOF behaves as a light-harvesting group, which reacts with pollutants or gases adsorbed on the surface of Zr-MOF, thereby enhancing the photocatalytic efficiency [55]. In 2012, Morris et al. [64] successfully synthesized two Zr-porphyrins MOFs, MOF-525 and MOF-545 (Fig. 4 ). The synthesized MOFs had great BET surface proportion with 2620 and 2260 m2/g respectively. Because of the incorporation of Zr-O bonds, this two Zr-MOFs possessed exceptional chemical stability which maintaining their three-dimensional structure under aqueous and organic phases. These characteristics indicated that MOF-525 and MOF-545 could be used as materials with excellent adsorption capacity and high stability. The photocatalytic performance of MOF-525 and MOF-545 had been studied by Toyao’s group [52] and Xu’group [55], respectively. UV–vis absorption spectra illustrated that MOF-525 and MOF-545 inherited the feature of the porphyrin ligand, which showed a wide and intense absorption in the region of 350–750 nm and 200–800 nm respectively. This was a huge improvement compared with UiO series Zr-MOFs, which was also reflected in their photocatalytic performance. MOF-525 presented a higher visible light driven catalytic efficiency and stability for arylboronic acid degradation than the corresponding homogeneous catalyst H4TCPP. In addition, they found a special electron trapped state in MOF-525 which effectively restricted the rapid electron–hole recombination. Therefore, MOF-525 supplied long-lifetime electrons for the photoreduction. Porphyrin-based linkers could be metallized by artificially synthesize. Compared with nonmetal porphyrin, the lifetime of excited-states molecules which formed by metalloporphyrin under visible light is longer [65]. For example, a Zr-porphyrin (Rh) MOF (RhPMOF-1(Zr)) was synthesized directly by a metallized porphyrin ligand (Rh(TCPP)Cl) with Zr6 center [53] (Fig. 5 a). The new Zr-MOF contained 3D channels and the Rh-porphyrin groups were exposed in the cavities (Fig. 5(b-e)). The solid-state UV–vis absorption spectra indicated Rh-PMOF-1 exhibited outstanding optical characteristics with extended absorption boundary reached 750 nm (Fig. 5(f-g)). Rh-PMOF-1(Zr) displayed obviously better catalytic activity towards CO2 reduction which up to 99% selectivity compared to pure PCN-224 (Fig. 5h). The reason for the enhancement of photocatalytic performance of Rh-PMOF-1(Zr) could be concluded as follows: (1) The compound possibility of electron-hole pairs descended when the Rh-porphyrin group was integrated. (2) The long-lived excited-states of Rh-PMOF-1 (207 μs under vacuum) is important for an efficient photocatalyst. Recently, Boyer et al. [66] synthesized a series Zr-porphyrins (Zn) MOFs (MOF-525(Zn), MOF-545(Zn), PCN-223(Zn) and PCN-224(Zn)) as heterogeneous photocatalysts (Fig. 6 a). Fig. 6b confirmed that MOF-525 had minimum size (0.18 µm × 0.18 µm) compared with other Zr-porphyrins (Zn) MOFs (PCN-223 (Zn), 0.32 µm × 0.52 µm; MOF-545 (Zn), 0.19 µm × 0.58 µm; PCN-224 (Zn), 0.69 µm × 0.69 µm). Polymerization kinetics (Fig. 6(c-e)) were studied to investigate the photocatalytic activity of mediated polymerization of methyl acrylate (MA) by using these Zr-porphyrins (Zn) MOFs as photocatalysts under visible light irradiation. MOF-525 (Zn) exhibited superior performance compared with other Zr-MOFs (Zn) due to its small size and Fig. 6g confirmed that the polymerization was controlled by photomediated. Furthermore, Zr-porphyrins (Zn) MOFs displayed better polymerization efficiency and reusability compared to non-metallated Zr-porphyrins MOFs (MOF-525) (Fig. 6f and Fig. 6h). In conclusion, porphyrins are frequently applied to constructed MOF photocatalysts. It is attribute to the excellent textural property, broad visible light response range and long lifetime of excited state of porphyrin ligands. In addition, porphyrins are generally devoid of cytotoxicity in the absence of light, which is important in environmental applications. Therefore, the combination of water stability, high porosity, relatively large pore size environment friendly and photoactivity makes Zr-porphyrin MOFs act attractive photocatalyst material. 2.1.3 Zr-pyridine MOFs Because of their excellent redox ability and long lifetime of photoexcited molecule, the incorporation of pyridine and its derivatives (e.g. bipyridine (bpy), terpyridine (tpy), quinoline and metallized pyridine.) in the ligands of MOFs has been proved an useful method to intensify the light absorption properties of the Zr-MOFs [16]. Zr4+ framework is a significant member in stabilizing the catalytic species and boosting the photocatalytic activity of pyridine ligands. Zr-MOFs modified by pyridine ligands serve as versatile platform can effectively couple these functional components, achieving the conversion of solar energy to energy products. Therefore, pyridine functionalized Zr-MOFs, due to their plasticity of ligands and the stability of Zr-O framework, encourage researchers to explored this type of materials with better photocatalytic performance. For example, by the incorporation of Ru and Co-based photosensitizer (PS) into UiO-67(bpy), the single-site MOF system Co-Ru-UiO-67(bpy) was synthesized directly [19]. The absorption edge of Co-Ru-UiO-67(bpy) extended to 750 nm compared to UiO-67(Zr) due to the incorporation of 2,2-bipyridine-5,5-dicarboxylic acid ligands in CO and Ru complexes. The photocatalytic activity and stability of Co-Ru-UiO-67(bpy) for H2 evolution was studied. Under the illumination of visible light, Co-Ru-UiO-67(bpy) reached 27 853 mol H2/g after 40 h and displayed constant activity for at least three runs during the recycling experiments. In 2019, by the incorporation of the photoactive Ru(cptpy)2 ligand into ZrO8 cluster, Elcheikh Mahmoud et al. [48] successfully synthesized a new chemically stable Zr-MOFs, which named AUBM-4 (Fig. 7 a and Fig. 7b). The optical band gap of this new Zr-MOF was calculated to be 1.88 eV, corresponding to the 660 nm absorption edge (Fig. 7c(Ⅰ)). The excellent light absorption ability made AUBM-4 possessed great ability for photocatalytic CO2 reduction. The HCOO− production increased linearly and the average rate of formation was 366 μmol·g−1·h−1 under the visible light (Fig. 7c(Ⅱ)). The outstanding efficiency of this catalytic photoreduction could be explained that the long launch lifetime of the photosensitive Ru based ligands in AUBM-4. In addition, the authors speculated that the fast metal to ligands charge migration between ruthenium and cptpy generated cptpy −. Finally, CO2 coordinated with Zr metal center which promoted the charge transfer from the cptpy − to the coordinated CO2 (Fig. 7d). Zr-pyridine MOFs can adsorb a large amount of CO2 and photocatalytic degradation of CO2 in situ because of the excellent surface adsorption. In this case, the photocatalytic effect of Zr-pyridine MOFs mainly focused on the reduction of CO2. Recently, researchers are exploring its performance in photocatalytic removal of organic pollutants. Wei et al [67]. synthesized three high stable Ir–Zr MOFs (Zr6–Irphen, Zr6–IrbpyOMe and Zr6–Irbpy) by using bipyridine-Ir(III) complexes ([Ir(pqcMe)2L]Cl; pqcMe = methyl-2-phenylquinoline-4-carboxylate; L = Irbpy, IrbpyOMe and Irphen) as organic linkers (Fig. 8 ) and tested the visible photocatalytic effects for the conversion of sulfide to sulfoxide. [Ir(pqcMe)2L]Cl consisted with cyclometalated Ir(III) complexes and 2-phenylquinoline (pq). Cyclometalated Ir(III) complexes had excellent intersystem-crossing ability and long excited triplet lifetimes [68], 2-phenylquinoline as a derivative of pyridine was an excellent ligand which had been demonstrated the triplet lifetime of [Ir(pq)2(proline)] [69]. Therefore, Zr6–Irphen displayed the optimum photocatalytic performance for sulfide-sulfoxide conversion. With the addition of polar protic solvent, the photocatalytic sulfoxidation reaction reached 100% yield within 6 h. This example showed that pyridine and its derivatives could form new ligands by anchoring specific components and synthesizing new Zr-MOF, which displayed efficient photocatalytic effect for degradation of refractory organic pollutants."
